ticker,published_utc,title,publisher,url
ALLY,2025-08-05T22:25:00+00:00,Janus Henderson Mid Cap Value Managed Account Q2 2025 Commentary,SeekingAlpha,https://finnhub.io/api/news?id=f8608e14d16595bdb50d59c9824ee0465e51de25c709e88300d77942340f425b
ALLY,2025-08-05T13:15:00+00:00,Janus Henderson Mid Cap Value Fund Q2 2025 Commentary,SeekingAlpha,https://finnhub.io/api/news?id=7c61c0db9eabc4adc165f725c075c4e2e7693ea0a038a4b6db17deb7b352dbbc
ALLY,2025-08-05T11:47:20+00:00,Buffett's 35 Berkshire July Dividend Dogs Note 6 To Watch For August,SeekingAlpha,https://finnhub.io/api/news?id=df94ee5ae51a2cea5aa6e63d2dc1450d0a5744df744b3d1602b30edba26ed564
ALLY,2025-08-01T14:33:18+00:00,Truist Securities Raises PT on Ally Financial Inc. (ALLY); Maintains ‘Buy’ Rating,Yahoo,https://finnhub.io/api/news?id=4cc40324fd394220713e8b97ea319d5b1ee84b92c3dfdafda1297111177c205c
ALLY,2025-08-01T13:50:03+00:00,Are You a Momentum Investor? This 1 Stock Could Be the Perfect Pick,Yahoo,https://finnhub.io/api/news?id=f8ec7d07e98b6cac414b66961f750314f350fcbe41d15fb6b20148947726a4ef
ALLY,2025-07-30T17:04:00+00:00,"Navient Q2 Earnings Miss on Lower NII & Higher Provisions, Stock Down",Yahoo,https://finnhub.io/api/news?id=ddc499a931572b1e7a4418e2158775ee330edad716fa582c31c4ac5f16917572
ALLY,2025-07-30T13:00:00+00:00,New Ally Bank Survey Reveals the Hidden Financial Cost of Friendships,Yahoo,https://finnhub.io/api/news?id=31754a7c2543a1dc9ae1ac74df87bb87b2844a75b671d21354d9e38b8f389270
ALLY,2025-07-30T11:29:19+00:00,Aon names new global controller and chief accounting officer,Yahoo,https://finnhub.io/api/news?id=7080192774a2f24ae5df781bcfe651e8635a35ca71b430bd97c090d104a44a79
ALLY,2025-07-29T21:00:00+00:00,Fidelity Capital & Income Fund Q2 2025 Commentary,SeekingAlpha,https://finnhub.io/api/news?id=912d51e8a90875f6344b57a5695d27e49463b96a9fcd9e4b66fa33f74ff9a19f
ALLY,2025-07-28T14:28:00+00:00,Navient's Q2 Earnings in the Cards: Here's What to Expect,Yahoo,https://finnhub.io/api/news?id=134226db92ddd1528265b39b00e4a2598c4cb0444364c3b7347ef06016405f4d
ALLY,2025-07-28T14:10:58+00:00,Atlanticus Holdings: Trading At Fair Valuation Ahead Of Q2 2025 Earnings,SeekingAlpha,https://finnhub.io/api/news?id=e20ea22c73a5db68983fa85317cb16f06752eeb410a6e522873de332a5c13006
ALLY,2025-07-28T13:00:00+00:00,"OneMain Holdings Stock Gains 1.3% on Q2 Earnings Beat, Provisions Dip",Yahoo,https://finnhub.io/api/news?id=6e21fce0a771acdd5c14380cee1c2838527698a28eacb6ac5f05eca13cdd86d2
ALLY,2025-07-28T09:30:00+00:00,Credit-Card Users Are Cautious Now. Rate Cuts Could Open the Floodgates.,Yahoo,https://finnhub.io/api/news?id=5391c893fea8058c297eb1be8e77ad4f3e4cfca177ec071167f8c0c334c7447a
ALLY,2025-07-25T16:08:00+00:00,"SouthState Q2 Earnings & Revenues Beat Estimates, Expenses Rise",Yahoo,https://finnhub.io/api/news?id=c6278d744279b137c868d4730a51ea76be7b1803d49ef6feb2a4b53e87e5899e
ALLY,2025-07-25T10:00:00+00:00,CFOs On the Move: Week ending July 25,Yahoo,https://finnhub.io/api/news?id=b1d715dfd1d6f05607cf0b7b545bcdeb76a488e88a35c45b43aed65e736209a2
ALLY,2025-07-24T17:47:00+00:00,"Mr. Cooper Q2 Earnings & Revenues Miss, Expenses Rise Y/Y",Yahoo,https://finnhub.io/api/news?id=bb6a095fcadc30f93065ab95661dd598b7a3fb310f77e1ae50c44f656c6c49b9
ALLY,2025-07-23T18:48:07+00:00,Ally Financial (NYSE:ALLY) Is Paying Out A Dividend Of $0.30,Yahoo,https://finnhub.io/api/news?id=5d77db7a185c3c1b406d879f6fd3d3fcbc94c2e5fd192e2a8165a90cb43f2088
ALLY,2025-07-23T14:00:00+00:00,Ally Financial rolls out proprietary AI platform enterprise-wide,Yahoo,https://finnhub.io/api/news?id=1940c6d663f0b0f4735a069124adf1a8acee9f4522d4773039641da020f24a7f
ALLY,2025-07-23T13:07:00+00:00,"Discover Deal Boosts COF's Q2 Earnings, Consumer Spending in Focus",Yahoo,https://finnhub.io/api/news?id=ec3d6b99839e8d6c72ee927c6cef2409f0acd47f9003cb4421f414dda13a0ee4
ALLY,2025-07-23T12:17:00+00:00,"COF Up on Q2 Earnings Beat, Discover Deal Boosts NII and Fee Income",Yahoo,https://finnhub.io/api/news?id=1430602a1e63e2add033e6ea12c20724ec4282ba1f09d3f53e669ad0b8a03ddb
ALLY,2025-07-23T10:45:00+00:00,BankUnited Announces CFO Succession Plan,Yahoo,https://finnhub.io/api/news?id=7c450c6b8f719f96fe44608e2cfccc8b80781c93a188812e9fd34cab432202a0
ALLY,2025-07-23T07:58:38+00:00,Ally makes AI platform available companywide,Yahoo,https://finnhub.io/api/news?id=2edce549c944a5174c6552c32844e10512c95aae82332cc5c91ffced4f279170
ALLY,2025-07-22T11:36:00+00:00,ALLY Q2 Earnings Top on Higher Net Finance Revenues & Lower Provision (Revised),Yahoo,https://finnhub.io/api/news?id=f358da15624dd6c06011f942193c5e19087ce2041389b5a0952ad4bac4560108
ALLY,2025-07-21T18:25:00+00:00,Ally Financial Q2 Earnings Miss on Lower Loans & Deposits,Yahoo,https://finnhub.io/api/news?id=fc69d20aa5dd5398fd16f93622f5ff398597f892f3c32612b446ebb89e735700
ALLY,2025-07-21T08:45:00+00:00,Ally Financial Upgraded As Digital-First Banking Shows Further Upside Potential,SeekingAlpha,https://finnhub.io/api/news?id=74e7e0d40948eca52213cc068ce5a64bf02b7ddd061b5db9b3a97299d73a2016
ALLY,2025-07-20T22:34:00+00:00,Ally Financial: Solid Q2 But Capital Concerns Remain,SeekingAlpha,https://finnhub.io/api/news?id=08ed5c66ace2a4630ebf9e07d70622470f36a0ae4ce6b3a78d8608d957d7e21b
ALLY,2025-07-20T13:21:32+00:00,Investing in Ally Financial (NYSE:ALLY) five years ago would have delivered you a 121% gain,Yahoo,https://finnhub.io/api/news?id=ef6b67beae53b8ddfc1a55ccad7e7f6df71e558f4e8ad44129bca799b5b647dd
ALLY,2025-07-20T13:00:04+00:00,Everyone wants to be a bank now. Banks aren’t happy about it.,Yahoo,https://finnhub.io/api/news?id=7da27ea3af67ee723cab8b8769580573ec02251d2da2ad6448e7b643e8ecbe99
ALLY,2025-07-19T07:05:52+00:00,Ally Financial Inc (ALLY) Q2 2025 Earnings Call Highlights: Strong Auto Finance Performance and ...,Yahoo,https://finnhub.io/api/news?id=cc0fe10a4ecaf7d1118d1dfd01d75f31f77c55ba32de145e1159ab55cc7ba702
ALLY,2025-07-18T13:30:03+00:00,Ally Financial (ALLY) Q2 Earnings: How Key Metrics Compare to Wall Street Estimates,Yahoo,https://finnhub.io/api/news?id=469f64ae22cad24583124bd55bfaa8675a26f59c31e3db3803b705cdc79c5cfe
ALLY,2025-07-18T12:26:08+00:00,Ally Financial Inc. 2025 Q2 - Results - Earnings Call Presentation,SeekingAlpha,https://finnhub.io/api/news?id=16bfd28b17cdc024480133f878dc936c83149153d801c498d4d859a8f8ee4c08
ALLY,2025-07-18T12:24:23+00:00,Ally Financial Inc. (ALLY)Q2 2025 Earnings Call Transcript,SeekingAlpha,https://finnhub.io/api/news?id=abd5087fad48d3c2b4e0e6a6eafabfcfe27ed2734110a8aa7a8d2c97b45f803d
ALLY,2025-07-18T11:33:37+00:00,Ally Financial: Q2 Earnings Snapshot,Yahoo,https://finnhub.io/api/news?id=2d4d856668eff709dc7205af18154039a1c80027493ab88732cf23e26fb8455d
ALLY,2025-07-18T11:25:00+00:00,Ally Financial reports second quarter 2025 financial results,Yahoo,https://finnhub.io/api/news?id=aeaa866bd715c23ab4baee6ee8fed2ce7e770a846b14721d0e70b65809d9563e
ALLY,2025-07-18T10:11:59+00:00,US stocks open up on earnings. S&P 500 and Nasdaq reach new record highs again,Yahoo,https://finnhub.io/api/news?id=745cfe95012be7f5cb272d64ec8162272f7abf2b0bb20d7ea4148d76f31e8c05
ALLY,2025-07-15T14:00:05+00:00,Capital One (COF) Earnings Expected to Grow: What to Know Ahead of Next Week's Release,Yahoo,https://finnhub.io/api/news?id=13d13c07c8fe38a667d24c0d438a0b5423d2c25df351abbf891da018872c9c71
ALLY,2025-07-15T13:15:01+00:00,Unveiling Ally Financial (ALLY) Q2 Outlook: Wall Street Estimates for Key Metrics,Yahoo,https://finnhub.io/api/news?id=1a7bfdd4064b3c5adb7a9047e774d6fbb5f22e01995f20b047c125746692ca04
ALLY,2025-07-14T14:24:43+00:00,"BTIG downgrades Affirm, PROG Holdings on credit risks",Yahoo,https://finnhub.io/api/news?id=934c12e1168a5c690545bbdad1422eff19d1a71c370eaccf9fd0d1ab44e0f566
ALLY,2025-07-13T11:51:03+00:00,"Inflation data, big bank earnings, and Netflix results: What to watch this week",Yahoo,https://finnhub.io/api/news?id=0099fa6bcad56b500d807b72462472a2ea6a13ddee478a80fd8683ed9074238e
ALLY,2025-07-11T14:00:04+00:00,Ally Financial (ALLY) Expected to Beat Earnings Estimates: Can the Stock Move Higher?,Yahoo,https://finnhub.io/api/news?id=c44fac1dfb11f6e81618e48c3006645d6c93aff09e32735a89f713451df30711
ALLY,2025-07-09T23:07:00+00:00,Ally Solutions Gains Momentum as the Most Affordable AI Front Desk for Small Businesses,Yahoo,https://finnhub.io/api/news?id=a9990fa8ea6b6cb0f84b6192d4533bb6d5f8422e18df29c9a30ee65f40743d97
ALLY,2025-07-07T12:45:00+00:00,OneMain Holdings Hits 52-Week High: Should You Buy the Stock Now?,Yahoo,https://finnhub.io/api/news?id=cdf1039beebdcbb4d703dc8931f2cac99f53a450720d727b7ef3a68f896114c8
ALLY,2025-07-05T20:29:09+00:00,Ally Bank Says This Is the Best Time To ‘Graduate’ From Your Starter Bank,Yahoo,https://finnhub.io/api/news?id=86ca3600dd7ba74cd4cd7032bf36f9582009fd021b39eb7e6a77b7814251b026
ALLY,2025-07-05T03:00:00+00:00,U.S. Banks Scale Back Held-To-Maturity Securities For 9th Quarter In A Row,SeekingAlpha,https://finnhub.io/api/news?id=3303dc95d8ed4bb38d04785733773b8b8373cb7272e9d0f588eeb3c50d5ebb4d
ALLY,2025-07-03T18:54:03+00:00,Ally Financial Stock Gets Relative Strength Rating Lift,Yahoo,https://finnhub.io/api/news?id=27405d75f51e321928e9caa7238effdeb7e7ce2961f13e59829812749c4e1902
ALLY,2025-07-02T13:00:03+00:00,How to Boost Your Portfolio with Top Finance Stocks Set to Beat Earnings,Yahoo,https://finnhub.io/api/news?id=4e3532d72155ae81c83c4b311ea59540c609c5b8a7a55338add46528bd76bc9c
ALLY,2025-07-01T13:41:00+00:00,Capital One Hits 52-Week High: Should You Buy the Stock Now?,Yahoo,https://finnhub.io/api/news?id=5caeb0a13b7e238496f0687d8b10dcdfd385ae5b94dad0cc16934c2a453bc525
ALLY,2025-07-01T12:30:00+00:00,Webster Financial Corporation Appoints Chief Risk Officer; Names New Board Member,Yahoo,https://finnhub.io/api/news?id=a2f4d6251aadf23e59c59cf0a4535c57fe2277975013af46f1c25c40c6c1fc6b
ALLY,2025-07-01T10:59:25+00:00,Webster Bank taps former Ally CRO,Yahoo,https://finnhub.io/api/news?id=65569440a65299f9448bd4310f91f3c2c20aea8daa20060420fb61db1d49febf
ALLY,2025-06-27T14:10:58+00:00,Ally Financial: Shares Look Cheap On Easing Cyclical Headwinds,SeekingAlpha,https://finnhub.io/api/news?id=4a6fb10caa2e957cdd5847cb19672cc4c23dfebcf0d0afd4c2df46964a75cf93
ALLY,2025-06-26T20:15:00+00:00,Career Financial Services Leader Appointed to First Citizens BancShares Board of Directors,Yahoo,https://finnhub.io/api/news?id=3e310b4193376aa6bc71bb4f4f9c4b6fe4f55fcfa5ad9df4308b51e85fa46f48
ALLY,2025-06-26T10:00:00+00:00,QC Ally Appoints Vice President of Operational Excellence to Drive Enterprise-Wide Efficiency and Performance,Yahoo,https://finnhub.io/api/news?id=2ae85fd43b41acc72fac8a9ca49bdc7dcf67c4f6b4d77c8079dc8d5454b9a23a
ALLY,2025-06-26T09:20:00+00:00,Touchstone Mid Cap Fund Q1 2025  Commentary,SeekingAlpha,https://finnhub.io/api/news?id=ce0bdfc3bf9b04c596e5f459dd08fe2572dc8bcc013d17053315fefb62da29a9
ALLY,2025-06-20T11:47:42+00:00,CarMax: Tariffs Support Q1 But Credit Headwinds Persist (Upgrade),SeekingAlpha,https://finnhub.io/api/news?id=d355f433816bfb7f0b439fe53da0c52ba3914f70f65bf0d1d351fdf0eefb9227
ALLY,2025-06-19T09:05:48+00:00,"Redemption Holding Company, Central Bancorporation and Ally Financial Inc. completed the acquisition of Holladay Bank and Trust.",Finnhub,https://finnhub.io/api/news?id=b961e55226b9ab91a98c0a2a3d8c31afe24488dee6991e216331dd5a27ec4d55
ALLY,2025-06-18T14:01:00+00:00,Ally Financial schedules release of second quarter 2025 financial results,Yahoo,https://finnhub.io/api/news?id=7f66155806a85d81e286f79aa42c9fcef0bb0593501a511be171cf9cbd7de882
ALLY,2025-06-17T17:20:00+00:00,AEG's Kate Sheets Named to Sports Business Journal's Forty Under 40 Class of 2025,Yahoo,https://finnhub.io/api/news?id=4ebc2ef4aae6559f19fc168aa03af403266990a0e60735ee3a46ea8682bbbc97
ALLY,2025-06-16T13:00:05+00:00,How to Find Strong Finance Stocks Slated for Positive Earnings Surprises,Yahoo,https://finnhub.io/api/news?id=ae87347cb7e5f4aa5d0a24a4cf7fdb2281956d64c3bc30c7e73503721a728778
ALLY,2025-06-15T19:15:00+00:00,Tracking William Nygren's Harris Associates Portfolio - Q1 2025 Update,SeekingAlpha,https://finnhub.io/api/news?id=27f163a1217d670dd9241ea06700801ae7e6793a361618c884e18a408bcaf892
ALLY,2025-06-11T08:35:23+00:00,"Transcript : Ally Financial Inc. Presents at Morgan Stanley US Financials, Payments & CRE Conference 2025, Jun-11-2025 07",Finnhub,https://finnhub.io/api/news?id=d7c537ccd5c1efce06efaa50e82c432527cf4c26c651183b324601d821cd9fc0
ALLY,2025-06-10T10:29:00+00:00,6 Things to Know About the ‘Neobank’ Chime Before Its IPO,MarketWatch,https://finnhub.io/api/news?id=11978a38a26a5a6aac94c2d2462c5bf9805d7d7a69237af5269598722e156532
ALLY,2025-06-07T13:15:00+00:00,1 Warren Buffett Stock That Could Go Parabolic in 2025 and Beyond,Yahoo,https://finnhub.io/api/news?id=9e3830974e7e59f1d555ddcfc983e19c30bf5727fc19da077658a4bee25afce6
ALLY,2025-06-03T12:47:00+00:00,Chime’s IPO terms show fintech valuations have returned to reality. That’s a good thing.,MarketWatch,https://finnhub.io/api/news?id=f03444a45a33d35d0c69a24ce76ebc94fd70ba7ad6b2d6f5b5ec07ff9981f095
ALLY,2025-05-30T11:35:50+00:00,"Transcript : Ally Financial Inc. Presents at Bernstein 41st Annual Strategic Decisions Conference 2025, May-30-2025 10",Finnhub,https://finnhub.io/api/news?id=e80a35b131ea0072cec7ba5418581ceb43c4fcdeb8620ed44a52690a95ece2b5
ALLY,2025-05-27T17:02:08+00:00,"Buffett's May DiviDogs Tag Ally As A ""Safer"" Buy",SeekingAlpha,https://finnhub.io/api/news?id=e432e7efb8712a2c119f45f9a1cc4f6c68108e90c1fa61c39fb4fa1ffa44e57d
ALLY,2025-05-27T16:09:00+00:00,COF Stock Tanks 5.9% Post Discover Merger: A Good Buying Opportunity?,Yahoo,https://finnhub.io/api/news?id=aa5991a5743eeabbb1b7bfe53ed77466503e58b957a501278f4cc34b95f51c8d
ALLY,2025-05-27T03:00:00+00:00,The London Company Mid Cap Vs. RMC Q1 2025 Commentary,SeekingAlpha,https://finnhub.io/api/news?id=e2ca460419ceeb6d60c033c73b582342fe6ce80f58e376f8f2c4b1757dbae453
ALLY,2025-05-21T14:55:00+00:00,Ally Financial to present at the Morgan Stanley U.S. Financials Conference,Yahoo,https://finnhub.io/api/news?id=d59971cdf9b51dfe9d44bf8d9697f922808f44e316e9bf9b0ecc4fe5192ebcdb
ALLY,2025-05-20T23:30:00+00:00,Janus Henderson Small-Mid Cap Value Fund Q1 2025 Commentary,SeekingAlpha,https://finnhub.io/api/news?id=a310f51f276776af7a0ea9a01fdfbd26c9ea1bd95caabfd33d216153fa8238ae
ALLY,2025-05-20T11:35:00+00:00,Janus Henderson Mid Cap Value Fund Q1 2025 Commentary,SeekingAlpha,https://finnhub.io/api/news?id=9ea505ba17f3294c12dfd3de3f1ef183c3f18d2faa58ba6236c7d09103aa9d61
ALLY,2025-05-19T12:22:00+00:00,2 No-Brainer Warren Buffett Stocks to Buy Right Now,Yahoo,https://finnhub.io/api/news?id=45158043161e5bc817f6dc6776662ec2aeba93021d40da22a82400a8bc130063
ALLY,2025-05-18T01:01:43+00:00,SoFi Technologies: Extremely Expensive At 50x P/E But Growth Opportunities Justify Premium,SeekingAlpha,https://finnhub.io/api/news?id=44d99768e5d277b7fc1c7bd0897db439cec0df414ff3b79506340f219580cdd2
ALLY,2025-05-15T20:55:34+00:00,Tracking Warren Buffett's Berkshire Hathaway Portfolio - Q1 2025 Update,SeekingAlpha,https://finnhub.io/api/news?id=bfb898f1d6f6d54a00ecd93f249cac0b420adb7e1a8893b0efd24d5521ad1402
ALLY,2025-05-14T13:04:16+00:00,What Makes Ally Financial (ALLY) an Attractive Investment?,Yahoo,https://finnhub.io/api/news?id=890ef14e4ba4a090415538c3f471cc450fbfb7855573fe80e9058c927a570385
ALLY,2025-05-12T20:03:00+00:00,Is the Options Market Predicting a Spike in Ally Financial (ALLY) Stock?,Yahoo,https://finnhub.io/api/news?id=e28690e090042f3d0f882d8b3d9fce4a508eb2f0e2a1b9b173b51ddfedb11bf9
ALLY,2025-05-12T19:00:00+00:00,Ally appoints Michelle Goldberg to Board of Directors,Yahoo,https://finnhub.io/api/news?id=c548f4d7a3ec128142f8e092798bedf6ed4066cc0980e7812522e04d47d5022e
ALLY,2025-05-12T16:19:10+00:00,Ally Financial Appoints Michelle Goldberg To Board Of Directors,Finnhub,https://finnhub.io/api/news?id=153a369f4296557deb9c0cf6e364ad304bc6d09e80fd9c52e41dd5ef91e99d2d
ALLY,2025-05-12T10:41:08+00:00,"Ally Financial : Quarter ended March 31, 2025",Finnhub,https://finnhub.io/api/news?id=bac80ab0bb239b7a0c3cbacc0072affb26d31174bf11485ae6983858307fa8c5
ALLY,2025-05-10T17:21:12+00:00,Ally Financial Inc. (ALLY): A Bull Case Theory,Yahoo,https://finnhub.io/api/news?id=c744d733a0935cb6030f06299173676d42c00a75c01633a110d7f3c8c5766ee3
ALLY,2025-05-09T14:01:00+00:00,Ally Financial to present at the Bernstein Strategic Decisions Conference,Yahoo,https://finnhub.io/api/news?id=f5fde2b548825e5eec84159694510ed5dd5e8fd843b49abb9c9be8b56097698d
ALLY,2025-05-01T16:00:00+00:00,"April earnings update: Robinhood, Sleep Number, Starbucks, Ally Financial and State Street",Yahoo,https://finnhub.io/api/news?id=d58b10f157a05b109bc4e80afe94448f8aa67270295875a43105fc78acffab62
ALLY,2025-05-01T13:00:00+00:00,"Ally Corporate Finance targets infrastructure sector with new vertical focused on power, energy and digital",Yahoo,https://finnhub.io/api/news?id=42a806eb93ca56051b4179e6cfb03f073ddba44d06364c9381e8108b439a3ce7
ALLY,2025-04-30T18:51:03+00:00,Ally Financial Inc. (ALLY): Among the Cheap Dividend Stocks Being Targeted by Short Sellers,Yahoo,https://finnhub.io/api/news?id=d57768be44b0391aceb680c6ccddc7ea2426aa45b28f3d7de999db9ce9f28bee
ALLY,2025-04-30T08:10:44+00:00,Ally Financial: Rise In Used Car Prices Could Help Mitigate Credit Risk (Rating Upgrade),SeekingAlpha,https://finnhub.io/api/news?id=7e5b4793d2e78c5e35edb51518e00b13a61c1f5ea0a832a511146ec5cc470e6d
ALLY,2025-04-29T17:37:57+00:00,Ally Financial And 2 Other Stocks That May Be Undervalued For Savvy Investors,Yahoo,https://finnhub.io/api/news?id=9232d4938bb3b1890a4d4cc83d2d6332de30e133a1eb374997bad121d490210d
ALLY,2025-04-28T11:36:00+00:00,Navient Gears Up to Announce Q1 Earnings: What's in the Cards?,Yahoo,https://finnhub.io/api/news?id=103a2a78c3072b0e2ce220f652c77117b2fd6b328d8b571ca08dc544aad704a4
ALLY,2025-04-27T08:53:21+00:00,Warren Buffett's April DiviDogs Tag One Buy In 15 'Safer',SeekingAlpha,https://finnhub.io/api/news?id=0c836689a2be179378959a023b60cf476dc8b2fd9aa27a192bd21df815642187
ALLY,2025-04-25T09:15:00+00:00,5 No-Brainer Warren Buffett Stocks to Buy Right Now,Yahoo,https://finnhub.io/api/news?id=a96abb591095f1ec20ac5aaa180deea9af2e9c66ea664cf1593dc010b46fb11f
ALLY,2025-04-25T07:05:00+00:00,"The Smartest Dividend Stocks to Buy With $1,000 Right Now",Yahoo,https://finnhub.io/api/news?id=4b25b2a2a86cae574df19d4a12acee32fa895fc1f98f496b4a4593852723214a
ALLY,2025-04-25T04:06:20+00:00,Ally Financial: It's Fairly Valued But Beware Of Tariffs And Technical Risks,SeekingAlpha,https://finnhub.io/api/news?id=7b00d0d6da04e34aa2db7262ee2ff4edee978a497b6bcea3d88e791d26a1e97f
ALLY,2025-04-24T08:15:00+00:00,"Stock Market Turmoil: Buy These 3 Dividend Stocks for Less Than $1,000 Right Now",Yahoo,https://finnhub.io/api/news?id=fc747c52233f59cc243a9082633ea8b81b42fd3085417fe458820019ea6f7bc5
ALLY,2025-04-23T13:00:00+00:00,"COF Stock Up 2.8% on Q1 Earnings Beat, NII Rises on Upbeat Card Spend",Yahoo,https://finnhub.io/api/news?id=8b431569e3158166690229f265ebfc92e7aba495b5cecb8009d92fd69a08df94
ALLY,2025-04-23T11:56:00+00:00,"COF Up as Q1 Earnings Beat on Higher NII & Fee Income, Provisions Dip",Yahoo,https://finnhub.io/api/news?id=33578cb2c0db8481fed2e77a6e983cef129a7e88456c936c55e3194bb2da8cc6
ALLY,2025-04-22T16:01:22+00:00,Ally Financial price target lowered to $41 from $45 at Truist,Yahoo,https://finnhub.io/api/news?id=e716ddb5d80779508305bf7dd90a0ecab79f1a44699fa233656eac3b4583424b
ALLY,2025-04-21T19:13:43+00:00,"Why Even High-Quality Financial Stocks American Express, Blackstone, and Ally Financial Plunged Today",Yahoo,https://finnhub.io/api/news?id=5691c7d5bfe342b0ea96cb3d6e47afcfb2bef5079f6eb23173f4fc18119807b2
ALLY,2025-04-21T15:17:00+00:00,ALLY Q1 Earnings Top on Higher Net Finance Revenues & Lower Provisions,Yahoo,https://finnhub.io/api/news?id=8cbbf011a9ef937414908fc6f61cd824caf050c694f77dea75a225cdbdbee3d4
ALLY,2025-04-21T05:39:13+00:00,Ally Financial reports first quarter 2025 financial results,Finnhub,https://finnhub.io/api/news?id=20dfdef16d0aa9028b8c87564fd1c5b3d71ecf01f3b60118bbccf9b1f149a75c
ALLY,2025-04-18T11:01:36+00:00,Ally Financial First Quarter 2025 Earnings: Misses Expectations,Yahoo,https://finnhub.io/api/news?id=dad083f8912e1ac2d450839b66bb6e72e6f4eb5f7f41fe50e32d253827d99484
ALLY,2025-04-18T07:02:38+00:00,Ally Financial Inc (ALLY) Q1 2025 Earnings Call Highlights: Strong Auto Originations and ...,Yahoo,https://finnhub.io/api/news?id=7df277797c25c4d10c077d313a6b0e44097d4d20903c4b1ef058a5a5e0fe7362
ALLY,2025-04-18T03:40:41+00:00,Q1 2025 Ally Financial Inc Earnings Call,Yahoo,https://finnhub.io/api/news?id=b3d1a34653fddf89b1edb71b5634b4e3fe2adbb5f9e2eba3fdb04923523a0420
ALLY,2025-04-17T15:45:55+00:00,Ally Financial Inc. (ALLY) Q1 2025 Earnings Call Transcript,SeekingAlpha,https://finnhub.io/api/news?id=e0a1f3a89f87d0381ecee1d967441130d887adc801e2c1b2f14349351dd2a35d
ALLY,2025-04-17T13:30:16+00:00,Ally Financial (ALLY) Q1 Earnings: How Key Metrics Compare to Wall Street Estimates,Yahoo,https://finnhub.io/api/news?id=407fe64fa75ea16cd46d5be96f1f88fa6be84f32f955d33101ba9d19414f26b1
ALLY,2025-04-17T13:17:57+00:00,"Ally Financial: Mixed Q1, With Weak Capital An Increasing Focus",SeekingAlpha,https://finnhub.io/api/news?id=b59f790bfed603cae2f2d70033216d4e6951d6672ab5339f44fbc4e81fad64ab
ALLY,2025-04-17T12:40:03+00:00,Ally Financial (ALLY) Surpasses Q1 Earnings Estimates,Yahoo,https://finnhub.io/api/news?id=e6188e326b8fd9ba822e8d29cb3bad184c425bbdea8a28915afe76ff25578086
ALLY,2025-04-17T12:07:06+00:00,Ally Financial Inc. 2025 Q1 - Results - Earnings Call Presentation,SeekingAlpha,https://finnhub.io/api/news?id=1385ca8514f13ba3c4e45d96e2423784e782e047b5470b194e5af505cd0add01
ALLY,2025-04-17T11:36:20+00:00,Ally Financial: Q1 Earnings Snapshot,Yahoo,https://finnhub.io/api/news?id=82e80bd9f870012800ab7d16f09506d3d5e16c6f88509a58109db21a327346c5
ALLY,2025-04-17T07:32:15+00:00,Ally Financial : Q1 2025 Ally Financial Inc. Earnings Press Release,Finnhub,https://finnhub.io/api/news?id=8a7f721fe15549b0ee686472721639f3488c1c3f249bea16dd272e9906763e26
ALLY,2022-06-06T13:50:01+00:00,Why This 1 Momentum Stock Could Be a Great Addition to Your Portfolio,Yahoo,https://finnhub.io/api/news?id=0b48bde173c570f26db89df39979661594129fc2cb9abbf18f5697b28e905a41
