ticker,published_utc,title,publisher,url
AZN,2025-10-16T21:09:01+00:00,Trump: Cost of Ozempic Could Be $150. Dr. Oz: Not Yet.,Yahoo,https://finnhub.io/api/news?id=3d6fdd3d62cdaaa34e84bc4bc578b8edc1cd5f2d0efd735b362fe5b8b5206eeb
AZN,2025-10-16T17:55:00+00:00,LLY's Oral GLP-1 Pill Scores Another Pair of Diabetes Wins,Yahoo,https://finnhub.io/api/news?id=b6656dc8dd77dacafed03a1e4ec30c4a8d7e7609817ca8888a62441ff8da9e97
AZN,2025-10-16T16:26:46+00:00,AstraZeneca doubles Lokelma output with $445m Texas plant expansion,Yahoo,https://finnhub.io/api/news?id=d4bf70291bd417f40636c6fa6c8b1f1744617f45913d3e524b35c5a9cd56dbea
AZN,2025-10-16T13:48:00+00:00,2 Pharmaceutical Growth Stocks to Buy Now and Hold for Decades,Yahoo,https://finnhub.io/api/news?id=330b9c95826c00fab473562b7572e31e004bf847ccab32732ce13052a0f32db9
AZN,2025-10-16T13:00:00+00:00,Personalis Announces New Data from a Landmark Lung Cancer Trial Utilizing Ultrasensitive MRD Testing,Yahoo,https://finnhub.io/api/news?id=9dee46b8f9a87cd67d09de717d98ff33def1fae2f5388ded4d3fd2c1eea17cbb
AZN,2025-10-16T11:23:44+00:00,"AstraZeneca cut to Sell by Deutsche Bank on pipeline doubts, patent risk",Yahoo,https://finnhub.io/api/news?id=15c2ff094a2c2e3f4a8c6394abd3112eb3ddb2c764a98de3e923371a0298c5a4
AZN,2025-10-16T11:01:31+00:00,Eli Lilly’s oral GLP-1RA gains fourth Phase III type 2 diabetes win,Yahoo,https://finnhub.io/api/news?id=e8641e8e7b5efa75947295090f68f153b8a60034ca4862b2fa793329349629c4
AZN,2025-10-16T06:37:57+00:00,3 UK Stocks That May Be Priced Below Their Estimated Value In October 2025,Yahoo,https://finnhub.io/api/news?id=2e95fe6ed7b4543d76a5314e4250658a356e1eafe5aeca2a1a73d66381ea0483
AZN,2025-10-15T14:57:29+00:00,European Equities Traded in the US as American Depositary Receipts Rise Modestly in Wednesday Trading,Yahoo,https://finnhub.io/api/news?id=19afaf86686334b11be36ce704f55c590f82cf4906fdf3064e0a50dc80a93830
AZN,2025-10-15T14:00:00+00:00,AstraZeneca unveils expanded manufacturing facility in Texas,Yahoo,https://finnhub.io/api/news?id=68f3fe75febd967bd96e8ba3253a723af274451f11cc44dc4dc24f4994bd65c2
AZN,2025-10-15T11:44:00+00:00,"Non-Small Cell Lung Cancer Analysis Report 2025: Market Dominated by Roche, AstraZeneca, Merck, and Novartis, Fueled by Immuno-Oncology, Targeted Therapies, and Strategic Pipeline Collaborations",Yahoo,https://finnhub.io/api/news?id=d50bcbd6ac249c8ebcb4b6411344c21508850feb5b38fbad9309faf5868390c1
AZN,2025-10-15T11:03:00+00:00,"Lilly, battling skepticism, reinforces GLP-1 pill’s case with new study data",Yahoo,https://finnhub.io/api/news?id=e1492779ad9ab7ca94618ee81929ae3fd9a64c18cb23141f9549c138cf3efc54
AZN,2025-10-14T18:15:52+00:00,I-Mab Biopharma Stock: Caution Warranted After Huge Surge,SeekingAlpha,https://finnhub.io/api/news?id=b80c05aac930259c2b7cffa31faa8a5ffd8940a4dfeb13891be07fce641a90a0
AZN,2025-10-14T15:57:17+00:00,China’s drugs offer lifeline for global pharma as it peers over the patent cliff,Yahoo,https://finnhub.io/api/news?id=f9b822c7a318d349bc6f992e71bae5aaef8211591e1df7f48af30bd5e56b41e9
AZN,2025-10-14T15:09:18+00:00,Allogene Therapeutics Faces Patent Infringement Challenges,Yahoo,https://finnhub.io/api/news?id=3ca4656b2523130a2c99907f75f630d1373b516d65934ec5504d876d3d08c9de
AZN,2025-10-14T14:57:00+00:00,5 Small Drug Stocks to Buy as the Industry Shows Some Recovery,Yahoo,https://finnhub.io/api/news?id=8173b8fd5fbe36f893a4658ec215d86285edf6652cdc57ae7d1653cf26cae89f
AZN,2025-10-14T13:45:02+00:00,Astrazeneca (AZN) is a Top-Ranked Growth Stock: Should You Buy?,Yahoo,https://finnhub.io/api/news?id=0b1f2e4694f480b173651381fa27c4bcde469d974a494b17ff855814961f3f6a
AZN,2025-10-14T12:43:00+00:00,Johnson & Johnson Earnings Beat Estimates. Why the Stock Is Dropping.,Yahoo,https://finnhub.io/api/news?id=37f99b90fa6df76efe96e4bfb5786b7fb24f9c238e23a603857d0f7a40cf88bf
AZN,2025-10-14T11:53:00+00:00,AstraZeneca cuts US drug pricing deal; FDA declares Novo plant out of compliance,Yahoo,https://finnhub.io/api/news?id=a8f0268f172a51a48fd45fd4f3a0d6a06dc87e7e0cd064a3244d9355ee13f1b8
AZN,2025-10-14T07:30:00+00:00,Ona Therapeutics Appoints Oncology Drug Development Veteran Dr. Antoine Yver as Chair to Accelerate ADC Programs to Clinical Inflection Points,Yahoo,https://finnhub.io/api/news?id=2f3a35bd832470af2d00e0f3fbe698417c0977c5b899c8929dfd8c73feae7c1d
AZN,2025-10-13T21:07:26+00:00,Trump Strikes Again: AstraZeneca's Surprise Drug Deal Could Shake Big Pharma's Global Pricing Power,Yahoo,https://finnhub.io/api/news?id=554f4785271337349356e408bc1a1a7a382c3f86976509675308fb85f86ff1ae
AZN,2025-10-13T19:24:00+00:00,Trump’s AstraZeneca Deal Echoes Pfizer Pact. Big Pharma’s Political Headaches Are Easing.,Yahoo,https://finnhub.io/api/news?id=8b5d9a7a8877330f2718e060c2160c257457621695bd6104cab575f4ca586748
AZN,2025-10-13T17:40:00+00:00,"AZN Strikes Drug Pricing Deal With Trump, Gets 3-Year Tariff Reprieve",Yahoo,https://finnhub.io/api/news?id=1480f66d706d835623c6a351a69c2d21b03fe4681b3b19910e0dc7f1cd409960
AZN,2025-10-13T16:25:11+00:00,Miners prosper as FTSE 100 makes steady progress,Yahoo,https://finnhub.io/api/news?id=db26f71f7a0a08480fab5df8fa3f21e721cfa497b203a00e93cbd194413fd94e
AZN,2025-10-13T13:40:02+00:00,Why This 1 Value Stock Could Be a Great Addition to Your Portfolio,Yahoo,https://finnhub.io/api/news?id=4a37dc64ec0d38e384cf013469891f0918aa2a6beb078b76c3544abac6147a98
AZN,2025-10-13T12:07:18+00:00,Pharma firms announce direct-to-consumer sales and price cuts in US,Yahoo,https://finnhub.io/api/news?id=c4dbdca2a1804bb7fb291a366121e7f467b8bab848147419667f7524bdedc0ea
AZN,2025-10-13T11:54:36+00:00,"Stocks to Watch Monday: Fastenal, Tesla, JPMorgan, Warner Bros.",Yahoo,https://finnhub.io/api/news?id=cb3113b604e8a05919ba3d5c31cfc70d322249d6e1b5ea23e41033dbade37a53
AZN,2025-10-13T11:48:52+00:00,AstraZeneca inks Trump drug pricing deal amid tariff threats,Yahoo,https://finnhub.io/api/news?id=7a2b2a23b1094dc04b183fe895b0aed3a50f1926bcb5753be43092992638d0b1
AZN,2025-10-13T11:00:00+00:00,AstraZeneca furthers ambition to redefine cancer care with first data from four major pivotal trials at ESMO,Yahoo,https://finnhub.io/api/news?id=0ab61ae3c521533d82a5883cfcd7f0aa5153993dcf602c0311b00f2010b39232
AZN,2025-10-13T09:05:32+00:00,"Trending tickers: TSMC, AstraZeneca, Lloyds, Fresnillo and Canal+",Yahoo,https://finnhub.io/api/news?id=ffb5d1f72c07e32984d03e814bbd5665e0983b3c79dc6bc016231b30b0c11690
AZN,2025-10-13T07:45:00+00:00,"Company News for Oct 13, 2025",Yahoo,https://finnhub.io/api/news?id=7b4925c4940e572195910bb591f0bb5eba93277fc536104b58415b369adf9e74
AZN,2025-10-13T04:00:00+00:00,AP Top Financial News at 1:51 a.m. EDT,Yahoo,https://finnhub.io/api/news?id=69868e4b0acd6844e6e5167022d799af84b9f1a28db535313bf5a32e3628b638
AZN,2025-10-13T04:00:00+00:00,AP Top Extended Financial Headlines at 1:51 a.m. EDT,Yahoo,https://finnhub.io/api/news?id=737b56cef97f266e3742864d87ab89ced2b20be4014737c32b1bdaf024b45dab
AZN,2025-10-12T04:00:00+00:00,AP Top Financial News at 11:57 p.m. EDT,Yahoo,https://finnhub.io/api/news?id=63b80c909944087d1e163827866a1c5e4be610435ebb391540cadb097b31f548
AZN,2025-10-12T04:00:00+00:00,AP Top Extended Financial Headlines at 11:57 p.m. EDT,Yahoo,https://finnhub.io/api/news?id=a213bb8f77d5d796f1ee3b97fab59a59b108bdbb00eb314d9d5bfd4bc54c8e08
AZN,2025-10-11T01:00:26+00:00,AstraZeneca to slash US drug prices as Trump pressures NHS to pay more,Yahoo,https://finnhub.io/api/news?id=aba6320c72c24f079bd7782c2fa88cd588fd8e199c90381ddd84c6473a48acda
AZN,2025-10-11T00:27:00+00:00,AstraZeneca Cuts Discounted Drug Pricing Deal With the White House. The Stock Is Rising.,Yahoo,https://finnhub.io/api/news?id=086d5d6d92bee3f135342f46997fa93df40e4d9d6268dec5fe65d0c2cd2f28af
AZN,2025-10-10T23:11:00+00:00,AstraZeneca Strikes Drug-Pricing Deal With Trump Administration,Yahoo,https://finnhub.io/api/news?id=78f4394e58d42f0b0a3fd285a0bacfb579cb04f8118f7d4f78bffdbee36ce6fe
AZN,2025-10-10T22:43:43+00:00,AstraZeneca agrees to lower drug prices for Medicaid under Trump administration deal,Yahoo,https://finnhub.io/api/news?id=3cea312294a4c44a928846940d6ec79072f0a5f06ed2687edfb554116db52424
AZN,2025-10-10T22:28:24+00:00,Trump Announces AstraZeneca Drug Price Cuts,Yahoo,https://finnhub.io/api/news?id=0b129b7457c07884d205b0b791d4cdba82810165c833f8c88d4b787c9cd517dd
AZN,2025-10-10T22:20:42+00:00,Trump announces US drug pricing deal with AstraZeneca,Yahoo,https://finnhub.io/api/news?id=154385e24008cef8df5bf9ea13a1e131f8162a68d133450fc25e047015178fe3
AZN,2025-10-10T21:58:15+00:00,Trump Announces AstraZeneca Drug Price Cuts for Tariff Reprieve,Yahoo,https://finnhub.io/api/news?id=3f72c0b7e0d9c373f702ec53e3ee2e2a04005b939f915a995ed04a63e287c347
AZN,2025-10-10T19:38:10+00:00,Sector Update: Health Care Stocks Decline Late Afternoon,Yahoo,https://finnhub.io/api/news?id=2a27e7e5d63c72c1b5aad86ef564c1fa8c9705a7afe66c986b47282a801423af
AZN,2025-10-10T18:07:36+00:00,Sector Update: Health Care Stocks Decline Friday Afternoon,Yahoo,https://finnhub.io/api/news?id=ebfa27236efd8b0a03f06d8f5003b3b9af448ed02da43fe5222a06419786e301
AZN,2025-10-10T17:32:57+00:00,Market Chatter: AstraZeneca Reaches Deal With Trump to Lower Drug Prices,Yahoo,https://finnhub.io/api/news?id=9d84fe4dbbf021e6bfc4f3239008e5b8b1fd3e653ddb9df361fa6e18bd1b0675
AZN,2025-10-10T17:18:54+00:00,Monopar Therapeutics: A Healthy Dose Of Skepticism Warranted,SeekingAlpha,https://finnhub.io/api/news?id=8cf650be428c062c1a863b49178cdd1971875542cb378fb657128b753e58b760
AZN,2025-10-10T12:50:00+00:00,IonQ Announces Pricing of $2.0 Billion Equity Offering,Yahoo,https://finnhub.io/api/news?id=e5b7659d59aaefb47d41e51ba39431ffc7301a7bcc8d41423006b2e881ac764d
AZN,2025-10-10T11:28:18+00:00,AstraZeneca sets $4.5bn Virginia API plant construction in motion,Yahoo,https://finnhub.io/api/news?id=3147ce1ac0f3a2dcb4554a096046c50511e1cb6511dae0958e4370d0dbc4fc9b
AZN,2025-10-10T09:07:00+00:00,AstraZeneca ups investment in Virginia; Moderna vets launch VC fund,Yahoo,https://finnhub.io/api/news?id=15ec430a4d9f5cafc0af8bfaa31a27297fcdf8620510b4489d757d0321061950
AZN,2025-10-09T16:30:00+00:00,"AstraZeneca plans to increase investment and scope of its Virginia manufacturing facility to $4.5 billion, creating 3,600 new jobs",Yahoo,https://finnhub.io/api/news?id=880cc2f1a29591f8860547db5ea431520b074dbb090a92976a55b6b84bacf9be
AZN,2025-10-09T15:05:00+00:00,Lifespan-Backed Algen Biotechnologies Partners with AstraZeneca to Advance AI Drug Discovery,Yahoo,https://finnhub.io/api/news?id=13f6a6379eab7aa8ce6faf7ec019ba95a522a01433173940a76d55291795365d
AZN,2025-10-09T10:00:00+00:00,"Turbine Launches Collaboration with AstraZeneca, Leveraging Turbine's Virtual Disease Models to Rationalize ADC Discovery",Yahoo,https://finnhub.io/api/news?id=26ab9cbcac6ce9e6a68a9e5c7bbe4ddf7e74c1f14b132ebf1db6d94089052463
AZN,2025-10-09T08:23:00+00:00,"Bispecific Antibodies Market - Global Forecast 2025-2032, Profiles of Key Players - F. Hoffmann-La Roche, Amgen, Janssen Biotech, Pfizer, AbbVie, Regeneron, MacroGenics, AstraZeneca, Merck, and Genmab",Yahoo,https://finnhub.io/api/news?id=d1948cb61301d64f144bdf4db2d55b6472eca18c5b1637ffc6ab4dc18bf7a5a4
AZN,2025-10-09T06:37:55+00:00,UK Stocks Including Serica Energy That May Be Priced Below Intrinsic Estimates,Yahoo,https://finnhub.io/api/news?id=9657c4e9853efed1d1d736bc7acc8a36dac6dbb1c0d4caf6ecc1a00df72e980c
AZN,2025-10-08T15:15:00+00:00,AstraZeneca's Baxdrostat Meets Goal in Resistant Hypertension Study,Yahoo,https://finnhub.io/api/news?id=0873f0eda3f76f3ed59a900e054efdb1cdc9c499b95e505de5624c9b277ced41
AZN,2025-10-08T11:00:00+00:00,"Mikael Dolsten, M.D., Ph.D., Joins TRIO Pharmaceuticals as Chairman",Yahoo,https://finnhub.io/api/news?id=a9fd62a1b4ca2a30527e726673bbe62f6500643377cd31a96721609132c8e6ca
AZN,2025-10-08T07:15:10+00:00,AstraZeneca Shares Surge 14% as Investment Pause Spurs Fresh Valuation Debate,Yahoo,https://finnhub.io/api/news?id=14c009227cb3d5182329d471fbc873acf332cd2b4844cb661fdd3d754a314c1a
AZN,2025-10-07T15:20:00+00:00,Neuromuscular Disease Therapeutics Market to Reach US$ 45.62 Billion by 2033 as Gene Therapies and RNA-based Treatments Redefine Patient Outcomes,Yahoo,https://finnhub.io/api/news?id=9ca05e134f35b94c3ed25a19fb6a0ca3e0477aee5fb8d0a79f0c9e229d8b6e55
AZN,2025-10-07T13:43:02+00:00,"Best Stocks To Watch: Two New IPOs, Pharma Titan AstraZeneca And Electrical Grid Play Emcor Trade Near Buy Points",Yahoo,https://finnhub.io/api/news?id=adf1d87790d3ed62fc2c353dcae69037afda2250c707cd3eecba2fd8a2d44820
AZN,2025-10-07T13:35:03+00:00,AstraZeneca (LSE:AZN): Exploring Valuation as Shares Move Steadily Higher,Yahoo,https://finnhub.io/api/news?id=00ec5b7747a9001f9de8ddbaedc8e9a8e58bbadfa6a91ccd9e3e09a36acec391
AZN,2025-10-07T12:39:00+00:00,Thermo Fisher's New R&D Alliance With AstraZeneca May Lift Its Stock,Yahoo,https://finnhub.io/api/news?id=d4002c197d3bafcf43939f68c82d98a1bc2e0fd7e0785be2f77c95321fd4a84a
AZN,2025-10-07T12:30:00+00:00,My Green Lab Thanks Board Member Penny James for Her Service and Welcomes Liz Chatwin to the Board of Directors,Yahoo,https://finnhub.io/api/news?id=f6ae325d53b4d9e4089a0c707662956c02334083a4448f60e830160fc15b9e23
AZN,2025-10-07T12:27:00+00:00,"Merck Rises 13% in a Week: Should You Buy, Sell or Hold the Stock?",Yahoo,https://finnhub.io/api/news?id=1abb297e6be03716f7053f6b96fee93e78e971ceb9e28854be00a15c20572caa
AZN,2025-10-07T11:00:00+00:00,Baxdrostat met the primary endpoint in Bax24 Phase III trial in patients with resistant hypertension,Yahoo,https://finnhub.io/api/news?id=3d71458561678a16a2b97f4bdfac911ca039b8c9e57b9bc267fa15425d59b217
AZN,2025-10-06T15:38:29+00:00,AstraZeneca threatens to stop investing in Britain,Yahoo,https://finnhub.io/api/news?id=1e422705b3472ae335e6a8cd65c98ee7d44a74eb3912b81ede14b55e941b570f
AZN,2025-10-06T13:56:00+00:00,Luckie Names Scott Gelber Chief Executive Officer to Lead Next Phase of Agency's Growth,Yahoo,https://finnhub.io/api/news?id=2ec4a07aa0a4059b8735838f9aee6454a296b27354243163a40a560f2716e784
AZN,2025-10-06T13:30:40+00:00,AstraZeneca signs up to $555 million deal with US-based Algen to develop gene therapies,Yahoo,https://finnhub.io/api/news?id=a43d3ef57f70a36e66f6950c279074b65c839dcfeafac73bbb2d89be586f7ac3
AZN,2025-10-06T13:29:00+00:00,My Top 5 Biotech Stocks Big Pharma Could Buy Next,SeekingAlpha,https://finnhub.io/api/news?id=0615cc217ad0cd350a198a8133c50199b31af463e4f96ab378a062934e7cccc8
AZN,2025-10-06T12:50:29+00:00,AstraZeneca/Daiichi Sankyo Partnered Breast Cancer Drug Shows Survival Benefit Over Chemotherapy,Yahoo,https://finnhub.io/api/news?id=229194d277bd8b01a3615a5aafb1b7df7ecd6e55e11a2bc5da75bd797897efc0
AZN,2025-10-06T12:04:23+00:00,AstraZeneca signs up to $555 million AI deal with Algen to develop therapies,Yahoo,https://finnhub.io/api/news?id=f44d13fd3e7225d1900f3b38a3af9f350cb674f64a995748e2a2b4504c3b017c
AZN,2025-10-06T12:00:00+00:00,Algen Biotechnologies Announces Multi-Target Partnership to Advance AI-Powered Drug Discovery in Immunology with AstraZeneca,Yahoo,https://finnhub.io/api/news?id=6c72a6a052905b24fea2dc68051d8bd749012cb3fb78df25d151127328e87b7b
AZN,2025-10-06T11:59:21+00:00,"ETG: Low Yield Relative To Peers, But Strong Historical Performance",SeekingAlpha,https://finnhub.io/api/news?id=11acc38f4a1861bebf0eb10e1f06fe0ac56ca92eb8ecc22f00cd3e76aa4904d9
AZN,2025-10-06T11:00:00+00:00,DATROWAY® (datopotamab deruxtecan-dlnk) improved OS and PFS in TROPION-Breast02,Yahoo,https://finnhub.io/api/news?id=f8d659c5655119915a41e63a573d898729557ea40d6121ea4f5632e91476d226
AZN,2025-10-06T10:07:00+00:00,Gilead delays arrival of Biktarvy copycats; CDC updates vaccine schedule,Yahoo,https://finnhub.io/api/news?id=10b987dc0e12419edf471f92b1270f2d7c343a1f9cc91a98b510e5a9c701f09d
AZN,2025-10-06T06:30:00+00:00,DATROWAY® Demonstrated Statistically Significant and Clinically Meaningful Improvement in Overall Survival as First-Line Therapy for Patients with Metastatic Triple Negative Breast Cancer for Whom Immunotherapy Was Not an Option in TROPION-Breast02,Yahoo,https://finnhub.io/api/news?id=1737344c46a87d9dbcc5d2a44f51b8a458ea45be72ed8f203e500cde05232534
AZN,2025-10-04T13:20:52+00:00,How Recent Developments Are Shaping the Story and Outlook for AstraZeneca,Yahoo,https://finnhub.io/api/news?id=8fcad538a908d37946b6ff500c47c3ef651dcc3137506f183b907f5971179752
AZN,2025-10-03T22:15:04+00:00,Astrazeneca (AZN) Rises Higher Than Market: Key Facts,Yahoo,https://finnhub.io/api/news?id=0fa2f0eb54481a12810160ece288bb7a27a9e9ace9a3d3639f3b82fd61f8584f
AZN,2025-10-03T20:58:46+00:00,"US Equity Indexes Rise This Week as AI-Trade Lifts Tech, Healthcare Gains Following Pfizer Deal",Yahoo,https://finnhub.io/api/news?id=6b62ac183b5a695c26807571dc66235f3c095bc9b6f389696fe9ff0940d3a2c8
AZN,2025-10-03T16:20:59+00:00,Pharmaceutical Stocks: Valuations And Pipelines Are Only Beginning To Be Appreciated,SeekingAlpha,https://finnhub.io/api/news?id=39054aec8ba10e961ea96a273ddee36fc4c99bf71a99023c0844a605f6cc98ae
AZN,2025-10-03T13:47:03+00:00,Structure Therapeutics: The Dark Horse In The Oral Obesity GLP-1 Arena,SeekingAlpha,https://finnhub.io/api/news?id=ed0f4a1dfebc13f9a887aac9c92ace202289cd3139f4b2fc607abd0cfaeb024a
AZN,2025-10-03T12:00:44+00:00,"How BeOne Medicines, An IBD 50 Stock, Is Taking On Big Names In Cancer Treatment",Yahoo,https://finnhub.io/api/news?id=542f2b1b75b8988cf9ad4aa311e83a32204312a65c8d207c95eda8dff57335b3
AZN,2025-10-03T09:18:00+00:00,Beauty Tech Shares Jump on Stock-Market Debut as Listing Gives Boost to London Exchange,Yahoo,https://finnhub.io/api/news?id=ca6e3f3880c0aefa29497c61aed0b401b3d40eae757dabab4f3959671bd65c2d
AZN,2025-10-03T06:37:58+00:00,UK Stocks That May Be Trading Below Intrinsic Value In October 2025,Yahoo,https://finnhub.io/api/news?id=201b39f7edb50c8ba7021984c735571dc1377465e22b8f686d1e7bfa6cc39c49
AZN,2025-10-02T16:58:21+00:00,Can Thermo Fisher (TMO) Balance Biomanufacturing Expansion and AI Ambitions to Shape Its Long-Term Edge?,Yahoo,https://finnhub.io/api/news?id=2fcb7eb09de5dff6bbfe8cc229ee01833afc9623b3037f492438e2b64a433c95
AZN,2025-10-02T16:22:46+00:00,AstraZeneca Stock Is Up 10% on Tariff News. But Is the Pharmaceutical Giant a Buy?,Yahoo,https://finnhub.io/api/news?id=4d71280f92d3a9cd78e0a2ecefcf5c8155ae03c5bd980b22d278b66f7adaeab4
AZN,2025-10-02T15:07:30+00:00,AstraZeneca’s US listing to leave £200mn UK stamp duty hole,Yahoo,https://finnhub.io/api/news?id=0cb79f7318b21e83d088bdbd34306e12a29fb2459825e1ef13a20c0e285b5b49
AZN,2025-10-02T13:50:03+00:00,Why Astrazeneca (AZN) is a Top Momentum Stock for the Long-Term,Yahoo,https://finnhub.io/api/news?id=68dea2234c45ee6ea1bf8255365087e58618d9375bb3429349ddf2bf10c72bd7
AZN,2025-10-02T11:51:40+00:00,Market Chatter: White House Asking Companies to Make Deals Ahead of Midterm Elections,Yahoo,https://finnhub.io/api/news?id=0c09b61ff324ec415d02050cac9142a892427322cfacc6af1323f139ae85e712
AZN,2025-10-02T07:48:55+00:00,AstraZeneca (AZN) Jumps to All-Time High on Trump Drug Tariff Delay,Yahoo,https://finnhub.io/api/news?id=6724a13cb03b67895d66db9e82177e85ea7776f16f300ae1fe47c9fb63bd6ebc
AZN,2025-10-02T05:30:00+00:00,GSK boss says US is ‘biggest priority’ as Trump pressures drugmakers,Yahoo,https://finnhub.io/api/news?id=ac2b25619ec496a9976f7602d8af704fc8e9a499b31712b86093f6b7fd4b56ae
AZN,2025-10-01T21:05:55+00:00,"S&P 500, Dow Reach New Peaks as Traders Look Past Ongoing Shutdown",Yahoo,https://finnhub.io/api/news?id=46463ae646d7ca61aa8571ec1d7bcf123f5787c7df74df4a1cce9896692a2f53
AZN,2025-10-01T20:00:50+00:00,Why Merck (MRK) Stock Is Up Today,Yahoo,https://finnhub.io/api/news?id=486fce15972b9fed8e3956ff090de0e7fa1db96758b3a92330e210d6b93ed58a
AZN,2025-10-01T18:36:31+00:00,Equities Rise Intraday as Markets Look Past Shutdown,Yahoo,https://finnhub.io/api/news?id=086767a9660837a406fab452a5b0cc67fe4dd2e002f497725a26a124b909e4f7
AZN,2025-10-01T16:30:18+00:00,FTSE 100 hits another high despite concerns over US government shutdown,Yahoo,https://finnhub.io/api/news?id=62752f37ef914efefc90981f0d4a39509a350e1c29d9160551a77cb4d362dceb
AZN,2025-10-01T15:44:05+00:00,"Pfizer Stock, Other Drugmakers Rally Again",Yahoo,https://finnhub.io/api/news?id=3d4f225276ac87a5c85b10c4e7ba33633e09007d4b366cd4c04200e8c17b96b4
AZN,2025-10-01T15:00:18+00:00,European Equities Traded in the US as American Depositary Receipts Surge  in Wednesday Trading,Yahoo,https://finnhub.io/api/news?id=8a8fce44938c18780982cac661a2936d8f34fbe7d32547020363e1525d61798a
AZN,2025-10-01T14:59:00+00:00,Thermo Fisher Scientific Announces R&D Partnership with AstraZeneca BioVentureHub,Yahoo,https://finnhub.io/api/news?id=15f9ca269f0de47a00abd66b901aad24c7b675a96efc6adb0fda2285da35f372
AZN,2025-10-01T12:06:39+00:00,European healthcare stocks surge after US deal with Pfizer,Yahoo,https://finnhub.io/api/news?id=e1362238af10635517926371f8ccb72fe98564dab92da9c050e5389996232440
AZN,2025-10-01T12:00:30+00:00,Why Drug Stocks Are Celebrating Trump's 100% Pharmaceutical Tariff,Yahoo,https://finnhub.io/api/news?id=bac3ddf7c37b22aa4b4c87ef97f323b201820218df4a801e903b13c033162193
AZN,2025-10-01T11:30:31+00:00,"European stocks rise, Wall St futures drop as US shutdown begins",Yahoo,https://finnhub.io/api/news?id=e26c7251dd5745b350a4eee019c627a2cf2c8db4c72df8d83fafd4ce32ccb190
AZN,2025-10-01T09:20:34+00:00,Convatec to open new R&D hub in Manchester as part of £500m UK investment,Yahoo,https://finnhub.io/api/news?id=a91e5ca6a0c231107ec195d5eab35e4d19205a3b0c84c97ca0e52f328277d2fa
AZN,2025-10-01T09:07:00+00:00,Pharma Stocks in Europe Jump After White House Unveils Drug-Buying Site,Yahoo,https://finnhub.io/api/news?id=1aae90b0d8ec6980c5b6b03cf220e404c1bc9a994a5d19860481ae54ab04a84e
AZN,2025-10-01T09:05:18+00:00,"Stocks to Watch Wednesday: Nike, Lithium Americas, Arm, Occidental",Yahoo,https://finnhub.io/api/news?id=0c07d91dfc9d3e0294361190c520161e7d11d3f8d6816c7d27813c5f3214b964
AZN,2025-10-01T08:00:00+00:00,AstraZeneca’s at-home flu vaccine is a breakthrough that could pave the way for others,Yahoo,https://finnhub.io/api/news?id=4102e68b6434f978b873e7b1fd57a5992550b74477f64fce27d344cdaa496448
AZN,2025-09-30T15:06:26+00:00,European Equities Traded in the US as American Depositary Receipts Edge Higher in Tuesday Trading,Yahoo,https://finnhub.io/api/news?id=fa5028946d1e82d8801cc258111d88b1b03ee7d39900329c0739fe13defcd5be
AZN,2025-09-30T14:28:27+00:00,Analysis-AstraZeneca's US listing may pull other firms from London in its wake,Yahoo,https://finnhub.io/api/news?id=c74cbd6f5be0e22cba01c6ca87abe50e40aecbc3b3e63dc9618d43751505bf3b
AZN,2025-09-30T13:40:03+00:00,Is ABCELLERA BIOLG (ABCL) Stock Outpacing Its Medical Peers This Year?,Yahoo,https://finnhub.io/api/news?id=4a19aceefb54231f3035c9154f160716833a1c97ccd2183c331a514ab803491b
AZN,2025-09-30T10:30:00+00:00,Genmab Strikes $8 Billion Deal for Cancer Treatment Maker Merus,Yahoo,https://finnhub.io/api/news?id=5e6093f3a5511a13b171e615c5fa9bdd4a507ce70ae291aa8eda81457ffd1f08
AZN,2025-09-30T06:52:21+00:00,Terns Pharmaceuticals: Valued As If It Can't Win,SeekingAlpha,https://finnhub.io/api/news?id=a574e7e6680682e8343a23007f4244d70bb896ad85a701fec882a5965a82444c
AZN,2025-09-30T05:52:15+00:00,Big Pharma’s retreat: Is NHS pricing behind investor pullbacks?,Yahoo,https://finnhub.io/api/news?id=3364c0c8e93f31eda3774a6f0761852c9c6da22758f15db91170ab5c90068d65
AZN,2025-09-29T16:19:36+00:00,FTSE 100 held back by weak oil after bright start,Yahoo,https://finnhub.io/api/news?id=da86e409568df1db9068ee8c88ffccfdc92c05224275aa255f923e1f56db2319
AZN,2025-09-29T15:38:46+00:00,GSK Leaps Into Buy Zone On Surprise Departure Of CEO Emma Walmsley,Yahoo,https://finnhub.io/api/news?id=4d8e9a8df02cb1e7569c82f75165b845c78fad74bdd9857f8139715a95163dc3
AZN,2025-09-29T13:57:37+00:00,"AstraZeneca plans full US listing, but defuses fears of UK exit",Yahoo,https://finnhub.io/api/news?id=b614e852566605615c1423d930f6438e3e14ae52511df171cf2ad0974392aeeb
AZN,2025-09-29T12:25:10+00:00,AstraZeneca Moves From ADRs To NYSE Listing,Yahoo,https://finnhub.io/api/news?id=4a7c1119118427dfc6a65ce656bc434eb931517bd38585fd17f4cb2af10e343c
AZN,2025-09-29T12:07:30+00:00,"CoreWeave, AstraZeneca, GSK, BYD, Tesla: Trending Stocks",Yahoo,https://finnhub.io/api/news?id=19a837498b03b3e2fc3f7df3443b2eaef661a029e29cce026daaecbcff193ae8
AZN,2025-09-29T12:02:22+00:00,AstraZeneca stokes fears of London exit with New York listing,Yahoo,https://finnhub.io/api/news?id=77db5d3cf79785f594b6a2671eb4d3ced4118eed2ffa49dac771b41e6613bda4
AZN,2025-09-29T11:37:00+00:00,GSK CEO Emma Walmsley to Step Down as Commercial Chief Takes Helm,Yahoo,https://finnhub.io/api/news?id=9bc0ea95ea99a5d1bd026c9c47dcd85f31d2002a578b477c817b467d941ffcb8
AZN,2025-09-29T11:00:00+00:00,ENHERTU® (fam-trastuzumab deruxtecan-nxki) demonstrated highly statistically significant and clinically meaningful improvement in invasive disease-free survival vs. T-DM1 in DESTINY-Breast05 Phase III trial,Yahoo,https://finnhub.io/api/news?id=68d88f9323361848a515f87a6a060486db006908e030d8a5828ec4cfb046f7ee
AZN,2025-09-29T10:59:13+00:00,AstraZeneca to overhaul US listing but remain on London market and keep UK HQ,Yahoo,https://finnhub.io/api/news?id=0cb1760799aa0be2b43f1a79aa4398445575fe7fc824ac20f08b95ef6ef329c8
AZN,2025-09-29T10:03:36+00:00,"AstraZeneca switches to direct US listing, keeps UK listing",Yahoo,https://finnhub.io/api/news?id=8c68f6b986232a702967e33a9581b43effe017e35b59026a8a2a714ffda7fdca
AZN,2025-09-29T09:58:28+00:00,"AstraZeneca will list shares directly in New York, but isn't leaving the UK",Yahoo,https://finnhub.io/api/news?id=9e7f7e4565680e828b5f072f882118453aabbc38668e73c806949398d495d9d3
AZN,2025-09-29T09:08:12+00:00,"Stocks to Watch Monday: Carnival, GSK, Alibaba",Yahoo,https://finnhub.io/api/news?id=f50603f65f37286c4befb56e8c24394095b444bcb2ee2648a866350000d35c2e
AZN,2025-09-29T08:48:10+00:00,"Trending tickers: Alibaba, AstraZeneca, GSK, Stellantis and Genmab",Yahoo,https://finnhub.io/api/news?id=33cd18916ddf5aa56d278668d4654c20071e13b4366470cd976e6778d9d61b31
