ticker,published_utc,title,publisher,url
AZN,2025-09-29T08:31:00+00:00,AstraZeneca to List Shares Directly on New York Stock Exchange,Yahoo,https://finnhub.io/api/news?id=f5e8bed359390246330467a7bd2d71e85a12f5e9bc35e07aaf5f3783d3884f23
AZN,2025-09-29T08:06:40+00:00,AstraZeneca to list directly on NYSE while keeping U.K. listing; shares up,Yahoo,https://finnhub.io/api/news?id=facc843c462f8f22f7a1c6a1e623d413d7d24669e15dd5f0bb36998cea4c0f91
AZN,2025-09-29T06:47:25+00:00,Heard on the Street Friday Recap: Another Dose of Tariffs,Yahoo,https://finnhub.io/api/news?id=27e4c1e6c7be05ec6963d6785e1312b9e30830decc80abb89f54e72688ecf1a4
AZN,2025-09-29T06:07:43+00:00,AstraZeneca plans full US listing while defusing fears of UK exit,Yahoo,https://finnhub.io/api/news?id=c8af1876876fba837a12e9551538598a9f4daba4fc697a47dafe845e20975faa
AZN,2025-09-29T05:39:40+00:00,Amgen Inc.’s (AMGN) and AstraZeneca’s (AZN) Tezspire Receives Positive Recommendation from the EU Medicines Agency,Yahoo,https://finnhub.io/api/news?id=7c2b79a36a512c5d95e15a72f12599d93909b9b83667023e190abc95c068bf76
AZN,2025-09-27T10:45:00+00:00,3 Magnificent Stocks Under $100 to Buy Right Now,Yahoo,https://finnhub.io/api/news?id=8fe1dc209442d35802c79b27de1a4e740ba48d31a42c785f07f5c12ee57b23cd
AZN,2025-09-27T09:00:32+00:00,Regeneron: Strong R&D Pipeline Drives Growth Outlook,SeekingAlpha,https://finnhub.io/api/news?id=3d4ba0704f1a3d97b6cda52ebfecc661b38899c3e02c095bd67bce24888f884c
