ticker,published_utc,title,publisher,url
AZN,2025-11-10T21:12:23+00:00,Stock Market Today: Dow Up On Shutdown Deal; Cathie Wood Loads Up On This (Live Coverage),Yahoo,https://finnhub.io/api/news?id=f1698b77ab81dc23045036884c6db94f327d0c00dc8f990e5848c6c9fc68238c
AZN,2025-11-10T16:05:00+00:00,European Equities Traded in the US as American Depositary Receipts Start Week Trending Higher in Monday Trading,Yahoo,https://finnhub.io/api/news?id=68da101fe0dc5faf7cdd7d226d4b1424a3bbcdc9bb2c3898eecffa68d583cc50
AZN,2025-11-09T21:33:00+00:00,Baxdrostat demonstrated a statistically significant and highly clinically meaningful placebo-adjusted reduction of 14.0 mmHg in 24-hour ambulatory systolic blood pressure in patients with resistant hypertension in the Bax24 Phase III trial,Yahoo,https://finnhub.io/api/news?id=0667e8527eb8a441c6f51d505ed5e8f554a8117d53b649133b1152c3848cb187
AZN,2025-11-08T21:21:45+00:00,AstraZeneca (LSE:AZN): Is There Value Left After Recent Steady Gains?,Yahoo,https://finnhub.io/api/news?id=860ee167bb747c2e4e3a651ebba8669b912e1c3d4341866d9cd827e691fd341c
AZN,2025-11-08T18:12:15+00:00,AstraZeneca PLC 2025 Q3 - Results - Earnings Call Presentation,SeekingAlpha,https://finnhub.io/api/news?id=e48ae0881460fb2ab3b32a86cb84bdff4047cdfa58b4dea865c0f1be2ccdfabf
AZN,2025-11-07T14:00:00+00:00,Statistically significant NATRON Phase III trial results for hypereosinophilic syndrome show FASENRA delayed time to first flare or worsening of disease,Yahoo,https://finnhub.io/api/news?id=5a2c188b0632093b147d510c924a6dbd52765266defb3d23059f0db6475c232d
AZN,2025-11-07T13:16:14+00:00,"Earnings live: Block stock drops after earnings miss, Airbnb pops, Opendoor pitches turnaround plan",Yahoo,https://finnhub.io/api/news?id=7781ea8d73913e13851e80afc1ee0fe29f712bdf4e2bdcf0d3b3ba28c68a2a76
AZN,2025-11-07T11:30:00+00:00,CEO Says AstraZeneca Can ‘Absorb’ Costs of Trump-Driven US Deals,Yahoo,https://finnhub.io/api/news?id=c23d40ae5dfdb4aef2dff555c0a5d67cb816b8b0b4a69b3250ee54f566aac3a6
AZN,2025-11-07T08:32:00+00:00,"Company News for Nov 7, 2025",Yahoo,https://finnhub.io/api/news?id=c391f3f6b6838ee90f36570c123adeea5656cc6e3217641c0c67a5e5f19c5689
AZN,2025-11-07T06:38:01+00:00,3 UK Stocks Estimated To Be Up To 50% Below Intrinsic Value,Yahoo,https://finnhub.io/api/news?id=d15965752e64529ed13a9c1cead44a68e16073d9a726cb05aa1000d731be81fc
AZN,2025-11-06T22:30:00+00:00,Health Care Roundup: Market Talk,Yahoo,https://finnhub.io/api/news?id=1d99b7c0bb3226b3bfa5ce72533e1cd450e77de384a62ae8b0cf8b56b4184752
AZN,2025-11-06T21:42:03+00:00,Why AstraZeneca Stock Topped the Market on Thursday,Yahoo,https://finnhub.io/api/news?id=0aa88492e73328c9e54dc90d575c756dc3bf16b1440f6ba77baa4830dee072ba
AZN,2025-11-06T21:08:25+00:00,AstraZeneca Bounds Into A Chase Zone As Cancer Drugs Drive Sales Beat,Yahoo,https://finnhub.io/api/news?id=4626015de5f6a56baa07b7598a05bda8a9400bee4c2e93cfa84340941f472aaf
AZN,2025-11-06T20:59:27+00:00,"Eli Lilly, Novo Nordisk to Cut Drug Prices, Get Tariff Relief Under Deals With Trump Administration",Yahoo,https://finnhub.io/api/news?id=b8968b6997d5d5b7775dfe5d047d00bb1b40f161ae04bffe433218ed07d6ee1d
AZN,2025-11-06T19:37:00+00:00,Novo Nordisk and Eli Lilly Can Sell Their Weight-Loss Drugs to Medicare Market,Yahoo,https://finnhub.io/api/news?id=38ef3517c33316538131bc213846dcee66a2a40483c0750a339b24b8eefdd0d9
AZN,2025-11-06T19:05:21+00:00,AstraZeneca PLC (AZN) Q3 2025 Earnings Call Highlights: Strong Revenue Growth and Strategic Advances,Yahoo,https://finnhub.io/api/news?id=cb49986c7c64c06834b72f49aa93ea17faf229037f9864193230225c7831fa39
AZN,2025-11-06T18:42:56+00:00,"Stocks in Focus Globally: Nissan, ArcelorMittal, AstraZeneca",Yahoo,https://finnhub.io/api/news?id=92179bd56f7b6d322906d082e7831eb8b7946a6bf6e620eb8fed36ed3b366f3e
AZN,2025-11-06T16:45:00+00:00,"AZN Q3 Earnings Top Estimates, Sales Rise As Most Key Drugs Outperform",Yahoo,https://finnhub.io/api/news?id=3b2683e43d4a98fba667e063a3c96a7c193adc973a1f1abe448727d9b78fcbbf
AZN,2025-11-06T16:41:57+00:00,AstraZeneca Stuns Wall Street With Surprise Profit Surge,Yahoo,https://finnhub.io/api/news?id=526c45b82942e9971dc9d9fb139b1d7b3f9938243ec8ee5ceaa76fa3d1988fca
AZN,2025-11-06T16:39:36+00:00,AstraZeneca to pour $50bn into US ahead of New York listing as UK investment plans stall,Yahoo,https://finnhub.io/api/news?id=5a4f4ef4c7913f9ed0ce6a8873e8c10c2c347cca6d1e8fb0ffe4bcfbc4c07e45
AZN,2025-11-06T16:26:15+00:00,AstraZeneca PLC (AZN) Q3 2025 Earnings Call Transcript,SeekingAlpha,https://finnhub.io/api/news?id=d1df158a9456a3d082d46653005008d4a18a553ace904692dd975b31f13d4059
AZN,2025-11-06T16:19:05+00:00,European Equities Traded in the US as American Depositary Receipts Decline in Thursday Trading,Yahoo,https://finnhub.io/api/news?id=2a62a479dcd0e2b6143ceb0842316e368fc66d5554ef2c5cc2eb290746ca611f
AZN,2025-11-06T15:28:24+00:00,"AstraZeneca: Solid Results, But Risks Emerge (Rating Downgrade)",SeekingAlpha,https://finnhub.io/api/news?id=823dad24b2f70bfa5493679741406cb2af82bbee0b099b21f1a74bd8f58d5034
AZN,2025-11-06T15:24:00+00:00,"Novel Pipeline Activity Signals Hope in Systemic Sclerosis, as Rheumatologists Anticipate First Real Therapeutic Advances in Years",Yahoo,https://finnhub.io/api/news?id=b74b23ea79d006ab669720baecf57ee8d6e7da31b9df1578784ecdad4e4566c2
AZN,2025-11-06T15:23:00+00:00,"Chronic Heart Failure Market Analysis and Forecast, 2025-2035, Featuring AstraZeneca, Bristol Myers Squibb, Cytokinetics, Bayer, Eli Lilly and Other Leading Players",Yahoo,https://finnhub.io/api/news?id=187de7c88f9a495e9226229df3d1df11dc06fc4d986887e3d8b36f0e1121d4ba
AZN,2025-11-06T14:41:46+00:00,"Britain risks losing access to the world’s best drugs, warns AstraZeneca",Yahoo,https://finnhub.io/api/news?id=09de53d693bd505c2073152b00e3a6610c9b885b0081cc249e39f12fa06bddb9
AZN,2025-11-06T14:31:00+00:00,AstraZeneca exercises option to buy an obesity startup,Yahoo,https://finnhub.io/api/news?id=feaa69984f2004c48247cc50b5f89f04928e11c0e36c079b35de72f5a399b516
AZN,2025-11-06T14:30:08+00:00,"Compared to Estimates, Astrazeneca (AZN) Q3 Earnings: A Look at Key Metrics",Yahoo,https://finnhub.io/api/news?id=a66d99ff249af276f085d44ca1731fa4cf276f24189ebe49dd879eee832d4ea6
AZN,2025-11-04T14:00:00+00:00,"Breakthrough Properties Completes One Helix, A Cutting-edge Research Facility Fully Leased to AstraZeneca",Yahoo,https://finnhub.io/api/news?id=2aab61d469ad271eb0426f07b1c930ace8969cf9d4c7af2f61d7fa2c367adaeb
AZN,2025-11-04T12:53:33+00:00,"Earnings live: Spotify stock turns lower, Palantir and Uber dive while Pfizer, Marriott rise",Yahoo,https://finnhub.io/api/news?id=59b6eb319c23c5c29c5f22b86f56081569e19496bbe6cea305932f6912966989
AZN,2025-11-03T18:59:33+00:00,Sector Update: Health Care Stocks Decline in Afternoon Trading,Yahoo,https://finnhub.io/api/news?id=aab7fea18382a07dab9a8f7d105772cf9077b0c74e567b739ef9d678e3013dd0
AZN,2025-11-03T15:39:00+00:00,Phlow Corp. Congratulates the Commonwealth of Virginia and the Virginia Innovation Partnership Corporation on a Historic Investment to Create the Nation’s Largest Workforce Development Center for Advanced Pharmaceutical Manufacturing,Yahoo,https://finnhub.io/api/news?id=2cc0e1a0e98754222ac40f68294eda1f4aaf3a2629168dfb7b41948125bf1668
AZN,2025-11-03T14:17:06+00:00,Earnings Take Centerstage as US Equity Futures Trade Mixed Pre-Bell,Yahoo,https://finnhub.io/api/news?id=034f435cfcae1064ba7a0f59afefce276d2f9d051a9a0bc4f1c0e15b7cdee709
AZN,2025-11-03T13:32:38+00:00,Investors Digest Berkshire Hathaway Earnings as US Equity Futures Turn Mixed Pre-Bell,Yahoo,https://finnhub.io/api/news?id=969225ffff803f695c8a8fb7f0b838d46f1f0ee92fa803f2ae3de28dc1266fbb
AZN,2025-11-03T13:06:31+00:00,"Earnings live: Berkshire Hathaway profits rise, Beyond Meat postpones earnings, with Palantir results on deck",Yahoo,https://finnhub.io/api/news?id=77751acd3fee695d16d7196965260c39596cdea6c6951eba1362007d485a5d79
AZN,2025-11-03T11:06:00+00:00,"Lung Cancer Antibody Drug Conjugates Research 2025: A $2 Billion Opportunity in 2030, Led by AstraZeneca, Daiichi Sankyo, Pfizer, and BMS Advancing Targeted Therapies Against HER2, TROP-2, and B7-H3",Yahoo,https://finnhub.io/api/news?id=1f1e1fb19c6be28bbb10f7687e6f0f10e9cce587cde57c7867f84ac7c3814bb9
AZN,2025-11-03T10:54:00+00:00,"Breast Cancer Antibody Drug Conjugates Market Research 2025-2030: $7 Billion Market Led by Daiichi Sankyo and AstraZeneca, with Rising Competition from Roche, Pfizer/Seagen, ADC Therapeutics",Yahoo,https://finnhub.io/api/news?id=794f598900fe6d69b7fd5789cac40aea6bd669c31842ea632c696fca4a02d08d
AZN,2025-11-03T08:50:36+00:00,FTSE 100 dips and US stocks mixed as US shutdown nears longest in history,Yahoo,https://finnhub.io/api/news?id=4e7fb9bee52f7551119302b528023ce70ec4f9127664fb8e961b24b308ef6391
AZN,2025-11-03T08:50:36+00:00,LIVE: FTSE 100 and US stocks rise as US shutdown nears longest in history,Yahoo,https://finnhub.io/api/news?id=97459d7508f751b7e8886f28f7bff4f7fe964315f5c2656aa753ef87192133f2
AZN,2025-11-03T08:00:00+00:00,"Tariffs, pricing, backroom deals — how pharma can navigate wildly shifting policies",Yahoo,https://finnhub.io/api/news?id=df3651281cdae837ea18be5cadb5a0dde59161366d41aa1fb11c9a70625ffda4
AZN,2025-11-03T06:39:48+00:00,UK's November 2025 Stocks Possibly Priced Below Estimated Value,Yahoo,https://finnhub.io/api/news?id=9aa28f223fa4977a9333d50a2c80c33bf91bd310dc82f6b00324c3c095982178
AZN,2025-11-02T14:05:42+00:00,What Analysts Say Is Shaping The New Story For AstraZeneca,Yahoo,https://finnhub.io/api/news?id=dec469ae90f540e0a65f4293a0397c132ab0e9c8fd5d0fae9a03a1bd2fd89414
AZN,2025-11-02T07:07:08+00:00,Wall Street Week Ahead,SeekingAlpha,https://finnhub.io/api/news?id=8834350af1a837126d8db68e94fded0a34364f99b03586b0dad5dee085578cc3
AZN,2025-11-01T11:00:00+00:00,"Palantir, Qualcomm Set To Report Earnings",SeekingAlpha,https://finnhub.io/api/news?id=a07d3c08563b779b262f79c69d0a178d819e1cb63337ef4bf44e8f26cc2fdcf9
AZN,2025-10-31T23:00:00+00:00,"SNAP benefits expire, open enrollment, earnings: What to Watch",Yahoo,https://finnhub.io/api/news?id=adc0cf2c6c12abe6b1c32f0506b428c99bc9cfa3f306c50e544297a8b7df5312
AZN,2025-10-31T21:12:27+00:00,"Earnings live: Amazon stock soars, Apple pares gains with earnings from AI players to come",Yahoo,https://finnhub.io/api/news?id=f71dd7ce2ec6ef6631512e643d8937c9c24821909027b57a9fe612fd64a8afb5
AZN,2025-10-31T18:00:00+00:00,"The Craneware Group Hosts 340B Rebate Forum, Confirms No New Vendor Needed for Pilot",Yahoo,https://finnhub.io/api/news?id=fcf1649587c0acd862a995caa6aff174aeabe308fa4e5b186969bac84c38232c
AZN,2025-10-31T12:37:45+00:00,AstraZeneca’s gMG drug fails to fend off rivals despite Phase III win,Yahoo,https://finnhub.io/api/news?id=9875190ef153cf6d3f100b95b6124cee15b8e9e8541a323748b4a5d460929efe
AZN,2025-10-31T01:00:00+00:00,DESTINY-Lung06 Phase 3 Trial of ENHERTU® Initiated as First-Line Therapy in Patients with HER2 Overexpressing Metastatic Non-Squamous Non-Small Cell Lung Cancer,Yahoo,https://finnhub.io/api/news?id=e10a7dd1108f4866696cf7b5c358d3d71d496b38ec52043648a55f102572fb83
AZN,2025-10-30T18:01:08+00:00,AstraZeneca Gefurulimab Shows Positive Phase 3 Results in Myasthenia Gravis Trial,Yahoo,https://finnhub.io/api/news?id=623c336327978067104ab85aebf262934c81b71e9615604268d9e849ec9ff690
AZN,2025-10-30T17:16:00+00:00,"Bladder Cancer Market - Global and Regional Analysis and Forecast (2025-2035) Featuring Merck & Co., Bristol Myers Squibb, Astellas Pharma, AstraZeneca, and Johnson & Johnson",Yahoo,https://finnhub.io/api/news?id=9a0326b70bd21d4034bf6fd8947f86a65c4eb02d4b5a41850de931e9a4df3c99
AZN,2025-10-30T14:18:00+00:00,"Competitive Landscape of Obesity Therapeutics Market Enters High-Growth Phase, Fueled by GLP-1 Surge and Expanding Oral Treatments | DataM Intelligence",Yahoo,https://finnhub.io/api/news?id=d847747732d6bac29de0a122a3c6451146670f24fbb74eed58c470e4a78a660e
AZN,2025-10-30T11:13:00+00:00,Eli Lilly Stock Rises on Earnings as Investors Await Trump Drug Pricing Deal,Yahoo,https://finnhub.io/api/news?id=aa9ec888fb6e84a874954ce2054b156ea86b801fc68753380466c81534c6252d
AZN,2025-10-30T11:07:36+00:00,Merck narrows full-year sales guidance,Yahoo,https://finnhub.io/api/news?id=27742642c27fd31712ba4db25eeb691585cc50621087a4db3bde8f9930df6eb4
AZN,2025-10-29T20:45:00+00:00,Eli Lilly Reports Earnings Thursday as Investors Await Trump Drug Pricing Deal,Yahoo,https://finnhub.io/api/news?id=bf6bec0f82931e3858541c60fb40f3f6b7f4625a40e0d87b948b9c823502694c
AZN,2025-10-29T13:30:45+00:00,Nvidia worth as much as German economy as value tops $5tn,Yahoo,https://finnhub.io/api/news?id=cb583d4c1316d66997d5f7fb52a11da85f8b14fa25a42137f117cad296a1f649
AZN,2025-10-29T13:30:45+00:00,Nvidia worth as much as German economy as value tops $5trn,Yahoo,https://finnhub.io/api/news?id=76eeaa651d282559c516351511916e2e58b01502664893b99a2982d2baa5a1b2
AZN,2025-10-29T06:38:08+00:00,UK Value Stocks Trading At Up To 49.1% Estimated Discount,Yahoo,https://finnhub.io/api/news?id=5f78833f9c8da41071ab66355880c50022804579b6558af1b387550a10c371d2
AZN,2025-10-28T22:15:05+00:00,Astrazeneca (AZN) Stock Declines While Market Improves: Some Information for Investors,Yahoo,https://finnhub.io/api/news?id=df4af386c9782a8198aa79d41e95eb8ef93457ae55f940789d96a46e5abfb59c
AZN,2025-10-28T12:00:00+00:00,Step Pharma announces the appointment of Dr Karen Smith as Chief Medical Officer,Yahoo,https://finnhub.io/api/news?id=35309bf903f94a702a0cf3bbc6528f5a442db9d39d3f3bf37d15e05b697b0991
AZN,2025-10-28T10:51:00+00:00,"United States Adult Vaccine Market Research and Company Analysis Report 2025-2033 Featuring GlaxoSmithKline, AstraZeneca, Sanofi Pasteur, Pfizer, and CSL Limited",Yahoo,https://finnhub.io/api/news?id=a52f9c17f3ce83be5fe44232d2aaf4b08bf3667c25c5c9d32a66a5d636e39d38
AZN,2025-10-28T06:37:52+00:00,UK Market: NIOX Group And 2 Other Stocks That May Be Trading Below Estimated Value,Yahoo,https://finnhub.io/api/news?id=5174ebdd25b21d00ec2f9b6086f340029bbded415628cee983a5990bd13a780f
AZN,2025-10-26T08:15:00+00:00,Eli Lilly: Is Another Monster Quarter Coming,SeekingAlpha,https://finnhub.io/api/news?id=7b335fd199e2e11bf7a03b65a5dae893b468b8b610800c92c23b6a88cf3faf8f
AZN,2025-10-25T21:06:46+00:00,Novavax (NVAX) Jettisons Maryland Facility to AstraZeneca as Investor Pressure Mounts—Is an Acquisition Inevitable?,Yahoo,https://finnhub.io/api/news?id=58b074e1ed60ea2c2cf2e95c50875b9fbfc041f7b4f26d972247f64260698887
AZN,2025-10-25T19:08:43+00:00,AstraZeneca (LSE:AZN): Is the Pharma Giant Undervalued After Recent Momentum?,Yahoo,https://finnhub.io/api/news?id=023f745aca3aedaf3da22120d5b238192867cb171a492f376a7710699e8b26fc
AZN,2025-10-24T20:12:20+00:00,Sanofi Jumps As Dupixent Nears $5 Billion In Sales; Trump Drug Talks Continue,Yahoo,https://finnhub.io/api/news?id=2d78abc9c521d5410a1b7a48cdb4537098c8b1423c3ba207e655bf50abb25221
AZN,2025-10-24T16:23:00+00:00,/C O R R E C T I O N -- Coupa Software/,Yahoo,https://finnhub.io/api/news?id=9de411387898da8e16a2c7632c83746b8cf1167e6d51faa5e10b66dd81391d18
AZN,2025-10-24T16:07:00+00:00,A GSK Cancer Drug Is Making a Comeback. It’s So-So News for the Stock.,Yahoo,https://finnhub.io/api/news?id=9f02ef810ac744fccab14ebf9cb9d0df8a18cfbf16ffef74f15639a6b2efa49f
AZN,2025-10-24T10:41:00+00:00,"United States Precision Medicine Market Analysis Report 2025-2033: Developments in Biomarker Identification and Genomic Sequencing, & Combining Big Data Analytics and AI Fuel Growth",Yahoo,https://finnhub.io/api/news?id=b198d769d906ece7e96a32cd6bbd328dd92a914a01afdfc1d4f032a2f98f6a44
AZN,2025-10-24T08:45:00+00:00,"Sanofi Earnings Get Boost From Dupixent, New Drugs as U.S. Talks Continue",Yahoo,https://finnhub.io/api/news?id=dc18cb6d0ed40579a1d5d3277b1879fa1c82349c7645503a37857e06f8848bce
AZN,2025-10-24T06:38:02+00:00,UK Stocks That Could Be Trading Below Estimated Value In October 2025,Yahoo,https://finnhub.io/api/news?id=713f89cfc56572e17d5c2527151753493f3f54d0156af4598dc775da17942ffd
AZN,2025-10-23T16:53:32+00:00,"Roche in ongoing discussions with US government over drug pricing, CEO says",Yahoo,https://finnhub.io/api/news?id=424723d14bc28b261f5d02e555bd3f1c9c36870ec15e479c5bcdf54fd2938fa0
AZN,2025-10-23T15:30:00+00:00,Radiopharmaceuticals Market to Reach US$ 13.4 Billion by 2033 | Astute Analytica,Yahoo,https://finnhub.io/api/news?id=258ee801c9efed665132d97319bf8eff446230eb17b25f9d8eed1847a91003b7
AZN,2025-10-23T09:38:00+00:00,"United States Chronic Obstructive Pulmonary Disease Market Report 2025-2033, Profiles of AstraZeneca, Pfizer, GSK, Novartis, Astellas Pharma, Abbott Laboratories, Boehringer Ingelheim, Almirall",Yahoo,https://finnhub.io/api/news?id=c71cd6e181f0deeeb69881f06ea43c4f632fd7742a51c44af85236f556c4c0bc
AZN,2025-10-23T09:24:00+00:00,Roche Raises Full-Year Earnings Outlook as U.S. Drug-Pricing Talks Continue,Yahoo,https://finnhub.io/api/news?id=e42785f0eb8f598b01cfb3e294109eadec999bde7d15ec3d47cfc78cb96833fb
AZN,2025-10-23T02:35:46+00:00,"J.P. Morgan Maintains a Buy Rating on AstraZeneca PLC (AZN), Sets a £140 PT",Yahoo,https://finnhub.io/api/news?id=ac355e46f7ecdd680dfb9aa8c8cfaeacfe609a80ec309b35b852e4f967d509fe
AZN,2025-10-22T18:31:10+00:00,AstraZeneca PLC (AZN): A Bull Case Theory,Yahoo,https://finnhub.io/api/news?id=e0d218b41b7faaefae65cacf38c249c1a4da121953c07905e8eb5b30615d1951
AZN,2025-10-22T10:57:00+00:00,"Nasal Polyps Pipeline Market Research 2025: Key Players Like AstraZeneca and KeyMed Biosciences are Pivotal in Advancing Treatments, with Products Such As CM-310 and Tezepelumab Leading the Way",Yahoo,https://finnhub.io/api/news?id=78b0d93ae8d6659d7ef4d89df936fb311afef3f899b709056e2da38ae7887cc1
AZN,2025-10-22T10:33:00+00:00,China’s Innovent Strikes Cancer Drug Deal With Takeda for Up to $11.4 Billion,Yahoo,https://finnhub.io/api/news?id=a9087a43bd38efcbfcd749b7102d1cd118ea9c1a570414f430286a3d03f7c20c
AZN,2025-10-22T10:27:00+00:00,"Thermo Scientific Revenue Rises, Boosted by Life Sciences Business",Yahoo,https://finnhub.io/api/news?id=d4e8a74f141a8f3c8bacf9e960823708a90cae7cb6f71c92570b586c8da97ec2
AZN,2025-10-22T09:00:00+00:00,Fortune 500 Leaders Share AI-powered Supply Chain Excellence on Stage at OMP Conference,Yahoo,https://finnhub.io/api/news?id=abc3a59250a1fd898141de33a3dc724763d679fcbab8192d8fe1f7ee3c57f3e2
AZN,2025-10-22T06:37:59+00:00,3 UK Stocks That May Be Trading Below Their Estimated Value,Yahoo,https://finnhub.io/api/news?id=a4073946fb1357ce4559ad9ccf46344010b19fa121165e887aa1ce01227e706d
AZN,2025-10-21T19:04:00+00:00,AstraZeneca PLC (AZN) Presents at ESMO Congress 2025 - Slideshow,SeekingAlpha,https://finnhub.io/api/news?id=f1cb437fcf7f56acc6e958a5c62f5ddbb380341b3981ab310975eec9f66a6523
AZN,2025-10-21T17:35:00+00:00,Danaher Third-Quarter Earnings Rise; Pharma R&D Spend Expected to Rebound,Yahoo,https://finnhub.io/api/news?id=ddc7b2d368d3608f038c125ea497cade99a93117fd91e094a3335cd1995ffe84
AZN,2025-10-21T14:39:44+00:00,Did IonQ Just Unlock Quantum Computing’s True Potential — And a Massive Stock Rally?,Yahoo,https://finnhub.io/api/news?id=e6ca71bce6ef173cd00d6d51595e7b8d67fc4c1c57076f4752f764472d29fec9
AZN,2025-10-21T13:00:00+00:00,Aera Technology Showcases the Enterprise Impact of Agentic Decision Intelligence at AeraHUB 25 NYC,Yahoo,https://finnhub.io/api/news?id=40d7ded00007d4467282a47148dace95ca88e277cee4e8fc4540f5009f7de27d
AZN,2025-10-21T13:00:00+00:00,CCC to Host Free LinkedIn Live Event on Responsible AI in Practice on October 30,Yahoo,https://finnhub.io/api/news?id=34337ff3d147c731ed03d73f70fad058b071fad4aefe1ffa916c1380a43b255e
AZN,2025-10-21T10:51:00+00:00,"The Zacks Analyst Blog Highlights AstraZeneca, RTX, Applied Materials, Park Aerospace and NetSol Technologies",Yahoo,https://finnhub.io/api/news?id=151286a2f18e57944bac5558d8fe0c257297a5b1259611dfa079f3f16efcbecd
AZN,2025-10-21T06:37:56+00:00,UK Stock Market's October 2025 Picks For Estimated Value Opportunities,Yahoo,https://finnhub.io/api/news?id=658cc1b44c47418ca48eb593e5710b9c6fa3a7f048f29d420df965edf261c5b3
AZN,2025-10-20T20:28:00+00:00,"Top Research Reports for AstraZeneca, RTX & Applied Materials",Yahoo,https://finnhub.io/api/news?id=cb7364a8b794e34cc386be6ef57c9f6a86136111fbff29ae2470683f4348cd24
AZN,2025-10-20T19:45:46+00:00,AstraZeneca's Cancer Breakthrough: Enhertu Data Sparks New Hope for Early Breast Cancer Cure,Yahoo,https://finnhub.io/api/news?id=1a1a4b6a0d6f10d38093814f4d51917ba1ae472fde2091cec3974b443aff9881
AZN,2025-10-20T13:50:01+00:00,Here's Why Astrazeneca (AZN) is a Strong Momentum Stock,Yahoo,https://finnhub.io/api/news?id=c231ef700805999eacefc540d99c6c6c34cbdc4d255e036e7d3ed4c0df08f3fc
AZN,2025-10-20T10:19:27+00:00,IXJ: Healthcare Sector Dashboard For October,SeekingAlpha,https://finnhub.io/api/news?id=7e5e4d81e7f7bbf4ace2094dc8b479304205e7043756c5390b7cef95e12da826
AZN,2025-10-20T06:37:54+00:00,3 UK Stocks That May Be Undervalued In October 2025,Yahoo,https://finnhub.io/api/news?id=2e2d7e287d57dd93f369bebe47a9cd54b19e8cef69173ae33147f4a2ad270f76
AZN,2025-10-19T11:00:00+00:00,DATROWAY® (datopotamab deruxtecan-dlnk) demonstrated unprecedented median overall survival improvement of five months vs. chemo as 1st-line treatment for patients with metastatic triple-negative breast cancer for whom immunotherapy was not an option,Yahoo,https://finnhub.io/api/news?id=fe408db9dcbbfadad4296ad9c12919baa9cbaf0c8a0af3713b9d9cc10787a036
AZN,2025-10-19T06:30:00+00:00,DATROWAY® Demonstrated an Unprecedented Median Overall Survival Improvement of Five Months Vs Chemotherapy as First-line Treatment for Patients with Metastatic Triple Negative Breast Cancer for Whom Immunotherapy Was Not an Option in TROPION-Breast02,Yahoo,https://finnhub.io/api/news?id=361c4ff3dc2fc4fb399e51a3b191831451130766a1d763d83cbc03abe67c1575
AZN,2025-10-18T18:07:00+00:00,How the Narrative Around AstraZeneca Is Shifting Amid New Risks and Pipeline Developments,Yahoo,https://finnhub.io/api/news?id=c040e2ca8a6eec4f2ce1d6edaf3ed1a0059aab30d8dba45da0aa4fb32fd4ec79
AZN,2025-10-18T14:35:00+00:00,ENHERTU® (fam-trastuzumab deruxtecan-nxki) reduced the risk of disease recurrence or death by 53% vs. T-DM1 in patients with high-risk HER2-positive early breast cancer following neoadjuvant therapy in DESTINY-Breast05 Phase III trial,Yahoo,https://finnhub.io/api/news?id=7e838f37348b8c0394260f3e735d2b4cfb60b103b0613f7bc9e3a8edfcfb7a38
AZN,2025-10-18T14:30:37+00:00,"AstraZeneca, In A Buy Zone, Makes A Big Breast Cancer Splash",Yahoo,https://finnhub.io/api/news?id=dfd3c1009bcc9b420acc0a8700713c223a09aae261c9fec4086fad21e18e8131
AZN,2025-10-18T14:30:00+00:00,ENHERTU® (fam-trastuzumab deruxtecan-nxki) followed by THP before surgery resulted in a pathologic complete response in 67% of patients with high-risk HER2-positive early-stage breast cancer in DESTINY-Breast11 Phase III trial,Yahoo,https://finnhub.io/api/news?id=e850be44b0837c591757c75ffd6972abd306d0ebde7719e5a285f21762cef29a
AZN,2025-10-17T22:15:02+00:00,Astrazeneca (AZN) Outpaces Stock Market Gains: What You Should Know,Yahoo,https://finnhub.io/api/news?id=d57e2284026deb310b969a8eb2fe02958126731a12d2b5c4cc1d25d6b73d0646
AZN,2025-10-17T20:17:00+00:00,TEZSPIRE approved in the US for chronic rhinosinusitis with nasal polyps,Yahoo,https://finnhub.io/api/news?id=962a781fc3e88a1f17aeb23275cfe63c5b3bdc16e453ca538f07348fd4500284
AZN,2025-10-17T20:00:00+00:00,FDA APPROVES TEZSPIRE® FOR CHRONIC RHINOSINUSITIS WITH NASAL POLYPS,Yahoo,https://finnhub.io/api/news?id=6741d71c1dd3a5cc3ffc6db0ed3e4221be51940bb03e1780cccf0a1330e3d2be
AZN,2025-10-17T19:50:43+00:00,Sector Update: Health Care Stocks Higher Late Afternoon,Yahoo,https://finnhub.io/api/news?id=85a8e8d7b5b2efc43892e4f5b915815ed2baf8b805b5447d410a3d2c783b1017
AZN,2025-10-17T18:02:00+00:00,Biotech Is Finally Rallying. Why Mizuho’s Jared Holz Is Optimistic This Time.,Yahoo,https://finnhub.io/api/news?id=f553f6fa35e1792518d8adc49b5e0963970986041fb8ed7049ec0284893ebbd6
AZN,2025-10-17T16:43:17+00:00,Omeros: Novo Nordisk Deal Highlights MASP-3 Alternative Pathway Targeting,SeekingAlpha,https://finnhub.io/api/news?id=48f7fdd15c0af61c293a4435c964ba6cbda99718392abd2f668d3c2372737420
AZN,2025-10-17T16:26:23+00:00,3 Price Catalysts For Eli Lilly,SeekingAlpha,https://finnhub.io/api/news?id=3084c73fd3836a539b5dae26c559828ff74a321f7ecc65300f09e602dacc2dec
AZN,2025-10-17T14:00:00+00:00,DATROWAY® Plus Rilvegostomig Showed Promising Tumor Responses in Patients with Metastatic Urothelial Cancer in TROPION-PanTumor03 Phase 2 Trial,Yahoo,https://finnhub.io/api/news?id=da2b25bb3158ccb2eea93411263ebb0e0e4ae23ef28e244554813a9dc3d5a485
AZN,2025-10-17T12:10:00+00:00,IMFINZI® (durvalumab) regimen reduced the risk of disease recurrence or death by 32% in high-risk non-muscle-invasive bladder cancer in the POTOMAC Phase III trial,Yahoo,https://finnhub.io/api/news?id=7516468ae13a1da4212c541648eaac3538529301f25cc18cbae77c3c46538ff6
AZN,2025-10-17T12:00:00+00:00,IMFINZI® (durvalumab)-based regimen reduced the risk of death by 22% in early gastric cancer vs. chemotherapy alone in MATTERHORN Phase III trial,Yahoo,https://finnhub.io/api/news?id=11879c3150f3a46fe4ee6ad43d8c90a9f0616b5fd1710241714c219c6ec6c5d2
AZN,2025-10-17T08:57:15+00:00,AstraZeneca boosts US footprint with Texas site expansion,Yahoo,https://finnhub.io/api/news?id=defa506841507638ea5756b59e3e71dcf1ecf4943b4cda7c593738bd9f744897
AZN,2025-10-17T07:14:00+00:00,Personalis (PSNL) Moves 20.5% Higher: Will This Strength Last?,Yahoo,https://finnhub.io/api/news?id=9514511fb3a10cd0476e1d2165d42e8fa7d8fb9109a4a5a07dc4c87627af692e
AZN,2025-10-17T07:01:47+00:00,Cullinan Therapeutics: Worthy Of A Small Position,SeekingAlpha,https://finnhub.io/api/news?id=0ff6cf42130fc3fc9b40c647542d94b513a53386dd0544efb978c5a6013c93ce
AZN,2025-10-16T21:31:00+00:00,Indolent Lymphoma Market Experiences Significant Growth Amid Evolving Therapeutic Landscape | DelveInsight,Yahoo,https://finnhub.io/api/news?id=019ca6cffacf1a2f861e1857be28418f61e79b3963ba633b1b6f5a0726e9affc
