ticker,published_utc,title,publisher,url
BYND,2025-11-11T20:11:32+00:00,"Beyond Meat, Inc. (BYND) Q3 2025 Earnings Call Transcript",SeekingAlpha,https://finnhub.io/api/news?id=592ea55f268e8d7a7c9667ce79c14025d053b684eb36788137e258097284f0d1
BYND,2025-11-11T08:48:43+00:00,"Beyond Meat: High Cash Burn, Extreme Dilution, And Negative Revenue Growth",SeekingAlpha,https://finnhub.io/api/news?id=7840761dcbb89a2c3a708aaad170bd12191a26c6e09b976623b4c5ed06c22646
BYND,2025-11-06T07:30:36+00:00,Beyond Meat: Major Questions Remain,SeekingAlpha,https://finnhub.io/api/news?id=4b0c747bad47e602173e7c181ea5ea32c3e7dac58f04e3fe002dc45cbbc4f82c
BYND,2025-11-04T15:30:17+00:00,BC-Most Active Stocks,Yahoo,https://finnhub.io/api/news?id=63e19e634954769ebeb73f5cceae3e5210284abab830db7e2c43e88fbf51bac1
BYND,2025-11-04T14:15:00+00:00,Beyond Meat® Teams Up With Hard Rock Cafe to Bring the Latest Beyond Burger® to Fans Nationwide,Yahoo,https://finnhub.io/api/news?id=b7430d354567abca56750c979d7508065c203cff9fb90df6e6ace33635d090b0
BYND,2025-11-04T13:12:30+00:00,"Tesla, Palantir, Beyond Meat: Trending stocks",Yahoo,https://finnhub.io/api/news?id=14290de90e29e64842bbfb21472a16850386b7197f308128078292cff2a82b50
BYND,2025-11-04T11:50:00+00:00,Why Beyond Meat Sank 12% in October,Yahoo,https://finnhub.io/api/news?id=d4c73f1b916530228d332863108edfb1082cd73b826d524e3a9de4cbe2b710fc
BYND,2025-11-04T10:05:41+00:00,Beyond Meat delays Q3 results filing due to impairment analysis,Yahoo,https://finnhub.io/api/news?id=3275deae519c13ef06dfb05beef8aa25e95e5f39cfe0116a4ece8775a17d7310
BYND,2025-11-04T02:30:00+00:00,Where Will Beyond Meat Stock Be in 3 Years?,Yahoo,https://finnhub.io/api/news?id=1c0bc0a22e9d12517d76957a8788a5350e1e7298ac37d7404a6351f48c07f788
BYND,2025-11-03T17:29:43+00:00,"Top Stock Movers Now: Amazon, Kenvue, Kimberly-Clark, Beyond Meat, and More",Yahoo,https://finnhub.io/api/news?id=8539975be32a4c4119ec5bf8d29d897e5512988f0b16456879b7bb637a50ca43
BYND,2025-11-03T17:15:04+00:00,"Amazon AWS & Cipher strike deal, Beyond Meat delays Q3 results",Yahoo,https://finnhub.io/api/news?id=d06f55ba8f5bc165b3a24d65e9afd8a977e4d4f785dc4ee221f931eb6aaf3678
BYND,2025-11-03T16:01:00+00:00,Beyond Meat Stock Tumbles After Delayed Earnings Report. What’s Behind the Holdup.,Yahoo,https://finnhub.io/api/news?id=dcc54e14fbb2842bc8150e2208a989b460c1e454ba3a625513e702d816ddf4de
BYND,2025-11-03T14:15:00+00:00,Beyond Meat® Introduces New Value Pack of Its Latest Beyond Beef® at Retailers Across Canada,Yahoo,https://finnhub.io/api/news?id=477feb2b3289a74982d895fb13d31101e5eb6fd1bf0ccb486f409b78cb5dfbf5
BYND,2025-11-03T13:52:13+00:00,"Wall Street Lunch: Amazon, OpenAI Sign $38B Deal For Nvidia GPU Access",SeekingAlpha,https://finnhub.io/api/news?id=e3e12d6fecba8c20ca9ef508758ed0db490edc1ff2f9c7112ddf1af6153d8e71
BYND,2025-11-03T13:06:31+00:00,"Earnings live: Berkshire Hathaway profits rise, Beyond Meat postpones earnings, with Palantir results on deck",Yahoo,https://finnhub.io/api/news?id=77751acd3fee695d16d7196965260c39596cdea6c6951eba1362007d485a5d79
BYND,2025-11-03T11:00:00+00:00,"Beyond Meat® Reschedules Reporting of Third Quarter 2025 Financial Results to November 11, 2025",Yahoo,https://finnhub.io/api/news?id=d656b6e47bcbbe3c990e866ac970c8b9299d6cbfb6b61a8d085928269c928c44
BYND,2025-11-03T06:00:00+00:00,2 Overvalued Stocks to Sell in November,Yahoo,https://finnhub.io/api/news?id=8e10e22e814f3d8c3ecdfbcac3d633e72245d9b1017c106dd5d0fc2c7442d7a8
BYND,2025-11-03T04:23:54+00:00,AI darlings prop up Wall Street as most other stocks fall,Yahoo,https://finnhub.io/api/news?id=b6993ff615b513679ccd93d945aafcc13e2b15e49128e062dfd1d2c2d0df3723
BYND,2025-11-03T03:05:06+00:00,Beyond Meat Earnings: What To Look For From BYND,Yahoo,https://finnhub.io/api/news?id=c60b89a9df1f5dd3e401dc19b2eb97f370786c12bf4a962fd97445052df374dc
BYND,2025-11-02T19:34:00+00:00,Is Beyond Meat Stock the Next GameStop or AMC? A Few Words of Advice for Investors,Yahoo,https://finnhub.io/api/news?id=f7deab03b524e2c6339b0049dddecd109989b7581d570d636c2554a284ccbc53
BYND,2025-11-02T08:14:00+00:00,Beyond Meat Stock Crushed Nvidia Last Week. But Does That Make the Meme Stock a No-Brainer Buy Today?,Yahoo,https://finnhub.io/api/news?id=143d2af21ef3ae7bcda6ff54208e77ff0df97ea068f22709d1497e49d19df17c
BYND,2025-10-31T21:05:00+00:00,Is Beyond Meat the Next Great Meme Stock? This Week's Performance Hints That the Party Could Be Over,Yahoo,https://finnhub.io/api/news?id=7e93e148158ad27fe486ea23310a63d404d3e02c6fafd64ea31efa00b255d674
BYND,2025-10-31T15:50:50+00:00,"If You'd Invested $10,000 in Beyond Meat Stock 6 Years Ago, Here's How Much You'd Have Today",Yahoo,https://finnhub.io/api/news?id=d756ac757bb10212b7ee2c2fd92e72c237d9baa563a8ca3a9762cc372d9cabc2
BYND,2025-10-31T14:47:33+00:00,Beyond Meat Rocketed 128% in a Day. Then it Crashed—Is it the Next Big Meme Stock?,Yahoo,https://finnhub.io/api/news?id=9e3d9a51378c2db667901d2d4b328f18aa3c0783923126b97f9cfd54895d6300
BYND,2025-10-31T13:33:00+00:00,"‘Sometimes the only winning move is not to play,’ says Michael Burry in bubble warning",Yahoo,https://finnhub.io/api/news?id=2bb66302f8284df9859eb5853984d05fc18b0282f39d54e5368953fef072491d
BYND,2025-10-31T11:45:00+00:00,"Beyond Meat Stock: Has the Company Turned Things Around, or Is It Just the Latest Meme?",Yahoo,https://finnhub.io/api/news?id=ca6101c0305cd9a91f743236f701153fe60d406fad830c91a5bcc35b553f9d16
BYND,2025-10-31T10:00:00+00:00,"Hiltzik: Meme stocks are still with us, offering dangerous temptations for unwary and novice investors",Yahoo,https://finnhub.io/api/news?id=18c2717c9b127cb9edaa4aa979c110bb6c7f792c41b9ceb251d9f1257165947b
BYND,2025-10-30T20:50:21+00:00,Beyond Meat Stock Falls 78.5% Following Massive Rally. Is the Party Over?,Yahoo,https://finnhub.io/api/news?id=03087e6ca1d06c183da8c8603303313aff6177cceb29c6349a8e8de3ec959cb7
BYND,2025-10-30T13:00:38+00:00,"Stocks making big moves yesterday: Applied Digital, Avnet, The Cheesecake Factory, Beyond Meat, and Huron",Yahoo,https://finnhub.io/api/news?id=d56bca516cadce638589ae5d8e837b4c3426eebfe6e7abca179fa1c30db2125c
BYND,2025-10-30T07:06:00+00:00,Beyond Meat Has Ushered in the Next Round of Short Squeeze Hype -- and It'll Almost Certainly End in Disappointment,Yahoo,https://finnhub.io/api/news?id=37937f20e7a02c72e2db036fb9da95090549c7600010f76da6e4095c3df12196
BYND,2025-10-29T19:45:42+00:00,Why Beyond Meat (BYND) Stock Is Falling Today,Yahoo,https://finnhub.io/api/news?id=dbe14e8dbf1e4bb765e9c655b84df6aa383126e54fc83abcface838834fd1a54
BYND,2025-10-29T16:25:42+00:00,"Dear Beyond Meat Stock Fans, Mark Your Calendars for November 4",Yahoo,https://finnhub.io/api/news?id=4ffcbfabc888f19d14427de8e5b1ad23aa230e49b1973c6521c2c20d70d2e012
BYND,2025-10-29T13:38:00+00:00,Is There a Future for Beyond Meat?,Yahoo,https://finnhub.io/api/news?id=0d75984bf3854818469f11bed231fc47d78a471a967668870ab518b7af46aa64
BYND,2025-10-29T11:00:00+00:00,Beyond Meat Announces Final Tender Results and Final Settlement for Exchange Offer and Consent Solicitation with Respect to Existing Convertible Notes,Yahoo,https://finnhub.io/api/news?id=62d75e803ff6cf10ceb5abfb533fc8d82187303bf2dc3f9f0b76a3faa5dbb86a
BYND,2025-10-29T10:47:51+00:00,"Social Buzz: Wallstreetbets Stocks Mixed Pre-Bell Wednesday; Beyond Meat to Advance, Nokia to Decline",Yahoo,https://finnhub.io/api/news?id=6ec5e4f89514bc60591ef1f639701618ee0fc0501851ee90d979869e809f22e2
BYND,2025-10-29T07:30:00+00:00,Does Billionaire Philippe Laffont Know Something Wall Street Doesn't? His Hedge Fund Is Backing a Stock That Jumped 211% in Just 5 Days.,Yahoo,https://finnhub.io/api/news?id=f17a3cef1ccb39dd19ace65bb7f429449e06c3b8d73b3234be93246990701c75
BYND,2025-10-29T06:10:10+00:00,How Analyst Views Are Shifting as Beyond Meat Faces New Risks and Opportunities,Yahoo,https://finnhub.io/api/news?id=e6d4f1b362ffa7453ac1fd2294d6ef5fb0ae1fac3bf0ebebe991f0d8011cf078
BYND,2025-10-28T18:40:47+00:00,Analyst who first called Beyond Meat’s rally buys 2% stake in Peter Thiel–backed company,Yahoo,https://finnhub.io/api/news?id=4cdccf725a5f37fbdd1281475cd5ee9d755f2a79b2d6d6b03e542d27c81c2012
BYND,2025-10-28T13:45:00+00:00,"Up Over 550% With More to Run, This Stock Could Be the Next GameStop",Yahoo,https://finnhub.io/api/news?id=83dd1779b89a453c531ce370efa9e33249d0e062e6ccb687d14a320bdf28475b
BYND,2025-10-28T12:08:32+00:00,This Stock Is Up 22% in a Week. Are We About to See a GameStop-Level Short Squeeze?,Yahoo,https://finnhub.io/api/news?id=4df278813255fb049806b022d5e931b598300db07fd6dd74d9569d6270ed3ad1
BYND,2025-10-28T10:39:47+00:00,"Social Buzz: Wallstreetbets Stocks Mixed Pre-Bell Tuesday; UnitedHealth Group, SoFi Technologies to Advance",Yahoo,https://finnhub.io/api/news?id=9cb272a8a142ee54a11c6c33d84d3cdc1d8cbe48bc6ee6a9696c63aae37a348c
BYND,2025-10-27T21:45:42+00:00,Why Beyond Meat (BYND) Shares Are Plunging Today,Yahoo,https://finnhub.io/api/news?id=5348ef6126b17795ee38a601fdda7f4f8b2675de99cd72477929a96fe090a3e6
BYND,2025-10-27T20:43:00+00:00,Short Sellers Are Targeting Small-Caps. Megacaps Are Getting a Pass.,Yahoo,https://finnhub.io/api/news?id=96bde4abbac4133d2af6156f7d75a5b0c39dc00190d9eaf410e39b3e5def74dc
BYND,2025-10-27T15:47:13+00:00,Beyond Meat's Dilution Makes It A Sell,SeekingAlpha,https://finnhub.io/api/news?id=cdd8b4486462eb8dd9a86cc141ec2538ef5cc6a8f1dad0b174024b8d8559e9ad
BYND,2025-10-27T14:20:23+00:00,"Wall Street Lunch: Qualcomm Enters Into AI Accelerator Market To Take On Nvidia, AMD",SeekingAlpha,https://finnhub.io/api/news?id=a0c1d53d221737afcab0946166b8f491279b1eb6953580cddcefc87455473ed3
BYND,2025-10-27T13:25:58+00:00,Beyond Meat: The Perfect Stock To Avoid At All Costs,SeekingAlpha,https://finnhub.io/api/news?id=f2fdd2137a60ec49718372f03938f8356fa6f636a42b0a2c71179eca2aed0e2d
BYND,2025-10-27T13:12:00+00:00,"GameStop Stock Jumps as Retailer, White House Trade Halo Memes",Yahoo,https://finnhub.io/api/news?id=ac3dc62f1f023c2f6c2c36017e80822face2907d29a898cf87ebd58efbfe6c70
BYND,2025-10-27T10:30:00+00:00,Can Beyond Meat’s Meme-Stock Star Turn Last Beyond Last Week?,Yahoo,https://finnhub.io/api/news?id=e81da9acb4f7eb44c10fcb1505df9b93a006e3e87e32f030298151959fa43a21
BYND,2025-10-27T10:00:02+00:00,Are the Magnificent Seven as speculative as meme stocks?,Yahoo,https://finnhub.io/api/news?id=0d5b1264a6abc53b64e641274c43dbf0fb368e5993a11ecb148ae411bbe239ac
BYND,2025-10-27T06:13:03+00:00,Beyond Meat: Recent Rally Unanchored To Prudence,SeekingAlpha,https://finnhub.io/api/news?id=ed2747e6bd2c9b57763dab0841044350eb53d0e32593751cf4acfb16c0a55913
BYND,2025-10-26T15:11:45+00:00,Beyond Meat (BYND) Surges After Walmart Deal and Clean-Label Launches—Is Retail Hype Reshaping the Story?,Yahoo,https://finnhub.io/api/news?id=ca48ba4b0469538b05300ef6a71a403ebf6ee4a4da77e242d35571de97709b5d
BYND,2025-10-26T09:15:00+00:00,Could Beyond Meat Help Make You a Millionaire?,Yahoo,https://finnhub.io/api/news?id=91540b378894f9471a9fd0325c7699439e27e8376fdbbb1e38f656bb2a299e3a
BYND,2025-10-25T11:00:00+00:00,"Microsoft, Meta Set To Report Earnings As Investors Watch Out For Trump-Xi, Fed Meeting",SeekingAlpha,https://finnhub.io/api/news?id=d5db441f4ccd9be07a8c416bf0dd115788548310d8ae67d27bbe6f36a1335745
BYND,2025-10-24T18:31:42+00:00,Investing.com’s stocks of the week,Yahoo,https://finnhub.io/api/news?id=9ccebeb7c68f3bdc86aa16f81c7db18153d0a09c8a70cebee982a818675480db
BYND,2025-10-24T18:03:00+00:00,Beyond Meat Stock Is on a Wild Ride. Why a Meme Rally Looks Undercooked.,Yahoo,https://finnhub.io/api/news?id=109fb75c6907d6e7a8df957d6b1b29a84fc63d33436986bfc2b2f44813e31a7e
BYND,2025-10-24T18:01:04+00:00,Top Midday Decliners,Yahoo,https://finnhub.io/api/news?id=b31758a048cd5ba9e5c1e280a12da3406674266d21bf7c6781675fba1d6b5143
BYND,2025-10-24T13:25:00+00:00,Wall Street Roundup: Are We In A Bubble?,SeekingAlpha,https://finnhub.io/api/news?id=ef4bdd44424649eba467c52814161760ca28d44a65804662acbd6811f2ad9d39
BYND,2025-10-24T12:58:00+00:00,"Beyond Meat Expects Impairment Charge, Revenue In Line With Target",Yahoo,https://finnhub.io/api/news?id=fd457be7e2837ebdac6167e93bffc2755a3d8e38b914ae00b9207d552dae2df8
BYND,2025-10-24T12:19:32+00:00,Beyond Meat stock rises after preliminary Q3 revenue tops estimates,Yahoo,https://finnhub.io/api/news?id=ead3803cc42615e7e12b051ac5d50219f60f2fc8a64741e5fc55c0d7258a9eb0
BYND,2025-10-24T10:39:53+00:00,"Social Buzz: Wallstreetbets Stocks Mostly Higher Premarket Friday; Beyond Meat, Intel to Advance",Yahoo,https://finnhub.io/api/news?id=a56cdcfe659de8ea59464cfb17c6c445961287800269a32b691858a89bb7f835
BYND,2025-10-24T04:32:55+00:00,2 Russell 2000 Stocks Worth Investigating and 1 That Underwhelm,Yahoo,https://finnhub.io/api/news?id=22db8ba782dc4587a17225b1307b6845735fabcc9d469fac3bb0c2456707b0de
BYND,2025-10-23T20:07:00+00:00,"Up 454% in a Week, Is This Company the Meme Stock of 2025?",Yahoo,https://finnhub.io/api/news?id=d971f2bcdcad5e1177e70ba311601106b121a22e304e0dd5d016acc82d8a7506
BYND,2025-10-23T19:50:44+00:00,Why Beyond Meat (BYND) Shares Are Falling Today,Yahoo,https://finnhub.io/api/news?id=364dc7dde72890504c3ba1757b134e76fcbaae4b2a828635a32b05635a391d56
BYND,2025-10-23T18:37:41+00:00,Beyond Meat’s Meme-Stock Resurrection Sparks a Retail-Trading Record,Yahoo,https://finnhub.io/api/news?id=1629e4580eb4b6c8a5842319fc0b2f2fd274e5b8a56d1fa43edf3f3e81b5b3b2
BYND,2025-10-23T16:58:00+00:00,Beyond Meat Stock Falls. Is the Meme-Fueled Rally Over?,Yahoo,https://finnhub.io/api/news?id=f20a87e879ac81c11c990b1522e9515542ae65ca947690a109aa49ff5ca8a148
BYND,2025-10-23T16:00:31+00:00,Beyond Meat Stock Is Tumbling. Is the Meme Stock Rally Already Over?,Yahoo,https://finnhub.io/api/news?id=dd1dba058a3b09e7acdd12d70adab65b708646e03ace043f3555dcf209266fa0
BYND,2025-10-23T14:10:20+00:00,Beyond Meat Is a Terrible Company,Yahoo,https://finnhub.io/api/news?id=a547efc5e17e4577a6b9f2e895d69935294107dba55353c63fa179d89a608534
BYND,2025-10-23T13:15:00+00:00,Beyond Meat® Announces Availability of Beyond Burger® and Beyond Beef® IV at Erewhon,Yahoo,https://finnhub.io/api/news?id=0de958216a1fe33ff8522d5d4ab5ce9ac6de096711e5b65c659e90bbc9ee52c9
BYND,2025-10-23T10:47:00+00:00,Tesla Stock Depends on Musk’s Robot Army. Why Fierce Competition Is a Problem.,Yahoo,https://finnhub.io/api/news?id=8baa7bcb7291766cd1ed77d20a7ac2755c6ae26dc7f2a69f25876f45ed9b88b2
BYND,2025-10-23T08:32:21+00:00,Beyond Meat Stock’s Wild Ride Triggers a Short-Seller Frenzy,Yahoo,https://finnhub.io/api/news?id=af0a4293fb4d5a33004d54470a0c38972ee3fdaa14a861109e294273e39436a8
BYND,2025-10-22T20:49:39+00:00,Hot-Money Retail Traders Turn Momentum Chasers Into Bagholders,Yahoo,https://finnhub.io/api/news?id=93f8d438ad781b54718d53e575cd450df766f1a709789e080ceb2f1abb9b86fb
BYND,2025-10-22T19:35:00+00:00,Beyond Meat Goes Meme: Traders Pile Into Struggling Faux Meat Shares,Yahoo,https://finnhub.io/api/news?id=58d925f72c5276194f6b008e78d7136f0d2e24aedf69da63bf355b8d81c56fbf
BYND,2025-10-22T18:27:15+00:00,"Beyond Meat Explodes 1,100% in Meme-Fueled Frenzy -- What's Really Driving the Surge?",Yahoo,https://finnhub.io/api/news?id=3afc292d79153bba4ee8bf7e2308f39a50d52709b3b070984f5688f8315a23cd
BYND,2025-10-22T18:01:09+00:00,Beyond Meat Soars After MEME ETF Inclusion Sparks Short Squeeze,Yahoo,https://finnhub.io/api/news?id=4ee70025346a11ebf888387be247e231d9eb6bdbf2648597cd8f45b03a041e75
BYND,2025-10-22T16:48:47+00:00,Beyond Meat Stock Goes On a Wild Ride,Yahoo,https://finnhub.io/api/news?id=a641f3d3f6060f02fa1a330a43bd4b9a2a52f90d76e5b5942e4b1c543c98254c
BYND,2025-10-22T16:47:00+00:00,"Beyond Meat Stock is Up 729% This Week and Still Climbing. Amid Rumors of a Short Squeeze, Could It Be Headed to the Moon?",Yahoo,https://finnhub.io/api/news?id=602a0349eeb5e0aa6513e2b2a48e9de117fa8969e925336b5f569ac9f85478d0
BYND,2025-10-22T16:43:00+00:00,"Beyond Meat shares surge over 1,000pc in ‘meme stock’ frenzy",Yahoo,https://finnhub.io/api/news?id=02c77667a3668e83d64905e49f260bd29c78248246a32fd1a901468c8394320e
BYND,2025-10-22T16:14:16+00:00,"From Beyond Meat to Krispy Kreme, meme stocks surge as investors pile back into speculative trades",Yahoo,https://finnhub.io/api/news?id=7f0a0df25b9613bd3a29903d0a5f20a5ea1b6d6625f43576459f20f52646c0bb
BYND,2025-10-22T16:11:00+00:00,Krispy Kreme Takes a Meme Stock Ride. Don’t Bite.,Yahoo,https://finnhub.io/api/news?id=6e340bfcb2d768453af1e9c0c7ba461214f8f987ae364a37e0baba386038f124
BYND,2025-10-22T15:56:17+00:00,Top Midday Stories: Netflix Shares Fall on EPS Miss; Google in Talks With Anthropic on Big Cloud Deal,Yahoo,https://finnhub.io/api/news?id=9b25482876465c19ee9b1d45860a921e1c124f132ab76265701623b82b758bac
BYND,2025-10-22T15:50:43+00:00,Why Is Beyond Meat (BYND) Stock Rocketing Higher Today,Yahoo,https://finnhub.io/api/news?id=b780864cddb94588bfe78b4d7d51ed0a93d76de03c4ffaae61a96cba2dcd946a
BYND,2025-10-22T15:38:09+00:00,Forget GameStop: Meme Stock Traders Are Now Pumping Beyond Meat—Here's Why,Yahoo,https://finnhub.io/api/news?id=6806808580391f59591ecf97413748a1be428361ffb99b9003c3236bf3208eb7
BYND,2025-10-22T15:37:16+00:00,Beyond Meat shares surge in meme-stock style rally,Yahoo,https://finnhub.io/api/news?id=4a0c10f2d368d1398079e5930eed50c56dbc198217ff0d8a8c177852beefe588
BYND,2025-10-22T15:14:00+00:00,Beyond Meat and Gold Are Wall Street’s Odd Couple. It Must Be FOMO.,Yahoo,https://finnhub.io/api/news?id=af50e15ffd0f565236e2edf265941a344707134d7c47f8933fc1bf970ebb8499
BYND,2025-10-22T14:12:24+00:00,"Beyond Meat, Inc. (BYND) Has 70% Upside Potential If It Follows Opendoor Technologies’ (OPEN) Path",Yahoo,https://finnhub.io/api/news?id=a4bb41f0422536007b07126f5abf1d67450304707ab7c126bfc8692c6abbd50d
BYND,2025-10-22T14:03:03+00:00,Beyond Meat fuels meme rally: What to know when trading meme stocks,Yahoo,https://finnhub.io/api/news?id=ecd3bcef502e7cc5f2c7b21ad62164299551e1b9dd4410871d201c3292c15fde
BYND,2025-10-22T13:43:00+00:00,BYND Stock Rallies as Walmart Deal Boosts Retail Comeback,Yahoo,https://finnhub.io/api/news?id=0389a9603a22ff05b993eba38a2f5ba1018f8376b4b93b42edba5595d9160f8f
BYND,2025-10-22T13:28:24+00:00,"AT&T adds mobile subscribers in Q3, Beyond Meat rallies by 1,300%",Yahoo,https://finnhub.io/api/news?id=b22237bfccb7acf09e9cf3ff96598cff6ff361ba0895143d97bb6b42c82b028a
BYND,2025-10-22T13:13:29+00:00,Beyond Meat: Technical Short Squeeze Set-Up Was Strong; Expect Resistance,SeekingAlpha,https://finnhub.io/api/news?id=258642d3ac729a8e55f0466cdbc02953b6cf707fb9b01fb14fc7258d730af7f2
BYND,2025-10-22T12:52:50+00:00,Wall Street Lunch: Gold And Silver Face Sharp Decline Following Historic One-Day Drop,SeekingAlpha,https://finnhub.io/api/news?id=f295765ff46dad2bfe78d4f1747f291e305d8394ce1b80c5bc45d6102e1690d3
BYND,2025-10-22T12:41:25+00:00,"Anthropic & Google talks, Beyond Meat soars",Yahoo,https://finnhub.io/api/news?id=bc4725e06155313e3762a267758506924e233fac54d08c64b5b15a455b7f2e2f
BYND,2025-10-22T05:05:11+00:00,Beyond Meat: Recent Rally Changes Little,SeekingAlpha,https://finnhub.io/api/news?id=e9e00c74372d852cd2b28085306b74ca07cb2cc6a468258cfcb4c487575699f8
BYND,2025-10-21T18:38:53+00:00,Meme Stock Madness: Will Beyond Meat’s 388% Pop End in Tears?,Yahoo,https://finnhub.io/api/news?id=c5cf2010a2e7dc81cd6e5a744119126bec4adeda4a7788ccacb2c77d1f2354de
BYND,2025-10-21T17:43:13+00:00,Sector Update: Consumer Stocks Mixed in Afternoon Trading,Yahoo,https://finnhub.io/api/news?id=24a59dc40ace2de18fd3180b0e368f184cae143fedf6e9e33c5e9afe1f374d16
BYND,2025-10-21T17:36:17+00:00,Top Midday Gainers,Yahoo,https://finnhub.io/api/news?id=aa1e52ffcab16a23793a3b168d287d20b88eb4e4fcdcd12e2f7ac8a1f9402ae9
BYND,2025-10-21T17:16:00+00:00,Is Beyond Meat the Next Meme Stock? What’s Behind the Rally.,Yahoo,https://finnhub.io/api/news?id=c116bb44d6fa644008ff6b39ff7e96a5fbbb310e70f0e94a85bb25ce120422e3
BYND,2025-10-21T17:14:42+00:00,"Netflix & Comcast's reported WBD interest, Beyond Meat skyrockets",Yahoo,https://finnhub.io/api/news?id=9710101506b6606259ed388729e220d72603362d6815e4ff98d5ff407aa14048
BYND,2025-10-21T15:40:10+00:00,Beyond Meat Surges on Expanded Distribution at Walmart Stores,Yahoo,https://finnhub.io/api/news?id=fcd804c40067b8e8a2632e072c66ac107eb0915dc76cccc2ecde65f1488d9e4d
BYND,2025-10-21T13:52:59+00:00,Beyond Meat stock soars after expanding Walmart distribution,Yahoo,https://finnhub.io/api/news?id=f8c7dc5bda91a53ab11cc317e6bb75c21eb2976ea37e7aaaf8bf3704536525d4
BYND,2025-10-21T13:15:00+00:00,Beyond Meat® Expands Distribution at Walmart,Yahoo,https://finnhub.io/api/news?id=783738c75c78c3be45a094ee2d627abe102f4bfda7be08a0f71afd0fe2871250
BYND,2025-10-21T12:05:24+00:00,"Beyond Meat, Tesla, and the aspiring Nvidia rival: Trending Stocks",Yahoo,https://finnhub.io/api/news?id=615b2732a3e0fa8f27b10562e727f263ea1e910564676f50d4511132d78ce2a5
BYND,2025-10-21T08:33:31+00:00,"Trending tickers: HSBC, Cleveland-Cliffs, GSI Technology, Beyond Meat and Replimune",Yahoo,https://finnhub.io/api/news?id=617ba6d96d27eea5578b0900c99ea9f26c15519a493f58727903fe88a08bc4ce
BYND,2025-10-20T19:45:46+00:00,Retail Traders Sending Beyond Meat 80% Higher Today,Yahoo,https://finnhub.io/api/news?id=cdefc693e75b43fcf0f402ca5dc7bef81b34acbb2a71060ebea9dff015790d85
BYND,2025-10-20T19:11:51+00:00,"Up Over 100% in 24 Hours, Is Beyond Meat Stock the Next AMC?",Yahoo,https://finnhub.io/api/news?id=ec1784a0025401310d401fb3dcd357e9e5945ee77dc1fe0c7e335c68e73ce7ee
BYND,2025-10-20T18:05:47+00:00,Meme Stock Beyond Meat Soaring As Traders Buy Up Shares,Yahoo,https://finnhub.io/api/news?id=74aff110f5b36327ccc5f05d5978f2097a302c3965db370524c3fc5c6cf5f7b9
BYND,2025-10-20T13:27:01+00:00,Wall Street Set to Open Higher Monday as Investors Look Ahead to a Week of Earnings Reports,Yahoo,https://finnhub.io/api/news?id=02a58d062b75c9387906e27779af7561de13c070c117961081b72d180cbaca38
BYND,2025-10-20T12:45:00+00:00,Beyond Meat stock price is surging today after crashing into penny territory. Here’s why,Yahoo,https://finnhub.io/api/news?id=d0926b753e33404d9c35a6aa5f565ace74d60398937438c4a8a253d12c215f32
BYND,2025-10-20T12:16:47+00:00,"Beyond Meat, Tesla, TKMS, Kering: Trending Stocks",Yahoo,https://finnhub.io/api/news?id=d1d4395ffebc1145b959ca3ce4b30c5f431b332607722c210ef9051e5cb0b21a
BYND,2025-10-20T12:01:55+00:00,Investors Look Ahead to Key Earnings Reports as US Futures Rise Monday Pre-Bell,Yahoo,https://finnhub.io/api/news?id=1f970db13b27134809d087f36f61701000f90c6b00d7d73a10962fc19f186a35
BYND,2025-10-20T10:53:34+00:00,"Trending tickers: Apple, Beyond Meat, Rani Therapeutics, BitMine and B&M",Yahoo,https://finnhub.io/api/news?id=fbcd7a0d3377507b70421e0ca2ac4bf29d43978cb90a02d248fa703c15893cc9
BYND,2025-10-17T11:12:40+00:00,Beyond Meat: Convertible Note Exchange Buys It Some Additional Time,SeekingAlpha,https://finnhub.io/api/news?id=3f13b504ce28ed132a9866a0435c10b35ba29869c9dec3f342c7c4d1f99898d6
BYND,2025-10-16T20:30:00+00:00,"Beyond Meat Announces Release at 5:00 p.m., New York City time, of Lock-up Restrictions on Shares that were Exchanged for Existing Convertible Notes in its Exchange Offer",Yahoo,https://finnhub.io/api/news?id=ef30a77aa7d688ad22e7905fc65c3fe7c5006a11b88097327e5380c1f8926a2d
BYND,2025-10-16T04:38:44+00:00,3 Cash-Burning Stocks We Think Twice About,Yahoo,https://finnhub.io/api/news?id=37783d7f500115c3de01b9c3741e1e31d8d67c866cfb6e6de8fb84c637ca032c
BYND,2025-10-15T18:01:52+00:00,Why Beyond Meat (BYND) Stock Is Up Today,Yahoo,https://finnhub.io/api/news?id=42c9d3c8d1ee86bec21e10d40f4ca557c10b3bfb1f6ed47887186eebb422b2b3
BYND,2025-10-15T00:14:37+00:00,How Recent Developments Are Rewriting the Story for Beyond Meat,Yahoo,https://finnhub.io/api/news?id=95aff2f9ef4fcc58930fe6f7b2e472ec1d41bda74a54abd03e295523fc1134b4
BYND,2025-10-14T18:10:00+00:00,Beyond Meat Stock Trades Below $1 for First Time. Why It’s Ailing.,Yahoo,https://finnhub.io/api/news?id=0facb57f6f33981917a3574e08068395bde86a87872633a878a49808a4871a62
BYND,2025-10-14T17:05:52+00:00,Why Beyond Meat (BYND) Stock Is Nosediving,Yahoo,https://finnhub.io/api/news?id=f8cdfe624b3b64d306558374cb979cdf52395abf7d2a786798a89b467f12bf52
BYND,2025-10-14T13:05:02+00:00,Beyond Meat: The Debt Exchange Offer Is Worse Than It Seems,SeekingAlpha,https://finnhub.io/api/news?id=b443415f6da002bd97920905edb017358ea5ad77d2071f52e4b1c847a827beea
BYND,2025-10-14T12:03:46+00:00,Beyond Meat: Debt Overhang Addressed But Operational Headwinds Remain - Sell,SeekingAlpha,https://finnhub.io/api/news?id=438fd029d7d80099a0db931603844502fb59f4c62171fcb1ef7eab26b000caf6
BYND,2025-10-14T08:18:09+00:00,Beyond Meat: I'm Not Comfortable With The Financial Situation,SeekingAlpha,https://finnhub.io/api/news?id=4514fda26e9b0d9d51385814fb68ba6907ad16cae01726778138478c35dc6590
BYND,2025-10-13T20:16:00+00:00,Beyond Meat Debt Deal Rattles Investors,Yahoo,https://finnhub.io/api/news?id=75ff1704fe90ffa16b8ffee5a853c301a85cb1f1a5f1d4a72de210415526e155
BYND,2025-10-13T18:08:23+00:00,"Oklo & other nuclear stocks climb, Public Storage upgraded",Yahoo,https://finnhub.io/api/news?id=3c91c8bbce6af02884534c5d11f33ae77be377022675ad1c5b6dea28061f6e1e
BYND,2025-10-13T17:54:19+00:00,Beyond Meat Plummets After Debt Swap Massively Dilutes Shareholders,Yahoo,https://finnhub.io/api/news?id=fea28ea5cb427c1709b410b42c2006f6bae01d38250195d66e3e346a4129feb0
BYND,2025-10-13T15:45:23+00:00,"Top Midday Stories: Broadcom, OpenAI Partner to Deploy AI Accelerators; Brookfield to Invest Up to $5 Billion in Bloom Energy Partnership",Yahoo,https://finnhub.io/api/news?id=488f6b962ea595b44e451c23b14bbcc3804398395d3429517758e8e661bd5e69
BYND,2025-10-13T14:53:44+00:00,"Taylor Swift on Disney+, Beyond Meat nosedives on debt swap",Yahoo,https://finnhub.io/api/news?id=ba8894bf04028a135b751085187fb6b3acb3daa722ee4fdc98c69630f0168732
BYND,2025-10-13T13:38:09+00:00,Wall Street Lunch: Broadcom Surges On Deal With OpenAI For Custom AI Accelerators,SeekingAlpha,https://finnhub.io/api/news?id=15599f5e0dd365ee72fa6b61f8bd086a0d5e1f84e77aff6214030550a23d8b4f
