ticker,published_utc,title,publisher,url
BYND,2025-10-13T13:18:04+00:00,Sector Update: Consumer Stocks Mixed Pre-Bell Monday,Yahoo,https://finnhub.io/api/news?id=84b71331e86678c96b028f9e79bb7d5ad7a5326db421d0d7c4fb07c670a4190d
BYND,2025-10-13T11:00:00+00:00,Beyond Meat Announces Early Tender Results and Early Settlement for Exchange Offer and Consent Solicitation with Respect to Existing Convertible Notes,Yahoo,https://finnhub.io/api/news?id=8c088d1ff10226837e1173482b185ab1583d2f8622c61771d433a96aff9abbdf
BYND,2025-10-06T12:43:23+00:00,Beyond Meat (BYND) Is Up 41.2% After Announcing Major Debt Swap and Share Issuance Plan,Yahoo,https://finnhub.io/api/news?id=619abcdc70b8ca8f367d3c31f83636e224f8aeb826ae2703ab943e29ee77b925
BYND,2025-10-03T11:55:25+00:00,Beyond Meat (BYND) Valuation in Focus After Major Debt Restructuring Sparks Shareholder Dilution Concerns,Yahoo,https://finnhub.io/api/news?id=d3fce5c6f384082a2a055ae21430fd7f0ece886012485e00531b6e08a93aaad8
BYND,2025-10-02T04:34:34+00:00,3 of Wall Street’s Favorite Stocks We Steer Clear Of,Yahoo,https://finnhub.io/api/news?id=6247c366f4da615427ee0ca00a1a46d81251390ee6f13da9f48c0feab363061c
BYND,2025-09-30T13:00:38+00:00,"Stocks making big moves yesterday: Beyond Meat, The Trade Desk, Guardant Health, PayPal, and Tilray",Yahoo,https://finnhub.io/api/news?id=0782c22b343c0e7e2277385b1f5e71147f7cd3c04d20afef83ff56780d37195a
BYND,2025-09-30T12:45:52+00:00,"Beyond Meat launches exchange offer, consent solicitation to eliminate debt",Yahoo,https://finnhub.io/api/news?id=7fc395f9c2c15a070121ac9ac1a0e01103cd264fdec460d7eebc2e3ade934e73
BYND,2025-09-30T08:44:31+00:00,"Trending tickers: Beyond Meat, Etsy, Asos, Close Brothers and AG Barr",Yahoo,https://finnhub.io/api/news?id=25c61f5320b988c449e1621ee313f5b94f79325ed6f4471fa62ba3358c40d1c6
BYND,2025-09-29T19:10:41+00:00,Why Beyond Meat (BYND) Stock Is Trading Lower Today,Yahoo,https://finnhub.io/api/news?id=69405faf2248585d107ce6385e9800ae3c74a583662204d174e406f5027500b0
BYND,2025-09-29T14:46:41+00:00,"Movie tariffs, Beyond Meat, Kroger & DoorDash: Trending Tickers",Yahoo,https://finnhub.io/api/news?id=96e4289363da0ea0e2c4e270987edc96f29535f83c348f9e28b63122c1c73359
BYND,2025-09-29T12:15:00+00:00,Beyond Meat Launches Exchange Offer and Consent Solicitation Intended to Eliminate Over $800 Million of Debt with Existing Noteholder Support,Yahoo,https://finnhub.io/api/news?id=ae6352458685a64f737907e764d385987d793288b23259131bbe000740bc18bd
BYND,2025-09-29T11:57:14+00:00,Beyond Meat Stock Plunges On Major Restructuring,SeekingAlpha,https://finnhub.io/api/news?id=60e83f3ca9b0ee338292fe038576d3419bbf644e1c00e30eb7be78f13208a501
BYND,2025-09-29T04:33:15+00:00,1 Consumer Stock to Target This Week and 2 We Brush Off,Yahoo,https://finnhub.io/api/news?id=ffe829c45a0f20d36b8ca0bf89a9dee9184d233912e8910f6504567f87d71416
BYND,2025-09-28T23:20:53+00:00,"Beyond Meat, Inc. (BYND) Cuts Jobs as Revenue Slumps 20% in Q2",Yahoo,https://finnhub.io/api/news?id=2deddb99124d7c75e12e25d738f2685e46e472629d2de3ab63109512a24232bc
BYND,2025-09-23T04:02:52+00:00,3 Reasons BYND is Risky and 1 Stock to Buy Instead,Yahoo,https://finnhub.io/api/news?id=0cf954c7363268d8da31c6cb5dfde5d5c97ce06d5bebde289602bc97c1ff4433
BYND,2025-09-18T03:30:10+00:00,Beyond Meat: No Way To Cost Cut Its Way Back To Life,SeekingAlpha,https://finnhub.io/api/news?id=ccaebfa6d406ef5233ac772a71e0a7b52564447c7704d5640859e20c2afee292
BYND,2025-09-15T15:40:37+00:00,"Micron, The RealReal, Beyond Meat: Top Analyst Calls",Yahoo,https://finnhub.io/api/news?id=7f03b70f3b667a9662388ba022b4b83192764f98e0aa0258230d68f47e0bf1ea
BYND,2025-09-15T14:40:59+00:00,"Broadcom initiated, Beyond Meat downgraded: Wall Street's top analyst calls",Yahoo,https://finnhub.io/api/news?id=c11bf82c185639c6119391e86ddbc913dde44ddd14d71d115362310926a06084
BYND,2025-09-15T14:31:21+00:00,Argus downgrades Beyond Meat on weak demand and balance sheet concerns,Yahoo,https://finnhub.io/api/news?id=8ba54c8da13ef1b035cd2537335d27e62050c80eacf52f88620f79d69c738350
BYND,2025-09-12T18:04:50+00:00,Beyond Meat: Bankruptcy Probable In 2027,SeekingAlpha,https://finnhub.io/api/news?id=04ecf677cca5a32fcf643be4582794ae782e4b2757925b0590a74accca5daf6d
BYND,2025-09-11T04:35:18+00:00,Q2 Earnings Outperformers: Beyond Meat (NASDAQ:BYND) And The Rest Of The Perishable Food Stocks,Yahoo,https://finnhub.io/api/news?id=dc81513b10c725a54b24e5f548a22ced119a1d3896640c10ab7e746975a553a6
BYND,2025-09-10T21:41:01+00:00,"Beyond Meat, BellRing Brands, Calavo, e.l.f. Beauty, and Tilray Shares Plummet, What You Need To Know",Yahoo,https://finnhub.io/api/news?id=3b3a4b5c50c968fc3c8da9a448c05780f91cff89c55c0b3086141ae195198b7d
BYND,2025-09-02T20:30:50+00:00,Why Beyond Meat (BYND) Shares Are Trading Lower Today,Yahoo,https://finnhub.io/api/news?id=ca9f0b4e628fa9fd97d5a38e8cd972c6ce15f3ea8e882a1390c61e3d3b70a9b7
BYND,2025-08-30T11:00:00+00:00,"Salesforce, Broadcom Set To Report Earnings As Markets Await Jobs Report",SeekingAlpha,https://finnhub.io/api/news?id=8d00d4f2ff77242fd8ccf32e73214430b736d23310e44c2ce48e5d936973a38c
BYND,2025-08-26T11:41:05+00:00,"Stocks Down Pre-Bell as Trump Says He Fired Fed Governor Lisa Cook, Threatens More Tariffs in Digital Tax Retaliation",Yahoo,https://finnhub.io/api/news?id=b3bb5b9c87a44bb8a69e80fd1b0042fce5febeb0ca119778811c2322f056404b
BYND,2025-08-17T21:01:38+00:00,Beyond Meat: Sales Challenges Deepen In Q2 2025,SeekingAlpha,https://finnhub.io/api/news?id=6b7fb57931a8633e66fab37d46b33bf6b63377b1722f4800e02fb17fb94e5f20
BYND,2025-08-15T19:46:43+00:00,Sector Update: Consumer Stocks Mixed Late Afternoon,Yahoo,https://finnhub.io/api/news?id=82cb7167610e7ab4dcf7260c4ec3e9bcd57ae85dc4226fc465a3401fe8cde805
BYND,2025-08-13T05:36:47+00:00,5 Insightful Analyst Questions From Beyond Meat’s Q2 Earnings Call,Yahoo,https://finnhub.io/api/news?id=9870979ba7b2270c8a4edfba4611db3c324f77d137e094d1a69d326e24c0a18e
BYND,2025-08-12T17:50:45+00:00,"Beyond Meat (BYND) Stock Trades Up, Here Is Why",Yahoo,https://finnhub.io/api/news?id=e4a885521faf23be715e730d74d5dcc754e8c0210cf4cc99368932042158c5b7
BYND,2025-08-12T07:16:51+00:00,BYND Q2 Deep Dive: Category Headwinds Prompt Operational Reset and Brand Refocus,Yahoo,https://finnhub.io/api/news?id=8c8595234ce3afa11b25dbdbbda70183deb1bf32600edf49d9c9fc847b08013d
BYND,2025-08-09T10:49:23+00:00,Beyond Meat: Bankruptcy Chances Surge After Disaster Q2 Report,SeekingAlpha,https://finnhub.io/api/news?id=c3aa72f2b36e57757e4ad19bddafecfee02b41c6d2f7cb804dc2468573385cc4
BYND,2025-08-08T11:22:36+00:00,"Retail investors account for 50% of Beyond Meat, Inc.'s (NASDAQ:BYND) ownership, while institutions account for 45%",Yahoo,https://finnhub.io/api/news?id=2e1fa2ded14545e950787339251c33dcfb2cc74839992bc727b0e192b7b3318b
BYND,2025-08-07T02:44:48+00:00,"Beyond Meat, Inc. (BYND) Q2 2025 Earnings Call Transcript",SeekingAlpha,https://finnhub.io/api/news?id=cccbc2d3db8670c314822ef1404f84d54170c0ad9d98a051ac940fedc4d4b473
BYND,2025-08-06T21:50:23+00:00,Beyond Meat: Q2 Earnings Snapshot,Yahoo,https://finnhub.io/api/news?id=7b17112a273e43b54a14cffa2b68ea85c37daf0a17b70b9de07f246e6907de6e
BYND,2025-08-06T21:13:56+00:00,Beyond Meat (NASDAQ:BYND) Misses Q2 Sales Targets,Yahoo,https://finnhub.io/api/news?id=977f0162c8a5fa85d9188167973c732564f0a846969777baaa8c4d01fc1b88c9
BYND,2025-08-06T20:58:00+00:00,Beyond Meat® Reports Second Quarter 2025 Financial Results,Yahoo,https://finnhub.io/api/news?id=38662fedc22cef63f88f72b567312a7f94eba6bc09b9ce50fbe1f3293fe0930a
BYND,2025-08-05T03:20:09+00:00,What To Expect From Beyond Meat’s (BYND) Q2 Earnings,Yahoo,https://finnhub.io/api/news?id=8336367905e598370e077e93024598a0981ec88cf002badd48eecfc2c4c105ea
BYND,2025-08-01T04:41:57+00:00,3 Unpopular Stocks We Keep Off Our Radar,Yahoo,https://finnhub.io/api/news?id=6e85d1782677cd49cc765312cb81f0df759fae7832db1af40ca2e0b7062505dc
BYND,2025-07-29T12:48:17+00:00,Lindt & Sprungli: A Premium Brand Trading At A Deep Discount,SeekingAlpha,https://finnhub.io/api/news?id=e7d22dfd3c5f2b1bafc0456e3f9cdc20401f41666b2bc5d5e57b8bfa44b1f3ea
BYND,2025-07-28T20:05:00+00:00,"Beyond Meat® to Report Second Quarter 2025 Financial Results on August 6, 2025",Yahoo,https://finnhub.io/api/news?id=17cd0b7af1add02acf39d30a43b4d1229bf9398d8224ddc44e62ff1d6b682dcf
BYND,2025-07-26T08:10:00+00:00,5 Stocks I'm Buying As Retail Investors Take Over The Market,SeekingAlpha,https://finnhub.io/api/news?id=628a51bd8158b84ba7d4a3e37fc209a9ba7f67814dbc70685a38b7c8801e3701
BYND,2025-07-25T20:29:30+00:00,Meme-Stock Roar Fades on Wall Street as Retail Finds New Thrills,Yahoo,https://finnhub.io/api/news?id=08b6a3d9e0f2f0cf5b3c8b6f3251794defecb2f075fb99802472befc21e580df
BYND,2025-07-23T17:31:59+00:00,Why Are Beyond Meat (BYND) Shares Soaring Today,Yahoo,https://finnhub.io/api/news?id=e4b8e969f8336f90e48659e411f05d3281c448e065d9b79ba96fb0e608f6b289
BYND,2025-07-23T14:15:00+00:00,Market Minute 7-23-25- Stocks Rip on Japan Deal,Yahoo,https://finnhub.io/api/news?id=c5c22d33eab2bb73780fdeddf880628828facf583d3ca875a3a9230f4bf5bba3
BYND,2025-07-23T13:49:37+00:00,Wall Street Lunch: Return Of Meme Stock Frenzy Causes Volatility In The Market,SeekingAlpha,https://finnhub.io/api/news?id=f8f2f4a0b0655c6c61f24b4e46338f0da827933e281e1f1af6b79cf50cf5886f
BYND,2025-07-23T13:25:11+00:00,"US–Japan trade deal, meme stocks, Big Tech earnings: 3 things",Yahoo,https://finnhub.io/api/news?id=d1702be312f1e66bb862cff822b344accb9d658f34bb38665e81c43a0e9a95e7
BYND,2025-07-22T14:11:45+00:00,Here's what's fueling the latest meme stock surge,Yahoo,https://finnhub.io/api/news?id=c1e9167c53aef76609ea52e0b6cc5edff27798e97c1840b830e332be79d24c80
BYND,2025-07-22T04:05:50+00:00,"Beyond Meat (BYND): Buy, Sell, or Hold Post Q1 Earnings?",Yahoo,https://finnhub.io/api/news?id=1ef8be423e28136cbb8b5f91c86999a0791053df15fba12a2e80ff9a97908a07
BYND,2025-07-18T12:55:00+00:00,Beyond Meat Is Spoiling At An Even Faster Rate,SeekingAlpha,https://finnhub.io/api/news?id=4bb3e56a10a67ae7afbc2afab100f0583305f27c742eac3ea33a99f389fb6842
BYND,2025-07-17T19:50:50+00:00,Why Beyond Meat (BYND) Stock Is Trading Up Today,Yahoo,https://finnhub.io/api/news?id=b564b0cecca6acb69faf8eba9a1f5333b148a21319bae308f02b22662c30315d
BYND,2025-07-16T03:37:27+00:00,Reflecting On Perishable Food Stocks’ Q1 Earnings: Beyond Meat (NASDAQ:BYND),Yahoo,https://finnhub.io/api/news?id=573bd61b054ced5471f56bc77c5de668f5cc05ba352785bdb20d0e3e5290af7c
BYND,2025-07-11T08:50:00+00:00,Zacks Industry Outlook Highlights Tyson Foods and Beyond Meat,Yahoo,https://finnhub.io/api/news?id=cc1c3ef5cbf9f41874675d72eaeb71fee40e0bd49fb6032d85b97bde296c621a
BYND,2025-07-10T13:06:00+00:00,2 Meat Stocks to Keep an Eye On Despite Market Challenges,Yahoo,https://finnhub.io/api/news?id=7f97329ab31af4576fbd439b8213d6f1839a28224851550a8cd14dd3eab8c5c0
BYND,2025-07-09T05:33:02+00:00,The 5 Most Interesting Analyst Questions From Beyond Meat’s Q1 Earnings Call,Yahoo,https://finnhub.io/api/news?id=c47cc6119f69584512e2f62a661c029343ee2cb6c88cc80ed8bebb2c62c0f120
BYND,2025-07-03T04:32:17+00:00,3 Small-Cap Stocks Walking a Fine Line,Yahoo,https://finnhub.io/api/news?id=e0539621708459af3f7ced0348970259e4b8e12278f063c538a7e9d697fcf9e7
BYND,2025-07-01T04:36:36+00:00,3 Low-Volatility Stocks with Mounting Challenges,Yahoo,https://finnhub.io/api/news?id=246dd77d72fe4f0f941ae7e431c2060e87a2d541ffa26ac669223a9fab30e695
BYND,2025-06-30T16:37:43+00:00,"Beyond Meat, Inc.(NasdaqGS: BYND) added to Russell 3000 Value Index",Finnhub,https://finnhub.io/api/news?id=08e70039c87bf6b5bebdd1e0f7cac85b96d9b2cceb87fe8a7e2cc63230a2ecef
BYND,2025-06-30T13:29:03+00:00,"Beyond Meat, Inc.(NasdaqGS: BYND) added to Russell 2500 Value Index",Finnhub,https://finnhub.io/api/news?id=488b6ac21ae8f3fcb24a962a1f94317ee90141e03c1ef0799a48efa2ea3b32c6
BYND,2025-06-30T10:28:54+00:00,"Beyond Meat, Inc.(NasdaqGS: BYND) added to Russell 3000E Index",Finnhub,https://finnhub.io/api/news?id=6132fcbc0ea7235b141b7c9f29ff74d7fd23c9ef35914748639f6d46b3fa4e44
BYND,2025-06-30T09:57:52+00:00,"Beyond Meat, Inc.(NasdaqGS: BYND) added to Russell Microcap Index",Finnhub,https://finnhub.io/api/news?id=2712cb3ab72443396645c0b0f738f44c57350d09adfe5f5f29a7df9ad9a0f102
BYND,2025-06-30T09:15:37+00:00,"Beyond Meat, Inc.(NasdaqGS: BYND) added to Russell Small Cap Comp Value Index",Finnhub,https://finnhub.io/api/news?id=668bca0df4e803aa5ced7dabe530eb8a6e9cafdeda20a82c20191ed942da7429
BYND,2025-06-30T07:42:37+00:00,"Beyond Meat, Inc.(NasdaqGS: BYND) added to Russell Microcap Growth Index",Finnhub,https://finnhub.io/api/news?id=065f99e6acfc9c91a3d4fbff70a628ec742b60697d03fbb1471c1d1d17aa421b
BYND,2025-06-30T04:26:52+00:00,"Beyond Meat, Inc.(NasdaqGS: BYND) added to Russell 3000E Growth Index",Finnhub,https://finnhub.io/api/news?id=1b390c56df271ee36c25cb1e946697176efccd7f78cca3a06e494b062d428429
BYND,2025-06-30T03:23:29+00:00,"Beyond Meat, Inc.(NasdaqGS: BYND) added to Russell 2000 Value Index",Finnhub,https://finnhub.io/api/news?id=e6b4724b1407430e927f2680c81566cdc07b62155b7657432ef6fdffb79cbfd6
BYND,2025-06-30T02:36:55+00:00,"Beyond Meat, Inc.(NasdaqGS: BYND) added to Russell Microcap Value Index",Finnhub,https://finnhub.io/api/news?id=c617dca45f584c856f291f819e598a1f989cab9dcf74e422736b482ad639ec41
BYND,2025-06-30T01:26:36+00:00,"Beyond Meat, Inc.(NasdaqGS: BYND) added to Russell 3000E Value Index",Finnhub,https://finnhub.io/api/news?id=a300fc307bcb1bd5886cbaef62154fa770631d1b3a634c94a313f80467c7aea3
BYND,2025-06-16T16:39:05+00:00,"MarineMax, Bloomin' Brands, Portillo's, Beyond Meat, and Estée Lauder Shares Are Soaring, What You Need To Know",Yahoo,https://finnhub.io/api/news?id=a955a1e797447125bfe959ac9ebc2d8b2558d25c79aebc3b905eb94784ccc779
BYND,2025-06-16T04:42:09+00:00,3 Unprofitable Stocks Skating on Thin Ice,Yahoo,https://finnhub.io/api/news?id=f50843ef4e00f57dcdcdc5deba3352cdb9f8158b3f235e9eb628f4d7ef6a01a5
BYND,2025-06-16T03:37:36+00:00,Perishable Food Stocks Q1 Recap: Benchmarking Fresh Del Monte Produce (NYSE:FDP),Yahoo,https://finnhub.io/api/news?id=159e16746c557f22ce86803cc12db53890a77a323ab06adb12a8842f3c8991f3
BYND,2025-06-12T03:34:30+00:00,Spotting Winners: Pilgrim's Pride (NASDAQ:PPC) And Perishable Food Stocks In Q1,Yahoo,https://finnhub.io/api/news?id=932f0f82f8229a74acc65210aa11c063691d7a5346d62d5a5ef00ef35aa9e669
BYND,2025-06-11T10:56:20+00:00,BYND Q1 Earnings Call: Management Focuses on Expense Controls and Distribution Recovery Amid Ongoing Challenges,Yahoo,https://finnhub.io/api/news?id=e2fced18adda09875de618f594f4efe38878389e8057c667bc51f08bbb657d84
BYND,2025-06-09T14:32:12+00:00,Was Jim Cramer Right to Warn Investors Against Buying Beyond Meat (BYND) a Year Ago?,Yahoo,https://finnhub.io/api/news?id=fd588a79af4cf77c9cd22ac299c0180e7265e88d4b33fd20a1a988e00d506448
BYND,2025-06-09T04:37:00+00:00,1 Unpopular Stock that Deserves a Second Chance and 2 to Ignore,Yahoo,https://finnhub.io/api/news?id=cc8f765a1a3327fcdbacf55ffe006e082ad3d1045f4a4cac2efad96905fff14f
BYND,2025-06-08T09:00:00+00:00,Stock Picks From Seeking Alpha's May 2025 New Analysts,SeekingAlpha,https://finnhub.io/api/news?id=3a5e8d20e2cf90ef0ecf688380d3db615ff43c7ca5ffbd7652204152657eb874
BYND,2025-06-06T23:26:24+00:00,Beyond Meat: Significant Deterioration In Results During Early 2025,SeekingAlpha,https://finnhub.io/api/news?id=92d8babbc9a8db591d7ca93fa9a682a893dc266adba05edaf25b7654706fb5c3
BYND,2025-06-06T10:15:00+00:00,Beyond Meat: Structural Issues Mounting Despite Management's Best Efforts (Rating Downgrade),SeekingAlpha,https://finnhub.io/api/news?id=2b667c774fd59238b5633947cc8bdcf920ad844ba335c7d2104ecea083957a2f
BYND,2025-06-04T14:15:16+00:00,90% of Startups Fail – Here's What's Going Wrong,Yahoo,https://finnhub.io/api/news?id=8356c450797f67cf6cf12b39839ea151722c1a06ac3659cdcb232e2a53c9613e
BYND,2025-06-03T04:31:58+00:00,1 Cash-Burning Stock with Solid Fundamentals and 2 to Brush Off,Yahoo,https://finnhub.io/api/news?id=1017ea024285c86d266d59fccf26935fe5312519e5003e1366a664135646e4f1
BYND,2025-05-30T04:35:03+00:00,1 Mooning  Stock with Exciting Potential and 2 to Be Wary Of,Yahoo,https://finnhub.io/api/news?id=565db809f4aae510696f479bf076ef8c73dfdf543773d777857cf6e003bf4cdf
BYND,2025-05-27T16:47:43+00:00,"Beyond Meat, Brinker International, FTAI Infrastructure, Super Micro, and The RealReal Shares Are Soaring, What You Need To Know",Yahoo,https://finnhub.io/api/news?id=7b428f6144d562d3d2d4728337ccf1e7637408c2f1f500e14d1519bef6fa5671
BYND,2025-05-26T04:31:15+00:00,3 Russell 2000 Stocks Walking a Fine Line,Yahoo,https://finnhub.io/api/news?id=3d647963ccb50d123dbc736eb51853a6915f8e772854ac35d605f315074a313b
BYND,2025-05-17T04:35:06+00:00,Beyond Meat: Sell As Situation Worsens,SeekingAlpha,https://finnhub.io/api/news?id=f6b38504a888b1eb08ba49402544b9dffd9d72427e34483ff38f2ae5583aa39a
BYND,2025-05-09T04:32:39+00:00,3 Stocks Under $10 Facing Headwinds,Yahoo,https://finnhub.io/api/news?id=6f482eeb284a9d113599bbbc2cfbbf1b17f9c8750ac448f3a699207574203337
BYND,2025-05-08T18:49:16+00:00,Why Beyond Meat (BYND) Stock Is Down Today,Yahoo,https://finnhub.io/api/news?id=444c14684b816ed77521ba5c948ef35acd27d2ef924fa4affcf08349c9933064
BYND,2025-05-08T13:14:38+00:00,Beyond Meat treads precarious path as economic uncertainty adds to category woes,Yahoo,https://finnhub.io/api/news?id=976bfdea14a82bdfebd945e2335aafcdd2fb995771de9be6300f493204999c63
BYND,2025-05-08T11:43:00+00:00,Beyond Meat secures $100M to pay down debt as plant-based sales suffer,Yahoo,https://finnhub.io/api/news?id=97a14f824d6b2a33d90975bdfca34df554fc1e70a895374fc0d7b10e56186b6c
BYND,2025-05-08T10:39:40+00:00,"Beyond Meat Shelves Full-Year Outlook After $7M Hit — CEO Warns Of 'Unforeseen' Economic Headwinds, But Downplays Tariff Threat",Yahoo,https://finnhub.io/api/news?id=bdc082bb1b085aac0e76964e3130d65c38137f08cbf33fc1d1ee93152524b210
BYND,2025-05-08T07:37:11+00:00,Beyond Meat Inc (BYND) Q1 2025 Earnings Call Highlights: Navigating Challenges with Strategic ...,Yahoo,https://finnhub.io/api/news?id=e6e979f3f5c3e8e195de42e1b149d8466b29a34efa5e721f0042ceccaac56f96
BYND,2025-05-07T21:40:07+00:00,"Beyond Meat (BYND) Reports Q1 Loss, Misses Revenue Estimates",Yahoo,https://finnhub.io/api/news?id=b6fb3484036c19db70393f127435c239b5180c9ae43fabb2af5b7a065cfe4b70
BYND,2025-05-07T20:41:45+00:00,Beyond Meat: Q1 Earnings Snapshot,Yahoo,https://finnhub.io/api/news?id=c053a7a6b8d2a3f20fcce7536a64341ad9f8777650f3ec872c8416c9e5d56fed
BYND,2025-05-07T20:41:09+00:00,"Beyond Meat (NASDAQ:BYND) Misses Q1 Revenue Estimates, Stock Drops",Yahoo,https://finnhub.io/api/news?id=888c0675a4c9c1d12e69c975cac2713c15c528b3ae505e8ee8932f52c1507e89
BYND,2025-05-07T20:38:52+00:00,Beyond Meat withdraws annual forecasts as US faux meat demand slides,Yahoo,https://finnhub.io/api/news?id=347b15cdab754799f7f3219b8245ba00cd87fc33a7fed7a90f8431684215c634
BYND,2025-05-07T20:15:00+00:00,Beyond Meat® Reports First Quarter 2025 Financial Results,Yahoo,https://finnhub.io/api/news?id=6dddad05033fcd539284311e4fde37bf721acd91326bc4aba9428ead6e874520
BYND,2025-05-07T20:15:00+00:00,Beyond Meat® Announces $100 Million New Senior Secured Financing from Ahimsa Foundation Affiliate,Yahoo,https://finnhub.io/api/news?id=d496056be8b48e798b1772e1c79b8808a04f4fdc3e2c96610dae08f50d0457b9
BYND,2025-05-07T18:38:18+00:00,"Beyond Meat, Inc. (BYND) Q1 2025 Earnings Call Transcript",SeekingAlpha,https://finnhub.io/api/news?id=4354295f1dadab0d8a1380a9aae3b689e2fad3c8cc16beaaaac78704697c065a
BYND,2025-05-07T16:29:07+00:00,"Beyond Meat withdraws annual forecasts, targets Q2 sales below estimates",Finnhub,https://finnhub.io/api/news?id=1b5aab393fb780ea45c113e6242a756926fd21ee71528e5ac8b73b57db3ff732
BYND,2025-05-06T23:00:00+00:00,"Fed rate decision, Zillow earnings, FedEx CEO: What to Watch",Yahoo,https://finnhub.io/api/news?id=4a399148a658f4a3d3e0acca196350ab2e3e75e993fb3779a80ffaad16e3e73e
BYND,2025-05-06T07:10:05+00:00,Beyond Meat (BYND) Q1 Earnings: What To Expect,Yahoo,https://finnhub.io/api/news?id=b5fdd71ba4a00e71e4a22e678a11de801a778223ea0bc2fd92974bf2e47cd612
BYND,2025-05-06T05:39:31+00:00,Beyond Meat: Beyond Rescuing,SeekingAlpha,https://finnhub.io/api/news?id=37d587cb758f44bf8ee53b7d6118834f6160ba626d4c7f6aece66da079f7580b
BYND,2025-05-02T10:53:00+00:00,Leftovers: Dunkin’ shakes up snacks with trail mix | Utz brings lemonade flavor to chips,Yahoo,https://finnhub.io/api/news?id=e95bccb342cb1ae04ee59b808a599a00a462742ec47a4d9c01d5d7c111b07a67
BYND,2025-05-02T04:43:18+00:00,3 Hated Stocks Showing Warning Signs,Yahoo,https://finnhub.io/api/news?id=1705ac20afa9ab2b056a4644283352a698d8299bc446c657f022d70c06dbaa4c
BYND,2025-05-01T13:00:00+00:00,Beyond Meat® Launches Beyond Chicken® Pieces at Kroger Stores Nationwide,Yahoo,https://finnhub.io/api/news?id=8dfdb646948e32a7d77a2766285b3771baf57533b61a0570742637e86030b132
BYND,2025-05-01T04:39:24+00:00,3 Dawdling Stocks in Hot Water,Yahoo,https://finnhub.io/api/news?id=9ea941996dbb67c23151543ae11f519f600dc2f939c8e40dcb2090f0c8c6c406
BYND,2025-04-28T09:02:20+00:00,Perishable Food Stocks Q4 Recap: Benchmarking Beyond Meat (NASDAQ:BYND),Yahoo,https://finnhub.io/api/news?id=abc753a274a3f13faf0f78e0066acefc12ce37b28923f6f8396a62e6a6d7ab30
BYND,2025-04-27T17:10:54+00:00,3 Unprofitable Stocks with Mounting Challenges,Yahoo,https://finnhub.io/api/news?id=95e5927b39f0226910ad31d45cbd459f834b99f9307611776797306397b1fbc5
