ticker,published_utc,title,publisher,url
JNPR,2025-06-30T09:23:00+00:00,"These Stocks Are Moving the Most Today: Enphase, Tesla, Juniper Networks, Wells Fargo, Palantir, and More",Yahoo,https://finnhub.io/api/news?id=a3a0db4b1752660f2fd7d29c650558376a294cf13f6233fbf17686a5112d5bc6
JNPR,2025-06-30T06:45:21+00:00,"HPE, Juniper Networks Shares Rise Premarket on DOJ Settlement",Finnhub,https://finnhub.io/api/news?id=4d3a7064ad0d2bf024cea6ebcb01f1fe3809d1452dfc9fb33a9d09936520c360
JNPR,2025-06-30T05:36:15+00:00,US Justice Department settles antitrust case for HPE's $14 billion takeover of Juniper,Finnhub,https://finnhub.io/api/news?id=bdb17a041f01ec6ec1f9cd1ef239c11febd9381a81fba32d3230e326fd2c2735
JNPR,2025-06-28T15:30:00+00:00,HPE and Juniper Networks Reach Settlement With U.S. Department of Justice,Yahoo,https://finnhub.io/api/news?id=3c99f19b946c96dd9d4362db8ec543d3e28ce39e3dbca11b07229e83158b514d
JNPR,2025-06-28T05:45:09+00:00,US DOJ settles antitrust case for HPE's $14 billion takeover of Juniper,Finnhub,https://finnhub.io/api/news?id=0f4f3aa0b3c94b2e5486f4455958240bdf871d974d9f889082ad450703d57be6
JNPR,2025-06-27T14:04:00+00:00,PTC Unveils Arena SCI for Resilient Product Development,Yahoo,https://finnhub.io/api/news?id=4d23b667b61a2363a416acd5713dc36916e003925f48290d8214cd89b1a0e623
JNPR,2025-06-27T08:27:00+00:00,"Zacks.com featured highlights Deutsche Bank, Juniper Networks, Astronics and Federated Hermes",Yahoo,https://finnhub.io/api/news?id=1cd9d1e6bac18083a205d6c3bc69511fa41086976ca9f4d51d26c9c79a586848
JNPR,2025-06-26T15:04:00+00:00,4 Stocks Trading Near 52-Week High With Room to Rise Further,Yahoo,https://finnhub.io/api/news?id=7eb80c9d48312ad70a7c0a84323397f30346756e7024b9ab8693df740b9d7fbe
JNPR,2025-06-26T14:28:00+00:00,Will ANET's Deeper Focus on Cloud-Native Software Pay Off?,Yahoo,https://finnhub.io/api/news?id=7a2e36bfd4491ed37fccc06497524f76433417ceffe293c0f43cecc07f7624de
JNPR,2025-06-26T14:05:00+00:00,"CIEN, Telxius Hit a Pioneering 1.3 Tb/s Wavelength Across the Atlantic",Yahoo,https://finnhub.io/api/news?id=3382203ae70700425e7476832be216cdb4ff41d01bb9fd2411c87d385890bd39
JNPR,2025-06-26T12:00:00+00:00,A New Era for Embryo Screening: Juniper Genomics Debuts with World’s First Whole-Genome and Transcriptome Test,Yahoo,https://finnhub.io/api/news?id=942bbf85e561c0c7e09588520dd642b93af2dce2e88972b5116685b0b6401565
JNPR,2025-06-25T19:21:26+00:00,"HPE CEO talks Nvidia AI partnership, IT spend, and Juniper trial",Yahoo,https://finnhub.io/api/news?id=464d02cd53b06b544105c36d9e4ff0655fbcd3d7a380a9b87fa3a4989ec284be
JNPR,2025-06-25T19:09:00+00:00,Alger Russell Innovation Index Updates for Second Quarter 2025,Yahoo,https://finnhub.io/api/news?id=106da9ac92f6d0b0b0da41b004b657f1f12597aeb761b26ec09a3a53cb1633f9
JNPR,2025-06-25T17:32:30+00:00,HPE CEO pushes back on tech slowdown fears despite signs of caution from CIOs,Yahoo,https://finnhub.io/api/news?id=cfa1fec960d5baeb28048e6bfacd92e3ee187d31f42ab1e8862c80e0901bc15e
JNPR,2025-06-25T15:26:00+00:00,Cisco Hits 52-Week High: Can AI Focus Further Drive the Stock?,Yahoo,https://finnhub.io/api/news?id=e223ae22ea2435ad52c9137b1018f11e31cffa88796481641b07357a39aa7ae8
JNPR,2025-06-25T13:59:00+00:00,CRUS Boosts Prosumer Audio With New ADCs & DACs for HiFi Applications,Yahoo,https://finnhub.io/api/news?id=6784fdf634954f8f9f73f483f6b90671d1d22941e542e4b26ef15eea0273fb2c
JNPR,2025-06-25T12:53:31+00:00,How Is Juniper Networks' Stock Performance Compared to Other Communication Equipment Stocks?,Yahoo,https://finnhub.io/api/news?id=8eb1d3bd978ea0621b5327b4edaa73deebe2d3a4668416ff1b50acbdd3815d49
JNPR,2025-06-23T20:15:00+00:00,Juniper Networks Announces Date of Second Quarter 2025 Preliminary Financial Results,Yahoo,https://finnhub.io/api/news?id=d95538709661a7bf1e9d0a9b43c4d837f7089f9cfa13dcb411dcd447dbc6dfdd
JNPR,2025-06-20T15:44:07+00:00,"Citigroup hires Drago Rajkovic as co-head of M&A from JPMorgan, memo says",Yahoo,https://finnhub.io/api/news?id=7b3049053337b20ed9e2b6dbbce5186235b6e14e8a63bfded235c7861514a53b
JNPR,2025-06-19T13:00:00+00:00,Wix Acquires Base44 to Boost AI-Driven Intent-Based Software Development,Yahoo,https://finnhub.io/api/news?id=5801ba32044be0ab8195124780ba21e20daeb37be225c3bfedad606762be0f5b
JNPR,2025-06-19T02:00:00+00:00,Juniper Networks Wins Four Awards at Interop Tokyo 2025,Yahoo,https://finnhub.io/api/news?id=c31bfcb49ab0b893d887f21241a377196c6ba332051a5dc96aa04c1d3dc3b43b
JNPR,2025-06-18T16:02:00+00:00,"Jabil Q3 Earnings Surpass Estimates on Solid Demand, Guidance Raised",Yahoo,https://finnhub.io/api/news?id=3319cd46439950396e4452b2a4e20c8ef809ed898ebaf80f283fca9400540768
JNPR,2025-06-17T20:53:00+00:00,Amazon CEO Says AI Will Lead to Smaller Workforce,Yahoo,https://finnhub.io/api/news?id=ecfc0f6437e978804ae1958d2091aec21e4fa99b35642b12d011144fd67a9379
JNPR,2025-06-17T14:33:00+00:00,Arista vs. Juniper: Which Cloud Networking Stock Has More Upside?,Yahoo,https://finnhub.io/api/news?id=125ea19ac0bbd412d470740fe511401de8e5888fade9630b0a6b912599d2c458
JNPR,2025-06-16T13:47:00+00:00,"Ericsson, Google Cloud Launch AI-Powered 5G Core Network as-a-Service",Yahoo,https://finnhub.io/api/news?id=0c6d95f1a7b09269c99238ddbacbb04fcefc302f6ded7a1ab1367bb3d475b8b3
JNPR,2025-06-11T13:38:00+00:00,"TTD, CART Deepen Alliance to Transform Retail Media on Open Internet",Yahoo,https://finnhub.io/api/news?id=f2891351d0720faa60cccc6ab4f94db04432fcc1436103e5f031cb734fac86e7
JNPR,2025-06-10T14:26:00+00:00,ITRI to Roll Out Cyble 5 in APAC to Boost Water Utilities' Operations,Yahoo,https://finnhub.io/api/news?id=c9d23b871da411912e4dd0b4cb6561049232594e0f66f9523615caa8358c51bb
JNPR,2025-06-10T14:23:29+00:00,Hewlett Packard Enterprise: The Underdog Cozying Up With Nvidia -- Initiating At Buy,SeekingAlpha,https://finnhub.io/api/news?id=d46ddd36eff67024a1146e6f3fb45cd4547720a16b6e21edaf237148a1884158
JNPR,2025-06-10T13:27:00+00:00,Arista 2.0 Strategy Gaining Traction: Is it the Next Key Growth Driver?,Yahoo,https://finnhub.io/api/news?id=7a816e0cddc454113ae0d89d43f7b0bb83b10d4a784626165ba622e906a31a6f
JNPR,2025-06-10T12:09:00+00:00,The Trade Desk Transforms Digital Advertising With Deal Desk,Yahoo,https://finnhub.io/api/news?id=84248b20f3ea15b3ea2da0c5aea1c6be3d62141157e2f9260f1067f44fd8b5a0
JNPR,2025-06-10T02:03:31+00:00,Hewlett Packard Enterprise: Digging Its Way Out Of A Value Trap,SeekingAlpha,https://finnhub.io/api/news?id=975b640f7810d73606e52300750cc41c1407ba13633c4facc66809e4ec138c14
JNPR,2025-06-09T13:50:00+00:00,Sensata's Dynapower Unveils MV Integrated PowerSkid: Stock to Gain?,Yahoo,https://finnhub.io/api/news?id=2905946e7aab97ee707dbb39923d532348970da4f7dba5d9322cf623cb7dfe9a
JNPR,2025-06-06T13:37:00+00:00,NTGR Buys Exium to Deliver an Integrated SASE Platform for SMEs & MSPs,Yahoo,https://finnhub.io/api/news?id=8eab2ba476a4008bfed9cbd44ec1683169528d1ff2eb31aad461f295c600a097
JNPR,2025-06-05T12:31:00+00:00,Arista Stock Surges 12.5% in 3 Months: Worth a Solid Buy?,Yahoo,https://finnhub.io/api/news?id=21bd610096aa2a3b162f3e5e04820faf74180c3fd66028c81b9e9309b351f885
JNPR,2025-06-04T17:25:18+00:00,HPE CEO on upcoming Juniper Network trial: The DOJ's thesis is 'flawed',Yahoo,https://finnhub.io/api/news?id=aa1b8028aab8caf166f69f5c70262ad39ac1ecf48c70874ff09005ea5b391551
JNPR,2025-06-04T16:15:00+00:00,Iridium Launches Iridium Chat App to Enhance Global Off-Grid Messaging,Yahoo,https://finnhub.io/api/news?id=dbec684412ff8b4b43fe07693d38d11dc2d240736b5b9eef52c3d0c587f3696b
JNPR,2025-06-04T16:08:00+00:00,Lumen Stock Soars on Powering the JUNO Trans-Pacific Cable System,Yahoo,https://finnhub.io/api/news?id=43881a72160758c23c52662322cc154791581af3abe9dfe4697de8847c18b019
JNPR,2025-06-04T12:36:00+00:00,Best Growth Stocks to Buy for June 4th,Yahoo,https://finnhub.io/api/news?id=1348c276ecb0028c295d0b399e1c7194c6e1e74a30809c3c4b4cb9d949f6f2d7
JNPR,2025-06-03T16:11:00+00:00,Hewlett Packard Enterprise CEO Sees ‘More Work to Do’ as Earnings Surprise,MarketWatch,https://finnhub.io/api/news?id=f901f3a86f78b72418c30d05f9af6dfafec0c4450bbd628bcc464c484a7961ee
JNPR,2025-06-03T13:42:00+00:00,Viavi Launches VINS to Tackle Rising GPS Jamming for UAV Navigation,Yahoo,https://finnhub.io/api/news?id=e7ba1574997b2a20a4705e000222c72f378455c696030d2b051c595b27011bed
JNPR,2025-06-03T13:22:00+00:00,"HLIT, Vectra to Make the 1st PTP-Less Virtualized Broadband Deployment",Yahoo,https://finnhub.io/api/news?id=aa2d9cd99c33d0ac909f3bcd98aecf16ff9e874c7ef4f5569c7532f1a210788a
JNPR,2025-06-03T03:44:05+00:00,"Infinigate@Infosec: disruptive cybersecurity, AI-Native solutions, Networking and Data Center.",Finnhub,https://finnhub.io/api/news?id=a9ab04419bb9383b16783d247c5f79305901e61d2278b84367d6e77150c5860c
JNPR,2025-06-02T15:22:00+00:00,Watts Water Stock Rises 26% in a Year: Will the Uptrend Continue?,Yahoo,https://finnhub.io/api/news?id=774499f5a02ff7ea01509e4eb774f35dc2abe89041018235c83cc9760ef33151
JNPR,2025-06-02T14:37:00+00:00,Nokia Selected by Vodafone Qatar to Boost 5G Coverage and Reliability,Yahoo,https://finnhub.io/api/news?id=046402aed4cf9e07687475c7ef26a3fbe3e650289bcd55a8700b94f814682072
JNPR,2025-05-30T13:11:00+00:00,Qorvo Expands DOCSIS 4.0 Portfolio for Broadband Cable Networks,Yahoo,https://finnhub.io/api/news?id=2e2ec020cbd50edcec1bd3bf4aad02f79c4d44f423181b9a6cba16989b520503
JNPR,2025-05-30T13:11:00+00:00,Iridium Partners Syniverse to Power Global D2D Satellite Connectivity,Yahoo,https://finnhub.io/api/news?id=b65c2035c12a8410bbba3bcfe1299ac280cc5bb25e1a6ae406196b9cb794ed96
JNPR,2025-05-30T13:02:00+00:00,VIAV Solution Boosts Fiber Fault Detection Capabilities: Stock to Gain?,Yahoo,https://finnhub.io/api/news?id=5e76b078001f1e1a32470913b6b6e706713b240455ff818a939e0c28485e6ec3
JNPR,2025-05-30T12:33:00+00:00,"Marvell Beats Q1 Earnings Estimates, Guides Strong on Robust Demand",Yahoo,https://finnhub.io/api/news?id=edd399088519d3f5c3e9e35c2d5bc3a39aa3ed71467b6ec67d4d269cd1f74692
JNPR,2025-05-29T15:34:00+00:00,Harmonic Unveils SeaStar Optical Node for High-Speed Broadband,Yahoo,https://finnhub.io/api/news?id=12ae3bc451228f2830df97e73a6e2ac7acc17c8c2567f2c340e8478978b3e225
JNPR,2025-05-29T14:21:00+00:00,"Fortive Expands Buybacks, Announces Pro Rata Ralliant Stock Dividend",Yahoo,https://finnhub.io/api/news?id=b75dda86811a0d66625df5a99987d47dda573da24cdec341044c3006d8f9aa5e
JNPR,2025-05-29T13:41:00+00:00,Best Growth Stocks to Buy for May 29th,Yahoo,https://finnhub.io/api/news?id=5753b7fb7b66c9f39d454deae6a740a2db4537345ed6347e59ad074feb5b1da5
JNPR,2025-05-28T15:44:00+00:00,"Motorola to Acquire Silvus Technologies, Expand Security Portfolio",Yahoo,https://finnhub.io/api/news?id=def37641498f1e95e8461d0c5c42f8e3eac250f7eabdc05740cbd8ff0eee1161
JNPR,2025-05-28T13:31:00+00:00,Pure Storage & SK hynix Partner to Deliver Next-Gen QLC Flash Storage,Yahoo,https://finnhub.io/api/news?id=a05db297f30a13b8bca6f9d34852ca133bd06546fe2e9f570c8d5e7189dc91c7
JNPR,2025-05-28T12:47:00+00:00,Flex Stock Surges 26% in the Past Year: Will the Uptrend Continue?,Yahoo,https://finnhub.io/api/news?id=102ec1f88b45819e85febb7c717243f846e8a5a335ff76c4ed7d4410aca58bbd
JNPR,2025-05-27T13:40:00+00:00,Ceragon Declines 44% in 6 Months: A Buying Opportunity for Investors?,Yahoo,https://finnhub.io/api/news?id=e7aff4f84e950024d36f66e5beac8dd54e30ae09bd06f912c05b57d63a99fd11
JNPR,2025-05-26T15:30:00+00:00,ANET vs. HPE: Which Networking Stock is a Smart Investment Now?,Yahoo,https://finnhub.io/api/news?id=d4f54656f0406423d4d9fff38e6ad3acaa0c5332a76585375e62e8fe45fb1580
JNPR,2025-05-23T15:42:00+00:00,Workday Q1 Earnings Beat Estimates on Solid Revenue Growth,Yahoo,https://finnhub.io/api/news?id=9aaf6a3a86c120036faa0ecde6d748dc62e34826bf943645a55ea5dd884f27a6
JNPR,2025-05-22T15:36:00+00:00,"VSAT, MOL Ink Deal to Upgrade Fleet Connectivity With NexusWave",Yahoo,https://finnhub.io/api/news?id=32db99f3639c4a4d521e26bd2a50bb624351695ad65c6603945dd6c3c63dbffb
JNPR,2025-05-22T13:15:23+00:00,5 Things To Consider After Lumen's Mass Markets Fiber Asset Sale To AT&T,SeekingAlpha,https://finnhub.io/api/news?id=5a10e2e05018978da1ca759cf60a9be19dc9ed9e42539ac2b3c64cbf47cb9ce8
JNPR,2025-05-22T12:06:00+00:00,CRDO Introduces PILOT for Predictive Link Optimization and Telemetry,Yahoo,https://finnhub.io/api/news?id=7326488e34494c70f743aedfd30274128c8d95958dd5bd37e4c21205656b3044
JNPR,2025-05-21T20:51:07+00:00,"Evercore ISI Upgrades Hewlett Packard Enterprise (HPE) Stock, Increases PT",Yahoo,https://finnhub.io/api/news?id=56b9264764fa52c2e3c1c345e5336e99960875f2c7f915fc4a565ec71ae96afc
JNPR,2025-05-21T15:53:00+00:00,Workday Unveils Illuminate AI Agents to Accelerate Workflows,Yahoo,https://finnhub.io/api/news?id=d6d8d4d6f091e0db3d32c77baad07745c01908dea5079679b96b4edca3ca9807
JNPR,2025-05-21T15:51:00+00:00,Viasat Misses Q4 Earnings Estimates on Flat Y/Y Revenues,Yahoo,https://finnhub.io/api/news?id=02c43fca89b0d6a070bd2b894da7d6137cd64e1d8d1e378cde57462185eb5991
JNPR,2025-05-21T14:53:00+00:00,"Keysight's Q2 Earnings Beat Estimates, Top Line Surges Y/Y",Yahoo,https://finnhub.io/api/news?id=161166896b4e4dc8dc0e539c8aaacf64480f701c4808e16eb4621ac7be2c7d00
JNPR,2025-05-21T11:12:00+00:00,SAP & Accenture Unveil ADVANCE to Boost Cloud-First Transformation,Yahoo,https://finnhub.io/api/news?id=5fe8843580ecff98e9db9d4cb6f9fcb23ca833c07b32fa88ca59e22f3e50712b
JNPR,2025-05-20T15:53:00+00:00,ERIC Elevates Digital Experience in Jordan: Will it Benefit the Stock?,Yahoo,https://finnhub.io/api/news?id=427c5c88ae4dfac45ab014e5a5e3e717d491f3b833a8da8707bf4c8b353606b8
JNPR,2025-05-20T15:40:00+00:00,HLIT Boosts Cignal TV's Broadcast Capabilities With Advanced Solution,Yahoo,https://finnhub.io/api/news?id=4b9e7e9d43cb3b96426d105daf0f7d78dda5445d1afc574a834f44092698e2b5
JNPR,2025-05-20T13:43:03+00:00,Evercore upgrades HPE to Outperform on attractive risk-reward profile,Yahoo,https://finnhub.io/api/news?id=07459d73248a6bb772e3ebbbf9206d14bce62c786931c2d59ba067c6a2ca8b2b
JNPR,2025-05-20T12:24:00+00:00,Cirrus Logic & Compal Electronics Collaborate on AI-Powered Innovation,Yahoo,https://finnhub.io/api/news?id=5a982647142ac7ab05650c1fd5dc8b104f0a9e3079437f958598b4af9bdfff60
JNPR,2025-05-20T10:29:00+00:00,"HPE Stock Is Rising Again. Expect More Gains, Analyst Says.",MarketWatch,https://finnhub.io/api/news?id=50e79ff29d1b39aec51abbf47b46089034f209a6dd8627ab607da97592a2a122
JNPR,2025-05-19T15:07:00+00:00,QCOM Advances Digital Transformation Initiative in UAE: Stock to Gain?,Yahoo,https://finnhub.io/api/news?id=c9fcf80d1c6947ca1d0a0c4fc691e3eff458a62d717b3ee959936278ae802d99
JNPR,2025-05-19T12:26:00+00:00,SLP Advances Predictive Toxicology With DILIsym 11: Shares to Benefit?,Yahoo,https://finnhub.io/api/news?id=5821c8f1a8e62a053cab07179b1e383e3bf70c06d346af5713d16741d85131c8
JNPR,2025-05-19T11:45:00+00:00,Juniper Networks and ServiceNow Extend Partnership with Combined Solution to Accelerate Time-to-Value for Deutsche Telekom Managed Services with End-to-End Automation,Yahoo,https://finnhub.io/api/news?id=35a9ce53fb9960739f6c4bfdd7a52860a39881162088d63e43a5e799ec679ae1
JNPR,2025-05-16T17:17:00+00:00,Can SIMO's Cutting-Edge Solutions Solicit Customer Interests?,Yahoo,https://finnhub.io/api/news?id=61d70758baed538991e84db76aa085f7b829ff04880bfec075ca78e6e01d2d0a
JNPR,2025-05-16T05:35:22+00:00,Top Merger Stocks Held By Fund Managers - Mid-Q2 2025,SeekingAlpha,https://finnhub.io/api/news?id=9bb4dc54ec9101c5cbf51d06e061be2ac2ee232f0f514c69d80868d965aac2f4
JNPR,2025-05-15T16:00:00+00:00,"Viasat, Blue Origin Partner to Demonstrate Telemetry Relay for NASA",Yahoo,https://finnhub.io/api/news?id=1a58e972a210d8ef34fffdd87b58f5e5dea92bb668c2e97086612a08052354c7
JNPR,2025-05-15T13:26:34+00:00,Cisco Q3 2025: The Market Still Doesn't Get It,SeekingAlpha,https://finnhub.io/api/news?id=c2841186b92f65d27d4ad65e1cbc53cc8e6b7b8bf6b578f204ea8463010172e3
JNPR,2025-05-15T13:14:00+00:00,"Western Digital, Ingrasys Partner for Next-Gen Fabric-Attached Storage",Yahoo,https://finnhub.io/api/news?id=45b3f300af4d7b6e08fc92773cf8967d141e852c042cf035854bf2b4ea699124
JNPR,2025-05-14T16:37:00+00:00,Will Healthy Momentum in IoT and AI Applications Drive NOK Stock?,Yahoo,https://finnhub.io/api/news?id=982869a67b79cd363f873625f782d218a361f0c76f731a5aca0d9eedf0836dcc
JNPR,2025-05-12T14:36:00+00:00,"Ubiquiti Q3 Earnings Beat Estimates, Top Line Surges Y/Y",Yahoo,https://finnhub.io/api/news?id=934e2e058c815518d7d778af8e34ac30972295661cc95f99186f8dfa58ed1eeb
JNPR,2025-05-12T14:08:00+00:00,"The Zacks Analyst Blog Highlights Five9, Affirm, Microsoft, Juniper Networks and Tyler",Yahoo,https://finnhub.io/api/news?id=2c992e5065fdcce135c8835a4cb7f0bae001526b57f7c977d133ffb440084415
JNPR,2025-05-09T16:19:00+00:00,"Altice Q1 Earnings Miss Estimates, Revenues Decline Y/Y",Yahoo,https://finnhub.io/api/news?id=6bfc09ba4078f02eef7db539520dde19d42a45ee882389fdf1c215123faf751b
JNPR,2025-05-09T15:20:00+00:00,Pinterest Q1 Earnings Miss Estimates Despite Y/Y Revenue Growth,Yahoo,https://finnhub.io/api/news?id=2d6be344d28ae1afd0a208b1687d1eb857f4e07c9f0acac43b82fa8b9572b114
JNPR,2025-05-09T13:30:00+00:00,Buy These 5 Cloud Computing Stocks to Strengthen Your Portfolio,Yahoo,https://finnhub.io/api/news?id=aa7cd207e86c436fe1e7c6123e415ad03c2079e1a8beee55c6fb305b557b0b39
JNPR,2025-05-08T16:26:00+00:00,"Zillow's Q1 Earnings Miss Estimates, Revenues Increase Y/Y",Yahoo,https://finnhub.io/api/news?id=b8fbed95e07dcc30e0781866d682d6effc0de1d81674f225d44b5a8771b07298
JNPR,2025-05-08T16:25:00+00:00,"Cogent Q1 Loss Wider Than Expected, Revenues Decline Y/Y",Yahoo,https://finnhub.io/api/news?id=e3b3105c689b8f4f0979f44db4fec37be80a67049eb3474981fa424ba466dca3
JNPR,2025-05-08T13:31:00+00:00,Marvell Technology Plunges 17% in a Year: Hold or Fold the Stock?,Yahoo,https://finnhub.io/api/news?id=9cf0ea3e3e4377b11d7ec198a6f940586a81b04876dbd9e27127d3a8842a0d98
JNPR,2025-05-07T15:38:00+00:00,"Arista Q1 Earnings Beat Estimates on Solid Demand, Revenues Surge Y/Y",Yahoo,https://finnhub.io/api/news?id=1c8ddcf8258c86a3627ea9d5b413e760a6b1612fa662527faa344732171b35ac
JNPR,2025-05-07T11:45:00+00:00,Juniper Networks Delivers the Next Era of AI-Native Innovation with Expanded Client-to-Cloud Insights and Self-Driving Network™ Operations,Yahoo,https://finnhub.io/api/news?id=baa51b1a9fc636b84f37481855cde42e411a8a697bd66e0dc273ef19351159a1
JNPR,2025-05-07T07:45:00+00:00,Juniper Networks Delivers the Next Era of AI-Native Innovation with Expanded Client-To-Cloud Insights and Self-Driving Network Operations,Finnhub,https://finnhub.io/api/news?id=66bb62f6a1ceed7d48085e337778fe7ad03cb37831fcb5f6d5af999fcf71322d
JNPR,2025-05-06T08:29:48+00:00,Juniper: Staying Bullish Throughout Acquisition Timeline,SeekingAlpha,https://finnhub.io/api/news?id=0bba3a296b4f61458a73cf7f466ec89cedf48383b57045e6f01eb8ae1a5de04f
JNPR,2025-05-05T08:15:00+00:00,"Here’s what I’ve learned after writing about Apple, Intel and Silicon Valley for over 30 years",MarketWatch,https://finnhub.io/api/news?id=4856c89fa88b9324d17338f5a3dac9a2f3bed6e7ff7281257c02bb572e2264ec
JNPR,2025-05-02T14:48:00+00:00,Juniper Q1 Earnings Beat Estimates on Solid Revenue Growth,Yahoo,https://finnhub.io/api/news?id=d05edf59e0f917a76909b6ede1002975c2f40238b9506f1907ec76dd67fada1c
JNPR,2025-05-01T22:00:16+00:00,Juniper (JNPR) Reports Q1 Earnings: What Key Metrics Have to Say,Yahoo,https://finnhub.io/api/news?id=69074ec04c23728ce9eb6d25c4fd0837ed410e32ee9fd60dace4d1db34941916
JNPR,2025-05-01T21:35:12+00:00,Juniper Networks (JNPR) Surpasses Q1 Earnings and Revenue Estimates,Yahoo,https://finnhub.io/api/news?id=1dac3688ff6f553506d12e91e9df174b33a716454ff65f9f07c4e4c677782f40
JNPR,2025-05-01T21:13:19+00:00,Juniper reports rise in quarterly revenue on robust networking gear demand,Yahoo,https://finnhub.io/api/news?id=e5bc25a6aa0505d4f88b0aebf85123c7574699c4ec9b596ffa034b19041b608e
JNPR,2025-05-01T20:34:21+00:00,Juniper: Q1 Earnings Snapshot,Yahoo,https://finnhub.io/api/news?id=daa9f9f0038fc3f4e21c4539b60b464e033a7d3528bcedec17eb0b731189e5f9
JNPR,2025-05-01T20:15:00+00:00,Juniper Networks Reports Preliminary First Quarter 2025 Financial Results,Yahoo,https://finnhub.io/api/news?id=d277a365f4e254d024b24173bef3834e300832793ff16fb4aa7310c6e7d28cb3
JNPR,2025-05-01T20:11:08+00:00,Tesla Board in Spotlight After Cashing In $1.2 Billion With Musk,Yahoo,https://finnhub.io/api/news?id=1336bdedfdfdc5de455ed37ea7ada4d8e137e0bbcc7e2ecd169a95fdc5b60dbb
JNPR,2025-05-01T11:45:00+00:00,"Juniper Networks Demonstrates Strong Momentum in AI-Native Data Center Networking with Recognitions, Growth and Innovations",Yahoo,https://finnhub.io/api/news?id=1515b96c134dc4a8795f06a8bffbe30a2ea54ffc88618be5117580e6028f10af
JNPR,2025-04-30T05:20:00+00:00,Arista Networks: Positioned For Growth With Many Large AI Tailwinds,SeekingAlpha,https://finnhub.io/api/news?id=37dc4a504cde1d9f54068ac545c4135b4be732450d29bcd37644b7f7b9ed8d25
JNPR,2025-04-29T15:32:00+00:00,JNPR Set to Report Q1 Results: What's in the Offing for the Stock?,Yahoo,https://finnhub.io/api/news?id=c64c75136a16a76a598ed950b9eae5006aa7c93f6a8279444b1456aa0ff127ce
JNPR,2025-04-29T02:15:00+00:00,Alphabet Sets A Positive Tone Ahead Of Mega Tech Earnings Results This Week,SeekingAlpha,https://finnhub.io/api/news?id=dc13ebbfecea942308757fd0ac43260ba4092619f845854fd643fdea3987fe21
JNPR,2025-04-27T22:42:17+00:00,Hewlett Packard: Why It's Too Unstable To Buy Right Now,SeekingAlpha,https://finnhub.io/api/news?id=c1e88017f18d5d092967a50de6770d5a8652988b3a8b7425e330c87b1d5ded5d
JNPR,2025-04-25T05:00:19+00:00,"Stocks to watch next week: Apple, Microsoft, Shell, HSBC, Lloyds and AstraZeneca",Yahoo,https://finnhub.io/api/news?id=ca9edd4559b6c0357af687f6e1cde0db5177f361a0cc944c63fa7a6a219797cd
JNPR,2025-04-24T11:40:31+00:00,Why Nokia Is A Hold With Warnings After Q1 Results,SeekingAlpha,https://finnhub.io/api/news?id=b448fec29e0a3f8fb991c83904a5a661ab02936beeb4dca57179715d9a0367b5
JNPR,2025-04-24T00:47:46+00:00,"Juniper Networks, Inc. (JNPR): Among Takeover Rumors Hedge Funds Are Buying",Yahoo,https://finnhub.io/api/news?id=011aac13a497f7635443149e7c58f4d7bc147473e3c019b56d8b9aac00c0923b
JNPR,2025-04-23T18:11:08+00:00,"Juniper Networks: AI Networking, Cash Dividends, And A Deal In Limbo",SeekingAlpha,https://finnhub.io/api/news?id=9ba6ee01906c2369698bf1fe17cd634d728a72b28f7ddd7772c1519b9be77009
JNPR,2025-04-23T17:15:00+00:00,Juniper Networks Inc. stock outperforms competitors on strong trading day,MarketWatch,https://finnhub.io/api/news?id=2cd0b5d2b2a63f7f1b1b7f301ee5eb059d496ffbda32043421e1626a9a45b372
JNPR,2025-04-22T17:15:00+00:00,"Juniper Networks Inc. stock rises Tuesday, still underperforms market",MarketWatch,https://finnhub.io/api/news?id=48221e06feaad931f4aa51454332824a995d4ba975579f8dedc81a428e136f0e
JNPR,2025-04-22T11:20:00+00:00,Patient Capital Management Q1 2025 Commentary,SeekingAlpha,https://finnhub.io/api/news?id=6c2ab59b274781b1680b0829702b5dfc23cb1399fda7943a3a9981db07bbbab8
JNPR,2025-04-17T18:58:43+00:00,"Elliott Management Seeks To Oust HPE's Chief Executive Neri, Report Says",Yahoo,https://finnhub.io/api/news?id=9a13ac7826a5db471bec63bca276c9cec0f2b90edb00e3ace4b9fae0c4ee32a2
JNPR,2025-04-17T14:25:00+00:00,JNPR Mist Cloud Solutions Achieve Moderate FedRAMP Authorization,Yahoo,https://finnhub.io/api/news?id=b7befe76bac39ec802681dd3b09e04900f63235eed7fbde050db03bf10a0b558
JNPR,2025-04-16T11:45:00+00:00,Juniper Networks Achieves FedRAMP Moderate Authorization,Yahoo,https://finnhub.io/api/news?id=298874d4098cbde8afc267149b45073a7e7f789d2c5ff52ed8bd19490cf7067e
