ticker,published_utc,title,publisher,url
MRNA,2025-11-12T12:05:54+00:00,Stocks Gain Pre-Bell Ahead of Looming House Vote to End Government Shutdown,Yahoo,https://finnhub.io/api/news?id=b49116d25ead08ec1e5cf667f762f2752507721dcf7f2eccabad83dd60d964df
MRNA,2025-11-11T20:55:53+00:00,"Gilead Sciences, Moderna, Artivion, Tenet Healthcare, and Charles River Laboratories Stocks Trade Up, What You Need To Know",Yahoo,https://finnhub.io/api/news?id=190fd5c6313bc6a2c89ea8bdc69e4b57d5f2f1d42ace523ec29e5831bf92d9cd
MRNA,2025-11-11T03:31:04+00:00,Q3 Rundown: Moderna (NASDAQ:MRNA) Vs Other Therapeutics Stocks,Yahoo,https://finnhub.io/api/news?id=da95532f5f4d93482608d9ff761982894769460a67d0b39d260ae12f363fb1d7
MRNA,2025-11-10T18:23:00+00:00,"Oxford Launches Regional Partnership to Drive Equitable, Innovation-Led Growth",Yahoo,https://finnhub.io/api/news?id=3081391cc2eadd0c18e089b519fa5c272b153d72f3b76b24061caac4575bc0e9
MRNA,2025-11-10T14:25:40+00:00,What Are Wall Street Analysts’ Target Price for Moderna Stock?,Yahoo,https://finnhub.io/api/news?id=908d138a2c17cf66f66235143e55367d853e5915e82297b0be53e1386fc20def
MRNA,2025-11-10T03:17:34+00:00,Moderna (MRNA) Is Down 9.6% After Cutting 2025 Sales Outlook and Ending CMV Vaccine Program – Has Sentiment Shifted?,Yahoo,https://finnhub.io/api/news?id=c98219ce3dc5f42ef9621fe51bd2ac982caa6ed62d6e1c6f985188365b23fdcc
MRNA,2025-11-09T13:42:34+00:00,"The Moderna, Inc. (NASDAQ:MRNA) Third-Quarter Results Are Out And Analysts Have Published New Forecasts",Yahoo,https://finnhub.io/api/news?id=e22bb6313a309562b37c48599cef5d1c7e0f12ffafd1af5f5adb090eeaa6ed44
MRNA,2025-11-07T22:19:41+00:00,"Earnings live: Earnings remain solid with peak reporting weeks in the rearview mirror, Disney results ahead",Yahoo,https://finnhub.io/api/news?id=54faa79558a2cfcf3110eb1ec4180e2f420d729411a265b8545924ecbdeb7d14
MRNA,2025-11-07T21:01:45+00:00,Sector Update: Health Care Stocks Ease Late Afternoon,Yahoo,https://finnhub.io/api/news?id=5cad40832af504c7df294b39cbe64260e886988e0d38e069b7ca11f452a8f7c7
MRNA,2025-11-07T19:01:27+00:00,Sector Update: Health Care Stocks Retreat Friday Afternoon,Yahoo,https://finnhub.io/api/news?id=43ac7c9db4b237b274afb6ea36c617ff32afb28bb7f5d3697cd23eb79ce7c193
MRNA,2025-11-07T16:01:46+00:00,"Moderna Continues to Target Cash Breakeven in 2028, Morgan Stanley Says",Yahoo,https://finnhub.io/api/news?id=02bb2814bf6ad98462b15fd8cde5a1c30f59229f031c18658300eb5459850b27
MRNA,2025-11-07T15:19:51+00:00,How Recent Analyst Shifts Are Reshaping the Story for Moderna Investors,Yahoo,https://finnhub.io/api/news?id=72543c9cbd32e908c2368c1a2327965d3b370ac43750fd67edd0d3858bfb33af
MRNA,2025-11-07T13:16:14+00:00,"Earnings live: Block stock drops after earnings miss, Airbnb pops, Opendoor pitches turnaround plan",Yahoo,https://finnhub.io/api/news?id=7781ea8d73913e13851e80afc1ee0fe29f712bdf4e2bdcf0d3b3ba28c68a2a76
MRNA,2025-11-07T11:15:00+00:00,"India Coronavirus Vaccine Research Report 2025: $1.25 Bn Market Opportunities, Competition, Forecasts 2020-2030 - Expanding Healthcare in Tier 2 and 3 Cities, and Innovations in MRNA Technology",Yahoo,https://finnhub.io/api/news?id=b1ff09fb1db49d8b92f48cef7e2eccc11285533ef8d2021373c64062d01146ae
MRNA,2025-11-07T09:04:03+00:00,"Moderna, Inc. 2025 Q3 - Results - Earnings Call Presentation",SeekingAlpha,https://finnhub.io/api/news?id=13e5ded189758f8b0690aa98f4ca972074a454cc8426b49b4611512790e1820e
MRNA,2025-11-07T05:31:02+00:00,MRNA Q3 Deep Dive: Cost Controls and Pipeline Progress Amid Declining COVID Vaccine Demand,Yahoo,https://finnhub.io/api/news?id=6d139994a1c603e779291bf5e8e68339acd9b593cff7026a6be2ed3acc88eb42
MRNA,2025-11-07T03:30:02+00:00,Moderna (MRNA) Reports Q3 Earnings: What Key Metrics Have to Say,Yahoo,https://finnhub.io/api/news?id=a1fc5656079dc8ffde58b23607ace44ea4d2476ab92aa5f1eb68785d25cdc636
MRNA,2025-11-06T21:09:31+00:00,Moderna Cuts Costs As Covid Vaccine Sales Decline; Shares Rise,Yahoo,https://finnhub.io/api/news?id=46083e1b62ebfc3ac3adb6569d0c5dbc89d571e1e19a1566e0523dd85945055b
MRNA,2025-11-06T21:03:16+00:00,"Stock market today: Dow, S&P 500, Nasdaq fall as Nvidia leads AI trade lower, jobs jitters reignite",Yahoo,https://finnhub.io/api/news?id=27923b39453de0bc53b0ab0ff3140eb8887d3d72f4c496eb59de74795a5247b2
MRNA,2025-11-06T19:16:00+00:00,"Moderna's losses narrow, Coach-maker's outlook disappoints",Yahoo,https://finnhub.io/api/news?id=40c96840f0abae2c918a59725abecbc7b9d39445a5c1ac3095b9701aa6978f51
MRNA,2025-11-06T19:11:21+00:00,Moderna Inc (MRNA) Q3 2025 Earnings Call Highlights: Strategic Cost Reductions Amid Revenue ...,Yahoo,https://finnhub.io/api/news?id=0b79d6a7270d7e4c9c4647f31fc14d19ab74b516ebaf6a847eae49f3dde94b98
MRNA,2025-11-06T16:58:00+00:00,"Moderna Q3 Earnings Beat, Stock Up on Revised '25 Spending Plans",Yahoo,https://finnhub.io/api/news?id=5c85ffb66508e208cb123df2833964c83a5baea6fda472bcbe1a0dac84063030
MRNA,2025-11-06T16:16:00+00:00,Moderna’s Quarter Wasn’t As Bad as It Could Have Been. The Stock Is Up.,Yahoo,https://finnhub.io/api/news?id=949a5348704ce253ef1ff532c910a902b59e3d0a110703df1015010d8291e901
MRNA,2025-11-06T15:37:35+00:00,Moderna Tightens 2025 Revenue Outlook as Third-Quarter Top-Line Beats Estimates,Yahoo,https://finnhub.io/api/news?id=4448ba2a5866654b426b152c7f25d3354e05259beefef9fddb1ba96504b8dbfc
MRNA,2025-11-06T15:26:15+00:00,"Moderna, Inc. (MRNA) Q3 2025 Earnings Call Transcript",SeekingAlpha,https://finnhub.io/api/news?id=e3c84e577f544b0b5672cd6d84c80f6a3c4986bc5424a27e59e3c47ec2e2b450
MRNA,2025-11-06T14:47:58+00:00,"Moderna Posts Narrower Loss, Cost Cuts Boost Shares",Yahoo,https://finnhub.io/api/news?id=d3e58a2f286e276f8f1b80b014e5927fd18af4ce31397cfb13a6b46409c1f478
MRNA,2025-11-06T14:33:53+00:00,Moderna Gains on Sharp Cost Cuts as Covid Vaccine Declines,Yahoo,https://finnhub.io/api/news?id=65946872be4011b6bb2584627da34aca6be7669a8bcd04ca4522de1050e66714
MRNA,2025-11-06T13:51:10+00:00,"Exchange-Traded Funds, Equity Futures Higher Pre-Bell Thursday Amid Continued Earnings Reports",Yahoo,https://finnhub.io/api/news?id=ec4764232aa3d31700326326cb724780cffc99493be27bafbc2b6facd0a55d26
MRNA,2025-11-06T13:15:03+00:00,"Moderna (MRNA) Reports Q3 Loss, Tops Revenue Estimates",Yahoo,https://finnhub.io/api/news?id=638c802d35ee0aa955984ab9c7f227638a352084ba3d85cbb5ff5987900efa90
MRNA,2025-11-06T13:08:06+00:00,"Moderna (NASDAQ:MRNA) Posts Better-Than-Expected Sales In Q3, Stock Soars",Yahoo,https://finnhub.io/api/news?id=605952d270708959c0073739dc6ce1135a782fab8f145cb991d6e6b3d89370f9
MRNA,2025-11-06T12:39:40+00:00,"Moderna revenue falls 45%, but still tops estimates",Yahoo,https://finnhub.io/api/news?id=141896dda1265bad90f3a195bebdad41c46332323586d444f0115b9f6646e07e
MRNA,2025-11-06T12:13:41+00:00,Moderna: Q3 Earnings Snapshot,Yahoo,https://finnhub.io/api/news?id=2b0137ae189d9adb7579120856f16a0032ace8e545c7c8cbf6ee22cd20674053
MRNA,2025-11-04T14:45:03+00:00,Pfizer COVID-19 vaccine sales tumble after government guidance on the shots narrows,Yahoo,https://finnhub.io/api/news?id=c8ef575d4e02b93eab59cba1c59e0e48eb818a3bfd42030fe03d8758e096c5eb
MRNA,2025-11-04T13:36:00+00:00,Should You Buy Moderna Stock Ahead of Q3 Earnings Report?,Yahoo,https://finnhub.io/api/news?id=6d581b90d524e90e7b4d17bfda471c1cd6d41be5b702313cfee8142e7661c2a0
MRNA,2025-11-03T18:20:43+00:00,Why Moderna (MRNA) Stock Is Falling Today,Yahoo,https://finnhub.io/api/news?id=e058fc2748e808ad707833f7fc5149e43f12a0a1cf0c7a72f91672fe1211a16f
MRNA,2025-11-03T12:00:00+00:00,Moderna Announces First Patient Dosed in Phase 1/2 Study of Investigational T-Cell Engager for Multiple Myeloma,Yahoo,https://finnhub.io/api/news?id=bf4b0aaa4ac81b4593a69fd1ed8b538de1e6333e3fef9434b16683c7ecfd7c73
MRNA,2025-11-03T10:00:00+00:00,Tidmarsh resigns from CDER; Kenvue to sell to Kimberly-Clark,Yahoo,https://finnhub.io/api/news?id=bc4a73786f98e345047b1a3d315599d55745b877699bdd9c908fde8c3cef74ac
MRNA,2025-11-03T07:37:54+00:00,"November trading, Berkshire's cash hoard, Big Tech's ad revenue and more in Morning Squawk",CNBC,https://finnhub.io/api/news?id=f292f2b81b09797bb4d4566afb40bbc0fe408e7c6c436b378aedbb3fae13deda
MRNA,2025-10-31T20:25:40+00:00,Why Moderna (MRNA) Stock Is Trading Lower Today,Yahoo,https://finnhub.io/api/news?id=8e12f5165a90ec4d4e045f653676566ee2f25722bcb7ad20c36e4265ef1c447f
MRNA,2025-10-31T16:05:42+00:00,"Moderna: Focus On Cancer Vaccines, Not Buyout",SeekingAlpha,https://finnhub.io/api/news?id=cb7d08d995bb2aca6008ec65cde8f3f37b3d46f12a6da35b209d86d535fddd64
MRNA,2025-10-31T13:00:03+00:00,"Moderna, Inc. (MRNA) is Attracting Investor Attention: Here is What You Should Know",Yahoo,https://finnhub.io/api/news?id=53c4e0f58596b9e1684157dcd766bca3ecff5b7301bc31baa6b14db50b2e71e9
MRNA,2025-10-31T08:56:00+00:00,Strength Seen in Moderna (MRNA): Can Its 13.9% Jump Turn into More Strength?,Yahoo,https://finnhub.io/api/news?id=12b3c122d19489bc92b9c4b1819a65352a2bfe02a4d0a1ea7aa6b8a0bfdf7d91
MRNA,2025-10-30T20:39:45+00:00,S&P 500 Gains and Losses Today: Meta Stock Drops After Earnings; Moderna Surges,Yahoo,https://finnhub.io/api/news?id=81ef75b062fd22af3d899e0f8e18cae1c128c7416ac2eb9901c7192abc7c34fc
MRNA,2025-10-30T18:04:26+00:00,Mizuho's Holz talks what is behind Novo's bid for Metsera,CNBC,https://finnhub.io/api/news?id=35c5640c10cc0c6ee89c268f8a395a8bf54f901ade153e03396566426038f49c
MRNA,2025-10-30T17:22:36+00:00,Moderna stock soars after report of potential buyout talks,Yahoo,https://finnhub.io/api/news?id=1867a86bc3ab33bcba6cfbce52decf14f1c3807ec8ec25e6f28d1f7803c58aa5
MRNA,2025-10-30T14:00:36+00:00,Earnings Preview: Moderna (MRNA) Q3 Earnings Expected to Decline,Yahoo,https://finnhub.io/api/news?id=f3966375d41ef77d861133e8556a5a55666bf4d7d302d00a1a127d958371aac6
MRNA,2025-10-30T04:34:16+00:00,1 S&P 500 Stock to Research Further and 2 We Find Risky,Yahoo,https://finnhub.io/api/news?id=b7ab894a54c2d35d453d08a864019279e9dc4c83718e8efe634491db58387eda
MRNA,2025-10-29T12:00:46+00:00,Analysts Name 9 'Left Out' Stocks With Huge Upside Ahead,Yahoo,https://finnhub.io/api/news?id=fa5bf95c2816f38c43cb3588cda5220e3fb8090fa86970edbd8ceeb4139b83be
MRNA,2025-10-27T14:10:00+00:00,Harvard Business Review Announces Final Speaker Lineup for Future of Business 2025,Yahoo,https://finnhub.io/api/news?id=9bf4991b442294ad174b936dc8a53780ce99e7962d800f557d94c4bf92aedad5
MRNA,2025-10-24T21:45:03+00:00,Moderna (MRNA) Outperforms Broader Market: What You Need to Know,Yahoo,https://finnhub.io/api/news?id=513f73aeb49d1ae057273c8c2bb93181308c0ae34a1df2f7a0a8f4687fee9515
MRNA,2025-10-24T01:15:32+00:00,How Investors May Respond To Moderna (MRNA) Halting Development of mRNA-1647 CMV Vaccine,Yahoo,https://finnhub.io/api/news?id=b794f0a83db506ce433a946655e0d2eacb492cee5960a309d6fbc00618bba1e5
MRNA,2025-10-23T20:11:58+00:00,"Moderna Topples, Threatening Its 50-Day Line, After A Key Vaccine Bites The Dust",Yahoo,https://finnhub.io/api/news?id=ef054648faa788fd2150894e6faf984a59732ab448a5598d14cf7e32ddcc84b4
MRNA,2025-10-23T19:55:00+00:00,Sector Update: Health Care Stocks Mixed Late Afternoon,Yahoo,https://finnhub.io/api/news?id=ed555a1a80472fc5d8a7fd99e2e5e51bac4b1f0f7335d0fbf97495320b9a0dfb
MRNA,2025-10-23T18:42:00+00:00,Moderna Named a Top Employer by Science for Eleventh Consecutive Year,Yahoo,https://finnhub.io/api/news?id=0744f9b986b44f3bedc46a92e4dafe58518bd13c86d14631f156a673ac1e5c6b
MRNA,2025-10-23T17:47:48+00:00,Sector Update: Health Care Stocks Softer in Afternoon Trading,Yahoo,https://finnhub.io/api/news?id=9d0e8f2e1041819ec1d3962dcca54e9e9ea8dac97ecfa6cf5f4d5179a04b8138
MRNA,2025-10-23T14:23:14+00:00,"Tesla, Zions Bancorp, Moderna: Top Analyst Calls",Yahoo,https://finnhub.io/api/news?id=b2d3baeb8c5f4280299d883d70be3de3cbdd0b9688d0c63175c0196ab8141b7e
MRNA,2025-10-23T11:00:00+00:00,Moderna to Host Investor Event - Analyst Day,Yahoo,https://finnhub.io/api/news?id=fd3f43ba5450a8a2e79c7045ecd7e7057d62f02210a6e8cf2049d549a19b3a6c
MRNA,2025-10-23T09:57:35+00:00,Moderna: Oddo BHF lowers target price,Finnhub,https://finnhub.io/api/news?id=8a923305c6c4dcca9b1070ce1e47d5c186a9f1b3c331e63a1f16f9c4de3de908
MRNA,2025-10-23T09:23:19+00:00,Moderna Earnings Preview: What to Expect,Yahoo,https://finnhub.io/api/news?id=5cf2f3362bb7dac023484d27c3bef55b281e0c06bf2e15e2e3338f2d12663370
MRNA,2025-10-22T21:50:05+00:00,Moderna (MRNA) Dips More Than Broader Market: What You Should Know,Yahoo,https://finnhub.io/api/news?id=ae25514c027f1ee593f7c53c3db6f87629f984a9b9c06846705fc14284d95cee
MRNA,2025-10-22T20:23:00+00:00,Moderna says CMV vaccine once seen as future blockbuster fails key study,Yahoo,https://finnhub.io/api/news?id=3db29d1d51965f9accc4f8ecdbd117cf76d6acff297b07b419011109c98bb423
MRNA,2025-10-22T20:05:00+00:00,Moderna Drops Vaccine for Birth Defects After Trial Failure,Yahoo,https://finnhub.io/api/news?id=bf3344aa96c0e93cb8cf7681114dac1776c5825aba6169b72a753f9b3fcebbe0
MRNA,2025-10-22T20:05:00+00:00,Moderna Announces Phase 3 Study of Investigational Cytomegalovirus (CMV) Vaccine Did Not Meet Primary Efficacy Endpoint,Yahoo,https://finnhub.io/api/news?id=16412c666d5b6e170a3bceaaacfd99451d33239683fed4f6692f5279f9c774db
MRNA,2025-10-22T18:04:25+00:00,"S&P 500 closes higher, recouping Wednesday’s loss and then some",CNBC,https://finnhub.io/api/news?id=6671be808a89b0486b3d1843be8ef385227deff7a82418547fc45bcb3cbb097f
MRNA,2025-10-22T17:15:51+00:00,"Stocks making the biggest moves after hours: IBM, Tesla, Moderna and more",CNBC,https://finnhub.io/api/news?id=66aacf32a7b4c165e616bf0a2cd4c80780d0be11ac5eb160057eaa93d4da13d1
MRNA,2025-10-22T17:10:00+00:00,Prediction: Moderna Will Soar Over the Next 5 Years. Here's 1 Reason Why.,Yahoo,https://finnhub.io/api/news?id=d5376f2256feb329c4f4f970888a0bcc3f6eb63e7bc17971dcc847bc381e600c
MRNA,2025-10-22T15:12:33+00:00,Stock Market Today: Stocks Hit Day Lows As Investors Digest Earnings; Gov't Shutdown Reaches New Milestone,Yahoo,https://finnhub.io/api/news?id=7d211135ffa0deeb4b7b8d6333488a6cf0ac746032252959688b0ba4416852c1
MRNA,2025-10-22T13:53:00+00:00,Should You Buy Moderna Right Now?,Yahoo,https://finnhub.io/api/news?id=0efa81a68fee926da54e814e2b769012cb1273dc1bb581e46f849abf5e126a22
MRNA,2025-10-21T19:34:02+00:00,Moderna Stock Is at a Crossroads. Is the Path Ahead One of Profit or Pain for MRNA?,Yahoo,https://finnhub.io/api/news?id=c34bcd8e20d4be57ccc4e1e20ee670bab7d57f9ad07f55ee68b211df63dcce7d
MRNA,2025-10-21T09:05:00+00:00,These 3 Beaten-Down Healthcare Stocks Could Have Farther to Fall,Yahoo,https://finnhub.io/api/news?id=dc00ec937fc6d61c9ce27d955801bd85f59e5380e2e280048a671b67811409a2
MRNA,2025-10-20T23:01:00+00:00,Crown Estate eyes expansion of Harwell science hub after acquiring land,Yahoo,https://finnhub.io/api/news?id=c538661b9415b4e53463a11c66bc3b4cad49c953e839d2a23531a1ab99e9a0a4
MRNA,2025-10-20T20:04:45+00:00,A Look at Moderna (MRNA) Valuation as Investors Weigh Post-Pandemic Growth Potential,Yahoo,https://finnhub.io/api/news?id=4427e56aa8cbe159f3835c9c34d64c2f8db2f18636fd49b0e1d17c0a18443311
MRNA,2025-10-20T19:14:00+00:00,Super Micro Is the S&P 500’s Biggest Gainer. The Stock Could Break Out.,Yahoo,https://finnhub.io/api/news?id=ce8340c9b693f3d64ab90ae69af5ce768ee9411d62945dec637c97058de3c359
MRNA,2025-10-20T18:05:48+00:00,"Stock Market Today: Dow Jumps, Apple Clears Entry As iPhone 17 Does This; These Gold Stocks Shine (Live Coverage)",Yahoo,https://finnhub.io/api/news?id=fdefd2fe925d8635fd269e57802109f11db645a9d3ddd65791bb8b7317536471
MRNA,2025-10-20T04:32:38+00:00,2 Mid-Cap Stocks to Consider Right Now and 1 That Underwhelm,Yahoo,https://finnhub.io/api/news?id=dc25f4d0a569420036d6380f793f096612f8e3791560c0294f0f50bacb40f8b5
MRNA,2025-10-19T12:00:00+00:00,Moderna Highlights Seasonal Flu and H5 Pandemic Flu Candidates at IDWeek 2025,Yahoo,https://finnhub.io/api/news?id=6ba1a801065141a09d66c85be0fa657240eea8d3406ec53b19ab4d9087b71422
MRNA,2025-10-18T09:30:00+00:00,Moderna Vs BioNTech: Who's Winning The Post-COVID Race,SeekingAlpha,https://finnhub.io/api/news?id=be3fc31fd328aaa5a2e9c7f6090935d75157a73fe954edd47ad9d5c63049b78c
MRNA,2025-10-17T19:32:15+00:00,Moderna Shares Fall After Early Trial Update on mRNA-4359 Cancer Vaccine Combination,Yahoo,https://finnhub.io/api/news?id=0bc63e8f8ddfd9f12b6bae7b4272a205ecc282e3b02d989685ea680d8cd0c7af
MRNA,2025-10-17T16:08:50+00:00,Moderna: More Downside In The Stock But The Cancer Vaccine Offers Potential,SeekingAlpha,https://finnhub.io/api/news?id=20a7ca1f5e3e655612b148b027368dcbdf187b13ed105dd1ed49a3c5ae04cd4b
MRNA,2025-10-17T16:06:38+00:00,"Moderna, Inc. (MRNA) Shareholder/Analyst Call Transcript",SeekingAlpha,https://finnhub.io/api/news?id=4ba3bc3df04ef0f9cb68f5f5e4ce78d2a06bca935386f2abe95c47ead5c25784
MRNA,2025-10-17T13:59:15+00:00,Moderna to Present Promising Phase 1/2 Clinical and Safety Data for Cancer Antigen Therapy mRNA-4359 at ESMO 2025,Yahoo,https://finnhub.io/api/news?id=71e19948742187574172ca8fb05120abf7d67ce3dac4b49df0a511ab075c500c
MRNA,2025-10-16T13:03:00+00:00,"MRNA Therapeutics and Global Markets Report 2025: Revenue Data from 2022-2024, Estimates for 2025, and CAGR Projections Through 2030",Yahoo,https://finnhub.io/api/news?id=ff0d4ea05a3ef215c79d648d62ac0891850999ec23f638c8063bd99d53fc6801
MRNA,2025-10-16T11:00:00+00:00,"Moderna to Report Third Quarter 2025 Financial Results on Thursday, November 6, 2025",Yahoo,https://finnhub.io/api/news?id=b45ec8b92644f8a0dc773f1f0711b724d40a2b1c4560854f2c3a39f21871e51a
MRNA,2025-10-15T20:08:45+00:00,Why Moderna Might Be a One-Hit Wonder,Yahoo,https://finnhub.io/api/news?id=11c7e5e8d658510600469ad8d44203508d4b26e03400f3192955b46ffb4c3158
MRNA,2025-10-14T21:50:05+00:00,Moderna (MRNA) Registers a Bigger Fall Than the Market: Important Facts to Note,Yahoo,https://finnhub.io/api/news?id=6f9c4ff7c170ddc2c0ccf6ec376b6abdc39a14e98fd48e77bf7fff1d1e9fe0ce
MRNA,2025-10-14T21:27:29+00:00,R&D spending now can have big payoffs later for companies,Yahoo,https://finnhub.io/api/news?id=047a7c2ff4a829a9cb3172cf2e5729ceeb75f7335da866219dfe233e5b56721f
MRNA,2025-10-14T17:33:00+00:00,Top Novavax Shareholder Demands Company’s Sale,Yahoo,https://finnhub.io/api/news?id=c1b99a395ced0a8bd4160d3bddfcc8d84c40df735d390f956f0f1e739ca5828a
MRNA,2025-10-14T16:57:12+00:00,Moderna: Q3 Earnings Preview - I Fear A Halloween Horror Show (Downgrade),SeekingAlpha,https://finnhub.io/api/news?id=0d2497fcd1ed94316d069811fd2eb1c9c92430b9fef270c48ef031561f514b4e
MRNA,2025-10-13T16:21:59+00:00,"Moderna (MRNA) Stock Trades Up, Here Is Why",Yahoo,https://finnhub.io/api/news?id=14a1c4d1d49348a5fa3be74c01f651f036708b33e72a4dde7764119a6862ffcf
MRNA,2025-10-13T12:30:04+00:00,Moderna Says Investigational Cancer Antigen Therapy Shows 'Promising' Early Data,Yahoo,https://finnhub.io/api/news?id=0ba2a8a0233c17a4922ec2874acf3116ff4dd8e113bb4673b2f4b54ae3da42ca
MRNA,2025-10-13T04:46:00+00:00,3 Cash-Burning Stocks with Warning Signs,Yahoo,https://finnhub.io/api/news?id=0409ad0d3d66d38f46740824cd635a4433e28d6f4f9d9639606e19c606eeb2ea
MRNA,2025-10-12T22:05:00+00:00,Moderna Presents Promising Early Data for Its Investigational Cancer Antigen Therapy at the 2025 European Society for Medical Oncology Congress,Yahoo,https://finnhub.io/api/news?id=0290b43c1024fc134579962c024b2fab85f6e6192c9e2839236f529f90745e00
MRNA,2025-10-10T19:51:22+00:00,"10x Genomics, BioMarin Pharmaceutical, AMN Healthcare Services, Illumina, and Moderna Stocks Trade Down, What You Need To Know",Yahoo,https://finnhub.io/api/news?id=5cfcf62a6b0e7f81fd5ad731774e17b389d051db740df3385dc4e7e72ac51601
MRNA,2025-10-10T13:00:04+00:00,How to Boost Your Portfolio with Top Medical Stocks Set to Beat Earnings,Yahoo,https://finnhub.io/api/news?id=8093c4e93b1929656819135a0d0759ecdba886a2c672855adf1c186f126a642c
MRNA,2025-10-10T09:07:00+00:00,AstraZeneca ups investment in Virginia; Moderna vets launch VC fund,Yahoo,https://finnhub.io/api/news?id=15ec430a4d9f5cafc0af8bfaa31a27297fcdf8620510b4489d757d0321061950
MRNA,2025-10-09T18:17:32+00:00,Should Moderna's (MRNA) Improved Revenue Trends Prompt New Action From Investors?,Yahoo,https://finnhub.io/api/news?id=2beeef2e1a7347488f23ea98c1db3dd8f6b1c27cf9bcd67e9d8eb313cff8d739
MRNA,2025-10-08T21:50:02+00:00,Moderna (MRNA) Surpasses Market Returns: Some Facts Worth Knowing,Yahoo,https://finnhub.io/api/news?id=328920477333405944d63342421360cdfbc0e50b6e69b4f50ff3b4f80eacd38d
MRNA,2025-10-08T07:00:00+00:00,Clustermarket Rebrands to Calira and Secures Industry Veteran to Capitalise on Demand for Optimised R&D Lab Operations,Yahoo,https://finnhub.io/api/news?id=29788823be757dd4838d896daad59de0b854847de1b905b10d9e03647d780af5
MRNA,2025-10-07T10:14:31+00:00,Venture financing for mRNA-based vaccines declines 82% in 2025 YTD,Yahoo,https://finnhub.io/api/news?id=aae9b6d6445a31bed6a4f562bd683198b440127972198066877d62432c14d0e5
MRNA,2025-10-06T13:00:04+00:00,These 2 Medical Stocks Could Beat Earnings: Why They Should Be on Your Radar,Yahoo,https://finnhub.io/api/news?id=abccda4bdc6cd6769971fad434c2c10bdb3d21b8e80cd1c58203baf5f7e72ba8
MRNA,2025-10-06T12:58:12+00:00,Moderna (MRNA): Assessing Valuation After Recent 12% Share Price Jump and Updated Financials,Yahoo,https://finnhub.io/api/news?id=d5d2aff319087fc77ee8cfbc1f28888b3764a701e306eeea9b225fdb2cb92b27
MRNA,2025-10-03T15:48:54+00:00,"Palantir, AI bubble comments, pharma stocks: Trending Tickers",Yahoo,https://finnhub.io/api/news?id=e133b8ef1ef28dc49f1289456a1433ec675317e6785a72400f568b4c5394c051
MRNA,2025-10-02T21:50:05+00:00,Moderna (MRNA) Beats Stock Market Upswing: What Investors Need to Know,Yahoo,https://finnhub.io/api/news?id=5fa57cacc7a01828e62b99a1fb5c5c44c4cb4aa94099a76ff42f7d03fef3e121
MRNA,2025-10-02T14:32:00+00:00,Could MRNA's Upcoming Product Launches Reduce COVID Sales Dependency?,Yahoo,https://finnhub.io/api/news?id=8d687c97057e476f96c06879559a7b7f894130bb1ceea45fbd112b66696ef077
MRNA,2025-10-02T13:30:01+00:00,Moderna (MRNA) Recently Broke Out Above the 50-Day Moving Average,Yahoo,https://finnhub.io/api/news?id=e5f44821417dcca1aba404f2c0748bf48fc93480c0aba6fe051fa5ca57f3f452
MRNA,2025-10-02T05:35:41+00:00,Brookline Reaffirms Price Target for Moderna (MRNA) After Strong mRNA-1283 Vaccine Results,Yahoo,https://finnhub.io/api/news?id=848f8052c37242aa8c5ef7de24818f6c1d98c527a7e4adc0f8adb24b3828f32f
MRNA,2025-10-01T20:20:00+00:00,"These Stocks Moved the Most Today: Nike, Netflix, Fermi, Moderna, AES, Lithium Americas, Sunrun, Corteva, and More",Yahoo,https://finnhub.io/api/news?id=6f5dbb34fdca4091ef3f86a6189a28cc3580cf82103a42749f49ef93744a9269
MRNA,2025-10-01T10:09:00+00:00,"These Stocks Are Moving the Most Today: Nvidia, Nike, Occidental, AppLovin, AES, Lithium Americas, and More",Yahoo,https://finnhub.io/api/news?id=95a0c0ed21eae0aadfec695cd107006a790b7a13f83eab6dfa8cce91f06be47a
MRNA,2025-09-30T18:51:18+00:00,Why Pfizer (PFE) Stock Is Trading Up Today,Yahoo,https://finnhub.io/api/news?id=9485dc1d081a34c22752ac6a933ac24fd26f71a0524094eee068926cb91885ea
MRNA,2025-09-30T11:30:00+00:00,2 Beaten-Down Stocks to Buy and Hold for a Decade,Yahoo,https://finnhub.io/api/news?id=ebfeedc9457194311eb3283ab90cc23d011a31fffb3df2d25bfbb93aff2e410a
MRNA,2025-09-29T13:15:09+00:00,3 Of My Favorite Biotech Stocks Under $10,SeekingAlpha,https://finnhub.io/api/news?id=956d7ca02fef0fb71847d3f0160659ce25fe440c9f8c6c613e7e70dbb7de075a
MRNA,2025-09-25T12:37:39+00:00,"Moderna, Inc. (MRNA) Presents at Bernstein Insights: Healthcare Leaders and Disruptors - 2nd Annual Healthcare Forum Transcript",SeekingAlpha,https://finnhub.io/api/news?id=2644cc17ed78fdc706dd217d4c8ce21e65f2523b0b122c470244a4e9254407c8
MRNA,2025-09-25T11:00:59+00:00,"Moderna, Inc. (MRNA) Presents at Bernstein Insights: Healthcare Leaders and Disruptors - 2nd Annual Healthcare Forum - Slideshow",SeekingAlpha,https://finnhub.io/api/news?id=fbf0715b0a45dee4eec6186bd27d6250b5c50a84b3c715ec6c435c6d065685e5
MRNA,2025-09-25T10:55:05+00:00,Moderna opens UK vaccine manufacturing facility,Yahoo,https://finnhub.io/api/news?id=d32e70b38fb0d7bde4620aee630156e74c3866d60d8a6292f2f169f19bf7f020
MRNA,2025-09-25T09:34:16+00:00,Moderna opens new manufacturing and R&D facility in the UK,Yahoo,https://finnhub.io/api/news?id=33736af5ab5dfd812cc827457d63af01c3247b25449878c686e42566ace270fb
MRNA,2025-09-25T07:35:28+00:00,Moderna opens mRNA production center in UK,Finnhub,https://finnhub.io/api/news?id=b385ef3947d994d2f7b14eb63602362dfa7a04dbda39441ae6243419472f204e
MRNA,2025-09-24T23:31:02+00:00,"Moderna's COVID-19 Vaccine Update Boosts Antibodies 16-Fold, Data Shows",Yahoo,https://finnhub.io/api/news?id=6a8fa97a81f536d7e5673ee28ab02feaab2615987fc96c6f4732e8e4e3aef14e
MRNA,2025-09-24T23:01:00+00:00,Moderna opens new vaccine facility in boost for UK pharmaceutical industry,Yahoo,https://finnhub.io/api/news?id=81df3737207d6fbb42b4c3c7db7336867a9b38177c9f0de0a0e75f7266f61f73
MRNA,2025-09-24T23:01:00+00:00,Moderna Opens State-of-the-Art Manufacturing and R&D Facility in the UK,Yahoo,https://finnhub.io/api/news?id=9df7153f7d75775e5b2b7d750f48496245f596174a160fdd66586c15379e3678
MRNA,2025-09-24T16:59:50+00:00,Moderna: Maintaining Sell Despite Consolidation - And Why MRNY Won't Help Either,SeekingAlpha,https://finnhub.io/api/news?id=840545eadbafaf44b49412b10e62f593e1822cf06f897534a259b668f083142e
MRNA,2025-09-24T01:01:07+00:00,"Flagship Pioneering, Creator Of Moderna, Launches Extuitive With $20M To Reinvent Consumer Products Using AI Shoppers",Yahoo,https://finnhub.io/api/news?id=563d5d8183cf7564a2c237dfa1ca6afa126b426cbfae3e3d01f4efad89db41c1
MRNA,2025-09-23T13:00:38+00:00,"Stocks making big moves yesterday: Plug Power, Moderna, Magnite, Compass, and RE/MAX",Yahoo,https://finnhub.io/api/news?id=a02ab65b3e976dd4864e874f73d132ff697c9f927ad4bb5520540b4e88307d10
MRNA,2025-09-23T11:00:00+00:00,Moderna Announces mNEXSPIKE Generates Strong Immune Response Against LP.8.1 Variant in Humans,Yahoo,https://finnhub.io/api/news?id=ad1bdc2fa15aed2363ac90ba6d799a604bf54db40937733394f4e43bead152a4
