ticker,published_utc,title,publisher,url
MRNA,2025-09-22T20:46:56+00:00,Why Moderna (MRNA) Stock Is Trading Up Today,Yahoo,https://finnhub.io/api/news?id=6f83f201c3a19e54be4ffd46e3680d2579c504ba9ed24b7f123c89d11e16dc26
MRNA,2025-09-21T14:25:25+00:00,"Moderna, Inc. (MRNA) Advances Flu, RSV, and Cancer mRNA Therapies Beyond COVID",Yahoo,https://finnhub.io/api/news?id=e4ceb7bf4e58a91aadf1a00d8c08423f526c19a4b7e37a7ee0aee88425aef4ab
MRNA,2025-09-19T21:24:55+00:00,CDC Ends Universal Covid Vaccine Recommendation; Moderna Skids,Yahoo,https://finnhub.io/api/news?id=c8f19364725e88c69cc3f01cb8f4c3806d771018987ff3ad960e1687f15fbe12
MRNA,2025-09-19T20:10:00+00:00,Moderna Announces First Made-in-Canada mRNA Vaccines Delivered to Canadian Provinces and Territories,Yahoo,https://finnhub.io/api/news?id=dc521d91307f0d04f7faee8383654cb4947429d87fa42d8e5d9e7ccb86ca3e40
MRNA,2025-09-19T19:15:00+00:00,Government of Canada announces major milestone in the Canadian biomanufacturing sector,Yahoo,https://finnhub.io/api/news?id=4d05d0db5e96e4899ae880921a6fde024d3df3970eb3761279352706febec817
MRNA,2025-09-18T22:50:05+00:00,Moderna (MRNA) Outpaces Stock Market Gains: What You Should Know,Yahoo,https://finnhub.io/api/news?id=efcfb5a17a3b9c9422e2bd2ee8abc8ce0974518afd4f2167cdcb85d8a258d104
MRNA,2025-09-18T18:49:16+00:00,The Battle Over Covid Vaccines Hits A Fever Pitch As RFK-Picked Panel Makes Its Debut,Yahoo,https://finnhub.io/api/news?id=a133c8e330265aaf231a3b7858680d34286f36a790f9e53a6d121e7e6c0f23b0
MRNA,2025-09-18T10:00:00+00:00,Trump's battle with the pharma industry shows no signs of easing,Yahoo,https://finnhub.io/api/news?id=af29f041ab6c7a96e487926ac658bf0ffa99b00569a8adbba2ab9be746547173
MRNA,2025-09-17T21:31:04+00:00,Moderna Reports 8-Fold Jump In Antibodies With Updated Spikevax,Yahoo,https://finnhub.io/api/news?id=08d9fb14e8acaafb6ea0e7d9755101b3952918233b3bb76c54fa8aa4a2eca909
MRNA,2025-09-17T15:04:00+00:00,MRNA Stock Rises as Updated COVID-19 Jab Shows Strong Immune Response,Yahoo,https://finnhub.io/api/news?id=4e8cda0cb7b88c74d1caf45046acd4fed2d44f4bfb67ad1bd11b03f4caed8373
MRNA,2025-09-17T14:28:00+00:00,Vertex Plunges Around 24% in Six Months: How to Play the Stock,Yahoo,https://finnhub.io/api/news?id=99ba2f51880573d5173b9a96f1a667abe614fcf001016d583fd9e4fbced86415
MRNA,2025-09-17T12:24:00+00:00,"Lilly, Novo showcase new obesity drug data; Fasenra falls short in COPD",Yahoo,https://finnhub.io/api/news?id=3573f7245ce873d1d8b103fba1481936dfe22f8834a5dde4155c7cd274ead975
MRNA,2025-09-16T21:34:21+00:00,"US Equity Indexes Lower Ahead of Fed Policy Decision Despite Robust Retail Sales, Surprise Industrial Production Print",Yahoo,https://finnhub.io/api/news?id=64d7a718eef6d461e2d1c25ec112182ee782351ea94f568036928f9483e2b952
MRNA,2025-09-16T12:06:34+00:00,How Renewed Scrutiny of Pediatric Vaccine Safety at Moderna (MRNA) Has Changed Its Investment Story,Yahoo,https://finnhub.io/api/news?id=f0863294438135a79400de030c6e15f237daf025ca50fe51e2854580b6f99805
MRNA,2025-09-16T11:00:00+00:00,Moderna Announces Updated COVID-19 Vaccine Against LP.8.1 Variant Generates Strong Immune Response in Humans,Yahoo,https://finnhub.io/api/news?id=90dbe72919252acffea8e313f1630ceac40b8e866821e789e4439fdf7adde50f
MRNA,2025-09-15T16:27:30+00:00,Arbutus: IP Drama With High Stakes,SeekingAlpha,https://finnhub.io/api/news?id=e0d55e7cd91607eef3cf2f8433c6b0143680c5ec530f1218f739885b1d222f87
MRNA,2025-09-15T09:00:00+00:00,Moderna and BioNTech pioneered mRNA vaccines. But who will make a mark in therapeutics?,Yahoo,https://finnhub.io/api/news?id=986ab71b684b76ee31c55965fb8cbcf337e08a9850b52bce92e253bd4ec5a81e
MRNA,2025-09-14T10:30:09+00:00,"Biotech stocks: Who wins and who loses if RFK, Jr. goes",Yahoo,https://finnhub.io/api/news?id=31d29ac220ba59ee628100b60a4ea64888e764f9d4af358946e890f8a14c4562
MRNA,2025-09-13T18:56:22+00:00,Moderna shares hit a low after report suggests the FDA plans to tie COVID shots to child deaths,Yahoo,https://finnhub.io/api/news?id=a454bedf0fe9fbfa2676df0e1775039edfbefa9706b3e37fdde80786bebdc3cc
MRNA,2025-09-13T00:55:00+00:00,Review & Preview: Waiting for the Rate Cut,Yahoo,https://finnhub.io/api/news?id=14a802790109311b7e36274a149e820b331472ba50a9b27f87fc898742d8a94a
MRNA,2025-09-12T22:45:04+00:00,Moderna (MRNA) Declines More Than Market: Some Information for Investors,Yahoo,https://finnhub.io/api/news?id=129eef522b889ecf1c79eb98cbcbf6b82c9cf3bd783baef12c2168364e81c3e9
MRNA,2025-09-12T22:16:37+00:00,S&P 500 Gains and Losses Today: Warner Bros. and Paramount Extend Gains; Moderna Plunges,Yahoo,https://finnhub.io/api/news?id=37d6d59670fb1a308bfa61e4b9915e28db9b02705456be2d9bd50a2b637fa243
MRNA,2025-09-12T22:15:00+00:00,"These Stocks Moved the Most Today: Warner Bros., Paramount Skydance, Tesla, Moderna, IonQ, Gemini Space, Microsoft, and More",Yahoo,https://finnhub.io/api/news?id=08c4721a83f253364f1d713ec65e8a986b276a93f4ac47a03a287ee85c36a38f
MRNA,2025-09-12T21:30:55+00:00,"US Equity Markets End Mixed as Investors Weigh Weak Consumer Sentiment, Inflation Outlook",Yahoo,https://finnhub.io/api/news?id=40522e17ccd2c36e3f9e53b29c90541370da376791acfd4b6b223fd6f4addec3
MRNA,2025-09-12T21:21:24+00:00,Vaccine Stocks Fall Following Report of Plans to Link Covid Shot With Child Deaths,Yahoo,https://finnhub.io/api/news?id=8913e1a8321bfab38025d8d96be2ba72251b8c12ee3a40231fd7b4b32bcc6895
MRNA,2025-09-12T21:01:22+00:00,Why Moderna (MRNA) Shares Are Trading Lower Today,Yahoo,https://finnhub.io/api/news?id=f7cb0dbfe6a5312a762a8c8df5240750bc4d77163b1f609aca6d6c921bcbc795
MRNA,2025-09-12T21:00:59+00:00,Why Pfizer (PFE) Shares Are Sliding Today,Yahoo,https://finnhub.io/api/news?id=2de7354b42a4a145524024082c16abd61453ac4a1a49bd5e2b9b494d7e3f0600
MRNA,2025-09-12T20:46:43+00:00,Sector Update: Health Care Stocks Fall Late Afternoon,Yahoo,https://finnhub.io/api/news?id=6bd5e7991460c9e932dc9b788acce013ff6114d26053eb352ca54f56ba015b31
MRNA,2025-09-12T19:56:00+00:00,Vaccine Stocks Fall on Reports FDA Will Allege Link Between Covid-19 Shots and Child Deaths,Yahoo,https://finnhub.io/api/news?id=eca4649ae68241fa6001e88ffb68490107c22287b56c96487ec3c6ef1789a30c
MRNA,2025-09-12T18:28:54+00:00,"Sept. consumer sentiment falls, Moderna & COVID report, Gemini IPO",Yahoo,https://finnhub.io/api/news?id=3785e99bb267fc0a5f87356570dafdb24186bec72dc57ab774180ac0e3e64163
MRNA,2025-09-12T18:02:11+00:00,Drugmakers Fall on Report US to Claim Covid Shots Killed Kids,Yahoo,https://finnhub.io/api/news?id=9186c55f9cebef9760d7ae26b547aeefc721f2e3defc02d0c08b159e7e443a12
MRNA,2025-09-12T17:33:09+00:00,"Pfizer, Moderna, BioNTech trade lower amid report of vaccine link to child deaths",Yahoo,https://finnhub.io/api/news?id=2288600223cbc1bbad65226826f34dc3ee15e0fcbe4643a44d152de90894b479
MRNA,2025-09-12T17:11:47+00:00,"Trump officials to link child deaths to COVID shots, Washington Post reports",Yahoo,https://finnhub.io/api/news?id=61cf2dd9d42cc255ff3d48c337ced6d4f8610fd1fbec0d1e6ce1e7aaece8c756
MRNA,2025-09-12T16:35:28+00:00,"Stock Market Today: Investors await opening trade from Gemini, Via, and Legence",Yahoo,https://finnhub.io/api/news?id=e1c588a8e044aeb5f01378cbfc6031637ce974106e73a021991d2dd4b8f36587
MRNA,2025-09-12T08:00:00+00:00,Pfizer Is Growing More Reliant on Vaccines as Controversies Swirl,Yahoo,https://finnhub.io/api/news?id=c9856317978cc0374201e534ece3e531bd07b9ea156ab6692f3248a096ffc96a
MRNA,2025-09-11T16:37:00+00:00,Which Investments Do the Uber-Rich Favor? This Wall Street Pro Knows.,Yahoo,https://finnhub.io/api/news?id=d18b15728a0ce1cde607dcdc3689e2cabf9c67bdb7480e370a4c544cbbb84a1a
MRNA,2025-09-10T09:00:00+00:00,Pharma’s new boomtown? Why drugmakers are setting up shop in a small Swiss city.,Yahoo,https://finnhub.io/api/news?id=b28040e0dd55cb8a50885830067c1799b807e6849ab6514102edae769db1bb7a
MRNA,2025-09-10T01:00:00+00:00,Health Officials Hunt for Cases Connecting Covid Shot and Harm in Pregnant Women,Yahoo,https://finnhub.io/api/news?id=f44fb8a85f855b0079f79e00cc7bd4de8f6138dc29c62a5ef5f21c035399ae2c
MRNA,2025-09-09T10:21:00+00:00,"USA Vaccine Market Outlook Report 2025-2030 | Focus on Lassa Fever, Ebola, RSV Vaccines, Alongside Genomics-Driven Targeted Therapies, Strengthens Public Health Preparedness and Investment Potential",Yahoo,https://finnhub.io/api/news?id=01b26b6d1e3a658e5fc5e6bd543ec22d3ebf9d02471ad137d9b2234ecaf9ab3c
MRNA,2025-09-08T19:26:30+00:00,Why Moderna (MRNA) Shares Are Falling Today,Yahoo,https://finnhub.io/api/news?id=5c4d0347fd13785e33f1c0dca96a95d59077c8fd8e8373697d1484d926da9792
MRNA,2025-09-08T13:14:34+00:00,"Moderna, Inc. (MRNA) Presents At Morgan Stanley 23rd Annual Global Healthcare Conference (Transcript)",SeekingAlpha,https://finnhub.io/api/news?id=9c1dc83dd6030fed48a69428174acdbe4d486088c8a2acc3fbdfb082011b6e53
MRNA,2025-09-07T19:28:16+00:00,"I Thought Of Moderna, Inc. (MRNA) After Florida’s Vaccine Rules, Says Jim Cramer",Yahoo,https://finnhub.io/api/news?id=f88e6b87e3ac593b02a6099e0016d49addce1e9c2146c33af7636e4f413e2dc6
MRNA,2025-09-07T09:42:00+00:00,Is it Time to Dump Your Shares of Moderna?,Yahoo,https://finnhub.io/api/news?id=80901e956a3e8910f8cafe0ba78501df0c0e30eecf66d27b66de9db48d38384d
MRNA,2025-09-05T15:23:48+00:00,"Shots Fired! After RFK Jr.'s Senate Grilling, Will Pfizer, Moderna Survive The Battle In D.C.?",Yahoo,https://finnhub.io/api/news?id=4caf28b49fea11b4077b5861c782e85397fabdde4a948a3f99406ba4d6a6271c
MRNA,2025-09-05T09:07:06+00:00,Pfizer: Still A Bargain Despite Kennedy's Anti-Vaccine Attacks,SeekingAlpha,https://finnhub.io/api/news?id=d73fe54fc34318ccf1d3729ec1a04d051d9f77957ff3802476624a400c8c850d
MRNA,2025-09-04T05:44:54+00:00,1 Cash-Heavy Stock Worth Your Attention and 2 We Question,Yahoo,https://finnhub.io/api/news?id=2f19f0ae525f9cf6ae3f2ec362554edc26ed629a20ac1196770940d81ce0da4c
MRNA,2025-09-03T20:52:55+00:00,Sector Update: Health Care Stocks Decline Late Afternoon,Yahoo,https://finnhub.io/api/news?id=3653e24500c574626a4d9e61fabdfa98699d8e685e00a07c4cd6ad43d9afb734
MRNA,2025-09-02T12:00:00+00:00,Moderna Announces Data to be Presented at the 2025 International Congress of Inborn Errors of Metabolism,Yahoo,https://finnhub.io/api/news?id=83b68aed9b6d0d6716203560c8a4636154d698a7173cd36db37f2e823053e436
MRNA,2025-09-02T09:57:13+00:00,Is Moderna Stock Underperforming the S&P 500?,Yahoo,https://finnhub.io/api/news?id=e6eec3e09cd26271831fd96cf69bd6177fe23518994d643046195320f5fe9345
MRNA,2025-09-02T06:34:47+00:00,Moderna (MRNA) Gains FDA Nod for Next-Gen COVID-19 Vaccine Targeting LP.8.1 Variant,Yahoo,https://finnhub.io/api/news?id=29f725c91f470876a3261f4acaeb78cf68d7d265bfbf1c9257503614f0c51f2c
MRNA,2025-09-02T05:33:58+00:00,3 Healthcare Stocks with Warning Signs,Yahoo,https://finnhub.io/api/news?id=43ed6bd58ebc848f8ece5aa293bac619207ea3bceb0e36d3568efdaf1172ecc9
MRNA,2025-08-31T12:40:00+00:00,Large-cap biotech is a sector to watch for investors: Analysts,Yahoo,https://finnhub.io/api/news?id=0662f07a31d05278cb660cdf2621d1dc4a73cf29cd67af073f9e563f506cfd9c
MRNA,2025-08-30T13:13:13+00:00,Insider Buyers At Moderna Likely Disappointed With 11% Slide,Yahoo,https://finnhub.io/api/news?id=c13f74d234ada77ea2f052c37a261d63720a840cc124b6a47be63c8d17e9c4d3
MRNA,2025-08-29T15:51:00+00:00,Boyd Gaming and Shoe Carnival have been highlighted as Zacks Bull and Bear of the Day,Yahoo,https://finnhub.io/api/news?id=abe38108d466fa485c347af342f37d30be9996f4503123da50d1fd6e84606970
MRNA,2025-08-28T16:04:00+00:00,FDA Approves Updated COVID-19 Vaccines but With Restrictions,Yahoo,https://finnhub.io/api/news?id=441e5e43d762e4bac0a6a43beddabacad1db6db57e99b826e745b7f93e68c615
MRNA,2025-08-28T11:55:32+00:00,FDA approves mRNA vaccines for new Covid-19 season amid political tension,Yahoo,https://finnhub.io/api/news?id=52bb6444dd51a03066168011e4c4489567a1f5a98e41869e26a85f8637d7f372
MRNA,2025-08-28T08:56:46+00:00,"Moderna, Inc. (MRNA) Expands Into Oncology with Pan-Tumor Vaccine",Yahoo,https://finnhub.io/api/news?id=305f45342dd4850f39d4fec08d2a59e003a3077c980c9bd43b1ac7d1bff44f68
MRNA,2025-08-28T06:20:59+00:00,mRNA Biotechs - Long-Term Value Risks Abound,SeekingAlpha,https://finnhub.io/api/news?id=6310569c4276657a4681c0e2da205eef7ecfa5255adbe404f4e05c5f77927e37
MRNA,2025-08-28T03:32:28+00:00,Reflecting On Therapeutics Stocks’ Q2 Earnings: Moderna (NASDAQ:MRNA),Yahoo,https://finnhub.io/api/news?id=1a60e70fd108460d6e028b8b7bcfb7587e1d107c0bec72a9a82b7e6d91e042f1
MRNA,2025-08-27T19:05:55+00:00,Why Moderna (MRNA) Stock Is Up Today,Yahoo,https://finnhub.io/api/news?id=6c280f886e525d295f2e4b39f5b50f97df36ac7a08a8f3cf14fabc8f85960e36
MRNA,2025-08-27T18:54:15+00:00,Moderna Receives US FDA Approval for Updated COVID-19 Vaccines Targeting the LP.8.1 Variant,Yahoo,https://finnhub.io/api/news?id=8bb335a52de11eefbfe8ccf4149c69c512d28b8deb50c0709b471b5a23f01a3f
MRNA,2025-08-27T18:25:49+00:00,RFK Jr. Makes Good On Promise To End Covid Vaccine Mandate. BioNTech Tumbles.,Yahoo,https://finnhub.io/api/news?id=1a299388f40e08b9bb9af5c91fbd4c1d220613b271a8129aa57f00d003fff393
MRNA,2025-08-27T17:24:00+00:00,Moderna Receives U.S. FDA Approval for Updated COVID-19 Vaccines Targeting LP.8.1 Variant of SARS-CoV-2,Yahoo,https://finnhub.io/api/news?id=b239ccce008a3a1628dd78041a649ea0fbf37ebd95f35aeb7bf1a6b08660a87e
MRNA,2025-08-27T17:12:00+00:00,New Covid-19 Boosters Are Coming Soon. Not Everyone Will Be Eligible to Get One.,Yahoo,https://finnhub.io/api/news?id=ea4e3f36b47db4a3426c20b44d91dbd2e7c27f056f00c0af8318cb2929301611
MRNA,2025-08-27T00:31:07+00:00,Trump Administration Plans To Pull COVID-19 Vaccines Off Market 'Within Months',Yahoo,https://finnhub.io/api/news?id=77dc9df5cd4ac485649fa3adce84d493276ea01777881d874b79d7f737013cad
MRNA,2025-08-25T12:10:10+00:00,Moderna’s updated Covid-19 vaccine gets Canadian approval,Yahoo,https://finnhub.io/api/news?id=ca68cf2410c2288e3ddf06f8aaea237dc05aa609b39726237bcceaf0ee19a316
MRNA,2025-08-24T06:17:32+00:00,"Moderna, Inc. (MRNA) Down 35% YTD. Here Is Why",Yahoo,https://finnhub.io/api/news?id=17f4e6c81875ca6e1ccf42fcdf6c54de058d799715fb82020780090a96682a3e
MRNA,2025-08-22T22:02:35+00:00,Moderna Stock Jumps After Canada Approves New Covid Vaccine,Yahoo,https://finnhub.io/api/news?id=930ffbce45b60b005cea82b42b67c994b724cd6cb272339dd48bb34dbbdb01f6
MRNA,2025-08-22T19:43:48+00:00,Sector Update: Health Care Stocks Advance Late Afternoon,Yahoo,https://finnhub.io/api/news?id=c218e73d8f27adacfefcfce8c07f9b0452f33385617cd9413dac81c59d59fe4a
MRNA,2025-08-22T17:43:55+00:00,Sector Update: Health Care Stocks Higher in Afternoon Trading,Yahoo,https://finnhub.io/api/news?id=d18b6981fb89095ac541b6a26d0c0dad9ee01c402e91dd342a2aa989c8bebbc3
MRNA,2025-08-22T13:25:00+00:00,Moderna Receives Health Canada Approval for Updated COVID-19 Vaccine Targeting SARS-CoV-2 Variant LP.8.1,Yahoo,https://finnhub.io/api/news?id=9e3741e889b6d7a26e0adfc2db360d3b00207430c1db4dbf2903b37862f6eda8
MRNA,2025-08-21T18:55:56+00:00,"LGI Homes, Moderna, Fortrea, 10x Genomics, and Cogent Shares Are Falling, What You Need To Know",Yahoo,https://finnhub.io/api/news?id=c82adba58645884f78a036c8b52d34a36b090299fc873111bdf6a6b0d9ea2545
MRNA,2025-08-21T11:00:00+00:00,Moderna to Present at Upcoming Conferences in September 2025,Yahoo,https://finnhub.io/api/news?id=b06081a200e687ff3cf502e15319f07b64e6904e75039b046260b839aa8f7325
MRNA,2025-08-20T17:20:06+00:00,What To Do With Nine Of The Bottom Performing S&P 500 Stocks,SeekingAlpha,https://finnhub.io/api/news?id=ab34a4f34a75065e946691be73d3b2154ad59c646d7c05888dd5dc75fcc9e676
MRNA,2025-08-19T13:06:00+00:00,Can Keytruda Sustain Merck's Growth Through the Rest of 2025?,Yahoo,https://finnhub.io/api/news?id=6b096a67d960612b50b9b6ad26359fd811ddbbb0b60b3c285dafa5330af78ea9
MRNA,2025-08-18T07:58:38+00:00,Biopharma layoffs rise as drugmakers tighten belts and reorganize,Yahoo,https://finnhub.io/api/news?id=fa88c71760b7feca0edda9fb50b38c77ec15f2f2a7db74b89a3e4af089ec1731
MRNA,2025-08-17T13:30:00+00:00,"If You're in Your 30s, Consider Buying These 2 Healthcare Stocks",Yahoo,https://finnhub.io/api/news?id=39d7ccd45b1e426ba3ec5195c8f6841666d5aeeaf5babb954a3fefe62f434c19
MRNA,2025-08-14T13:00:00+00:00,U.S. mRNA Therapeutics CDMO Market to Hit Valuation of US$ 6.27 Billion by 2033 | Astute Analytica,Yahoo,https://finnhub.io/api/news?id=c588757df013ccd53132d9feda71055faa6484bc5c0213edd33ed2aa5dccacc9
MRNA,2025-08-13T21:50:46+00:00,"Biogen, Moderna, Align Technology, QuidelOrtho, and Masimo Shares Skyrocket, What You Need To Know",Yahoo,https://finnhub.io/api/news?id=f748b6a3dc571de13eb1fedaabf19603761a479b602748cb464eeb611f0c9cde
MRNA,2025-08-13T19:16:00+00:00,Moderna Stock Jumps as NIH Chief Tempers Administration’s Attack on mRNA,Yahoo,https://finnhub.io/api/news?id=92c2487580647dd26791acac87419a105aaa33d306677f00cf07d2f66333122b
MRNA,2025-08-13T11:30:00+00:00,"[Latest] Global AI in Synthetic Biology Market Size/Share Worth USD 192.95 Billion by 2034 at a 28.63% CAGR: Custom Market Insights (Analysis, Outlook, Leaders, Report, Trends, Forecast, Segmentation, Growth Rate, Value, SWOT Analysis)",Yahoo,https://finnhub.io/api/news?id=a9d4b27834c4a287d359e19e4d7c32379cd4380bb80d79efec2562426598b9ab
MRNA,2025-08-13T04:18:30+00:00,3 Reasons to Avoid MRNA and 1 Stock to Buy Instead,Yahoo,https://finnhub.io/api/news?id=eec0fae318aec301bb5de584b5c7c1f01bea541430dd1d9bb057fe852c2c4ea0
MRNA,2025-08-13T04:15:16+00:00,The 5 Most Interesting Analyst Questions From Moderna’s Q2 Earnings Call,Yahoo,https://finnhub.io/api/news?id=6949d9d0f8e6be7a524e423b46b57282bc9d8b58766bb4dddb2976ef56dd8dd3
MRNA,2025-08-13T04:04:42+00:00,MRNA Q2 Deep Dive: Revenue Beat Overshadowed by Lower Guidance and Cost Cuts,Yahoo,https://finnhub.io/api/news?id=8bc1281ba4fe7341c9b79bba555637eb4bacf0531dcde06820409632399d3dac
MRNA,2025-08-12T18:20:39+00:00,"Moderna, Teleflex, Envista, Enovis, and UnitedHealth Shares Are Soaring, What You Need To Know",Yahoo,https://finnhub.io/api/news?id=6ae36edf187519d5d990965771ded1a7897acb47da5b0781540ca7a70ed28c1d
MRNA,2025-08-11T12:46:16+00:00,Find Oversold Stocks to Buy at a Discount With This Barchart Screener,Yahoo,https://finnhub.io/api/news?id=d394e02ebffaf7d5eab27928a584c1b02c0445a9f82e6c9a98c6803e907de907
MRNA,2025-08-11T11:36:00+00:00,"mRNA Platform Strategic Business Analysis Report 2025 | Global Market to Reach $129.1 Billion by 2030 - Rising Infectious Diseases, Technological Advancements, and Pandemic Preparedness Drive Growth",Yahoo,https://finnhub.io/api/news?id=da169c15b5ed6ce5d7d2a390b89fd4a58341ee69e558aa9a8ece0f4540e407d9
MRNA,2025-08-11T09:22:00+00:00,The 3 Things That Matter for Moderna Now,Yahoo,https://finnhub.io/api/news?id=f8b8c13ce853f20eef3be2a29a3f56b9bbb277895063a5967c5e59bd37ca0548
MRNA,2025-08-10T20:44:32+00:00,Tracking Baillie Gifford's 13F Portfolio - Q2 2025 Update,SeekingAlpha,https://finnhub.io/api/news?id=4faa71e8e6a1fb142e292585c4567007403d7d7799b299abcbd26dd5c81296a6
MRNA,2025-08-09T22:35:44+00:00,"Moderna, Inc. (MRNA)’s “Got The Double Whammy,” Says Jim Cramer",Yahoo,https://finnhub.io/api/news?id=d31232621a4cb07c3ea686b3c06b5d5a4659a4d3c11c984335457c12f2aa3366
MRNA,2025-08-07T19:29:19+00:00,"Alexandria Real Estate Equities, Inc. (ARE): A Bull Case Theory",Yahoo,https://finnhub.io/api/news?id=d143ca41769313ae483b482a6ffa6740f043f16e67bbc3942d0101ac40354a61
MRNA,2025-08-07T19:17:04+00:00,"Moderna Is Cutting 10,000 Jobs as Its Business Erodes. How Should You Play MRNA Stock Here?",Yahoo,https://finnhub.io/api/news?id=b8da474e1d7d5bfb55a9c15d67bbf5e01186ef8b195d9e6c3c30bc4f9de0d5d8
MRNA,2025-08-07T14:16:00+00:00,"Influenza Vaccine Market Research Report 2025-2030 Featuring GSK, Abbott, Pfizer, AstraZeneca, Sanofi, Moderna, CSL, Emergent BioSolutions, BIKEN, Serum Institute of India, Sinovac, GC Biopharma",Yahoo,https://finnhub.io/api/news?id=55c7cc77d1fd20de5684daa8ba9a18267a9e8f07b6b81697e00ce172515607a7
MRNA,2025-08-07T11:34:54+00:00,RFK Jr’s mRNA funding halt signals “shift in US public health”,Yahoo,https://finnhub.io/api/news?id=941ddaff6855a991a20d9423905639cb78835b6465ba4c05e478869f6b2235d4
MRNA,2025-08-07T08:31:00+00:00,AI is already upending the corporate org chart as it flattens the distance between the C-suite and everyone else,Yahoo,https://finnhub.io/api/news?id=5c94e9b312c4f82a68bdf67e3a6a0ada4c988d969a37b2db3f2fc60bc6e34552
MRNA,2025-08-06T22:22:52+00:00,Podcast: Stock Indexes Rise as Trump Boosts India Tariffs; Earnings in Focus,Yahoo,https://finnhub.io/api/news?id=5e3783ceb0c6c6a32a2cfe7f56bae2a9e059de701f7e028c80655286373ad721
MRNA,2025-08-06T10:30:36+00:00,US Health Department Ending Federal mRNA Vaccine Development,Yahoo,https://finnhub.io/api/news?id=294cfc2940509d17e0297bab8434380ebca59456f5886d62a0a1aa2d4679fa4d
MRNA,2025-08-06T07:35:14+00:00,Moderna Stock: Is Wall Street Bullish or Bearish?,Yahoo,https://finnhub.io/api/news?id=4c5ff4fb65d18acc59a698d9d5fcb6031015472e9b7c5c6c0a9c5fce2171a9e2
MRNA,2025-08-05T22:52:00+00:00,HHS to Wind Down mRNA Vaccine Programs,Yahoo,https://finnhub.io/api/news?id=a714837d65fea79f318c0c01ada6295ba08f068bbf32d514ad328f33ebc70cd3
MRNA,2025-08-05T11:06:21+00:00,"Moderna: RSV Upside Slim, Cash Burn Heavy",SeekingAlpha,https://finnhub.io/api/news?id=dec74b30d659c6359af7f503f4d507940028530e679a7fb806c41897811119b5
MRNA,2025-08-05T10:00:00+00:00,"Lipid Nanoparticles Market Industry Trends, Key Growth Drivers, Challenges, Future Opportunities, and Regulatory Landscape 2025-2034",Yahoo,https://finnhub.io/api/news?id=99856ad330416ed59c17e6f36fe8966532e1d75ec8625b139d80259f5540664c
MRNA,2025-08-05T08:03:00+00:00,"Cancer Vaccine Research Report 2025-2035 | Market Accelerates with Key Players Like Merck and Moderna, Backed by Pharma-Biotech Collaborations and Academic Partnerships",Yahoo,https://finnhub.io/api/news?id=a2f69b323d53e66fb01bddee62c9fbb8526467370f91cdf85555ed9ea70d5d9d
MRNA,2025-08-04T15:08:52+00:00,"Moderna Beat COVID Vaccine Revenue Estimates But Still Lowered 2025 Outlook, RBC Says",Yahoo,https://finnhub.io/api/news?id=d554f1e074c087ddb95bc36fef85c5deb8b9d94937e5b9c4d4b8890b2db88ada
MRNA,2025-08-04T09:58:00+00:00,Health Care Roundup: Market Talk,Yahoo,https://finnhub.io/api/news?id=118598c44e50c2147995d5bbde90416570f7379aafe40894ae0fdd2fe99658de
MRNA,2025-08-04T09:33:19+00:00,"Moderna Q2 Earnings Review: Downsizing Triggers Selloff, But I'm Long-Term Bullish",SeekingAlpha,https://finnhub.io/api/news?id=4fb669cdd9240fd661346c57e4a926ffbcbef8e991e74044b90ac410f68bfda0
MRNA,2025-08-02T07:42:14+00:00,What Moved Markets This Week,SeekingAlpha,https://finnhub.io/api/news?id=4e77039fa9e29acaa79062b5c5c0531b736c0f09633de5a0b88301bdff0e02ac
MRNA,2025-08-02T07:05:08+00:00,Moderna Inc (MRNA) Q2 2025 Earnings Call Highlights: Navigating Challenges with Strategic Cost ...,Yahoo,https://finnhub.io/api/news?id=62f327842c048e7624e757d5a05c2d38279c5a9114b6120cd8a15b8a239c10c0
MRNA,2025-08-01T22:00:02+00:00,Here's What Key Metrics Tell Us About Moderna (MRNA) Q2 Earnings,Yahoo,https://finnhub.io/api/news?id=5e0677e2190e5b8fc88126bf041d9e98bda7e4860e258bfc8ad5ab85daf66a48
MRNA,2025-08-01T21:15:18+00:00,"Equities, Yields Tumble Following Jobs Report Shock; Wall Street Posts Weekly Declines",Yahoo,https://finnhub.io/api/news?id=8032be3437c08763352826aff3557ce25cb6f2bf31b7854bbf608fc291aed19e
MRNA,2025-08-01T20:10:12+00:00,"Moderna Cuts Forecast, Stock Wobbles Despite Beat",Yahoo,https://finnhub.io/api/news?id=9d671c64b655f8da3fbfd2b6116197c119115dec7499c9c00de08c283bb6f2ab
MRNA,2025-08-01T19:47:58+00:00,What Companies Have Said About Jobs in the Past Quarter,Yahoo,https://finnhub.io/api/news?id=3782ac51316c0cbc52fed79e4537d56561c1d1a920a91a4b50fc16a957b00c29
MRNA,2025-08-01T18:14:58+00:00,Moderna sharpens focus on $1.5bn cost cutting plan after 41% revenue slump,Yahoo,https://finnhub.io/api/news?id=da7495941c21b40ddc316969dbfb87808d63c9b046416855bdbe38b97c1e02e7
MRNA,2025-08-01T17:21:00+00:00,"MRNA Beats on Q2 Earnings & Sales, Stock Down on Lowered Sales View",Yahoo,https://finnhub.io/api/news?id=3a49c8107c123b7e307fa0aa7ceac15cabef1164d8a32652eaaac694eca1fee5
MRNA,2025-08-01T16:10:37+00:00,Moderna Tempers High End of Revenue Guidance Amid Vaccine Delivery Timing Shift,Yahoo,https://finnhub.io/api/news?id=f62c129327910fed847fe651aff500a651c212316c018a7dcb8517b69427d647
MRNA,2025-08-01T14:33:00+00:00,Moderna Stock Is Falling After Earnings. What Has Wall Street Worried.,Yahoo,https://finnhub.io/api/news?id=74a9d1f211c4252a3299035be4344fd0b45cc7e277ebd9777093ea27801a0680
MRNA,2025-08-01T14:30:04+00:00,Moderna Stock Drops as Firm Cuts Revenue Outlook on UK Vaccine Deliveries Delay,Yahoo,https://finnhub.io/api/news?id=a640c6088d78d8978ca9ed05429f1288d74ca4d2e31256d2543aeebcfe260373
MRNA,2025-08-01T14:10:12+00:00,Stocks Slump on Tariffs and Weak US Job Growth,Yahoo,https://finnhub.io/api/news?id=d0b5022825f76d5d648cea23db874fa76af76372001e1c23b4f4f8535494e264
MRNA,2025-08-01T13:46:00+00:00,"Coinbase, ExxonMobil & Chevron, Moderna: Trending Tickers",Yahoo,https://finnhub.io/api/news?id=48c6dc65dd29f6eb79745eb64243f2b64943e8f4239d97a5dbdb650a70f88292
MRNA,2025-08-01T12:44:55+00:00,Moderna's Key Patent Win Overshadowed By Gloomy Outlook,Yahoo,https://finnhub.io/api/news?id=212fa4f3d46b9e154a74420c485eefe25fcc53dce03633dfcea5fb8e55225e1f
MRNA,2025-08-01T12:18:43+00:00,"Exchange-Traded Funds, Equity Futures Lower Pre-Bell Friday Amid Revived Trade War Fears",Yahoo,https://finnhub.io/api/news?id=bad25a2ed5f7f4ff610194dc76409ba7f1c1655952c6d227e8736d1385811956
MRNA,2025-08-01T12:10:01+00:00,"Moderna (MRNA) Reports Q2 Loss, Beats Revenue Estimates",Yahoo,https://finnhub.io/api/news?id=9a93211dec14a15c6b0d658a81b1798a18aba8ddb3adcaa2610e37620b6041fa
MRNA,2025-08-01T11:56:32+00:00,"Moderna, Inc. (MRNA) Q2 2025 Earnings Call Transcript",SeekingAlpha,https://finnhub.io/api/news?id=a956bbbb37dd25fbf69d6ae761a697014fc70fd592b02d58c67c2addbc641ba1
MRNA,2025-08-01T05:57:50+00:00,"Stock Losses Extend on Tariffs, Swiss Franc Drops: Markets Wrap",Yahoo,https://finnhub.io/api/news?id=8999e4b029e23177973986e041c5070c8ff614e9174833075963d538a9ba9015
