ticker,published_utc,title,publisher,url
SNOW,2025-11-12T12:02:40+00:00,BTIG Maintains Snowflake (SNOW) Buy Recommendation,Fintel,https://finnhub.io/api/news?id=0fbf746d8c80ebb0a9e7e7dde8e034919133048609ce58efe7c9c3f686bb0630
SNOW,2025-11-11T06:19:00+00:00,"The Zacks Analyst Blog Palantir, Snowflake, Datadog, Atlassian and Zoom Communications",Yahoo,https://finnhub.io/api/news?id=eb59a2aac84e04391472d4cabc84baaba9d7481799a7ca3312e39a89d686d3dd
SNOW,2025-11-10T22:45:02+00:00,Snowflake Inc. (SNOW) Surpasses Market Returns: Some Facts Worth Knowing,Yahoo,https://finnhub.io/api/news?id=d917381bc27fc299983e9b4fb659859d4db8812e11da7700dbf5dd8b70a1db0c
SNOW,2025-11-10T20:03:00+00:00,dmTECH modernizes customer engagement with SAS Customer Intelligence 360 and Snowflake,Yahoo,https://finnhub.io/api/news?id=5b7e6894a302a6ec9d98a8549f8811fb2b53e79bef8772a780574f65eabcaa31
SNOW,2025-11-10T14:54:00+00:00,5 AI-Powered Internet Software Giants to Power Your Portfolio in 2026,Yahoo,https://finnhub.io/api/news?id=9af5db49519a8ceccab67515d59fdbea4fa5ce9c02171e735d1a38a1a3b93012
SNOW,2025-11-10T13:15:03+00:00,Monday.com (MNDY) Surpasses Q3 Earnings and Revenue Estimates,Yahoo,https://finnhub.io/api/news?id=a8b7a2e4066c5c79b81f233c8bc26bdb4e982de24a55e34cc9eca19fcfd77ee3
SNOW,2025-11-10T12:47:17+00:00,"AI Stocks Hit Turbulence, Retreat From 2025 Highs Amid Capital Spending Boom",Yahoo,https://finnhub.io/api/news?id=194ec8787f5a20ea0982dec787a21221fca38f82c08ee7cd5962e01dcd6e61fb
SNOW,2025-11-09T14:12:00+00:00,Could This Be the Most Overlooked Way to Profit From the Artificial Intelligence Software Boom?,Yahoo,https://finnhub.io/api/news?id=1887da6328a4c16106a7e666c73000d61e6fd89e1d3493c1da7678f72a109f06
SNOW,2025-11-09T05:09:24+00:00,Snowflake (SNOW): Assessing the Valuation After Latest Quarterly Results Spark Investor Interest,Yahoo,https://finnhub.io/api/news?id=4e3a7ce37988baed3597bc8fbb90e72a713f7511300087a89b7016bd20096d11
SNOW,2025-11-07T22:36:00+00:00,"McDonald’s Stock Challenged By a Tougher Economy, Analyst Says. Plus, Marriott, Snowflake, and More.",Yahoo,https://finnhub.io/api/news?id=390e82fc85caae9bf63148b6463477bd144e5ac1a509a379ba484b59d7461efb
SNOW,2025-11-07T20:22:33+00:00,Sealy Mattress Maker At New Highs; Snowflake And Aerospace Play Also In Buy Zones,Yahoo,https://finnhub.io/api/news?id=48f14e5ce1ea6c7576c57490a6a0923d6fa0054d0a9fc79bd2c08150c28d9c90
SNOW,2025-11-06T22:30:03+00:00,VTEX (VTEX) Meets Q3 Earnings Estimates,Yahoo,https://finnhub.io/api/news?id=6bf6fad995b9d96e4994517e4b1c8baec07215583dcb55c37b3bb88358444768
SNOW,2025-11-06T17:31:00+00:00,Will Atlas Momentum Help MDB Maintain Its Subscription Growth Trend?,Yahoo,https://finnhub.io/api/news?id=75472382f99dc78ee56b408f96ed27af5dda7e0d431fb0a0c2af77767031a57b
SNOW,2025-11-06T17:02:00+00:00,3 Key Reasons to Buy Snowflake Stock Beyond the 71% Surge YTD,Yahoo,https://finnhub.io/api/news?id=e93ba9f77f32b6f59ee971688ac5ca1fa02fb644d1189d8dd23a3bdae021c396
SNOW,2025-11-06T16:06:00+00:00,Datadog Stock Surges 21%. Why This Software Maker’s Earnings Have Investors Excited.,Yahoo,https://finnhub.io/api/news?id=60c8a3276f76fa755e63961130a6016d4b7f5ecf0f97509a10bdb97a5b2619c8
SNOW,2025-11-06T12:59:50+00:00,BST: AI-Focused Portfolio With A Monthly Payout,SeekingAlpha,https://finnhub.io/api/news?id=8919fb4ed5998fde95373add2d0dffc3ec0fc9d77f896532f0299023ac2b44bc
SNOW,2025-11-05T15:53:56+00:00,"SAP, Snowflake partner to unite cloud products",Yahoo,https://finnhub.io/api/news?id=161de569700a721bd4c5220aeb0b2d6715dc55918d4d24a2db64e33c7b42333b
SNOW,2025-11-05T07:00:46+00:00,NAVER Corp (XKRX:035420) Q3 2025 Earnings Call Highlights: Robust Revenue Growth Amid Strategic ...,Yahoo,https://finnhub.io/api/news?id=dc2b0bc1b2ba4d7c71d7e42f6580760607a21d52d1a22afe041e936ade63be05
SNOW,2025-11-04T21:59:39+00:00,"Snowflake Pushes New Partnerships With Google, SAP",Yahoo,https://finnhub.io/api/news?id=300790101666c353a918049fe20b0f7ace38f35230f6e7a6cdd1aecebfcc70d1
SNOW,2025-11-04T20:40:43+00:00,"Snowflake, PagerDuty, monday.com, Oracle, and HubSpot Stocks Trade Down, What You Need To Know",Yahoo,https://finnhub.io/api/news?id=8297f7888db0d9df7a8aaa08eec428aaa667f92879898644a3cd557982af7eea
SNOW,2025-11-04T17:33:00+00:00,BLZE Set to Report Q3 Earnings: How Should Investors Play the Stock?,Yahoo,https://finnhub.io/api/news?id=c92acdfe0309b5b4d5abace3d97e261d3e35cf5fb86f735902c91575ed3e2cf3
SNOW,2025-11-04T15:00:00+00:00,SAP Empowers Developers to Drive the Business AI Revolution,Yahoo,https://finnhub.io/api/news?id=7acbc47feccc3b660ed1ac6963d23c40959aa6675dae6e038e5e879a820b4030
SNOW,2025-11-04T15:00:00+00:00,SAP and Snowflake Unleash the Power of Data and Enterprise AI Across the Business Data Fabric,Yahoo,https://finnhub.io/api/news?id=ca0aa7b84444b696ca9d47b6651dcae97529a5beb205d3d268185070cc9605b1
SNOW,2025-11-04T14:10:00+00:00,Snowflake Intelligence Brings Agentic AI to the Enterprise,Yahoo,https://finnhub.io/api/news?id=33170a9b6b5e8e1a65a9a8212e142596829deb9d387ab5761403853591108eff
SNOW,2025-11-04T14:05:00+00:00,Snowflake Unveils New Developer Tools to Supercharge Enterprise-Grade Agentic AI Development,Yahoo,https://finnhub.io/api/news?id=e4da0986b5b70ba22f2355362af437bfc1938501e47d0412ef43408e6f52f60a
SNOW,2025-11-04T14:00:00+00:00,Snowflake Delivers the Enterprise Lakehouse with Enhanced Open Data Access and Flexibility for Agentic AI,Yahoo,https://finnhub.io/api/news?id=094af8dcb381446ea805e9da154fdf8e364646708ce534c71781ab516a13881b
SNOW,2025-11-04T12:35:02+00:00,Spotify (SPOT) Q3 Earnings and Revenues Beat Estimates,Yahoo,https://finnhub.io/api/news?id=a6934221c8b621a7ffdbab834ec735f8a996fa1fdb3ce8cfef4ab9c63be879c0
SNOW,2025-11-04T12:16:48+00:00,Palantir: Why The 7% Selloff Is A Strong Buy Opportunity,SeekingAlpha,https://finnhub.io/api/news?id=6821e50d1e239b582925a68e23e8cc18410b1c89f62316456dd86712aa046bed
SNOW,2025-11-04T11:30:00+00:00,"CGI advances in Partner Status with Snowflake, ServiceNow, and UiPath, accelerating client outcomes in AI, data and business automation",Yahoo,https://finnhub.io/api/news?id=74dd6ccd49111e53b9cd1a664587f35f2c88296d95ccfd70a5e4f9541816f067
SNOW,2025-11-04T11:22:01+00:00,Deloitte Tax and Snowflake expand partnership,Yahoo,https://finnhub.io/api/news?id=6be9c402f008115fd834c18aef8b531b997c971d20179850fe3ac5ca7b62a333
SNOW,2025-11-03T16:42:03+00:00,"Palantir's Q3 Results Likely to be Major Step in 'Right Direction' in AI Revolution, Wedbush Says",Yahoo,https://finnhub.io/api/news?id=e15cc19bc77e8aa2167c7d79cc69cf4b65be1aba6378f15be1b71bfbb519ef98
SNOW,2025-11-03T14:10:00+00:00,Snowflake to Present at Upcoming Investor Conference,Yahoo,https://finnhub.io/api/news?id=36b673b8535aaad442eb6ff9213e60daa6c4bd21237292840f4a6600903554bf
SNOW,2025-11-03T14:05:00+00:00,USA Bobsled/Skeleton Taps Snowflake Intelligence to Redefine Speed and Precision on Ice,Yahoo,https://finnhub.io/api/news?id=02baa10fc130dbf4b67d1129c24ddf8d25a4ff8bcfcb85c2aefd011c0e27ce8d
SNOW,2025-11-03T14:02:00+00:00,Deloitte Expands Alliance With Snowflake to Enhance Tax Data Management Solutions,Yahoo,https://finnhub.io/api/news?id=c63fc994937e116e7698eb77423b9128849af12128f1178a30f80338ac5b0537
SNOW,2025-11-03T14:00:00+00:00,"Snowflake to Announce Financial Results for the Third Quarter of Fiscal 2026 on December 3, 2025",Yahoo,https://finnhub.io/api/news?id=e5a4720320462607917cecfc3d9fa88ea334336d9f303822450b7fb672dc7936
SNOW,2025-11-03T13:09:09+00:00,Is Snowflake’s Soaring Price Justified After Major Cloud Partnerships?,Yahoo,https://finnhub.io/api/news?id=3ebdf67e39c7495cced6d43bb21a8ab1c5700a880d04db67907572980e47f139
SNOW,2025-11-03T12:00:22+00:00,"Snowflake Inc.'s (NYSE:SNOW) high institutional ownership speaks for itself as stock continues to impress, up 3.4% over last week",Yahoo,https://finnhub.io/api/news?id=5946c559b42c7479664a87cdbcc158c4a30ffc8bf8c607b4b7e4a8afcad57f81
SNOW,2025-11-02T22:05:00+00:00,Best And Worst Stocks And ETFs Through October,SeekingAlpha,https://finnhub.io/api/news?id=596767e13d34a784a158a95a4044312cbba2c5a6989cb2aea4741c3376130be3
SNOW,2025-11-02T19:53:40+00:00,Snowflake's CRO Mike Gannon's Instagram Interview With Influencer James Dumoulin Triggers SEC Filing,Yahoo,https://finnhub.io/api/news?id=6732dc0fdb33a81fdd7b6aa1593e933d9e0c5c05ed476b61516b8a50ff4f8287
SNOW,2025-10-31T13:00:04+00:00,Snowflake Inc. (SNOW) Is a Trending Stock: Facts to Know Before Betting on It,Yahoo,https://finnhub.io/api/news?id=a7cce91124e9479e867b7e162333232045e7696d388ab152680788dbab97a2d7
SNOW,2025-10-31T09:43:00+00:00,"Citizens JMP Raises Snowflake (SNOW) PT to $325, Reiterates Outperform Rating",Yahoo,https://finnhub.io/api/news?id=2920f2a31047568bf7c2ce4c770a7d9ac972d4de4004f5e900c2064c598ba649
SNOW,2025-10-30T18:11:00+00:00,"Microsoft Q1 Earnings & Revenues Beat on Cloud, AI Strength",Yahoo,https://finnhub.io/api/news?id=016658114ef3393a935b5996f21b39d9cc950d7e3c36211b5b74825cf1d790c7
SNOW,2025-10-30T16:09:36+00:00,Snowflake (SNOW) Sees $10B Revenue in Sight — Wall Street Boosts Price Target,Yahoo,https://finnhub.io/api/news?id=a4cd578d8a7c5623b35c13db21e3de78ea8d86697368d8a00bec2d8a9c609e0e
SNOW,2025-10-30T14:21:34+00:00,Citi Raises Palantir (PLTR) Price Target Ahead of Earnings; RBC Warns on Valuation,Yahoo,https://finnhub.io/api/news?id=e5ea29f6122680b846ee59f8b073a03c28d50cba21a46c5aa97911c0a0ef8e08
SNOW,2025-10-30T12:43:39+00:00,"Palantir, Snowflake tie-up to yield ‘AI promises,’ Snowflake CIO says",Yahoo,https://finnhub.io/api/news?id=ca81f84cccc58c97c8cf57125da63c1f83a5058e645246ce91dba86b1eabc98b
SNOW,2025-10-30T12:00:30+00:00,"For Snowflake Insiders, Selling US$6.3m Of Shares Was A Smart Move",Yahoo,https://finnhub.io/api/news?id=87d37e2e4c20126da9519cefb20319bb69d52aa364bf08bf703a19670221ad5b
SNOW,2025-10-29T16:50:00+00:00,Backblaze vs. Snowflake: Which Cloud Data Stock Is the Better Buy?,Yahoo,https://finnhub.io/api/news?id=ad8559c8719b6af8f5485fd485dc8e003b6edd6b0a078624cb89058672fad89e
SNOW,2025-10-28T23:59:43+00:00,JMP Securities Maintains Snowflake (SNOW) Market Outperform Recommendation,Fintel,https://finnhub.io/api/news?id=2bcc0f8f5851d4856fe1e220556a2f7bef8406d8b74be9a731f63430aaf770b8
SNOW,2025-10-28T21:21:40+00:00,Is Datadog (DDOG) The Best AI SaaS Stock to Buy?,Yahoo,https://finnhub.io/api/news?id=206fab53ee5eccabd9f0451c8b555f7039bf25034df071fdaa423d9dc7aaba02
SNOW,2025-10-28T15:21:39+00:00,Analyst Explains How AI Will Benefit Snowflake (SNOW),Yahoo,https://finnhub.io/api/news?id=c9714a87610885517963124304c29bda890358d43deb89661f1215986c4d1674
SNOW,2025-10-28T14:00:00+00:00,Ensono Launches AI & Innovation Division to Power Next-Generation Managed Services,Yahoo,https://finnhub.io/api/news?id=0e586c139a4e96de19af3b14b24744e192daea76ef33f013e1b260c7f686c79a
SNOW,2025-10-28T12:39:00+00:00,Balancing Innovation and Income: A2 Fund Shares 2026 Market Outlook Following 75% YTD Fund Growth,Yahoo,https://finnhub.io/api/news?id=1d533564b1da34b74b7626beb0d72d022ea58f63dea656a7d4c034b135600ba8
SNOW,2025-10-28T12:38:59+00:00,Snowflake Reaffirms Outlook After Executive's Social Media Remarks,Yahoo,https://finnhub.io/api/news?id=bb6252c13b6228227bd3a159c37d7b7a5f41f80fa8e747f2b73349639d454fe6
SNOW,2025-10-28T11:00:02+00:00,2 Bull Call Spread Trade Ideas for Snowflake this Tuesday,Yahoo,https://finnhub.io/api/news?id=b23d492a145d16903f1f09a7b1e5d2e0998542eb8e2f9a4ca4b1a8e8a0c857f4
SNOW,2025-10-28T04:36:30+00:00,3 Large-Cap Stocks with Promising Prospects,Yahoo,https://finnhub.io/api/news?id=363ae857444948d007d512177dbc2a6e957ea340980a8ac828fa1a631ffb31fd
SNOW,2025-10-27T13:00:00+00:00,JPXI Launches TDnet Disclosures on Snowflake,Yahoo,https://finnhub.io/api/news?id=2560ab2cb38713ac49bceabdd8d859559c1617ae4eac66654b0461989444a774
SNOW,2025-10-27T12:50:00+00:00,Can Salesforce's Data Cloud Business Offset Slowing Growth Trends?,Yahoo,https://finnhub.io/api/news?id=e25d6a7c4a5dc03b354f7cb397c699a3d0b201d613f979dd71ee28748d4f2514
SNOW,2025-10-27T12:49:00+00:00,Liberate Earns Spot on Redpoint's Prestigious AI64 List of Top Emerging Enterprise AI Companies,Yahoo,https://finnhub.io/api/news?id=7a96d05964dc0a043e613388b607cdab818e1a8ba190fc4315731b4ce626b1e5
SNOW,2025-10-26T18:45:00+00:00,Prediction: 1 Growth Stock Set to Bounce Next Year,Yahoo,https://finnhub.io/api/news?id=d158b568f9ee80b0ea38e076ddfd7bec72b16d09c70a1916b7d4f7c42f49e87f
SNOW,2025-10-26T12:41:46+00:00,"Apple, Google, Meta, Amazon, Microsoft Earnings Due; Fed Rate Cut, Trump-Xi Ahead",Yahoo,https://finnhub.io/api/news?id=1b7b30d090ca6562aad6d45ba9df30be1cb37f93357e46595afd82ef5635e651
SNOW,2025-10-26T03:13:07+00:00,Snowflake (SNOW): Assessing Valuation After Wave of High-Profile AI Partnerships and Product Innovations,Yahoo,https://finnhub.io/api/news?id=34ac27db9e2df5790cf8edc9765e8722a6f5a49c2023782ff6d63c8eaf8fbe84
SNOW,2025-10-25T12:00:56+00:00,"Tesla, AI Plays Lead Five Stocks Near Buy Points Without This Big Risk",Yahoo,https://finnhub.io/api/news?id=f9ccd9c8434b4b35722152095959f25113c51ea5458d206d80f7a09c49b951f5
SNOW,2025-10-24T20:55:00+00:00,"Tech, Media & Telecom Roundup: Market Talk",Yahoo,https://finnhub.io/api/news?id=214b678efa064036a2beaf3690a688980eaa5d6ad0426ea379888801d7d3edba
SNOW,2025-10-24T19:17:00+00:00,6 Stocks to Sell in a Hot Market,Yahoo,https://finnhub.io/api/news?id=10ef61fc65945b5bb6234b5e177200502eb136caf6df384ee067bc1c47325aed
SNOW,2025-10-24T14:00:10+00:00,Snowflake: Big Market With An Equally Big Valuation,SeekingAlpha,https://finnhub.io/api/news?id=eb6b7ca2bb3630e0fe893fa177b8af63b2bdbe92046b124481582e8355244fdb
SNOW,2025-10-24T12:39:19+00:00,Snowflake: Strong Momentum And A Reasonable Valuation,SeekingAlpha,https://finnhub.io/api/news?id=aea866a1ab906c0477df0ed1e9445fb8c42808ca2ed50718ab0be582c9750164
SNOW,2025-10-24T12:12:53+00:00,"Dow Jones Futures: Intel, AI Play Jump After Bullish Tesla Move; Trade Talks, CPI In Focus",Yahoo,https://finnhub.io/api/news?id=bb5919be2e5d53fa8c016d91ce66695093b97e66b992b2ae38dabfca85e8c37c
SNOW,2025-10-23T19:29:00+00:00,Maxima Named to Redpoint’s AI64: Celebrating the Top Emerging Enterprise AI Applications,Yahoo,https://finnhub.io/api/news?id=ff01cb87945303062b1fb73a0bc3bc477c430b0e6abec82e773d9fb2223fccbe
SNOW,2025-10-23T18:56:35+00:00,"Wedbush Raises Snowflake (SNOW) Price Target to $270, Citing Expanding AI Integration",Yahoo,https://finnhub.io/api/news?id=19ea384a57b38d858aeb96e4e72bf0e9a7699b8acfb36f68d7a6ca0ab04ed99c
SNOW,2025-10-23T18:21:20+00:00,Expanded AI Collaborations Could Be a Game Changer for Snowflake (SNOW),Yahoo,https://finnhub.io/api/news?id=c11e8b26cd201581c2fbf35d375c271fa2f3d092b4202cb8f3890cedc462629c
SNOW,2025-10-23T16:41:00+00:00,"Buy Snowflake Stock, J.P. Morgan Says. It’s Critical for AI Agents.",Yahoo,https://finnhub.io/api/news?id=05baaa46f4f109edd93e66f744db89edf487b7808fbbb0e05415bd216c036acb
SNOW,2025-10-23T12:23:00+00:00,Can This Stock Be the New Snowflake of the Next Decade?,Yahoo,https://finnhub.io/api/news?id=443cf83086b67a7570573586ec40686b649bf1c9aad27d6528c79143cb27db37
SNOW,2025-10-23T11:29:10+00:00,WTW’s Radar platform integrates with Snowflake,Yahoo,https://finnhub.io/api/news?id=8517e6493d251b88f64c9f4bea2588df103c7730359696f3453440d3505f119c
SNOW,2025-10-22T19:20:48+00:00,"Fastly, JFrog, Snowflake, DigitalOcean, and Amplitude Shares Plummet, What You Need To Know",Yahoo,https://finnhub.io/api/news?id=5bd0de32d2f94a2b1601d96b783121324e61950136328c2643651b94d5fa8054
SNOW,2025-10-22T18:34:53+00:00,Snowflake Inc. (SNOW): A Bull Case Theory,Yahoo,https://finnhub.io/api/news?id=a58a7444c03629fdb3322e7a7aa0f6665c54a17472eb892501e5e0ee420f55f4
SNOW,2025-10-22T12:55:47+00:00,Jim Cramer Says Amazon “May Actually Be Reaching a Bottom”,Yahoo,https://finnhub.io/api/news?id=dd999fcf9d56862b8989493ffcb0bbc26b73d8453ab4e9d90c10dba86a60bf3a
SNOW,2025-10-22T12:55:00+00:00,NYSE Content Advisory: Pre-Market Update + Uniphore raises $260 million to boost AI leadership,Yahoo,https://finnhub.io/api/news?id=1bf35da0fd69a0adf1621553d15d7a7671992bea3331ffe82edcbcb51a7b876d
SNOW,2025-10-22T12:00:00+00:00,WTW Radar integrates with Snowflake to deliver effortless data integration and real-time insights,Yahoo,https://finnhub.io/api/news?id=e9bb3de86768c21ab39383812cec672e5eed3269e25fcda34454998f63a3d65e
SNOW,2025-10-22T11:30:00+00:00,"AI and Data Leaders NVIDIA, AMD, Snowflake, and Databricks Invest in Uniphore’s Series F to Accelerate Its Leadership in Business AI",Yahoo,https://finnhub.io/api/news?id=2435f0b76cc474f396bb05c7cda151152017f09237c1e5a4e35ffdc49df71966
SNOW,2025-10-22T09:17:27+00:00,"Oppenheimer Raises the PT on Snowflake Inc (SNOW), Keeps a Buy Rating",Yahoo,https://finnhub.io/api/news?id=54c6bffb8681e497d439e8a48a01b7fdee703ff72f7cebd5460d67b325d9613f
SNOW,2025-10-21T16:18:43+00:00,Wedbush Sees Snowflake Entering Next Phase of AI Growth,Yahoo,https://finnhub.io/api/news?id=33052c25486fd6f417e03d6a4249f001dade456f8dfe6e461fa3c07b3e6ee0b1
SNOW,2025-10-21T14:14:58+00:00,Is the Snowflake AI Cloud Partnership Accelerating Palantir’s Enterprise Ambitions for PLTR?,Yahoo,https://finnhub.io/api/news?id=0b0b129800723db1de331dc4b08882a431300cdda25989c8f303fdd2c02f8a75
SNOW,2025-10-21T13:58:19+00:00,Amazon Cloud Reputation Takes Hit After Outage Lasting 15 Hours,Yahoo,https://finnhub.io/api/news?id=52e2b4960dc26a53f84d007fadccf8036918a17bf847869465242640849a0c5f
SNOW,2025-10-21T09:53:01+00:00,William Blair Maintains a Hold Rating on UiPath Inc (PATH),Yahoo,https://finnhub.io/api/news?id=2182dcee429d07e924d4739bc17930b04a3653edbb95332faee933906bcdbb60
SNOW,2025-10-21T09:37:39+00:00,"Palantir, Snowflake Partner to Boost Enterprise AI and Analytics",Yahoo,https://finnhub.io/api/news?id=2c82bdceeffc9cc78cabc2c01d1bb7961d2e3dbb4930ed5b90d494c9c814a61a
SNOW,2025-10-21T01:32:12+00:00,"Snowflake's Growth Is Back, But The Train Has Left The Station",SeekingAlpha,https://finnhub.io/api/news?id=c96ddd919284374afb62d91a05933302a3f46c0e9c23c76cffe7add239f63cdb
SNOW,2025-10-20T22:39:00+00:00,Wedbush Maintains Snowflake (SNOW) Outperform Recommendation,Fintel,https://finnhub.io/api/news?id=9c561223ffa3d4239959b467226923a206b7b3ba797fd1310288cc72dd987d70
SNOW,2025-10-20T21:45:03+00:00,Snowflake Inc. (SNOW) Outpaces Stock Market Gains: What You Should Know,Yahoo,https://finnhub.io/api/news?id=51548e9dea89134142fe092d96f8c840d1f430f2ff65466c400223c1857cd516
SNOW,2025-10-20T19:43:59+00:00,Sector Update: Tech Stocks Gain Late Afternoon,Yahoo,https://finnhub.io/api/news?id=09c5be31a0fe670604de9d9e6344cde717775166265dbfa84efe5b5b814b9701
SNOW,2025-10-20T14:57:13+00:00,"Lululemon, Snowflake, Darden Restaurants: Top Analyst Calls",Yahoo,https://finnhub.io/api/news?id=5d5046df4105103358bd1ff5dec5f8785f205b1ebe090103fbc03175e539f0a0
SNOW,2025-10-20T09:00:48+00:00,"Palantir Technologies: Stretched Or Not, This AI Rally Isn't Done Yet",SeekingAlpha,https://finnhub.io/api/news?id=6532904b91f75602df06cfdf6d3e0e871e87a835c824d2e639b3a7a7db796bbd
SNOW,2025-10-19T20:46:16+00:00,Stock Volatility Has Increased Since The 10/11 Plunge - Solution? AI Dilution,SeekingAlpha,https://finnhub.io/api/news?id=8ba0689d69784a8cff3e12077ac7b88e2f4af7ccc37eafde47192575dbdc3a47
SNOW,2025-10-19T11:00:11+00:00,Snowflake (NYSE:SNOW) Has Debt But No Earnings; Should You Worry?,Yahoo,https://finnhub.io/api/news?id=95a49b21ee55d701fda16c9e757900f585a0433a3befdd281857d8d84d000f6e
SNOW,2025-10-17T15:36:20+00:00,"Is Palantir Stock a Buy, Sell, or Hold on New Snowflake Partnership News?",Yahoo,https://finnhub.io/api/news?id=fe1c82ffca273859aec8217544c0590a13d35b5282c2b506bd6e94a1d5d107b7
SNOW,2025-10-17T14:15:00+00:00,2 Millionaire-Maker Artificial Intelligence (AI) Stocks,Yahoo,https://finnhub.io/api/news?id=117486a184b762948ddc32e45884ce00bfbc845ed96a04a566d7108f22226e8b
SNOW,2025-10-17T13:45:00+00:00,Better Artificial Intelligence (AI) Stock: Snowflake vs. Palantir,Yahoo,https://finnhub.io/api/news?id=3bdca893c12a9cb411ada5c9a92947b6fd26d06300d11407cb331fa6be588923
SNOW,2025-10-17T12:03:53+00:00,Rosenblatt Maintains Snowflake (SNOW) Buy Recommendation,Fintel,https://finnhub.io/api/news?id=b0b8a681260426e7ab6370372cc35373069e705478720f195a26b8e33f14d910
SNOW,2025-10-16T20:50:10+00:00,Snowflake Is Partnering with Palantir. Does That Make SNOW Stock a Buy Now?,Yahoo,https://finnhub.io/api/news?id=f3b67065e85ee0b0f532146b4ee1efc98bcd32ad6e1cdf174030a2646e68f629
SNOW,2025-10-16T20:31:54+00:00,"Stocks to Watch Thursday Recap: Nestlé, TSMC, J.B. Hunt, Salesforce",Yahoo,https://finnhub.io/api/news?id=3b77619ba29fdafd6e24d8cf8b1bcea67176d1b9ca05fd5a53458488874d3ce3
SNOW,2025-10-16T17:39:48+00:00,Sector Update: Tech Stocks Mixed Thursday Afternoon,Yahoo,https://finnhub.io/api/news?id=a7907c8ff14fc7bf04fc2674f682f820b18b8049ac4f95a1be67fcb27efcefd6
SNOW,2025-10-16T16:38:30+00:00,"Palantir, Snowflake Reverse Down Amid New AI Data Partnership",Yahoo,https://finnhub.io/api/news?id=18c62f52475aa85330170fda0a4ace2e4123cc0ed45a94f0e02e5e9cd743a1fd
SNOW,2025-10-16T14:55:00+00:00,"Snowflake & Palantir, Travelers, J.B. Hunt: Trending Tickers",Yahoo,https://finnhub.io/api/news?id=b83389da367ac78fdee09c5d93cd25b5c521a83c935f7646fbdf4f66adbbe196
SNOW,2025-10-16T13:27:53+00:00,Wall Street Lunch: Can Retail Therapy Save The Holidays?,SeekingAlpha,https://finnhub.io/api/news?id=55f5904c0cdc31b379a26758aee7258abe49c6de0bcec35516af15c4d9798cd0
SNOW,2025-10-16T12:34:00+00:00,Snowflake Stock Jumps on Palantir AI Partnership,Yahoo,https://finnhub.io/api/news?id=efd3a301a1b70c794da4f90ae6c184bf218f18e5de33ad40fc3a051ac8c29143
SNOW,2025-10-16T12:22:06+00:00,"Palantir Rises, Snowflake Jumps On New AI Data Partnership",Yahoo,https://finnhub.io/api/news?id=89f7fc48f059882ab84a2cd5df90281e2a1d12a7e0641cf24f96cb4dbef9b6e0
SNOW,2025-10-16T12:00:44+00:00,Artisan Mid Cap Fund Trimmed Snowflake (SNOW) Following a Strong Performance And An Elevated Valuation,Yahoo,https://finnhub.io/api/news?id=220c0a8db6344171732ed97469a71485589281c4cbe55f8d82d61272c17a278a
SNOW,2025-10-16T10:59:00+00:00,Snowflake and Palantir Announce Strategic Partnership for Enterprise-Ready AI & Analytics,Yahoo,https://finnhub.io/api/news?id=33f794913e221735aa22d5610f06d8206d36e5ef83e7223d5f8abba0eac0a1f2
SNOW,2025-10-15T23:25:56+00:00,Snowflake's Cash Flow Shows A Healthier Valuation Picture,SeekingAlpha,https://finnhub.io/api/news?id=b4b314245ab43adb804359d0e4b828cedd38936beb2b723b5c28e22031d39358
SNOW,2025-10-15T15:30:00+00:00,Campfire Raises $65 Million Series B to Redefine How Finance Works in the AI Era,Yahoo,https://finnhub.io/api/news?id=d27b79d1697035c75273b2d6f7bdd8625ac2392730c3c3e4d799069189ad7e35
SNOW,2025-10-15T15:09:00+00:00,Zip Named to LinkedIn’s 2025 Top Startups List in the U.S.,Yahoo,https://finnhub.io/api/news?id=6d077c5a4f14c10887e9064aaba81dccd0fe11ff2e5c814bbafd753703dac831
SNOW,2025-10-15T14:15:17+00:00,Does Snowflake’s 96% Surge Signal Strong Growth or Investor Euphoria in 2025?,Yahoo,https://finnhub.io/api/news?id=bcc4444854e38f717546bc30f8b0edbbe662f2199af4f93ad03674166001afc5
SNOW,2025-10-15T13:00:12+00:00,Investors in Snowflake (NYSE:SNOW) have seen respectable returns of 96% over the past year,Yahoo,https://finnhub.io/api/news?id=6106749b43b5219f57c7fcfd7a2047ca4c8630f67aa8cb2a7ef632b6021f6c74
SNOW,2025-10-14T15:27:05+00:00,Snowflake Stock: Try This Iron Condor Trade With A Bullish Tilt,Yahoo,https://finnhub.io/api/news?id=8bafe55281005d6c3efa7c3e0868adb3990b1a70b59dd87e358d0ce08f2a440b
SNOW,2025-10-14T13:30:03+00:00,Wall Street Analysts Think Snowflake (SNOW) Is a Good Investment: Is It?,Yahoo,https://finnhub.io/api/news?id=0194170c9b70db81678c1492a054e533eea82728e27ba23ac8f0e4ab154c5014
SNOW,2025-10-14T13:05:00+00:00,Verato to Host Expert Panel on Master Data Management and AI-Ready Transformation at Gartner® IT Symposium/Xpo™ 2025,Yahoo,https://finnhub.io/api/news?id=57ca72b5295e0cf0d648e794b6ffe066c0d182883c32d9125a9782ef16c62008
SNOW,2025-10-14T13:00:00+00:00,Cognite and Snowflake Form Strategic Partnership to Unify Industrial Data for Enterprise-Wide AI at Scale,Yahoo,https://finnhub.io/api/news?id=dc929b58ea24a521bf4827977c6d0316f56fd3d23157a3a581090243bb3ee561
SNOW,2025-10-14T12:48:30+00:00,"Palantir: Understand The Moat To Understand The Valuation, Let The Story Play Out",SeekingAlpha,https://finnhub.io/api/news?id=fa41d2d5719fc39ad5d731e44643be7d8eb9b6a835f44f67b296ecbb00d71032
SNOW,2025-10-14T08:00:00+00:00,Palantir: $1 Billion Quarter Changes Everything (Rating Upgrade),SeekingAlpha,https://finnhub.io/api/news?id=97dae12f49ae14ea866cf3f0b416e31d6e56011f72d6d0d517bab07356f0650e
SNOW,2025-10-14T07:18:00+00:00,UiPath and Pilgrim's Pride have been highlighted as Zacks Bull and Bear of the Day,Yahoo,https://finnhub.io/api/news?id=b7e172859302cb4fa88ffcf8da757cc4f6f7d7b1eca39fba22d6a612b6ec3dd3
SNOW,2025-10-14T07:00:00+00:00,Artisan Mid Cap Fund Q3 2025 Commentary,SeekingAlpha,https://finnhub.io/api/news?id=335246dbc5e6017bf79a3d9dca9caa2f586a6e2a5780ba11d8a74c55f8339d9a
SNOW,2025-10-13T17:56:43+00:00,Snowflake Looks Deeply Undervalued Here Based on Its Own FCF Margin Analysis,Yahoo,https://finnhub.io/api/news?id=e99f21bac63731bfcb2eb801beddb42b894a44333712cd833ce8caa2367ca9d4
SNOW,2025-10-13T16:44:10+00:00,Breakout Watch: This AI-Fueled Palantir Peer And Nvidia Partner Is No Flake,Yahoo,https://finnhub.io/api/news?id=334108981a25d7c4983ac1b1a960f200639eef4552fbbc3dbe9036c443870781
SNOW,2025-10-13T13:33:00+00:00,Prediction: Geopolitical Tensions Could Create the Next Wave of AI Winners,Yahoo,https://finnhub.io/api/news?id=d1667bae5e94fc6655e3833c76ba2aebb2a30b1355621cd06019e600c0c7ec9a
SNOW,2025-10-13T13:28:50+00:00,Snowflake Launches Cortex AI for Financial Services with Secure AI Capabilities,Yahoo,https://finnhub.io/api/news?id=0309150500150b3ab099d883ff44556af9747a0d43755cc564d7a62b1eb08432
SNOW,2025-10-13T12:07:28+00:00,Fee-Fi-Fo-Fum: Is A Giant Crash Brewing For AI Stocks?,Yahoo,https://finnhub.io/api/news?id=74506bbbaec73cf9b944e2b763325217ea4cdae2d3eb1fc3b2512039f21a132a
