ticker,published_utc,title,publisher,url
SNOW,2025-10-13T10:43:30+00:00,"China Resources Beer appoints new president, CFO",Yahoo,https://finnhub.io/api/news?id=b1cfdcc43dffea9b1354d65b2461785cf03b776e473966e8f8d3212904fa5cd6
SNOW,2025-10-13T04:50:53+00:00,1 High-Flying Stock on Our Buy List and 2 We Find Risky,Yahoo,https://finnhub.io/api/news?id=91f6a8f0b196b60b7acd1b99c3f2f14afa9ab7c60643e08dc1cfacdd4ddf29f4
SNOW,2025-10-13T03:54:04+00:00,"UBS Raises Price Target on Snowflake (SNOW) to $310, Maintains Buy After Industry Events",Yahoo,https://finnhub.io/api/news?id=f01222ae9bdf596018ab475d0e3e6e550f40e4ca99288a83f31dc6fc78df3f2b
SNOW,2025-10-13T00:09:57+00:00,MEGMILK SNOW BRAND (TSE:2270): Evaluating Valuation After Completing Major Share Buyback,Yahoo,https://finnhub.io/api/news?id=2b5790107920345c8166323da38cd416c49d6e45a7f93369a93e900a5cbd5c4a
SNOW,2025-10-12T17:03:04+00:00,Fee-Fi-Fo-Fum: Is A Crash Brewing For AI Stocks?,Yahoo,https://finnhub.io/api/news?id=93a0432b7cd73581a5e3a5c2be70106be2e497ee7caf0d69ae074c560f983c87
SNOW,2025-10-11T12:00:35+00:00,Oracle Leads Five AI Stocks Near Buy Points After Market Sell-Off,Yahoo,https://finnhub.io/api/news?id=beee8ce98e0ddfa6f74a1f9bdbd02184ee39e3bf7f3a1c0895ed316676197311
SNOW,2025-10-10T22:04:55+00:00,"Stock Market Week Ahead: Gridlock, Q3 Earnings And AI Conferences",Yahoo,https://finnhub.io/api/news?id=b6a4027b89c7bfa69a7e2d7befbe93a10bc3cadd8c0f37eec1d761694c63b705
SNOW,2025-10-10T21:45:05+00:00,Snowflake Inc. (SNOW) Sees a More Significant Dip Than Broader Market: Some Facts to Know,Yahoo,https://finnhub.io/api/news?id=a287aee208105304eb98b61d4c9661b366cefa529e77fc721a4ea8ce13d39768
SNOW,2025-10-10T15:21:54+00:00,"Snowflake: 25% Rally Hit My Target, Cloud, And AI Growth Story Isn't Over Yet",SeekingAlpha,https://finnhub.io/api/news?id=aee8e7d7bc6e944261b57839ef0e9753953fa2b36c4b75bdd254f072b47f38e4
SNOW,2025-10-10T08:09:28+00:00,Snowflake (SNOW): Valuation Insights Following Launch of Cortex AI for Financial Services Expansion,Yahoo,https://finnhub.io/api/news?id=0425f81972d1fee1a33258245e33807c26e533d51fa9a71b8f2f174d7c629cca
SNOW,2025-10-09T21:05:30+00:00,Snowflake’s (SNOW) Vertical AI Expansion Draws Analyst Optimism From Mizuho,Yahoo,https://finnhub.io/api/news?id=41ceaf4ee45f2e0a10f5c5dcb675deea065589d9ea72b2133a57af70280958d0
SNOW,2025-10-09T18:18:00+00:00,"SNOW Up 17% in Three Months: Should You Buy, Sell, or Hold the Stock?",Yahoo,https://finnhub.io/api/news?id=3539eb345677fd7da8eb92262dc2c12e68519a135d1d8cb20f52cec177627e90
SNOW,2025-10-09T18:01:05+00:00,"AI Party Is Not Over, Goldman Sachs Issues Top Picks",Yahoo,https://finnhub.io/api/news?id=6c253e870627ce50e740d0b925f91d90f2485cb2a70aba4d13be8a5662ef24ec
SNOW,2025-10-09T17:15:54+00:00,Why UiPath (PATH) Stock Is Up Today,Yahoo,https://finnhub.io/api/news?id=df8832403e9f1fabc5bcee5a5b6e4bb6e6f43205c757b0cba364becfb342b061
SNOW,2025-10-09T16:37:34+00:00,Datadog Stock Earns Relative Strength Rating Upgrade,Yahoo,https://finnhub.io/api/news?id=b4723f076fb11f42c2d63c5fd27443163d5cb3cadb6fb9209283d7f7b7a30b75
SNOW,2025-10-09T13:00:00+00:00,"Quad makes audience creation easier, faster and more precise with natural language AI prompts powered by Snowflake",Yahoo,https://finnhub.io/api/news?id=4dbfa7b49d53009bd3515cc35f80a176e3e37726241839f007ccbe7f02c196b8
SNOW,2025-10-09T13:00:00+00:00,SnapLogic Named a Leader in Snowflake’s 2026 Modern Marketing Data Stack Report,Yahoo,https://finnhub.io/api/news?id=2e94a3bf15d4652715ba42bf4df9a549291f600344c45bc73221c87031013f09
SNOW,2025-10-09T12:04:31+00:00,"Dow Jones Futures Rise; Nvidia Chipmaker Taiwan Semi Sales, Delta Air Earnings Strong",Yahoo,https://finnhub.io/api/news?id=beafaee43659e08113670ca1cfba4e4aa6bfdc13b2d1cc939147fb95e8c8cda5
SNOW,2025-10-08T20:49:29+00:00,Dow Jones Futures: Nvidia's Huang Spurs AI-Led Market To Highs; Tesla Has New Buy Point,Yahoo,https://finnhub.io/api/news?id=977244465a766dfdc85ed2e72cddbd44a0d04306bca190076dd102b0d8c01924
SNOW,2025-10-08T19:25:44+00:00,"Snowflake (SNOW) Stock Trades Up, Here Is Why",Yahoo,https://finnhub.io/api/news?id=409b35576ebd5d4d31a61d17902c2599467399a57087effa4d052a01d40db723
SNOW,2025-10-08T17:28:52+00:00,Snowflake Stock Rallies After Analyst Hikes Price Target,Yahoo,https://finnhub.io/api/news?id=fdeee749e7c4fdf02a12763a41eec0b5e46c27cb303af337ddf3f15f36f21964
SNOW,2025-10-08T08:59:49+00:00,"Stocks to Watch Wednesday: FICO, Equifax, Lucid, SoftBank",Yahoo,https://finnhub.io/api/news?id=f270fa3a3acba2fcd60cfc65c3351f45cb617adc430a4822d1773a4abab984c5
SNOW,2025-10-08T03:36:28+00:00,Confluent stock gains on report of potential sale amid AI-driven demand,Yahoo,https://finnhub.io/api/news?id=eea341072cc518ae14dedb65df4f977e377b3176f8726e1b14d3010c07d5843f
SNOW,2025-10-07T17:15:47+00:00,"Workday, BILL, Workiva, Zscaler, and Snowflake Stocks Trade Down, What You Need To Know",Yahoo,https://finnhub.io/api/news?id=9cd189d53189dcb73d656a9f6a672bb424db18c8031c0eb100fccd6e5f61e40a
SNOW,2025-10-07T17:04:00+00:00,Palantir Foundry: Driving the Next Wave of Enterprise Intelligence,Yahoo,https://finnhub.io/api/news?id=ab9b5f07c6aac056e2e68727a8b3317a8c9ae6804ad74e02c81b54994b8b97b9
SNOW,2025-10-07T15:19:00+00:00,Are C3.ai's High-Profile Partners Enough to Offset Missteps?,Yahoo,https://finnhub.io/api/news?id=4bc06e0fd0515dc6803ac2dd00c5da6dd3ed02aedde15e8438aec21fc21758c8
SNOW,2025-10-07T13:35:24+00:00,Will Snowflake's (SNOW) New AI Push Reshape Its Competitive Edge in Financial Services?,Yahoo,https://finnhub.io/api/news?id=c768612b5f21a4000fb5fc360a5dd16174350a54a85b78a3b424000837f42020
SNOW,2025-10-07T13:00:04+00:00,Here is What to Know Beyond Why Snowflake Inc. (SNOW) is a Trending Stock,Yahoo,https://finnhub.io/api/news?id=df8b69e4fa6890ee96bd21708733358f4659a8e92d7e13a26c88c45c03a01ffc
SNOW,2025-10-07T11:00:52+00:00,Is It Too Late To Consider Buying Snowflake Inc. (NYSE:SNOW)?,Yahoo,https://finnhub.io/api/news?id=6edddfe6d3b0fa46e4791f025dc5b2d9fb13eaca9c4f15ed68fe58e805707f59
SNOW,2025-10-06T17:20:00+00:00,Snowflake vs. Amazon: Which Cloud Data Stock Has an Edge Now?,Yahoo,https://finnhub.io/api/news?id=20532c2aee67081dda47dcdb6f354a17a6899e2cfd8c1fe94182239a760c65e7
SNOW,2025-10-05T09:18:00+00:00,UiPath Stock Jumps on Collaboration With Nvidia and Others. Is It Time to Buy the Stock?,Yahoo,https://finnhub.io/api/news?id=d95fb01ddc9d3564a818a0b7609a69d1b7d382e36f8c39d6905300509042393c
SNOW,2025-10-03T21:45:05+00:00,Snowflake Inc. (SNOW) Stock Dips While Market Gains: Key Facts,Yahoo,https://finnhub.io/api/news?id=d8a8d00f8a9606e03fe92666d8dcd3b498eaeb9812f1201d44724008b2648c43
SNOW,2025-10-03T13:00:11+00:00,"With 71% ownership in Snowflake Inc. (NYSE:SNOW), institutional investors have a lot riding on the business",Yahoo,https://finnhub.io/api/news?id=896d0fc218fad02f5d41dcf06a7c8c75d5f41a518717bfc913071614d2cb82d7
SNOW,2025-10-03T11:01:02+00:00,"Dow Jones Futures Rise, Tesla Tries To Steady; Jobs Report Shut Down",Yahoo,https://finnhub.io/api/news?id=7c6da13585ccffda6b0412eeac8121a9fa57cd650700c882bfc4ed64f1ae3ec5
SNOW,2025-10-03T03:06:51+00:00,Dow Jones Futures Rise; AI Stocks In Buy Areas As Tesla Sells The News,Yahoo,https://finnhub.io/api/news?id=93e91bcb606e8daed52c12a03a6b6fa1b9965ad9e20044f09f8bd6b7e8dd8cd6
SNOW,2025-10-02T20:32:29+00:00,How 'Snowflake Intelligence' Could Open Doors For Software Maker,Yahoo,https://finnhub.io/api/news?id=60dbb61ec460da107b2dd0c05c61291a106ca3092e5992976e48f13b1a5e6acd
SNOW,2025-10-02T17:06:24+00:00,"UiPath (PATH) Is Up 5.4% After AI Partnerships with NVIDIA, OpenAI, Google and Microsoft Announced",Yahoo,https://finnhub.io/api/news?id=07c2559b920eb0b5e9025c023cb9a0a00f103e80fa5f9c3e598c1169fe4ccc97
SNOW,2025-10-02T13:30:00+00:00,Securonix Named Data Security Data Cloud Product Partner of the Year by Snowflake,Yahoo,https://finnhub.io/api/news?id=5ac0b689db6ed58a2aec3d81a6e34bec14ce36d760961536399f7e0d3fad9feb
SNOW,2025-10-02T13:01:00+00:00,Snowflake Unveils Cortex AI for Financial Services: Enterprise-Ready AI Built to Scale,Yahoo,https://finnhub.io/api/news?id=c75b50a6e3745da5d55c1fb5c6e2f967cb10b687849987aa47f4e5c8c5aefdfd
SNOW,2025-10-02T13:00:00+00:00,"Blend360 Launches Agentic AI Foundry, BlendX, to Deliver Sophisticated AI Implementations on Snowflake AI Data Cloud",Yahoo,https://finnhub.io/api/news?id=c63bede33de90ab1a40fd9cec5ce1da1184a62374adbb9b4d76b9833a2a04017
SNOW,2025-10-02T12:18:01+00:00,"Dow Jones Futures Fall, Techs Rise With Tesla Deliveries Due; Nvidia Partner In Buy Zone",Yahoo,https://finnhub.io/api/news?id=f7943ecba869bef6ce264e5e32637b15637b6309088b3bdca9b611ab35e8d4cd
SNOW,2025-10-02T12:00:00+00:00,SAAS NORTH Returns To Ottawa This November 5-6 To Mark 10 Years of Tech Innovation and Growth,Yahoo,https://finnhub.io/api/news?id=dac3fc3cee3670f0c70b68b5e2232a9429dfef3cbb17c7c19c67bf0139352cfc
SNOW,2025-10-02T03:01:54+00:00,"Dow Jones Futures: Stock Market Hits Highs, Tesla Deliveries Due; Nvidia Partner Breaks Out",Yahoo,https://finnhub.io/api/news?id=15436dc4ccae425e61b849d52f0d9a478a033863c22d02115296a9e7895b61c5
SNOW,2025-10-02T00:08:21+00:00,Wells Fargo Initiates Coverage of Snowflake (SNOW) with Overweight Recommendation,Fintel,https://finnhub.io/api/news?id=ed35152f95f98b41c849574bcfb63078e3669bbbf80cdcd8feb26eba4062dc4e
SNOW,2025-10-01T12:00:00+00:00,"RudderStack Recognized as ""One to Watch"" in Snowflake's Modern Marketing Data Stack Report",Yahoo,https://finnhub.io/api/news?id=0167922b5f3bb3e836d9ffaa6fa0838272e2416acf2415a125ed7426032184ee
SNOW,2025-10-01T09:18:21+00:00,Why Did UiPath (PATH) Stock Jump on Tuesday?,Yahoo,https://finnhub.io/api/news?id=d5ac8967a68e5df56f104fa94ecd1544d11fc7e661cb19f59f9471e72a136de8
SNOW,2025-09-30T20:20:00+00:00,OneTrust Recognized as Leader in Snowflake's Modern Marketing Data Stack Report,Yahoo,https://finnhub.io/api/news?id=c10b499b8e70ed05270efde2b3776adab7f6ca63aefaa6039f4deb80486b6899
SNOW,2025-09-30T20:01:00+00:00,"Domo Recognized in Snowflake's Fourth Annual Modern Marketing Data Stack Report as ""One to Watch""",Yahoo,https://finnhub.io/api/news?id=eea94c28768f563e73438a8ac434f1f6ea51cddb5a39733f9ebb77548ea1a12a
SNOW,2025-09-30T19:39:20+00:00,"Robinhood volumes, UiPath deals, Instacart: Trending Tickers",Yahoo,https://finnhub.io/api/news?id=7147d22f01da56d918f41561d13fe3e8a99181e929bb9945fe1bc26aca8105d4
SNOW,2025-09-30T18:00:00+00:00,Acxiom Recognized in Snowflake’s Modern Marketing Data Stack Report for Identity & Onboarding and Collaboration,Yahoo,https://finnhub.io/api/news?id=74858af15d2ff89fd47f0b5d3a3d36d2c98f947f991ce4db36beade9f22d1dec
SNOW,2025-09-30T17:15:00+00:00,"Ketch Highlighted in Snowflake’s Fourth Annual Modern Marketing Data Stack Report as ""One to Watch""",Yahoo,https://finnhub.io/api/news?id=372ff756c0e645a8f627d32e7b068976fcc867b7b01eaff48a213ad2b67a22e8
SNOW,2025-09-30T17:05:00+00:00,Sigma Highlighted in Snowflake’s Fourth Annual Modern Marketing Data Stack Report as Leader,Yahoo,https://finnhub.io/api/news?id=352cba72df363048f4e870fd44278726cecd054be6c2411c181682361c957468
SNOW,2025-09-30T17:04:00+00:00,"Hevo Data Recognized as ""One to Watch"" in Snowflake's Modern Marketing Data Stack Report",Yahoo,https://finnhub.io/api/news?id=1be7a03d181424a2bdc0224ae27af8d6180550ff823ae1d2367342a3ef26d84c
SNOW,2025-09-30T17:02:00+00:00,Tealium recognized in Snowflake’s Modern Marketing Data Stack for powering real-time engagement via bi-directional data flows,Yahoo,https://finnhub.io/api/news?id=23f37122cf3d3ecd1f26eefae11336e876f2c643731464f03d7ef92807644f25
SNOW,2025-09-30T17:02:00+00:00,"MessageGears Recognized as ""One to Watch"" in Snowflake’s Modern Marketing Data Stack Report",Yahoo,https://finnhub.io/api/news?id=3350cc2cdec083bbc49b25b6c49a216b29f80e9decaf635221be4da1b48a1ba7
SNOW,2025-09-30T17:01:00+00:00,"GrowthLoop Recognized as ""One to Watch"" in Snowflake's 2026 Modern Marketing Data Stack Report",Yahoo,https://finnhub.io/api/news?id=6beaf13b5e18c9c1270df33599fafa9c74b43c3ee885e76d7bbfcf0159f9d650
SNOW,2025-09-30T17:00:00+00:00,Kipi.ai Delivers Marketing Mix Modeling and Analytics App on Snowflake AI Data Cloud,Yahoo,https://finnhub.io/api/news?id=2004e40599619de27087e8bf1c7516e922d4ff9313c16034b0d4b6e15c15ac63
SNOW,2025-09-30T17:00:00+00:00,"Improvado Recognized as ""One to Watch"" in Snowflake's Modern Marketing Data Stack Report",Yahoo,https://finnhub.io/api/news?id=f10238820512f411c01bde167792da1162ddda64cf34f88599f8d5cb32f2abab
SNOW,2025-09-30T17:00:00+00:00,RelationalAI Recognized as “One to Watch” in Snowflake’s Modern Marketing Data Stack Report,Yahoo,https://finnhub.io/api/news?id=ea0e547c1959a0a60bfed286af9c7aab38c099ac52badbdd7a0ca2305e4857ed
SNOW,2025-09-30T17:00:00+00:00,Airbyte Recognized as Leader in Snowflake’s Modern Marketing Data Stack Report,Yahoo,https://finnhub.io/api/news?id=46128db07d9039dda868dead71e2f9e5f07cd98e1e62f1762f1aa0a3144cf175
SNOW,2025-09-30T16:50:58+00:00,"UiPath (PATH) Shares Skyrocket, What You Need To Know",Yahoo,https://finnhub.io/api/news?id=c7d4a8852ce5445f26c26f9dce956db04d5754ff30f05219f246ab830d82a698
SNOW,2025-09-30T16:30:00+00:00,IPinfo Recognized as Leader in Snowflake’s 2026 Modern Marketing Data Stack Report,Yahoo,https://finnhub.io/api/news?id=e23cf42c929fe9a449a7005f39a9088433a6f7afbaaf40570cf7c23512f43157
SNOW,2025-09-30T15:40:27+00:00,Why Shares of UiPath Are Soaring Today,Yahoo,https://finnhub.io/api/news?id=67172c9e4f6d67c90e630a5714752aa1abd634d87ee2781d4d67f9753c593425
SNOW,2025-09-30T15:35:00+00:00,UiPath Stock Rises Sharply. What OpenAI and Nvidia Have to Do With It.,Yahoo,https://finnhub.io/api/news?id=ac0abfda3afc183143854df1eea4c711f44e64d51e2ad2c5ffdf25b7a4f14099
SNOW,2025-09-30T14:11:27+00:00,"UiPath shares jump on NVIDIA, OpenAI partnerships",Yahoo,https://finnhub.io/api/news?id=48f5de7ca7845023341b12cfc64dab02d3230103150f7cc91374bdd2f1221b5e
SNOW,2025-09-30T13:48:30+00:00,"UiPath shares surge on NVIDIA, OpenAI partnerships",Yahoo,https://finnhub.io/api/news?id=9f9f137e27557b5ce37274b5dac9d57eebeea56f71c9a21b8727538ec7742ae1
SNOW,2025-09-30T13:00:00+00:00,Iterable Recognized as Leader in Snowflake’s Modern Marketing Data Stack Report,Yahoo,https://finnhub.io/api/news?id=79539a90443764db0d641ef624ae497c37d1bc9ed0fc0119da690eb1401f970d
SNOW,2025-09-30T12:55:00+00:00,NYSE Content Advisory: Pre-Market Update + Snowflake celebrates 2025 Startup Challenge,Yahoo,https://finnhub.io/api/news?id=39e22e3d87e303b41638f908d759695609e97a6832a97ff07d1b7f91cae27993
SNOW,2025-09-30T12:30:00+00:00,UiPath Announces Partnership with Snowflake to Unite Agentic Automation and Snowflake Cortex AI,Yahoo,https://finnhub.io/api/news?id=26871fd99540a150008b93d7866ea128ebcc961409abf03a6d7bed6dd937ff03
SNOW,2025-09-30T12:00:00+00:00,Inovalon Launches New Data and Analytics Offering on Snowflake AI Data Cloud for Healthcare & Life Sciences,Yahoo,https://finnhub.io/api/news?id=77a2aa737136245d7e41e672c60d38b92371421a93609d6e71f77dadb6f283e9
SNOW,2025-09-29T12:31:00+00:00,Agiloft and Spaulding Ridge Partner to Transform Contracting for CFOs and Global Enterprises,Yahoo,https://finnhub.io/api/news?id=ccc4244dd06254a885a9184fe6cf4d5d4c88f387e507f5afe84b798cc8661110
SNOW,2025-09-29T12:00:00+00:00,Snowflake Names Stella Low as Chief Communications Officer,Yahoo,https://finnhub.io/api/news?id=9bc55d21ce7f9d7d5488ea9ec10fd9c7de94805d10ccf7247460a9f33871d2b9
SNOW,2025-09-29T11:00:24+00:00,"Snowflake Insiders Sell US$3.6m Of Stock, Possibly Signalling Caution",Yahoo,https://finnhub.io/api/news?id=617590008016008a38f37d1cf64f92ae6611d136fe968f5dcee713dcee4d29c5
SNOW,2025-09-29T03:31:49+00:00,Data Storage Stocks Q2 Earnings Review: Snowflake (NYSE:SNOW) Shines,Yahoo,https://finnhub.io/api/news?id=e7ea855e8f80f1a610284d4f4d486c84e85947cec42a713c5cb3a63ece81c411
SNOW,2025-09-29T03:03:15+00:00,"Dow Jones Futures Rise With Tesla Deliveries, Jobs Report Due; 5 Stocks Eye Buy Points",Yahoo,https://finnhub.io/api/news?id=de0eb11aa74a65a64f916b0962bdb3136bb9fbdbb8e4d0fa7b65023aacb1cb1f
SNOW,2025-09-26T21:45:05+00:00,Snowflake Inc. (SNOW) Outperforms Broader Market: What You Need to Know,Yahoo,https://finnhub.io/api/news?id=eb1b331ccc0e6ba7b85f00e654480f2a55e5367f0a1cf7b9524fe6229c4829bb
SNOW,2025-09-26T20:57:32+00:00,"Dow Jones Futures: Market Rallies Off Key Support, 5 Stocks Eye Buy Points; Tesla Deliveries Due",Yahoo,https://finnhub.io/api/news?id=d09161d54ba1ab2cfbfcb47cf11b05abbfae1bd5809ce9ca8bc2110a9bf531ed
SNOW,2025-09-26T17:49:00+00:00,"Blend Achieves Snowflake Premier Partner Status, Unlocking Next Phase of Joint Innovation",Yahoo,https://finnhub.io/api/news?id=5a4c2bfe697e8e08bd86ddc3ee487499239a6c16c46d36d7b3f97da98e25f7a0
SNOW,2025-09-26T15:30:05+00:00,Snowflake (SNOW) Down 8.1% Since Last Earnings Report: Can It Rebound?,Yahoo,https://finnhub.io/api/news?id=831b9c134b24b7f8978b4a95193254f5ef07535bef9ba739e72a2aa8fd8f26d9
SNOW,2025-09-26T12:14:06+00:00,"Dow Jones Futures Rise: Nvidia, Palantir Near Buy Points With Fed Inflation Due; Trump Sets New Tariffs",Yahoo,https://finnhub.io/api/news?id=7657674fdcb72cb83b02593e77efea65f28061800714ee8feb24d76d32b939a4
SNOW,2025-09-26T11:00:17+00:00,"Smart Companies Don't Just Endure — They Grow, Too",Yahoo,https://finnhub.io/api/news?id=5aad34a75562d7be40fcf25dfa8b6352c1ffc5fd7870b7cf2f38c1a0545af09f
SNOW,2025-09-26T01:20:48+00:00,"Dow Jones Futures: Nvidia, Palantir Near Buy Points With Market In Flux; Trump Sets New Tariffs",Yahoo,https://finnhub.io/api/news?id=14133b92c3be82d5bd77d6e1c03d0ac78e7809db1124c1a42d719c306ca94050
SNOW,2025-09-25T13:03:10+00:00,"Databricks, OpenAI team up to deliver AI models for enterprise clients",Yahoo,https://finnhub.io/api/news?id=62e6409bb5f3b5a6493a6c9a38aca9047ca91aa12650a71bfc4c41b18fce9df0
SNOW,2025-09-25T11:05:02+00:00,Snowflake: Not For The Faint Of Heart,SeekingAlpha,https://finnhub.io/api/news?id=a73fe5558f85cd989c2576cbd3605f6b0a4d12fe4454922449f2ceb34fbffce8
SNOW,2025-09-24T20:05:00+00:00,"Snowflake Announces Snowflake for Startups to Help Companies Build, Launch and Scale Enterprise-Grade AI Innovations",Yahoo,https://finnhub.io/api/news?id=9b771699f29cf63bcd6fd0c48efb40ebded5bb9f8b597e37948371290672ce08
SNOW,2025-09-24T15:52:00+00:00,Simplement Announces Signals™ for Snowflake AI Data Cloud,Yahoo,https://finnhub.io/api/news?id=562119cd1df26acec90e37de9e33dba4a877d570b1cd5343ba379257d4f86848
SNOW,2025-09-24T15:47:00+00:00,Will Improving Margins Position MongoDB for Durable Growth Ahead?,Yahoo,https://finnhub.io/api/news?id=50b97e48e641967befcac1a5673ebe3cfdca55946e959198d1964c56ba3accd8
SNOW,2025-09-24T15:36:11+00:00,"Rattled by Trump's Chaotic H-1B Policy, US Firms Quietly Wait Out Changes",Yahoo,https://finnhub.io/api/news?id=364cccd4a264be9d8c6f50cc9e700bef8c9a757eaf07f8ef62a401db28e2f4d5
SNOW,2025-09-24T11:39:41+00:00,Is It Too Late to Consider Snowflake After the Recent Earnings Surge?,Yahoo,https://finnhub.io/api/news?id=72cc22d7e32b2bfcf61c7e6d30f646743e4e1c29f7de37057c5f59fb1401c254
SNOW,2025-09-24T11:00:00+00:00,"Denodo Users Gain 345% ROI, 3–4x Faster Time-to-Insight, and Other Advantages, When Deployed alongside a Data Lakehouse",Yahoo,https://finnhub.io/api/news?id=0dc1071c3db5d3adf8631bcb60269c9e2b6fc0d0293e3398be93aa562c1a676c
SNOW,2025-09-24T10:48:04+00:00,"GitLab names new interim CFO, CAO",Yahoo,https://finnhub.io/api/news?id=ac285b88603480bab8a55cc80f017007828f4c7bf292376d4ef29d9e5382c403
SNOW,2025-09-24T05:57:56+00:00,"Workday Unveils Data Cloud with Zero-Copy Integration to Databricks, Salesforce, Snowflake for Real-Time Insights",Yahoo,https://finnhub.io/api/news?id=e13d709fd211899483432f9f3d1d3c64c2ae02f8542d030d989ddfefc1598745
SNOW,2025-09-23T17:09:00+00:00,SNOW Expands in Cloud Analytics: Is the Growth Thesis Strengthening?,Yahoo,https://finnhub.io/api/news?id=92d9ba1b08c88db94e922d3ca12a4f358c8c52e554592b55a4ad11afde3c6f96
SNOW,2025-09-23T16:37:46+00:00,Snowflake leads push to standardize metadata for AI,Yahoo,https://finnhub.io/api/news?id=d8a3d6157ef5852e24d6f5211e46c6e4c077b951e89b52305a8b38a8d8c6e3b1
SNOW,2025-09-23T16:32:00+00:00,RelationalAI Joins Snowflake and Industry Leaders to Establish the Open Semantic Interchange (OSI) Industry Initiative,Yahoo,https://finnhub.io/api/news?id=51f8a04a4ce2952a60221c85f66c593f1a625f6de67c19b8300b5b9661f99a6d
SNOW,2025-09-23T13:32:00+00:00,"ThoughtSpot Joins Forces with Snowflake and Industry Leaders to Spearhead Open Semantic Interchange, Ushering in a New Era of Data and AI Interoperability",Yahoo,https://finnhub.io/api/news?id=07dcd6980c681d7cf660980eb50057787980362fedb12f4286865bc23b5dbffb
SNOW,2025-09-23T13:31:00+00:00,Sigma Joins Snowflake to Spearhead Open Semantic Interchange: Unlocking Data and AI Interoperability Across the Ecosystem,Yahoo,https://finnhub.io/api/news?id=e84329eec5ce91415eea87f7f7d91291230f7ed88b14dcd459024dc6d3a39a65
SNOW,2025-09-23T13:01:00+00:00,"Snowflake, Salesforce, dbt Labs, and More, Revolutionize Data Readiness for AI with Open Semantic Interchange Initiative",Yahoo,https://finnhub.io/api/news?id=c89f200707bd95335abfb62ef0f515baf2d651c426f80a493c56980e31696844
SNOW,2025-09-23T13:00:05+00:00,Is Trending Stock Snowflake Inc. (SNOW) a Buy Now?,Yahoo,https://finnhub.io/api/news?id=87b337121d801eea1ef7509e74ca408dbd48e4fa26790649bdded53b435c0297
SNOW,2025-09-23T09:15:00+00:00,AI Market Could Soar 6 Times by 2030: 2 Brilliant AI Stocks to Buy Now (Hint: Not Nvidia),Yahoo,https://finnhub.io/api/news?id=f2a140046be76c53c21f1ba939f811489ff17416eb24e5b691ef8f490a63a127
SNOW,2025-09-23T07:30:00+00:00,ValuEngine Weekly Market Summary And Commentary,SeekingAlpha,https://finnhub.io/api/news?id=6fc7c50e4e41f32ef18b537b1ad3b7aaa7ed4bd00d9e56a1ec2dc987125bb6d6
SNOW,2025-09-22T21:10:45+00:00,Piper Sandler Turns Less Bearish on Workday (WDAY) Following Workday Rising,Yahoo,https://finnhub.io/api/news?id=0f4f0a6e5fc8e407d34e49205c9e37a6a028f4538962d1af0b5291bd8b248519
SNOW,2025-09-22T16:12:00+00:00,MDB Shares Jump 39% YTD: Should You Add the Stock to Your Portfolio?,Yahoo,https://finnhub.io/api/news?id=c393af8ce3fcde1ff95d6cf5145ee18edf99f3da52ae4421bdf48695ec38c660
SNOW,2025-09-22T15:40:00+00:00,C3.ai's Q1 Margin Squeeze Raises Questions on Path to Profitability,Yahoo,https://finnhub.io/api/news?id=a72e798c343b154945f98ead8ddd444ee47e86d47536f6ddf10f8978216ee13b
SNOW,2025-09-21T09:11:27+00:00,Salesforce (CRM) Unveils AI-Driven Strategy to Boost Customer Satisfaction and Profitability,Yahoo,https://finnhub.io/api/news?id=5b1d38b3d3aa1aea0f14163f71355614798e288b1d86e26f8bbd80436b28946b
SNOW,2025-09-21T09:10:00+00:00,Snowflake: AI Driven Growth At Too Great A Price,SeekingAlpha,https://finnhub.io/api/news?id=d5f2d2bf24387838bd1beb883662085fc7c449367c12ff94c2d25d7b506d0022
SNOW,2025-09-19T16:39:00+00:00,SNOW Rides on Enterprise AI Adoption: Can the Growth Continue?,Yahoo,https://finnhub.io/api/news?id=f2e70588ad749ba31fbb75aea686afd4e79c79b380585564aa843e06066e7af1
SNOW,2025-09-18T16:24:28+00:00,Snowflake Inc. (SNOW) Ranked 1st on 2025 Fortune 50 List,Yahoo,https://finnhub.io/api/news?id=f9823531d56a6e84cf276effdd939ff6da15f7d04cc0e40bb131edcad96cee7e
SNOW,2025-09-18T14:01:00+00:00,Snowflake Named 2025 Strategic Partner of the Year by Morgan Stanley,Yahoo,https://finnhub.io/api/news?id=704b199f05364a986df5d786690486a25d484ec49e1ade9b0a3033bf5f0b22d6
SNOW,2025-09-17T20:10:37+00:00,Use These Stock Chart Signals to Find Winning Options Trades,Yahoo,https://finnhub.io/api/news?id=fbc70af2dec8238c8e4baa8090c3f82750936ef406d3fac91d5aa3a099138888
SNOW,2025-09-17T18:54:00+00:00,Can AI-Powered Tools Position MongoDB for Sustained Revenue Growth?,Yahoo,https://finnhub.io/api/news?id=51491623fe0ef6764e694265c6ea19baaa94c42adf0b3944ab9b06c8bfd8aa97
SNOW,2025-09-17T13:20:27+00:00,Analyst Explains Why She’s Buying Snowflake Inc (SNOW) – ‘It Was Just Too Tempting’,Yahoo,https://finnhub.io/api/news?id=83a6e3652728dfe3258bf89f712000b38ae87ffb3ca9283ac2f7ed1df4e9ce4d
SNOW,2025-09-17T13:11:40+00:00,What Catalysts Are Shifting the Narrative for Snowflake After Recent Analyst Upgrades,Yahoo,https://finnhub.io/api/news?id=90640865de5e6e7e5c1031752180b6eb8b41b08fff354a8e3bacbf52d3b1e4ac
SNOW,2025-09-16T21:25:00+00:00,The AI Trade Has Stocks Near Highs Again. Some Tech Names Remain on the Sidelines,Yahoo,https://finnhub.io/api/news?id=f1f1c448ff5d55a8bcf5a2b3ebb71d1a29e9c3f58b5d0b7d75b6e9147f52bbed
SNOW,2025-09-16T18:06:00+00:00,SNOW's Robust Portfolio Expands Client Base: Will the Trend Continue?,Yahoo,https://finnhub.io/api/news?id=ab0e4077e0c99ae705d3238c326adcd0632536397814bf051a0563a637da23d9
SNOW,2025-09-16T16:00:00+00:00,Suger Surges 17x to Process Over $6 Billion in Cloud Marketplace Transactions,Yahoo,https://finnhub.io/api/news?id=de7a86799cd098dc2d71680533f09178afbfe50618dadff4a295657e281551eb
SNOW,2025-09-16T14:00:00+00:00,"Introducing Pulumi Neo, the Industry's First AI-Powered Platform Engineer",Yahoo,https://finnhub.io/api/news?id=14a520db4035cf197078cbdf3d12651a8f4d8dc1e9c03cadb2c6445ef17557cb
SNOW,2025-09-16T14:00:00+00:00,Workday Introduces Workday Data Cloud to Unlock the Power of People and Money Data and Accelerate AI-Powered Innovation,Yahoo,https://finnhub.io/api/news?id=e863b293e092c4ca7774a6bce96138914569f6a32630f3cd842206f7fa0b27ba
SNOW,2025-09-16T13:15:00+00:00,"Peraton Joins Forces with Snowflake to Fight Federal and State Fraud, Waste, and Abuse with Rapid FI",Yahoo,https://finnhub.io/api/news?id=749ff441b18213c5418f67cd7f4b09a6af3ee3514648950583204f34b5b32006
SNOW,2025-09-16T13:01:20+00:00,Snowflake: Palantir's Growth At A Fraction Of The Price (Rating Upgrade),SeekingAlpha,https://finnhub.io/api/news?id=8adf38f2a69bcb3c78fcc75eb9e09ea3c478c544a1e6a147bc91fd9646166ba8
SNOW,2025-09-15T16:24:01+00:00,Sezzle: Incredible Buy Or Risky Business?,SeekingAlpha,https://finnhub.io/api/news?id=c12f0d282458f3734808b5822fbeaddcfbcca6816bfcf39aedb97ad9a27e3ab6
