ticker,published_utc,title,publisher,url
STX,2025-11-12T14:20:00+00:00,"The Seagate Hotel, Golf & Beach Club Joins Marriott Bonvoy's Autograph Collection",Yahoo,https://finnhub.io/api/news?id=ae898a4b20841aecc6f7fad2a6707aa6a6cadc018912c1e1bceb9e6ef3a26b78
STX,2025-11-12T13:30:03+00:00,Here's How Much a $1000 Investment in Seagate Made 10 Years Ago Would Be Worth Today,Yahoo,https://finnhub.io/api/news?id=2ddb720bb981e2c54a5fc722c7314a6fead60387abd9f99e40e700fbd23469e9
STX,2025-11-12T13:05:00+00:00,"Guardant Health Announces Launch of Single Namespace Group Uniting Leading Technology, Healthcare and Research Institutions to Set Global Standard for Exabyte-Scale Data Access",Yahoo,https://finnhub.io/api/news?id=16b092ceb43ddbebf995603543cad47214b19c48b3f007c3431ce9c5f465a2df
STX,2025-11-12T12:18:31+00:00,Does Seagate’s Surging Share Price Reflect True Value After Its AI Storage Partnership?,Yahoo,https://finnhub.io/api/news?id=b47a3dde1fdb2955a788f2a8b2c36d7a29dc8c70d5deb0dda0d595f49cfc318a
STX,2025-11-12T12:18:00+00:00,Best Growth Stocks to Buy for Nov. 12,Yahoo,https://finnhub.io/api/news?id=40f73c4aee681a9d84f6236224410d2ad0c78aa1bf46f19f1fa90c141e0977f2
STX,2025-11-12T04:37:16+00:00,1 Large-Cap Stock for Long-Term Investors and 2 We Turn Down,Yahoo,https://finnhub.io/api/news?id=aea95ed5555b1ce1604d291949379231f2e272b53c568f4c2aa9945565bc55bb
STX,2025-11-11T14:01:00+00:00,"Backblaze Q3 2025 Drive Stats: Rethinking Failure, Celebrating High-Capacity Drive Strength",Yahoo,https://finnhub.io/api/news?id=f9049265ac31cbf97ca754a3899cf5bb41b87edf6955ed52bebaadd9077761f0
STX,2025-11-10T18:25:32+00:00,Memory and Data Storage Stocks Surge Amid Optimism About AI Demand,Yahoo,https://finnhub.io/api/news?id=b6a54b61bc5567886ef58123bdd6141b8b3118c73c023d3ba91cc463033314bc
STX,2025-11-10T16:41:00+00:00,3 Stocks Showing Relative Strength as Markets Pull Back,Yahoo,https://finnhub.io/api/news?id=3b6bf3298155dca26de2145dc5ba3c31414ee3d8145f5799005dae5d0603cea4
STX,2025-11-10T11:27:00+00:00,Best Growth Stocks to Buy for Nov. 10,Yahoo,https://finnhub.io/api/news?id=736daa16a66332b46eca521f7103b7563d47c45d0d54a6c44b982f4c46e51467
STX,2025-11-10T04:29:15+00:00,What Factors Are Shaping the Evolving Story for Seagate Technology Holdings?,Yahoo,https://finnhub.io/api/news?id=7692245029783bc08ffc1bb58208c7e14bbdcbc6fe2e9056b676f7a9f87479b7
STX,2025-11-09T07:29:00+00:00,TCW Relative Value Large Cap Fund Q3 2025 Sectors And Securities,SeekingAlpha,https://finnhub.io/api/news?id=043c42ac83a65c1a5115fd186e750869e9b500d84f7da28ca097cf781dab61dd
STX,2025-11-08T13:49:26+00:00,Is Seagate (STX) The Best AI Stock to Buy According to American Politicians?,Yahoo,https://finnhub.io/api/news?id=a06cb43af1973ce048cccc508b3a32b415887981323f76efb0ed71d50aa4455d
STX,2025-11-07T18:45:10+00:00,1 Cash-Producing Stock to Consider Right Now and 2 Facing Challenges,Yahoo,https://finnhub.io/api/news?id=77636014609b7f5188847d10aabc728597c908f52dafa14683bafcfb15bb491b
STX,2025-11-07T16:42:00+00:00,Western Digital and Seagate Soar Despite the AI Selloff. Why Wall Street Remains Bullish.,Yahoo,https://finnhub.io/api/news?id=70eb49f6f41f33fe137019ac0b773be0d7a77c83210be834cc636f475b4bdb31
STX,2025-11-07T09:30:00+00:00,These 3 Stocks Have Been the S&P 500's Hottest Buys This Year. Can They Still Go Higher?,Yahoo,https://finnhub.io/api/news?id=b8d6a10976bc13072d370736271da8e840914fb4c1d10d56d92f1fc05ea754a0
STX,2025-11-06T12:02:01+00:00,Micron Stock Hits Record Peak After HBM4 Prices Leap 50% -- Analysts Rush to Upgrade,Yahoo,https://finnhub.io/api/news?id=aeb1fb6861562304f6192e5138600f1e2123bf3cc7b4af43de48d3730b64f4fb
STX,2025-11-06T04:11:33+00:00,Jim Cramer on Seagate: “They Have Super Growth”,Yahoo,https://finnhub.io/api/news?id=0c362586eb084b45249a8464f09f8035c8c4e1b561614a96b5af52de5fb801f0
STX,2025-11-05T21:26:45+00:00,S&P 500 Gains and Losses Today: Seagate Stock Surges; Supermicro Falls After Soft Earnings Report,Yahoo,https://finnhub.io/api/news?id=81c3f0fee039d0d48320ac13b7a615f9eebbe087ff9cbd89cf0bb4cadb396b21
STX,2025-11-05T21:17:24+00:00,"US Equity Markets Close Higher, Led by Comms Stock Gains, Supreme Court's Tough Tariff Questions",Yahoo,https://finnhub.io/api/news?id=e677b51dceeee56a2c9eae7e68ae23b038e31136f55d524ced7053de5aeb9f1f
STX,2025-11-05T20:42:00+00:00,Seagate's Record Earnings Prove Its Role as a Core AI Player,Yahoo,https://finnhub.io/api/news?id=731c66197564403202161ff89d9d57fabb636072a208e17cdb392cece757083d
STX,2025-11-05T17:44:00+00:00,"Top Stock Movers Now: Seagate Technology, McDonald's, Trex, Pinterest, and More",Yahoo,https://finnhub.io/api/news?id=53c8c4b12bc0f758df150a9fe1f88bdeb1c8e70357b48aaf18983fe04940869e
STX,2025-11-05T14:22:00+00:00,Can WDC's Revenue Momentum Continue on Rising Cloud and AI Demand?,Yahoo,https://finnhub.io/api/news?id=b1b4847e44353627e7d7ee1822c2e0437cc8fc9c8bfea1ead70264d3d664af8c
STX,2025-11-05T13:09:34+00:00,Seagate (STX) Is Up 12.3% After Strong Earnings and Dividend Hike Is Its Growth Story Evolving?,Yahoo,https://finnhub.io/api/news?id=a57d8d4cf5639addf1b4ade70a8faa554b45244c9b43bbe26e10f8208871465d
STX,2025-11-05T12:30:00+00:00,Seagate Announces Exchanges With Holders of $500 Million Principal Amount of Exchangeable Notes,Yahoo,https://finnhub.io/api/news?id=5179ea07fc9f2e688d61195c6de9b2b488f5198ee3e56410b93779c1df5adcb9
STX,2025-11-04T20:00:00+00:00,4 Convertibles That Saw Significant Advance And Bullish Analyst Sentiment,SeekingAlpha,https://finnhub.io/api/news?id=94ce9d4672a57c913f87779a3fc14d7568ecb8488ff00093a04479f60583af6b
STX,2025-11-04T19:15:39+00:00,"Qorvo, Intel, Micron, Seagate Technology, and Western Digital Shares Plummet, What You Need To Know",Yahoo,https://finnhub.io/api/news?id=2296f221b97053ed0c08e7b1263466eb56d3aadbdbd80e9facf8a1cfc39842b3
STX,2025-11-04T17:20:02+00:00,Why Seagate (STX) Might be Well Poised for a Surge,Yahoo,https://finnhub.io/api/news?id=f08ea5be79c1668f489d327d4bbbfcb73f4dd5e67ae8c0bd727119f0e3bc9ce6
STX,2025-11-04T05:34:46+00:00,5 Insightful Analyst Questions From Seagate Technology’s Q3 Earnings Call,Yahoo,https://finnhub.io/api/news?id=ca7992a477e454e8f70d361e0bc884ed31799e24b26473fdeaa9bed4d85f6228
STX,2025-11-03T21:40:00+00:00,3 Hot Stocks Just Raised Dividends—1 for the First Time Ever,Yahoo,https://finnhub.io/api/news?id=ccf4de9b5ae1cc0dad64bf34731b7d4bd79a9aa2c2ecf9dbc46b1e7848dcb0b9
STX,2025-11-03T19:07:01+00:00,Tuesday's big stock stories: What’s likely to move the market in the next trading session,CNBC,https://finnhub.io/api/news?id=dbe0c0714315ddeba60ce30f31a352bc1a7fbc018d2aa29daacd19a430716a68
STX,2025-11-03T16:47:00+00:00,Seagate Technology Holdings PLC stock outperforms competitors on strong trading day,MarketWatch,https://finnhub.io/api/news?id=ec5bc34ff81c289c58696e188e6186f0332f3d405411d020ced34d8be7d40c0f
STX,2025-11-03T11:56:12+00:00,Memory chip makers gain as Samsung delays DDR5 pricing amid price spike,Yahoo,https://finnhub.io/api/news?id=115257a0476db10186510a491acc3c837ff5f205bec1483b8bd18f4eaecd0fd9
STX,2025-11-03T11:39:20+00:00,"Wall Street futures rise on AI optimism, US-China trade truce",Yahoo,https://finnhub.io/api/news?id=5e6ddc2c6d7672a44f8faee8e52cfdc68b5499b29cfcffd3081eaa0235363873
STX,2025-10-31T19:20:52+00:00,Seagate (STX): Exploring Valuation After Recent Double-Digit Growth and Share Price Surge,Yahoo,https://finnhub.io/api/news?id=a95dbbe52ee3a7f7c60fd584aab7683677c15ff7de0f4991125cb05945022e35
STX,2025-10-31T17:23:00+00:00,Western Digital Stock Rises After Earnings Beat. Profits Are Growing.,Yahoo,https://finnhub.io/api/news?id=e642ac573f39e9aa201413355dd76f125b9c0f825c7229a8afd597caf7e1ab85
STX,2025-10-31T14:34:21+00:00,Western Digital Jumps To Record Highs After Earnings. AI Is Powering A 230% Rally This Year.,Yahoo,https://finnhub.io/api/news?id=4cc3424e0088e646eb1a2f36c93982e65b209713393df932390c0e07303447fb
STX,2025-10-31T14:32:25+00:00,"Stock Market Powers Higher Amid Huge Earnings, Federal Reserve, Trump-Xi: Weekly Review",Yahoo,https://finnhub.io/api/news?id=338dc0035f3b53921969430cbeeebc32f627144b9f54ea678f50acd402bf0ea0
STX,2025-10-31T13:40:02+00:00,The Zacks Rank Explained: How to Find Strong Buy Computer and Technology Stocks,Yahoo,https://finnhub.io/api/news?id=3410913e67326be6d29caf6be74f6eda3d45224e4d94e85e150ed7aa089f640a
STX,2025-10-31T12:27:00+00:00,Western Digital Stock Surges After Earnings Beat. Why Profits Are Growing.,Yahoo,https://finnhub.io/api/news?id=f4c19ac7716699861799d26c838107e4efa7a7c4b4c18a7fee44774ef1d87d6d
STX,2025-10-31T11:31:33+00:00,"Data storage firms Western Digital, Seagate soar on AI-driven demand spike",Yahoo,https://finnhub.io/api/news?id=2e279536c6222c380dd2be62142d0fbb419be9145104e0a0069f5865593e0b44
STX,2025-10-31T07:59:24+00:00,Why Seagate Technology Stock Was Winning This Week,Yahoo,https://finnhub.io/api/news?id=094ced554430a3544d8d8124a247a87d6b53a7cc351e7e4a5fa785c603832081
STX,2025-10-31T04:39:40+00:00,3 Market-Beating Stocks with Promising Prospects,Yahoo,https://finnhub.io/api/news?id=f40218721d03d0a3c0ce56c865dfcf61d593ff1aa89d74fbdacb700f88bc24c6
STX,2025-10-30T21:59:59+00:00,Western Digital forecasts strong quarterly earnings on rising cloud storage demand,Yahoo,https://finnhub.io/api/news?id=1358a4e72c8b99840fe1da57e65a91ab097e5999d89adeebff7f97cca751c11c
STX,2025-10-30T19:28:14+00:00,Seagate Technology Holdings PLC (STX) Q1 2026 Earnings Call Highlights: Record Margins and ...,Yahoo,https://finnhub.io/api/news?id=9ce9ec929320795b28f4981ce3ddb0232edc966db2e94f7c8b721054e29d066a
STX,2025-10-30T19:08:02+00:00,Surging AI Data Center Capex Seen Lifting These Stocks,Yahoo,https://finnhub.io/api/news?id=68e0abe57a8fac5474b536b96dda0cc646c7d9ce84ed6102516a4210aa8a2e10
STX,2025-10-30T16:46:00+00:00,Seagate Technology Holdings PLC stock underperforms Thursday when compared to competitors despite daily gains,MarketWatch,https://finnhub.io/api/news?id=c85f18eae79e7fa960bca684c850203ca7b61586e592f76aa6f1c5c202ab93ad
STX,2025-10-30T15:49:00+00:00,"NETGEAR Q3 Earnings & Revenues Beat Estimates, Q4 Guidance Provided",Yahoo,https://finnhub.io/api/news?id=e8fcd2adf1782de714ba423f32cf02f082d0a2f0249da8e6e00b67e464148317
STX,2025-10-30T14:35:57+00:00,Seagate Q3: Build-To-Order Strategy Is Playing Out,SeekingAlpha,https://finnhub.io/api/news?id=bf470fcc5e8430173981d287987c179896bb684e22ea10d20e543f8f328df257
STX,2025-10-30T14:34:29+00:00,Seagate (STX) Climbs to Fresh High on Strong Q3 Earnings,Yahoo,https://finnhub.io/api/news?id=b171194233f8db41cd983fd91f8650569b499de60e36cb9da630025d3925bb89
STX,2025-10-30T11:38:05+00:00,Discover DoorDash And 2 Stocks That May Be Trading Below Their Estimated Value,Yahoo,https://finnhub.io/api/news?id=62325712f84cb3ff3ec5faea87755f0485fa15080da007c78990a9061baee2de
STX,2025-10-30T11:12:36+00:00,"Seagate (STX) Margin Expansion Surpasses Expectations, Reinforcing Bullish Profitability Narrative",Yahoo,https://finnhub.io/api/news?id=ee3acb83707509560669103bc52bd9de24830ff2913502daaac6b77e49b08659
STX,2025-10-30T04:35:53+00:00,2 Semiconductor Stocks to Target This Week and 1 We Turn Down,Yahoo,https://finnhub.io/api/news?id=96d5498d5fdcbe2152ed4f69017332c98d1876cd3384396fd674c5438b122346
STX,2025-10-29T20:51:28+00:00,US Equity Indexes Mixed as Powell's View Policy Not On 'Preset' Course Sinks December Rate Cut Bets,Yahoo,https://finnhub.io/api/news?id=911edd71feaab3f95737756cb2b56b9520c754ab2114aa18b1f8a58c6954790d
STX,2025-10-29T20:05:06+00:00,Seagate Stock Soars To New Highs After Earnings. AI Has Industry 'Desperate For Storage.',Yahoo,https://finnhub.io/api/news?id=97ef70e344b5499ca26b59be5026322b365c320800872c8cf29b91248288f2d1
STX,2025-10-29T19:56:38+00:00,Why Seagate Technology Stock Is Skyrocketing Today,Yahoo,https://finnhub.io/api/news?id=a287cc4f365ab7bb329d90dc1413704ca4fcecc501d051c541948b6c78bb9877
STX,2025-10-29T19:49:23+00:00,No Tech Wreck From a More Hawkish Fed,Yahoo,https://finnhub.io/api/news?id=fb6e67beed22434e6e15789fe6566b89d48d9778fd27df7a3e3411b7a307d707
STX,2025-10-29T17:30:39+00:00,"US Equity Indexes Touch All-Time Highs as Fed Set to Cut Rates, Nvidia Surpasses $5 Trillion Market Cap",Yahoo,https://finnhub.io/api/news?id=414cd3f7d4bb74ca98fe417085a97f8696a157be292f059e134390f9c4842c45
STX,2025-10-29T17:10:59+00:00,Why Are Seagate Technology (STX) Shares Soaring Today,Yahoo,https://finnhub.io/api/news?id=03428a07237286d2608df33583e9ab4b5dde74de8b91cb0a8cb45ccb57fc5419
STX,2025-10-29T16:02:00+00:00,"Seagate Stock Pops 17% on Earnings. ‘Solid Execution, No Doubt,’ Wall Street Says.",Yahoo,https://finnhub.io/api/news?id=25a1c84f86a130146188343dc47dceca799fc5ed4cf55e64080bb10d7abf396f
STX,2025-10-29T15:10:20+00:00,"Seagate: My Bullish Thesis Remains Intact, Followed By Cloud Storage Demand",SeekingAlpha,https://finnhub.io/api/news?id=90d5528b8c858af2c6f69d8faf8657d68890f7dddb32321b1276d281d0141746
STX,2025-10-29T13:40:00+00:00,"Seagate's Q1 Earnings & Sales Top, Product Uptake & Pricing Lift Margins",Yahoo,https://finnhub.io/api/news?id=eefd4b7d3535c26f54dd6f402f291ea85c69ef7e7967f44d342133cc5fbf983c
STX,2025-10-29T12:46:04+00:00,STX Q3 Deep Dive: AI-Driven Data Center Demand Fuels Nearline Storage Momentum,Yahoo,https://finnhub.io/api/news?id=23f9223d2a00e217d2d38a2f0a1a03eb1f024f66e6b698435ce358ac91397e7d
STX,2025-10-29T12:33:20+00:00,Seagate Stock Rallies On After Earnings. AI Has Industry 'Desperate For Storage.',Yahoo,https://finnhub.io/api/news?id=367539ab3006d82a075a201a5f551e38701cfc6e3fbb0d6ae8f05df92fd2952f
STX,2025-10-29T12:07:00+00:00,Micron Stock Jumps on Upbeat Memory Chip Forecast From SK Hynix,Yahoo,https://finnhub.io/api/news?id=ca9bae63993994e58556f2347b66d226e5074e0f7593bad867a33c60848042ee
STX,2025-10-29T08:37:27+00:00,"Stocks making the biggest moves premarket: Nvidia, Caterpillar, Generac, Caesars Entertainment & more",CNBC,https://finnhub.io/api/news?id=9a93375b2b95a808717ff77583bd4698a0582dbadb5d59bce0bf0832fa57aa85
STX,2025-10-29T08:10:09+00:00,"Dow Jones Futures: Trump Upbeat On China, Lifts Nvidia; Why Microsoft, Google, Meta Earnings Are So Important",DowJones,https://finnhub.io/api/news?id=b7ec0087065b1fa56757a06ed8771516486513aed898f7b154ea6d4d966d0b99
STX,2025-10-29T05:44:44+00:00,Nvidia in line for $5 trillion market cap — and other early market movers,MarketWatch,https://finnhub.io/api/news?id=f51d39fd3325e35e09a4972195160986f9e0f85eb7111c8ce41082b02fbb3db1
STX,2025-10-29T04:48:47+00:00,Is Seagate’s 158% Rally in 2025 Fully Justified After Latest Cloud Expansion News?,Yahoo,https://finnhub.io/api/news?id=6e5f24a5019bd778563c3b4661a4b341f03a5ea14e95c646e08685693fc0453e
STX,2025-10-29T03:02:30+00:00,"Dow Jones Futures: Trump Upbeat On China; Why Microsoft, Google, Meta Earnings Are So Important",Yahoo,https://finnhub.io/api/news?id=c9900d511fc4382728ebd8b2bc52a9395ecf49efd0b2510574ce11df7a3a412c
STX,2025-10-29T01:51:49+00:00,Seagate Technology Holdings plc 2026 Q1 - Results - Earnings Call Presentation,SeekingAlpha,https://finnhub.io/api/news?id=8253a7957cef7d8c2e5c5cff5f7932bd154ece1c1a7bdb69c199ca1a605285ec
STX,2025-10-29T01:31:51+00:00,Seagate Technology Holdings plc (STX) Q1 2026 Earnings Call Transcript,SeekingAlpha,https://finnhub.io/api/news?id=2480a956c22bb52b5773dbeb9a663258732d5a9c8e74f977445243c3198d55b8
STX,2025-10-29T01:31:27+00:00,Seagate Earnings Are Imminent; These Most Accurate Analysts Revise Forecasts Ahead Of Earnings Call,Yahoo,https://finnhub.io/api/news?id=bc5a7a67c3e8abebe4fbe7989c319ac118d8f98ab6ee2983fcbfdd1b9c80a54c
STX,2025-10-29T01:20:24+00:00,Seagate Is Up 4.7% After Earnings: Everything You Need to Know,Yahoo,https://finnhub.io/api/news?id=203b2ee1e010618fb7b6d0dd4b3f19659ee48d8fc7ae8a035923c00e0db3477a
STX,2025-10-28T22:49:45+00:00,Seagate Technology (STX) Q1 2026 Earnings Call Transcript,Yahoo,https://finnhub.io/api/news?id=8c442c6a2d9c796293b996fb4b7bb37728e67f15935469b820571ada009fa466
STX,2025-10-28T21:15:03+00:00,Seagate (STX) Q1 Earnings and Revenues Surpass Estimates,Yahoo,https://finnhub.io/api/news?id=95b94da551ba559ef530cc89f40f0f5cac145c82765146f421ae25b25a8131a3
STX,2025-10-28T21:14:28+00:00,"Seagate Technology (NASDAQ:STX) Reports Strong Q3, Stock Soars",Yahoo,https://finnhub.io/api/news?id=bafb6503b2b00fc9ff08b9073a8880aa1f5ef49c1161bdcf3ce612b17da2aa29
STX,2025-10-28T20:39:47+00:00,Seagate Posts Results Ahead Of Estimates Amid AI-Fueled 160% Rally,Yahoo,https://finnhub.io/api/news?id=c8f1fe890a45c63cba3be26175cce9529285d3963daa28ba80e6b9183242c847
STX,2025-10-28T20:25:48+00:00,Seagate: Fiscal Q1 Earnings Snapshot,Yahoo,https://finnhub.io/api/news?id=a9c87705dc5318def9170bdd5c3530bda1953840f4f78c3449dd6752b880e5ec
STX,2025-10-28T20:23:25+00:00,Seagate forecasts second-quarter results above estimates on AI strength,Yahoo,https://finnhub.io/api/news?id=0c3165dcb6f03725ac2f1dba242d98405ed5d7f3fbaf61941eeccba35bd05a50
STX,2025-10-28T20:05:00+00:00,Seagate Technology Reports Fiscal First Quarter 2026 Financial Results,Yahoo,https://finnhub.io/api/news?id=aed82ef87185d66515ebb0c74c305c01b31ae309c564e3c126cc5c0fd7b94e17
STX,2025-10-28T18:16:47+00:00,Jim Cramer’s Positive On Seagate Technology (STX),Yahoo,https://finnhub.io/api/news?id=11d49a12370b542bf714f8967e122062ff66a46174dd8e7658dbc978e15212c5
STX,2025-10-28T17:30:00+00:00,Seagate Technology Raises Qtr Dividend by 2.8%,MarketWatch,https://finnhub.io/api/news?id=642f418094c5e8494d59d067058ce1a43c75d4ab1b1407a6103d072bdcca68b5
STX,2025-10-28T17:14:31+00:00,"Stocks making the biggest moves after hours: Visa, Seagate, Caesars Entertainment, Mondelez and more",CNBC,https://finnhub.io/api/news?id=2a0e926ba5b9b2d3feb0104f53af482fd4b7fe6d7c8bcdb024fd21e270608221
STX,2025-10-28T16:51:00+00:00,Seagate Technology Holdings PLC stock underperforms Tuesday when compared to competitors,MarketWatch,https://finnhub.io/api/news?id=ac37a0ce9d3f522668bf73fbbb32877e731eab6d87842e8bc6dc98b001aa0537
STX,2025-10-28T16:02:50+00:00,Jim Cramer Says Sandisk Has “Pricing Power”,Yahoo,https://finnhub.io/api/news?id=7ae5898c955e2aab9bdb03c9f3f9ba4f11520d578d56688da419e2b28f591761
STX,2025-10-28T14:05:00+00:00,Should You Bet on Western Digital Stock Before Q1 Earnings?,Yahoo,https://finnhub.io/api/news?id=e49e69c322167ce7da6092bc590e8999ad7266623b3b2c860452fa717fdb77bb
STX,2025-10-28T05:39:39+00:00,"UnitedHealth, UPS and Visa among the companies reporting earnings",MarketWatch,https://finnhub.io/api/news?id=2913bd748f23ee8ddf28453e2e07ac49724fc776e7568240c8ba394626b7c959
STX,2025-10-27T22:05:01+00:00,Agilysys (AGYS) Q2 Earnings and Revenues Top Estimates,Yahoo,https://finnhub.io/api/news?id=4490e0b5f3ad78b06456ec3af383b06824c46694dd1688d65c32c18dfac86f4a
STX,2025-10-27T16:04:00+00:00,Jim Cramer on Seagate: “That’s a Great Thing to Be in This Environment”,Yahoo,https://finnhub.io/api/news?id=4a2287592470ecc2be4d43265dda606ae622c099b321e38ae85f356f77054282
STX,2025-10-27T13:44:00+00:00,How Should You Play Seagate Stock Ahead of Q1 Earnings Release?,Yahoo,https://finnhub.io/api/news?id=1f6e4d41e16f2bcc48774242206453c51123a1aca6ef6f9edd40c0c0bf43b3a2
STX,2025-10-27T12:30:03+00:00,Here's How Much You'd Have If You Invested $1000 in Seagate a Decade Ago,Yahoo,https://finnhub.io/api/news?id=8f870c46d8d964b872673b1c9b34599e22a8077b981583147564bc7fa7492fec
STX,2025-10-27T03:13:43+00:00,Seagate Technology (STX) Reports Earnings Tomorrow: What To Expect,Yahoo,https://finnhub.io/api/news?id=50bd10b4f3d315fc4dafb642b78da103efce93d1470cd46173fa145f96a38092
STX,2025-10-26T23:10:28+00:00,Looking at the Narrative for Seagate as Analyst Targets Shift with AI Storage Demand,Yahoo,https://finnhub.io/api/news?id=fc4ea39afcc414333ee98583fc7c053cbe4bcdf878d7b52d7d32043bf5a3fac2
STX,2025-10-26T09:00:00+00:00,The surprising stocks leading the tech sector this year thanks to an AI renaissance,MarketWatch,https://finnhub.io/api/news?id=1cc2961dbe99c9d8056cb8ef779fe58bf1ed98997bbb9312990d7365c6bfd638
STX,2025-10-24T19:40:14+00:00,"Texas Instruments (TXN) Makes You “Feel Like A Chump,” Says Jim Cramer",Yahoo,https://finnhub.io/api/news?id=d74944032136273c89611b594652f90280ffccb82814d182be17bdb3ddd38e39
STX,2025-10-24T18:57:34+00:00,Cramer's week ahead: Fed meeting and earnings from Big Tech,CNBC,https://finnhub.io/api/news?id=3028adc409e4c02206fa7386560e8cd41cf269689e5fc16d9c3407437bae3852
STX,2025-10-24T18:36:11+00:00,"Seagate Technology (STX) Stock Is Up, What You Need To Know",Yahoo,https://finnhub.io/api/news?id=1b0e3ca9276e53bd2ad9e8b4b4d0e4f7929e5fc12362414a1ce21f92f9873d10
STX,2025-10-24T18:28:00+00:00,ADP to Report Q1 Earnings: Here's What Investors Should Know,Yahoo,https://finnhub.io/api/news?id=a11722670d0b0e88789488125a4901fb3072b397867d12056368d9cc0f0b7446
STX,2025-10-24T16:00:02+00:00,Seagate (STX) Is Up 5.14% in One Week: What You Should Know,Yahoo,https://finnhub.io/api/news?id=d755908b1d18f66980366985d24d292a40208b854691380cff2dcfed66d7744a
STX,2025-10-24T15:27:00+00:00,Seagate's Mozaic 3+ Ramp Gains Momentum Across Global CSPs,Yahoo,https://finnhub.io/api/news?id=a6f31a2d355e710123a1a15cb4bf4f76d81c1e827e135ea8ce2dfd234d264b89
STX,2025-10-24T15:18:00+00:00,"Zacks Industry Outlook Highlights Micron Technology, Seagate Technology and NCR Voyix",Yahoo,https://finnhub.io/api/news?id=57162cefe7faa0b7d33c9aa21e26df8adc9abdd1adfdaaff6defbe4c254698e8
STX,2025-10-24T15:06:31+00:00,Seagate Stock Soars 172% YTD. Can Q1 Earnings Take It Further?,Yahoo,https://finnhub.io/api/news?id=1e8693aa8fe685bd26794d03cc9de5d397af8a6a8d868812fd77f76dc56794f5
STX,2025-10-23T13:15:04+00:00,Curious about Seagate (STX) Q1 Performance? Explore Wall Street Estimates for Key Metrics,Yahoo,https://finnhub.io/api/news?id=430df95dd5fe38e106de33b966046d5143958a918cdb96e1ab543bba1b22f3ae
STX,2025-10-22T20:14:39+00:00,Seagate: A Momentum Investor's Goldmine In The Data Storage Revolution,SeekingAlpha,https://finnhub.io/api/news?id=79ab5eb326cda8a9654194b6d0bfced90c4cc8961fbb3260857f6370d3cf9251
STX,2025-10-22T14:31:00+00:00,F5 Gears Up to Report Q4 Earnings: What's in the Offing?,Yahoo,https://finnhub.io/api/news?id=3e389f01f160550400d02981e1b9a07c69f7255b32d7905ebd1b7d21e86c26ec
STX,2025-10-21T14:00:17+00:00,Seagate (STX) Reports Next Week: Wall Street Expects Earnings Growth,Yahoo,https://finnhub.io/api/news?id=68d78d64a3f7c4216ad62fca5744ae34dfae033f7ba52d4dc9488f3e6ccde4a6
STX,2025-10-19T13:17:11+00:00,Is Seagate Technology Holdings (STX) the Most Underrated AI Stock to Buy?,Yahoo,https://finnhub.io/api/news?id=8ba6537afd538b21af03a338d8c4b4ccf403174e3d93017ffca2f1cfe6249c25
STX,2025-10-17T11:30:02+00:00,Why Wall Street Thinks This Tech Stock Is a Buy Now,Yahoo,https://finnhub.io/api/news?id=a67a9542a8f44e29802bc16a9c67590e54be9071bcff7164e3481baa515429df
STX,2025-10-17T06:11:42+00:00,How Investors Are Reacting To Seagate Technology Holdings (STX) Amid Analyst Upgrades and Sector Optimism,Yahoo,https://finnhub.io/api/news?id=4699ce4037abef025ba2555b00c857daa3fa049f2b376ebe251003d4ae1c0e24
STX,2025-10-17T03:14:08+00:00,Seagate Technology (STX): Valuation in Focus After Analyst Upgrades and Rising Optimism on AI Data Storage Growth,Yahoo,https://finnhub.io/api/news?id=3b3292e54a9bedc9699546368ffa0ffbb603390aa03bcb0b56a6bd3a2deb39d2
STX,2025-10-16T20:52:14+00:00,S&P 500 Gains and Losses Today: Regional Banks Slump on Worries About Bad Loans; Data Storage Stocks Surge,Yahoo,https://finnhub.io/api/news?id=1c8a7ffc2a7643f2c56bcf54529bf3d1c835fba3100d2022886743e5668c4949
STX,2025-10-16T19:38:08+00:00,"Wall Street Is Even More Bullish on Micron, Seagate, and Western Digital. Here's Why.",Yahoo,https://finnhub.io/api/news?id=0261303f98f03394251934cd3f5e743737a723ccdd63dbb34004ca2a653a82d4
STX,2025-10-16T13:24:00+00:00,Best Growth Stocks to Buy for Oct. 16th,Yahoo,https://finnhub.io/api/news?id=6e99b0e5587dd8adf2ec68e18da00f5a58dda9c8883dd018e745b9078c136aed
STX,2025-10-15T13:45:03+00:00,Here's Why Seagate (STX) is a Strong Growth Stock,Yahoo,https://finnhub.io/api/news?id=36b744fb75b3a134597421e1ce595302c6b346281ef902d143274a084d02a357
STX,2025-10-15T13:30:00+00:00,Can Western Digital's SIT Lab Expansion Boost Its Competitive Edge?,Yahoo,https://finnhub.io/api/news?id=1fea2642b31f24fede280e4d9bfaa0fccc7f57af5952da95d84130fedd11aaf9
STX,2025-10-15T12:00:04+00:00,5 Stocks Double Your Money — And None Is Nvidia,Yahoo,https://finnhub.io/api/news?id=ffbee2bd7b5b06267a0ddb2ebe993f8c7e4b172997206a301834f045b0e175b0
STX,2025-10-15T08:00:04+00:00,5 Stocks Double Your Money — And None Are Nvidia,DowJones,https://finnhub.io/api/news?id=c11b7576630cb8404b3e12378a3cb22ada6912253ab2c7469ea18457d84dd9e6
STX,2025-10-14T20:05:00+00:00,"Seagate Technology to Report Fiscal First Quarter 2026 Financial Results on October 28, 2025",Yahoo,https://finnhub.io/api/news?id=32f5dfeb5eb302f96aa1f7b79cab299b957ecec83fa0e0e6860dc3267966f0f3
STX,2025-10-13T15:59:00+00:00,ZeroPoint Technologies Teams with OCP Composable Memory Systems TCO Sub-Team Member to Showcase Inline Hardware Memory Compression,Yahoo,https://finnhub.io/api/news?id=9998da527f474df9da5593517df67f36aecbc43357de4ecf680c067d382b00d2
STX,2025-10-13T13:19:00+00:00,"Western Digital and Seagate Remain Buys Even as Stocks on Remarkable Runs, Citi Says",Yahoo,https://finnhub.io/api/news?id=5919de082268622eabffbc0a02c1380c9caa0e455890b618b34459557a4f0b15
STX,2025-10-12T06:06:54+00:00,Does Seagate’s 148% Rally Reflect Its Real Value After Latest AI Storage Demand Surge?,Yahoo,https://finnhub.io/api/news?id=6be71db254cf9a079c3ad3dd6fd8fae2e3204991d3e9455302ed6721f150b855
STX,2025-10-10T17:50:38+00:00,"Marvell Technology, Seagate Technology, Western Digital, Skyworks Solutions, and Texas Instruments Shares Are Falling, What You Need To Know",Yahoo,https://finnhub.io/api/news?id=ed20424bb57f17ab579858b7429bd011937692980fe6314821c73730ccc52769
STX,2025-10-10T16:50:00+00:00,Seagate Technology Holdings PLC stock outperforms competitors despite losses on the day,MarketWatch,https://finnhub.io/api/news?id=dcdc1ae7d4b501de2698e1d8ff581476c95e32df507d63f909457725c4e5f365
