ticker,published_utc,title,publisher,url
STX,2025-10-10T11:40:00+00:00,NetApp Rises 46% in Six Months: Where Will the Stock Head From Here?,Yahoo,https://finnhub.io/api/news?id=8f6b4ffa538dc351656ad326ded85c28fcb356ed43d42b2dbaf5626c9bb1c0b2
STX,2025-10-09T08:17:14+00:00,Seagate Technology’s Quarterly Earnings Preview: What You Need to Know,Yahoo,https://finnhub.io/api/news?id=ff38d3a323e2d55cf0b08aaba5cdfe8db2c2f48f7182ebe22697bf225fe54a29
STX,2025-10-08T23:57:02+00:00,Seagate: Generative Audiovisual AI Could Create A HAMR HDD Boom,SeekingAlpha,https://finnhub.io/api/news?id=005c3e070a2b094c882e6b6d8ded4fc1ee8df9b9dffb5af1e103bd73930e5878
STX,2025-10-08T17:41:00+00:00,"Gold Just Hit $4,000. Mining Stocks Look Like the Best Way to Play It.",Yahoo,https://finnhub.io/api/news?id=6d9cf05277e0914be9f20cc3a07e7b4c7361535023c0bac22949ee2f76ac662f
STX,2025-10-08T13:50:03+00:00,Are You a Momentum Investor? This 1 Stock Could Be the Perfect Pick,Yahoo,https://finnhub.io/api/news?id=d393f018e02fe0d436822253ac32377aa0dbbfe0541f57110ae36c38067deef4
STX,2025-10-08T01:15:16+00:00,"Seagate Soars On HAMR Hopes, But Risk-Reward Has Flipped (Rating Downgrade)",SeekingAlpha,https://finnhub.io/api/news?id=4f0bd2e27580767ebb4415e4e92e10f43146938f627b306e714e625f86ffd8fd
STX,2025-10-07T19:00:00+00:00,Here’s Why Western Digital and Seagate Technology Are Falling Fast Today,Yahoo,https://finnhub.io/api/news?id=f72b158264a1df434a69d63391cf0a39ab65140bdf27cce677407a286b067d66
STX,2025-10-07T18:01:01+00:00,"Amkor, Amtech, Micron, Seagate Technology, and KLA Corporation Shares Plummet, What You Need To Know",Yahoo,https://finnhub.io/api/news?id=bc57489d644c09c01276982acb66918fee06cd5f994d057a8e99a42ec394154c
STX,2025-10-07T16:00:03+00:00,Are You Looking for a Top Momentum Pick? Why Seagate (STX) is a Great Choice,Yahoo,https://finnhub.io/api/news?id=4e0406c4f306c90ac92f230ddb357154910ee007fcbfcc11c7da0331e3cff2f4
STX,2025-10-07T12:51:54+00:00,Why Jim Cramer thinks the stock market isn't loved,Yahoo,https://finnhub.io/api/news?id=bebf757b1babf49a27c0939fc45477485934d5701afa2be44d83e1279edd58bb
STX,2025-10-07T12:00:16+00:00,"At US$243, Is It Time To Put Seagate Technology Holdings plc (NASDAQ:STX) On Your Watch List?",Yahoo,https://finnhub.io/api/news?id=19a620fc009da6f7313f9032fad482733cc141fa788381638b33f02b700eb0c6
STX,2025-10-07T06:50:00+00:00,ValuEngine Weekly Market Summary And Commentary,SeekingAlpha,https://finnhub.io/api/news?id=fa69a98da56ae7c45625d88621897e9af01e68a6ce43758521b43fde6af2af78
STX,2025-10-06T14:05:00+00:00,STX vs. QMCO: Which Data-Storage Stock Deserves a Spot in Your Portfolio?,Yahoo,https://finnhub.io/api/news?id=b4cc8e46881f35b15d23a712829bdcbcca16401bc1ec430c88202a9fe544bf70
STX,2025-10-06T13:40:02+00:00,This Top Computer and Technology Stock is a #1 (Strong Buy): Why It Should Be on Your Radar,Yahoo,https://finnhub.io/api/news?id=4551c2fccd88bd3bbf0a78b0b905c1e83acdc08355b6399eceef992eab5a5063
STX,2025-10-05T09:15:39+00:00,Jim Cramer on Western Digital: “It’s Good to See the Market Giving the Stock its Due”,Yahoo,https://finnhub.io/api/news?id=d261e153acb3f6a77cb934ec22e0e36f3dd1c569a775a4908839c516dda54dcc
STX,2025-10-03T20:45:25+00:00,Why Seagate Stock Crushed It With a 17% Gain This Week,Yahoo,https://finnhub.io/api/news?id=abc6ad33a3de530c563e4a993760494d5c5bc243d4ef41afa69f864c7e833997
STX,2025-10-03T16:10:02+00:00,Why Seagate (STX) Could Beat Earnings Estimates Again,Yahoo,https://finnhub.io/api/news?id=a55fa3fe801d66b54a781daa5c8dcc68e7b28d79b9483b83bb714feec5f310d1
STX,2025-10-03T13:31:20+00:00,S&P 500 Stocks: These 5 Lead As Index Hits Record High,Yahoo,https://finnhub.io/api/news?id=a176349df44524c82fe9269941a92c11049a52eb48c28c301fd46de47eb909be
STX,2025-10-03T13:01:00+00:00,Micron's NAND Sales Hit $8.5B in FY25: Can the Momentum Continue?,Yahoo,https://finnhub.io/api/news?id=2feb19120d8dcbd2ffb0770843d68d009d1bd6ce1a416954245e3912c76474ee
STX,2025-10-02T16:48:35+00:00,Seagate Technology (STX): Assessing Valuation After Recent Analyst Upgrades and AI-Driven Optimism,Yahoo,https://finnhub.io/api/news?id=2f16f5eb7892692caa8ca90fb0725c186a0e5def636898db69e38340d39ed5c7
STX,2025-10-02T13:52:00+00:00,"SSD Supplier Status Report, Q2 2025 - A Strong Recovery in PC SSD and Enterprise SSD Shipments Drove Solidigm and SK Hynix's Share Gains",Yahoo,https://finnhub.io/api/news?id=becafdfd5367de5295b63b314c39e34680df27e1fc4eb90b14799e43f5f4c081
STX,2025-10-02T13:15:02+00:00,"Micron Technology, Inc. (MU) Soars to 52-Week High, Time to Cash Out?",Yahoo,https://finnhub.io/api/news?id=671057b148758faeefdc4adedd28df291c29bf8d627ec33ca4548f928c561d16
STX,2025-10-02T12:30:02+00:00,"If You Invested $1000 in Seagate a Decade Ago, This is How Much It'd Be Worth Now",Yahoo,https://finnhub.io/api/news?id=061d4174e62019b09d78072766780eb2f40c95de0825d716e47744c08776d7aa
STX,2025-10-02T04:37:42+00:00,1 Unpopular Stock That Deserves Some Love and 2 We Brush Off,Yahoo,https://finnhub.io/api/news?id=536f5b802242a201d74e4dd7c44a3f820b0e68e920c435ffd976ded16d94e869
STX,2025-10-01T20:02:23+00:00,This Top S&P 500 AI Stock Is Even Beating Palantir in 2025. Should You Buy It Here?,Yahoo,https://finnhub.io/api/news?id=ebf7913c6eda8e98bba504a2295104b8c46bfd9b404f4a5ab07dc9f0e6545dd9
STX,2025-10-01T19:45:14+00:00,AI Stocks Have Fueled the Bull Market for 3 Years—Will the Momentum Continue?,Yahoo,https://finnhub.io/api/news?id=c339d6aefa0e72b76c555b6fb00db8ec14a74f01acf31366c246c4d3177acbb0
STX,2025-10-01T16:35:10+00:00,"These S&P 500 Stocks Stood Out in Q3 2025: Western Digital, Warner Bros Discovery, Seagate, Corning, Teradyne",Yahoo,https://finnhub.io/api/news?id=74ce702a719feb6d45fd3c82fdf7113d3a3add66e7df1b9124137bb45b53b13a
STX,2025-10-01T13:50:02+00:00,Why This 1 Momentum Stock Could Be a Great Addition to Your Portfolio,Yahoo,https://finnhub.io/api/news?id=fa578e241cd804dc2eea27f8f83c4842b1e0afe8ea27446ae8cc197dce4502e1
STX,2025-10-01T08:00:00+00:00,Micron: Still Undervalued After Massive EPS Recovery,SeekingAlpha,https://finnhub.io/api/news?id=a840710956b16bebdac175a8a24a15540485d6e5d5d47fab5c0a411e0748bcdc
STX,2025-09-30T16:00:03+00:00,Seagate (STX) Upgraded to Buy: What Does It Mean for the Stock?,Yahoo,https://finnhub.io/api/news?id=a2786a16278f31989f2fc25bfd99a10ba8bd56da12cdc9ef9ea199678c3a5548
STX,2025-09-30T15:05:00+00:00,"Don't Fear AI Bubble, There Will Be Winners - Tech Contrarians",SeekingAlpha,https://finnhub.io/api/news?id=58d9aaaca47d8b88156dad7f0db721bb33b7ec62dfa9956c05ea755a691e09c6
STX,2025-09-30T14:37:00+00:00,47-year-old tech stock gets new price target on AI demand,Yahoo,https://finnhub.io/api/news?id=62f2636b37f0e07d5250e9e0a05bad195bcc2c29ca79d62723138b945f800bec
STX,2025-09-30T13:15:01+00:00,Seagate Technology Holdings PLC (STX) Hits Fresh High: Is There Still Room to Run?,Yahoo,https://finnhub.io/api/news?id=1320cc663a6a74f7d027979f100516ed41b6d246aab7498b505038c090d569a6
STX,2025-09-30T04:31:59+00:00,3 Growth Stocks We Approach with Caution,Yahoo,https://finnhub.io/api/news?id=a123c2b69234559656568549f6b85ee79169a158056413829f2393aae0d44bf0
STX,2025-09-29T19:10:49+00:00,"Seagate Technology (STX) Stock Trades Up, Here Is Why",Yahoo,https://finnhub.io/api/news?id=bb905cd465e6c80978cc2e5011586afd5d7b98e3863305b800d20a09a0ce38db
STX,2025-09-29T18:30:00+00:00,Western Digital stock surges: A closer look at the record climb,Yahoo,https://finnhub.io/api/news?id=c485b32572af9003a575e057d89243a242cb9a06cccfdaaf00222088f6dc7065
STX,2025-09-29T18:03:42+00:00,Cannabis Stocks Rally After Trump's Post On Health Benefits. But There's This Risk.,Yahoo,https://finnhub.io/api/news?id=6f32fc9b713be2ca3d32c0e25d5ed5ff94e9a16de0b2dbad810e9946f49347ee
STX,2025-09-29T17:13:47+00:00,Morgan Stanley materially lifts HDD price targets and forecasts,Yahoo,https://finnhub.io/api/news?id=90dabb9bd2ee8334205ab27141d079afd48afb92de73f636739300ef9327f716
STX,2025-09-29T17:09:20+00:00,Hard Drive Stocks Are Surging. These Analysts Think the Good Times Can Continue,Yahoo,https://finnhub.io/api/news?id=e56ff478326012830c2cb8c445734e515266e503231a33e61a22467e4a88145e
STX,2025-09-29T17:03:48+00:00,"Top Stock Movers Now: Electronic Arts, Western Digital, Intel, and More",Yahoo,https://finnhub.io/api/news?id=bcc55ed885462546dce1c6ed2539f3284238d361043f2cdf222d1087042ca0fe
STX,2025-09-29T16:17:01+00:00,Newest S&P 500 Stock Is Index's Biggest Winner In 2025,DowJones,https://finnhub.io/api/news?id=121bc15ba8a50e81b694f080ccf444527d5425863ebbccae703775ace86b335b
STX,2025-09-29T16:01:00+00:00,Western Digital Is the S&P 500’s No. 1 Stock Today. One Firm Nearly Doubled Its Price Target.,Yahoo,https://finnhub.io/api/news?id=41cec1220fdde9759f9d463be04762833e69cfe4dc9d4c44b80059fc47658568
STX,2025-09-29T15:05:57+00:00,"Seagate, Western Digital Surge On Price Target Hikes. Why Hard Drives Are Getting An AI Boost.",Yahoo,https://finnhub.io/api/news?id=50aa94a3ca054d87b18bc675e95d805b519bed84d4b947fbb1b5221b25082f4d
STX,2025-09-29T13:45:01+00:00,Why Seagate (STX) is a Top Growth Stock for the Long-Term,Yahoo,https://finnhub.io/api/news?id=4dfd7da3af6d2816907353704c9abc3c044d7e705cb0f94bf7d93b173cbe6554
STX,2025-09-29T11:19:19+00:00,Western Digital: The AI Effect Has A Clock,SeekingAlpha,https://finnhub.io/api/news?id=6a96afe67b724f73e9da52ebb96622e83ede4c891268d4568d5bef38976d0c8e
STX,2025-09-27T14:28:46+00:00,AI-Fueled Demand and HAMR Innovation Could Be a Game Changer for Seagate (STX),Yahoo,https://finnhub.io/api/news?id=f346a41b1bd8c01c0134d0d44b585f71030b8adc496b2ba1c2e721cdb9f48c82
STX,2025-09-26T21:19:00+00:00,"AI Stocks Wobble As Spending Balloons. Another DeepSeek Dip, or a Dark Fiber Moment?",Yahoo,https://finnhub.io/api/news?id=87150299714a08678f9f848213fa4ec42fa64bbd817ab80b9d186c3cf70a7b45
STX,2025-09-26T16:48:00+00:00,Seagate Technology Holdings PLC stock underperforms Friday when compared to competitors,MarketWatch,https://finnhub.io/api/news?id=504639e81dd12a8e384fb57326c1b9500381a3c6ed01b7d19841b49cf8f6f1d7
STX,2025-09-26T14:14:00+00:00,Micron's DRAM Revenues Hit $28.6B: Can the Momentum Continue?,Yahoo,https://finnhub.io/api/news?id=4f69dffa76d67e398dbf8c5710a31a15156854a21cad830b682f47a3b8b2b92f
STX,2025-09-26T13:00:39+00:00,"Stocks making big moves this week: Mirion, Jabil, AutoZone, Seagate Technology, and EVgo",Yahoo,https://finnhub.io/api/news?id=1169d40bdd039b03fc336e21ab786244b975525f40fbe659ff0d03b0f497b0c3
STX,2025-09-26T12:57:54+00:00,"“This Is Unbelievable,” Says Jim Cramer About Seagate (STX)",Yahoo,https://finnhub.io/api/news?id=e70a26cab93f97d181461c806374ebd4b6252ec3808734e3118082a32dc52517
STX,2025-09-26T04:04:58+00:00,3 Reasons to Sell STX and 1 Stock to Buy Instead,Yahoo,https://finnhub.io/api/news?id=9af6ba4e9388aac4c31ff36f3261f02fe5a77238acebeea3d0027417082a5840
STX,2025-09-25T13:53:27+00:00,Analyst Explains Why Seagate (STX) Has a ‘Lot More Upside’,Yahoo,https://finnhub.io/api/news?id=d6bc7b4d2d686f57098dbdf21f6403e8fe51d41a5d01792e360ff14224278928
STX,2025-09-24T16:49:00+00:00,Seagate Technology Holdings PLC stock underperforms Wednesday when compared to competitors,MarketWatch,https://finnhub.io/api/news?id=e8b32b3704127c88d155f9f57c62baa136b0ced0c2e20e65fbac02c4a1703a10
STX,2025-09-24T15:51:36+00:00,"BofA raises Seagate, Western Digital targets on resilient pricing dynamics",Yahoo,https://finnhub.io/api/news?id=ef2c7cf18d52771ea1e77a76cf8b0c09e02e9a502994d3ea3a10017785ce73fb
STX,2025-09-24T05:42:06+00:00,"Bernstein Rates Seagate (STX) Outperform, HDD Rebound & HAMR Drive $250 PT",Yahoo,https://finnhub.io/api/news?id=5fecb2e73dc52ac0cd31dedc9e62305a0ba5e6a91e1ef2bd2a1bfa558ed58f0a
STX,2025-09-24T01:18:32+00:00,This recent S&P 500 addition is now the best-performing stock in the index,Yahoo,https://finnhub.io/api/news?id=d15505f81a75158767a9f10bdcb69fa71cb72cfab62e8f50f333e1ed98b5e9c8
STX,2025-09-23T16:24:04+00:00,Sandisk Stock Jumps After Analyst Doubles Price Target. Data Storage Stocks Are Getting AI Boost.,Yahoo,https://finnhub.io/api/news?id=a9345ac831196834b067a3bc2e22663cd7056fb007c68902a574d7a394822760
STX,2025-09-23T13:35:38+00:00,Micron Needs a Rosy Outlook to Justify Its Soaring Stock Price,Yahoo,https://finnhub.io/api/news?id=22d92f619d91dc0422f6ec5cbb332190c0407f1107f0f36e6d5f6510501bd28e
STX,2025-09-23T13:00:02+00:00,These 2 Computer and Technology Stocks Could Beat Earnings: Why They Should Be on Your Radar,Yahoo,https://finnhub.io/api/news?id=71303b4fd1b0ea148d79de269d71140390b1319c4b2ef4433d2a572761d62443
STX,2025-09-23T11:01:40+00:00,Western Digital (WDC): Examining Valuation as AI-Driven Demand Fuels Price Hikes and Investor Interest,Yahoo,https://finnhub.io/api/news?id=95b7936da8a84b74600034a10905bc4c97332aa345c5d637d95732463792ad1e
STX,2025-09-22T16:57:00+00:00,"Toll Brothers’ Montrose at Innisbrook Community Opens New Townes Collection in Palm Harbor, Florida",Yahoo,https://finnhub.io/api/news?id=fb741b3a4e16f239379eb258948806de118c888ccd349479bc4b7c3e51f004c4
STX,2025-09-22T15:41:00+00:00,Seagate Stock Surges 153.4% in 6 Months: Will the Uptrend Continue?,Yahoo,https://finnhub.io/api/news?id=ada57cabe510bf294077fadfef50acb9ad95a0776c52115f20d5cc9e6fc1abda
STX,2025-09-22T10:25:27+00:00,Is Seagate a Smart Move After Shares Surge 39% on AI Infrastructure Hype?,Yahoo,https://finnhub.io/api/news?id=8d8949ee3963678ea4b275b25cda5fadbf0380d83f3da83aeccfed5e32bddc48
STX,2025-09-21T14:00:07+00:00,The hottest thing in the stock market is suddenly boring tech,Yahoo,https://finnhub.io/api/news?id=e4c0821c2426afe8eb3f52a1c16414d84db630fe165b6eb896e5b0a42aff271f
STX,2025-09-19T21:19:11+00:00,Why Seagate Technologies Rallied Double Digits This Week,Yahoo,https://finnhub.io/api/news?id=59106fd973fabc447e935e14c16acb1ada2223b2b584545f460f9401d2fe275c
STX,2025-09-19T12:52:00+00:00,Nvidia Stock Can’t Keep Up With Micron and Other AI Plays. Here’s Why.,Yahoo,https://finnhub.io/api/news?id=0da0afaf1ffa34569a184ec9c27d9ec8f4b0e47e096c3d7e0589ab44307885c2
STX,2025-09-19T12:15:00+00:00,"Meet the Brilliant Stock That Is Racing Into the AI Infrastructure Boom in 2025. Is It a Buy, Hold, or Sell From Here?",Yahoo,https://finnhub.io/api/news?id=992d6452a1d2cd817562e9c2efb8c9eed5e2fb21e9f452d2d19404c4e6b31891
STX,2025-09-19T10:30:00+00:00,"Hard Drives Are Making an AI Comeback. Yes, Hard Drives.",Yahoo,https://finnhub.io/api/news?id=be46d7df6da5b720f01f740df51b4726675cd08d4ad864565c0d7dabb73a9392
STX,2025-09-19T05:37:36+00:00,1 Mooning  Stock Worth Investigating and 2 We Brush Off,Yahoo,https://finnhub.io/api/news?id=d20d84a0288e8c37725d15228641947307f8a8793459aa6e187aa1d3ad98e0a2
STX,2025-09-18T22:10:49+00:00,Analysts Note Growth Potential and Risks for Western Digital (WDC),Yahoo,https://finnhub.io/api/news?id=be48dbd559f911de83b03255ac3973c15281d3e2fc1b9efc78d5706a3ad07db5
STX,2025-09-18T16:33:00+00:00,Micron Bets on G9 NAND SSDs: Is it the Next Growth Catalyst?,Yahoo,https://finnhub.io/api/news?id=fdfe1da441de4e486f96f8889d6139535af4001050cfdd10245013b0b6905d81
STX,2025-09-18T06:31:42+00:00,Is Seagate Technology Stock Outperforming the S&P 500?,Yahoo,https://finnhub.io/api/news?id=c2095b50d74ea029246fba401d6dd6237753c8d206818407db26969ec4081b1f
STX,2025-09-17T14:40:53+00:00,"Apple initiated, Hershey upgraded: Wall Street’s top analyst calls",Yahoo,https://finnhub.io/api/news?id=a103473c78092b09fbc87051a7b0840a8b7431c6274373f53a5b36ea3c00594c
STX,2025-09-16T14:44:20+00:00,"IT hardware enters the ‘Intelligence Revolution,’ Bernstein says",Yahoo,https://finnhub.io/api/news?id=d4f52c0b8367292d2f5732bd1fd4bb2e719245e9d0ef06b425c8e9b75d226ef8
STX,2025-09-16T14:27:13+00:00,Seagate's Growth Runway Extends With Large Data Center Investments,SeekingAlpha,https://finnhub.io/api/news?id=0c508886d13ac558cfcf8215bdb3608e738357fb40163d17aebb8a5475bfbc02
STX,2025-09-16T14:09:00+00:00,WDC Surges 129% in 6 Months: How Should Investors Play the Stock?,Yahoo,https://finnhub.io/api/news?id=42c2995529f45b56832e8d8c9ff779decba59d30b02a25b102d52aa299e8f3f1
STX,2025-09-16T13:35:34+00:00,"Apple initiated, Hershey upgraded: Wall Street's top analyst calls",Yahoo,https://finnhub.io/api/news?id=a882702607be0d5bfb461d31fdc538c1562764f6552fc54775707e30a99e3683
STX,2025-09-16T12:06:48+00:00,Seagate Technology (STX): Rethinking Valuation After Analyst Sentiment Shifts and Strong Year-to-Date Gains,Yahoo,https://finnhub.io/api/news?id=a8b94b5e7b147f242e2da4e24bac8d92222e7d6df45f45280e3ef7fde03f6cc7
STX,2025-09-16T12:01:00+00:00,Strength Seen in Seagate (STX): Can Its 7.7% Jump Turn into More Strength?,Yahoo,https://finnhub.io/api/news?id=ff02cef50e76c366a2c4124d4e2af8c4cf2777bceb835a4b06b8681cef58f4df
STX,2025-09-16T11:07:07+00:00,S&P Futures Tick Higher Ahead of FOMC Meeting and U.S. Retail Sales Data,Yahoo,https://finnhub.io/api/news?id=c50c5d117fc993b24ab273197e387cb4232c33ed4c2c3eac60f554d84d8c8fd9
STX,2025-09-16T09:15:00+00:00,Should You Forget BigBear.ai and Buy 3 Artificial Intelligence (AI) Stocks Right Now?,Yahoo,https://finnhub.io/api/news?id=028a8116cc6c6f1c9fafdc5c456d781e1add46cadf2b6484f3fa26189b0b4d33
STX,2025-09-15T22:43:44+00:00,S&P 500 Gains and Losses Today: Seagate and Western Digital Surge; JM Smucker Stock Slides,Yahoo,https://finnhub.io/api/news?id=4f352b012a6a0f74833706f8f51ed1fa92d4a0597090f4bdcb13a4c075637841
STX,2025-09-15T22:36:00+00:00,Review & Preview: Stocks Jump Again. Will the Rally End With a Rate Cut?,Yahoo,https://finnhub.io/api/news?id=38560ecab83495f66836dd9790f292c02b42338371f22a12322b8abb9b494a76
STX,2025-09-15T22:28:44+00:00,Some of the Biggest AI Winners of 2025 Are Data Storage Stocks,Yahoo,https://finnhub.io/api/news?id=fde4117804182f974e0ad5d12c29de5969e7dc8a3527660f6a16c785c644a36d
STX,2025-09-15T21:41:00+00:00,"Tech Buying Pushes S&P 500, Nasdaq to Fresh Records",Yahoo,https://finnhub.io/api/news?id=861c943be092d5c7749337e49d9a7fd81f2e006830deeb59021c98c1f0d26986
STX,2025-09-15T21:37:15+00:00,Stocks Rally as Bond Yields Fall Before FOMC Meeting,Yahoo,https://finnhub.io/api/news?id=ad787dfd79fcf79bed1068ce210f8605f577ad41fa92c6ae45b67e4d0f1b33fa
STX,2025-09-15T21:21:27+00:00,Stock Market Today: Dow Up As Buffett Stock Tests Entry; Tesla Jumps On Musk Move (Live Coverage),Yahoo,https://finnhub.io/api/news?id=5322948e5176ecd7649d20e945c7e7e94e4dcf04a469d104678b2b0f7bda407f
STX,2025-09-15T21:20:40+00:00,Why Is Seagate Technology (STX) Stock Rocketing Higher Today,Yahoo,https://finnhub.io/api/news?id=cf915ec09f4333b0b6d8d168687b292a3797f779a4ec04d804e19076e1b9e391
STX,2025-09-15T16:37:40+00:00,This Tech Stock Has Delivered Palantir-Like Gains. Should You Buy It Now?,Yahoo,https://finnhub.io/api/news?id=3e7ce25f05d04de17ff62bbef1b06ffc023097bdb5f3810168f2d19518b37bbb
STX,2025-09-15T16:31:56+00:00,"Top Stock Movers Now: Tesla, Intel, Nvidia, and More",Yahoo,https://finnhub.io/api/news?id=c2199f08499e23b638e6e6199c3401d9262a091c68208f45f6f453b9794944fc
STX,2025-09-15T14:20:15+00:00,Time To Count Profits - Sandisk Isn't The Next Micron,SeekingAlpha,https://finnhub.io/api/news?id=6c25de112cbfe20d44f5ef7b1fa23caf38bf57a8b6e69d42ae8945ee52f61628
STX,2025-09-15T04:35:06+00:00,Semiconductors Stocks Q2 Results: Benchmarking Seagate Technology (NASDAQ:STX),Yahoo,https://finnhub.io/api/news?id=e0a1318b19c6b8459729bd672ad06a04e4d5da79f48d29abf3ad192fc5507b44
STX,2025-09-14T09:23:11+00:00,Money Flows Help You Find Superstar Stocks Like Seagate,Yahoo,https://finnhub.io/api/news?id=09345f76d1d9f9f2760c009efb09fa5e2228a65a82511df45ce8a071760fa9db
STX,2025-09-12T20:40:37+00:00,"Seagate Technology Holdings plc (STX) Has Historically Traded At A Big Discount To The S&P, Says Jim Cramer",Yahoo,https://finnhub.io/api/news?id=63bbd61aed69a923897c535394592644af2080bdd317cfe7b26df081c5f2da3a
STX,2025-09-12T14:50:03+00:00,Here's Why Seagate (STX) is a Strong Momentum Stock,Yahoo,https://finnhub.io/api/news?id=6c420d54bc894b19b22e7f633139ab842db775411e506d3c8aaa531e20114982
STX,2025-09-12T10:36:00+00:00,Strength Seen in Micron (MU): Can Its 7.6% Jump Turn into More Strength?,Yahoo,https://finnhub.io/api/news?id=9b1a79ee51e63c5a5ec1adf2c8e1d8a1162351092bf59aa4542c871c6b488df7
STX,2025-09-11T19:10:54+00:00,Micron Stock Leads The Memory Storage Group Higher As AI Demand Surges,Yahoo,https://finnhub.io/api/news?id=bf1645b6f36ec94169f98e4596f63f132241fce8b5990e865948daea3d7a295a
STX,2025-09-11T14:55:01+00:00,"Barclays ups price targets for Seagate, Western Digital on improved HDD outlook",Yahoo,https://finnhub.io/api/news?id=70e35ca0251ca97d22893e4f9786474477dd0db7eb4474691f9789d51af281a2
STX,2025-09-10T12:13:08+00:00,Why Seagate (STX) Shares Jumped 12.4 Percent After Analysts Raised Long-Term Earnings Forecasts,Yahoo,https://finnhub.io/api/news?id=5ec808cfe702e00c2ba573ca04636dc1540ca733af8aa087c479f289ed08b093
STX,2025-09-09T16:54:00+00:00,Seagate Technology Holdings PLC stock underperforms Tuesday when compared to competitors despite daily gains,MarketWatch,https://finnhub.io/api/news?id=52bbec249da464e8dc06050fa559a94b6a1ebfc31c0b875863989b9e2f029970
