ticker,published_utc,title,publisher,url
TSLA,2025-11-12T22:02:40+00:00,Tracking Cathie Wood's ARK Invest 13F Portfolio - Q3 2025 Update,SeekingAlpha,https://finnhub.io/api/news?id=e40ec65ff111700464629f15fa3b413b2a2a5176dbc6bda627c5aa446e6bd8ee
TSLA,2025-11-12T16:37:00+00:00,What Tesla Stock Would Look Like in 10 Years If Musk Hits Pay Targets,Yahoo,https://finnhub.io/api/news?id=d6edb26de7cdbdc3312cd64041086f09dfb0a6ea95c16126356f29cb70ba8934
TSLA,2025-11-12T16:22:35+00:00,TSLA: Tesla Sales Plunge 23% Globally After U.S. Tax Credit Ends,Yahoo,https://finnhub.io/api/news?id=0049d0a4805e59b0b3734432077378d4922a8fa69ba01bd87ff025ef31af24fe
TSLA,2025-11-12T16:13:50+00:00,Tesla Faces Key Turning Points as Morgan Stanley Flags Six-to-12-Month Catalysts,Yahoo,https://finnhub.io/api/news?id=6d123e2b5c823c5d9bea4ed01532e385d967720a3b93c1f0f583982e3c834fe2
TSLA,2025-11-12T15:46:06+00:00,"'Michael Burry Scared Me,' Says 25-Year-Old Who Bought Nvidia Dip For $101—'SOLD IT ALL!!' Over AI Bubble Fears, Now Sitting On Cash Awaiting Crash",Yahoo,https://finnhub.io/api/news?id=3e1f30806176d5da807d4836646d52878d907b9b2944bc86c611fe9a5cdecefc
TSLA,2025-11-12T15:16:10+00:00,"Robert Kiyosaki Says He's Never Been Fired Because He's 'An Entrepreneur, Not An Employee'",Yahoo,https://finnhub.io/api/news?id=7b26a5ce51f172a2ed509c4d7cde7ef5b7ef8b932233113e36e90bb7d9f2b46b
TSLA,2025-11-12T15:01:59+00:00,Nasdaq Loses Early Gains,Yahoo,https://finnhub.io/api/news?id=3638db684edb083293c24d34de12f71ca134aa095cb979c3b12164dd7e1b37cd
TSLA,2025-11-12T15:01:00+00:00,"Coinbase to Leave Delaware, Reincorporate in Texas",Yahoo,https://finnhub.io/api/news?id=6ee7f944b21445b38aa42729b29202d6d9b584d11dcd0df556c777004f290365
TSLA,2025-11-12T14:53:00+00:00,Tesla Stock Is Stable Despite Awful EV Sales. Why Wall Street Isn’t Worried Yet.,Yahoo,https://finnhub.io/api/news?id=b98de3f9c171d9ab2d4a26241d166ce91c6b8804da1a5b6962d8c3531c01a18f
TSLA,2025-11-12T14:35:10+00:00,"Stock market today: Dow, S&P 500, Nasdaq diverge as Big Tech wobbles ahead of House shutdown vote",Yahoo,https://finnhub.io/api/news?id=5ac1e354046ae67801df8a12a0c9586a9da27f72dc8aca009ddc32880dfd8396
TSLA,2025-11-12T14:16:08+00:00,Elon Musk Says 'It's Time' To Put Dogecoin On The Moon But It Is Not DOGE That Surges,Yahoo,https://finnhub.io/api/news?id=ddb3be070563c4f33ee25457d05983aa3dd4e3ddcc356116059e5e3f3b37e943
TSLA,2025-11-12T13:53:19+00:00,Crypto exchange Coinbase set to reincorporate in Texas,Yahoo,https://finnhub.io/api/news?id=2e8ec03d9c188b5ce437a84957be1929c292a686f45af17f54c676eb9c6c3f4d
TSLA,2025-11-12T13:48:58+00:00,10 High Quality ETFs & Stocks To Buy In The Next Market Downturn And Hold Until 2030,SeekingAlpha,https://finnhub.io/api/news?id=76b42e36e743e58ebcb32e24328c02d01398875d1a87ece4f4584b582d89ee87
TSLA,2025-11-12T13:48:18+00:00,Warren Buffett Says 'Very Wealthy CEOs Hate When Others Get Even Richer' — Was It a Dig at Elon Musk As He Could Become World's 1st Trillionaire?,Yahoo,https://finnhub.io/api/news?id=e07d0dbaf21daf0f8e35497e1a5c5d1098e2a6ad11914491501cca9adbe7cc3b
TSLA,2025-11-12T13:28:13+00:00,What will matter to Tesla stock price over the next 6 to 12 months?,Yahoo,https://finnhub.io/api/news?id=872ab94be1bbb9624b01fb0bcdc06e6f8ca0af5bb4da20489d0dbd1da0ccac75
TSLA,2025-11-12T13:15:00+00:00,Tesla’s October Sales Were Awful. The Stock Is Rising.,Yahoo,https://finnhub.io/api/news?id=a5826b5da730c29baadca5f251ac8caed83b1aae4caa024e3bfcc2b1ba2fb213
TSLA,2025-11-12T12:37:29+00:00,Latest News In Electric Vehicles - Aptera Motors Advances Toward Scalable Solar Vehicle Production,Yahoo,https://finnhub.io/api/news?id=f7e63a10175432d47fc9125871ec93b67e93b0677e81456f37f4e60d40f6e4cd
TSLA,2025-11-12T12:31:11+00:00,"Cathie Wood Dumps $2.4 Million Worth Of Tesla Shares, Doubles Down On These AI Stocks",Yahoo,https://finnhub.io/api/news?id=e94dc85e708409a86b13369f382029aec33036b6875142e13aeb6c8c43b1daa7
TSLA,2025-11-12T12:26:00+00:00,"These Stocks Are Moving the Most Today: AMD, Oklo, Nvidia, On Holding, Bill Holdings, and More",Yahoo,https://finnhub.io/api/news?id=d7e4b6abca580b17f00dbefbf94b385e5ea1b5f848ef589750d61e8879d1d8a4
TSLA,2025-11-12T12:12:15+00:00,Rivian Surges as CEO RJ Scaringe Lands $4.6 Billion Payday,Yahoo,https://finnhub.io/api/news?id=6ab6f9f4cf6baa757ac2b42cbe4f8edb278cdc25b36c7a97b66f6518794058ee
TSLA,2025-11-12T11:32:00+00:00,The Zacks Analyst Blog Highlights Tesla and QuantumScape,Yahoo,https://finnhub.io/api/news?id=59dbcb24878eb2985619c7faaf278586cf64187567242f2bbee350bf1b625e8d
TSLA,2025-11-12T11:30:05+00:00,How buying the dip & selling the rip is fueling investor gains,Yahoo,https://finnhub.io/api/news?id=738997381394a14560151d48bdec123a0739e03365fda67c173eebb586b884af
TSLA,2025-11-12T11:00:01+00:00,"Waymo begins offering freeway robotaxi rides in San Francisco, LA and Phoenix",CNBC,https://finnhub.io/api/news?id=36427d01b5b1ca8f2227aae24582add0d5f786a172b896ba482fa632918ad5df
TSLA,2025-11-12T10:30:00+00:00,"Humanoids Rise: Figure's $1 Billion, Musk's $1 Trillion, XPeng's IRON",SeekingAlpha,https://finnhub.io/api/news?id=46b3ef5114dce45077af222fb0792937a880642e65af848e55860a464494083b
TSLA,2025-11-12T10:21:30+00:00,Tesla's Bot Optimus Is No More Than A Dream,SeekingAlpha,https://finnhub.io/api/news?id=9b8fd18ab4ba4bdaa732d788d9fdb6c7f6db14d7422354847f73392c40601d7d
TSLA,2025-11-12T09:31:00+00:00,Uber Stock Is a Buy: But You'll Have to Watch It Closely,Yahoo,https://finnhub.io/api/news?id=1bbb39b792663917fee1bd06321826e56bc80b06285f0b5adfe72b2a314f4f8c
TSLA,2025-11-12T08:37:56+00:00,"Coinbase moves incorporation to Texas from Delaware, following Musk's lead",CNBC,https://finnhub.io/api/news?id=818a184754596f33098448e0c920439900d470af0d63c128ec7737af6008f379
TSLA,2025-11-12T08:05:00+00:00,Prediction: This Dividend-Paying Value Stock Will Join Berkshire Hathaway in the $1 Trillion Club Before Walmart,Yahoo,https://finnhub.io/api/news?id=d919804423962c5ae8cd0475aa6ee107188b1a5a36915ea9c65b1c7ecbd46a11
TSLA,2025-11-12T05:00:00+00:00,Baron Technology Fund Q3 2025 Top Contributors And Detractors,SeekingAlpha,https://finnhub.io/api/news?id=23ed55211d9527fd87fa0f74c9afa2026bad2ec2ad20ebd38f8eac34175b98eb
TSLA,2025-11-12T03:01:12+00:00,From $20K To $1M: The Nvidia Trade Jim Cramer Called Back In 2017,Yahoo,https://finnhub.io/api/news?id=ece8b2853b35932713a900d1739792c6698aad5ba6c6d692e73aef7c93363f60
TSLA,2025-11-12T02:01:04+00:00,Bitwise Investment Chief Says Bitcoin Sideways Movement 'Means Bigger Allocations',Yahoo,https://finnhub.io/api/news?id=c0e90d72c355646977aec8c134571fb4c8e268c3593df8e435b19c1e2d431025
TSLA,2025-11-12T01:12:00+00:00,Could Buying Tesla Today Set You Up for Life?,Yahoo,https://finnhub.io/api/news?id=a23923ae469a0cf804bc8cd9d98d38f950b5b700412143de26bd745e481f2ac2
TSLA,2025-11-11T23:31:23+00:00,Dave Ramsey Tells Gen Z To Push Back Against The Establishment By Picking Up A Trade Instead Of An 'Overpriced And Leveraged' Degree,Yahoo,https://finnhub.io/api/news?id=4e5c19f78e57f27f14d5e96d86993e34d6da64a931a28003f542969d6ea9d87b
TSLA,2025-11-11T22:01:08+00:00,"Not a 'Zombie Company': Scale AI's CFO Says People 'Mischaracterize' Deal That Sparked Founder Joining Meta, Boasts Misunderstood Trajectory",Yahoo,https://finnhub.io/api/news?id=9601bbc02733bc92425f6786754628306ad02333b029a98f74412768903f3c9e
TSLA,2025-11-11T21:59:09+00:00,Tesla just bet $1 trillion on Elon Musk’s next decade,Yahoo,https://finnhub.io/api/news?id=456a184983a586582b2187450a036f0717755cdf1be72b058b686c3549e0c3b7
TSLA,2025-11-11T21:43:41+00:00,US Equity Indexes Mixed as Technology Restrains Nasdaq Composite,Yahoo,https://finnhub.io/api/news?id=1b29ec77843759a214fa6853819c9082b8226a96226f8b136d48a109162ff3ed
TSLA,2025-11-11T21:23:00+00:00,"These Stocks Moved the Most Today: CoreWeave, Nvidia, Tesla, Nebius, Rigetti, BigBear.ai, Rocket Lab, and More",Yahoo,https://finnhub.io/api/news?id=b4123dc3a58132906e0066ed2b2428ef0e083123cbc5c5c93921a90f55f5bb88
TSLA,2025-11-11T21:22:51+00:00,"Tesla Just Lost Its Cybertruck Leader. Should You Buy, Sell, or Hold TSLA Stock?",Yahoo,https://finnhub.io/api/news?id=57d7f7ea51fd87b938a4257a4c65f4a705e669cfd528a47fcf164a70f9914287
TSLA,2025-11-11T19:01:05+00:00,Crypto Is 'Boring' Now – Here's Why That's Actually A Good Thing,Yahoo,https://finnhub.io/api/news?id=a05523df98ea9278abc3a12227f05e792b6af5eab21964c8d15da936579f3dd6
TSLA,2025-11-11T18:11:08+00:00,What the Rise of Trillionaires Could Mean for the World,Yahoo,https://finnhub.io/api/news?id=ea1e058886e317a67c03d51cf991528057dabbcf017cd3d6ae550ef386f1a6c5
TSLA,2025-11-11T18:07:00+00:00,Tesla: what must happen for the $1 trillion payout,Yahoo,https://finnhub.io/api/news?id=82bbbe83b1ac9e7ce3d3a6a774d857322fca10d561074da7d591697c14492c4a
TSLA,2025-11-11T18:01:06+00:00,"Bitcoin To $1M, Jesus Christ's Second Coming: Crypto Speculators Bet On What Will Happen Before GTA VI",Yahoo,https://finnhub.io/api/news?id=5e6f3dc3d6a884dd6dc126e252b9b1dba7cac8a8b4a323764658406151f5c46f
TSLA,2025-11-11T16:24:47+00:00,"Tech Weekly: precious chip deals, precious metals",Yahoo,https://finnhub.io/api/news?id=f32f5efdb131a47979a500e61f78d1649df2063f9a189257165a9590b7258a87
TSLA,2025-11-11T16:21:43+00:00,"Cathie Wood Sells More Tesla, Pivots to AI Boom",Yahoo,https://finnhub.io/api/news?id=8ec363e08fd308477c230ca42c2449c0295a67cec1a6722ad1b6e7e68ce894a7
TSLA,2025-11-11T16:18:09+00:00,5 Things That Have Made Tesla Stock Jump Over the Years,Yahoo,https://finnhub.io/api/news?id=67127b96e32a7beac090a907b34f5482dbc3a9467751afe51a9585da03a20087
TSLA,2025-11-11T16:10:33+00:00,"Top Analysts See S&P 500 Climbing 7,500 by 2026 on AI Momentum",Yahoo,https://finnhub.io/api/news?id=7cb7682312d759fd8654667dfbb6bf11c7b75eb219e82f405a9daf824cee1ed1
TSLA,2025-11-11T15:43:13+00:00,Tesla Stock Is Slipping Today as Investors Eye Chinese Sales Numbers,Yahoo,https://finnhub.io/api/news?id=90dcd5e0ed242db1088f8b29e4deec495b634aaa7b38b0e0e3586cdec8584a40
TSLA,2025-11-11T15:40:08+00:00,How the Wealth of the 5 Richest People in 2000 Compares With the 5 Richest in 2025,Yahoo,https://finnhub.io/api/news?id=d0cf3e6d9cf8c42fc59a2d8e03d53686cc1b755580e10837f9a99cbe0e60acd1
TSLA,2025-11-11T15:32:00+00:00,"These Stocks Are Moving the Most Today: CoreWeave, Nvidia, Tesla, Nebius, Rigetti, BigBear.ai, Rocket Lab, and More",Yahoo,https://finnhub.io/api/news?id=2e7d15812426b7d311a2bee0b3b2d467490c9cbc2017b4c231d1c126589dae25
TSLA,2025-11-11T15:15:31+00:00,Tesla China Sales Hit 3-Year Low,Yahoo,https://finnhub.io/api/news?id=15eea56e5028beb3ca40329b4fdcf0d1fa99c9ce8ec1072b0aa355ccbb4c88af
TSLA,2025-11-11T14:57:00+00:00,EV Face-Off: Tesla's Scale vs. QuantumScape's Battery Vision,Yahoo,https://finnhub.io/api/news?id=8e3c140f47b762ec2b7317019f1e7c47b076cd45f6eca4d3ea2854f25b44f49d
TSLA,2025-11-11T14:52:18+00:00,Tesla: Still A Strong Buy (On Pullbacks),SeekingAlpha,https://finnhub.io/api/news?id=b0f70c0629f1ea1889a0fb2eca300ac0eb787636ea1d63ae4907615fa2647a57
TSLA,2025-11-11T14:46:00+00:00,What Tesla Stock Looks Like in 10 Years If Musk Hits Pay Targets,Yahoo,https://finnhub.io/api/news?id=cf88f0a7609d8eca2060d7811f016b342527497429d767df24045e95f938f449
TSLA,2025-11-11T14:18:07+00:00,Elon Musk's $1 Trillion Pay Package Won't Save A Fading Giant,SeekingAlpha,https://finnhub.io/api/news?id=70893754d24c04dd61de252a60c24d61d5fbdeaa46cf164fb238e655b4aa9e2d
TSLA,2025-11-11T12:30:51+00:00,XPeng's Iron Vs. Tesla's Optimus: The Battle For The Future Of Robotics,SeekingAlpha,https://finnhub.io/api/news?id=1255aa83e44ec0713a4084c3d3d949c7cd9697471eb72dfb634219ea8b98891f
TSLA,2025-11-11T12:10:06+00:00,Intense competition drags Tesla’s China sales to lowest point in three years,Yahoo,https://finnhub.io/api/news?id=514117b7c5f0d75e97399423c24468f40c4ae553f894cfc1564f1d7a0e619652
TSLA,2025-11-11T12:09:31+00:00,TSLA: Tesla Stock Soars After Chair Predicts Historic AI-Driven Expansion,Yahoo,https://finnhub.io/api/news?id=c18533bcc13e14c36027f35ae0071180b7e5775c0bf6c6d6e59be41c696e1a10
TSLA,2025-11-11T11:44:27+00:00,"Social Buzz: Wallstreetbets Stocks Mostly Lower Premarket Tuesday; Rocket Lab to Advance, CoreWeave to Decline",Yahoo,https://finnhub.io/api/news?id=e5da4cc942e1f8e921b601b85dbff57c309d3b2e5de238c6bbc122a6ecfd3af9
TSLA,2025-11-11T11:37:26+00:00,Latest News In Energy Transition - Brazil Expands Renewable Capacity With New Solar and Hybrid Plants,Yahoo,https://finnhub.io/api/news?id=23e2ef307670ccac2daf5fe992a9a1b25ba00b97f148f1c9243c22a3120e8f9d
TSLA,2025-11-11T11:05:00+00:00,Prediction: 3 Stocks That'll Be Worth More Than Tesla 5 Years From Now,Yahoo,https://finnhub.io/api/news?id=fbd55c941e0638c73233241b0214008454918e973775e568bee7dccc2fd077fc
TSLA,2025-11-11T10:53:42+00:00,"Magnificent Seven Stocks: Nvidia, Tesla Sell Off",DowJones,https://finnhub.io/api/news?id=b0ada2f943ed30ff3ccde01e1d8f93f568c9d2aea47ab6d7f39018ead5d16919
TSLA,2025-11-11T10:00:00+00:00,How Would We Know If Market Were 'AGI' Pilled?,SeekingAlpha,https://finnhub.io/api/news?id=f9aadd63e63cfcf315f6da4605fb8aa5fe7fd27c7a7354ef852efa9e290fc0aa
TSLA,2025-11-11T06:07:00+00:00,Tesla has more bad news for Cybertruck lovers,Yahoo,https://finnhub.io/api/news?id=e761d4ab6d46c7a43b0aa0d48e6d123b2c833e48f9bc85779a8cb11f0afa9576
TSLA,2025-11-11T05:00:00+00:00,Tesla Or Bust? GM Stock A Better Ride,SeekingAlpha,https://finnhub.io/api/news?id=1f4c7d4dca864eacad5c691e3aa12670b0ea094ffe5f108088e5cb425d17a56f
TSLA,2025-11-11T02:01:09+00:00,$135K Mortgage and $400K Roth - Would You Take Money From Your Roth To Be Mortgage-Free? Here's What Suze Orman Says To Do,Yahoo,https://finnhub.io/api/news?id=c6fc4ab2e7736780a3006a6b8127f589486c62622454d78cec5c242fbabefb78
TSLA,2025-11-11T01:31:05+00:00,"Amid Trillion-Dollar Package Criticism, Elon Musk Reveals He Came To Montreal With 'One Bag' Of Books, $2.5K At 17",Yahoo,https://finnhub.io/api/news?id=6cdc8f0d71692de3718aa6d6596c8434ce85dfe66a21745d2013d780dc6b7e20
TSLA,2025-11-11T01:18:16+00:00,"Dow Jones Futures: Amazon, Broadcom, Nvidia, Palantir, Tesla Are Big Winners; CoreWeave Tumbles On Earnings",Yahoo,https://finnhub.io/api/news?id=a7509d8deeb0ddff6f00810502e43f9c8b6dc6014015f46b99c54e4f571ebe09
TSLA,2025-11-10T23:31:41+00:00,Suze Orman Says 'Everyone Should Absolutely' Own Bitcoin But Adds One Catch… 'You Gotta Be OK With Losing That Money' In Case She's Wrong,Yahoo,https://finnhub.io/api/news?id=58d011fe214bec839eb81d9afc95575976af244dcc9f55382f6cca596a4393fc
TSLA,2025-11-10T22:15:00+00:00,Automakers handle tariff 'punches' pretty well: Portfolio mgr.,Yahoo,https://finnhub.io/api/news?id=ff2a9e919317b8420a0e709b957897b307ae7941f852ead1a77026c3e6afee1e
TSLA,2025-11-10T21:23:00+00:00,Veteran analyst delivers bold twist on Tesla stock,Yahoo,https://finnhub.io/api/news?id=7c3bfa13ccc31bcfadfe90b22387ae6ca9ac7a2f580c10e470ec6ab5623bf52f
TSLA,2025-11-10T21:15:00+00:00,"These Stocks Moved the Most Today: Metsera, Nvidia, Tesla, Rumble, MP Materials, Viasat, Monday.com, CoreWeave, and More",Yahoo,https://finnhub.io/api/news?id=a4e0e4a2c6a5fc240f484488ca1a9f7cd116334c2a48c8fb92de4cfc2fd495fe
TSLA,2025-11-10T21:12:23+00:00,Stock Market Today: Dow Up On Shutdown Deal; Cathie Wood Loads Up On This (Live Coverage),Yahoo,https://finnhub.io/api/news?id=f1698b77ab81dc23045036884c6db94f327d0c00dc8f990e5848c6c9fc68238c
TSLA,2025-11-10T21:09:00+00:00,XPENG Breaks Out as Deliveries Surge & AI Vision Expands,Yahoo,https://finnhub.io/api/news?id=33cd6affae8175f1e2ebee03865fb8b29e48b5912aa160e6f3e5a18745cf1b72
TSLA,2025-11-10T21:07:41+00:00,Shareholders Just Approved a $1 Trillion Pay Package for Elon Musk. What Does That Mean for Tesla Stock in 2026?,Yahoo,https://finnhub.io/api/news?id=47b918d5f27764f542959874a8febf2cc4280f596879d13a9e0b9cb7324cd571
TSLA,2025-11-10T21:00:42+00:00,"Stock market today: S&P 500, Nasdaq soar, lead Dow higher as Senate vote lifts hopes for end to US shutdown",Yahoo,https://finnhub.io/api/news?id=e9147659d866bd56e93df7b96d934f4d27393db3bd8c321ada44647b527803a1
TSLA,2025-11-10T20:42:52+00:00,Tesla investor support for Elon Musk's massive pay plan was lower in 2025 than in 2018,CNBC,https://finnhub.io/api/news?id=e6205170e290c7ad1156d46edff06fd90462543d47608e6e884f277e2a0bc221
TSLA,2025-11-10T20:30:54+00:00,"Tesla AI Projects Face Uncertainty Despite Retention of Musk as CEO, Truist Says",Yahoo,https://finnhub.io/api/news?id=d48e7d57789d36e92b592a6b028828b60fa22856da99a649ca2019fe1cd50667
TSLA,2025-11-10T20:06:09+00:00,‘Envy and greed walk hand in hand’: Warren Buffett casts side eye on Elon Musk-sized pay packages in final send-off,Yahoo,https://finnhub.io/api/news?id=b0deb22bdec8ee4309757f4f5768aa69ecccc3a1d70bb0bb88ce05c626fc5e76
TSLA,2025-11-10T19:22:00+00:00,Making Sense of the Market's Tech Worries,Yahoo,https://finnhub.io/api/news?id=513f29f42ac058c37dab1e720321bd98b850084b9522a2c59b634aafa052cb98
TSLA,2025-11-10T18:52:51+00:00,"Tesla's Physical AI Products Still a Long Way Off, Truist Securities Says",Yahoo,https://finnhub.io/api/news?id=19a06dfaacf339d70e8b33d720e81756ea361b30c83735bd011238fd046780ed
TSLA,2025-11-10T18:11:14+00:00,Stock Market Today: Nasdaq Jumps On Shutdown Hopes; This Stock Gets Support (Live Coverage),Yahoo,https://finnhub.io/api/news?id=180b091ca1352f96c59b96b5451a25de5ec7f99d9519a3f48b15cef34004efef
TSLA,2025-11-10T18:10:27+00:00,"Tesla shake-up, Warren Buffett to 'go quiet' from Berkshire",Yahoo,https://finnhub.io/api/news?id=1be173199bea5c3a548c1eefaeeef7763548b328edaf5f40157a59ffba234176
TSLA,2025-11-10T18:01:11+00:00,"NBA Legend Shaq Says 'I Would Lose Almost Every Time' When He Invested, Then Adopted Jeff Bezos's Rule and 'I Quadrupled What I'm Worth'",Yahoo,https://finnhub.io/api/news?id=52a895238738579f03c8d5fd2d9f0f8680c6b5d3bcb85a5e436f9c8e10cd201c
TSLA,2025-11-10T17:59:40+00:00,Tuesday's big stock stories: What’s likely to move the market in the next trading session,CNBC,https://finnhub.io/api/news?id=8738679a5a66aec4d3db96fd66b9a22d639d6a95665070d222d19259342203d2
TSLA,2025-11-10T17:58:47+00:00,Tesla Faces a Setback in China as Sales Slide to Three-Year Low,Yahoo,https://finnhub.io/api/news?id=4080ffd13c9f884ea7f109f31f0c827818392338b30e25ab186767c41065d3d3
TSLA,2025-11-10T17:51:26+00:00,Tesla's Cybertruck Chief Moves On After 8 Years,Yahoo,https://finnhub.io/api/news?id=9be5ef55581be0f6baa798e9399f4bb20ee0fa7629c5e17b7cec8e08a69e717c
TSLA,2025-11-10T17:34:22+00:00,"Tesla Loses Model Y, Cybertruck Chiefs As China Sales Hit Three-Year Low. The Stock Is Still Rising.",Yahoo,https://finnhub.io/api/news?id=e3125568570dd953387f18b655f046c4e9c199b42223bc02bb7195ae48a47ccc
TSLA,2025-11-10T17:31:10+00:00,Move Over Zuckerberg: Three 22-Year-Olds Just Became The Youngest Self-Made Billionaires In History — Thanks To An AI Hiring Startup,Yahoo,https://finnhub.io/api/news?id=fe484909bbff08f9b13008895bdc5267de6ef9fb5ffc6d76127f0e9d18316b8f
TSLA,2025-11-10T17:30:00+00:00,Elon Musk's $1T package among headlines signaling AI bubble,Yahoo,https://finnhub.io/api/news?id=7a1f767ea373f50e86cf8c93eb7a24b2f747b567508cf3a3db250f97ee411a0d
TSLA,2025-11-10T17:01:15+00:00,"The $18,000 Warning Sign: How Social Security's Funding Gap Threatens Your Retirement",Yahoo,https://finnhub.io/api/news?id=55235f8fe96f851d58a2b3278195074dfe3ee8fba53ecb30e72549f2551ab3f8
TSLA,2025-11-10T16:33:00+00:00,Rivian 'copies' rival Tesla with $4.6 billion move,Yahoo,https://finnhub.io/api/news?id=73aae45112ca4e63639892cc8415e48446dfb6cf0796cb131fd277f0604fc767
TSLA,2025-11-10T16:16:05+00:00,Lab-Grown Diamonds Just Got Smarter: Now They Can Store Your Bitcoin Value,Yahoo,https://finnhub.io/api/news?id=c847655e85152aea4807bce01294f8694db62b41f63f1f1d4406e9419cd3e05f
TSLA,2025-11-10T16:12:23+00:00,Stock Market Today: Dow Jumps Amid Shutdown Move; Cathie Wood Loads Up On This (Live Coverage),DowJones,https://finnhub.io/api/news?id=c548fe1ffeb27d64ed4ac6ad7d61dee1cbd0dc6b77cb09b490d5c83bf8b6e5c1
TSLA,2025-11-10T16:06:44+00:00,Tesla Cybertruck boss Siddhant Awasthi leaves amid fading demand,Yahoo,https://finnhub.io/api/news?id=ca49d1f361b67712f4cd54194a643e7862e5e092a1838f899e1c6ce04c8685a6
TSLA,2025-11-10T16:04:41+00:00,COP30 begins in Brazil today. Where we are 10 years on from the Paris Agreement,Yahoo,https://finnhub.io/api/news?id=566af88ed6dec658e9b8831f0b25d2405f8cdb795a7ddcb54006e48d7c8c5ddf
TSLA,2025-11-10T15:46:11+00:00,Utah Jazz Owner Ryan Smith Shared How He Became A Billionaire: 'Your Success Is Directly Correlated With Your Pain Threshold',Yahoo,https://finnhub.io/api/news?id=67259e4187d9cdace497e82a0267fa062eac41698fe5922e3d7985233ce6442b
TSLA,2025-11-10T15:34:22+00:00,Wall Street Is Buying the Dip in Big Tech After Shutdown Deal,Yahoo,https://finnhub.io/api/news?id=af0c9d1cad14bb4d7e3b73c3e8f9677888ec85523878a0558118a47e39a132b6
TSLA,2025-11-10T14:53:48+00:00,Wall Street Lunch: Generative AI Powers October E-Commerce Spending,SeekingAlpha,https://finnhub.io/api/news?id=dce4f4231faca8f9bae441f731fdbb91b49bee3e3629e999aca01894e710bf46
TSLA,2025-11-10T14:53:00+00:00,Tesla’s Cybertruck Head Exits. What It Means for the Stock.,Yahoo,https://finnhub.io/api/news?id=bd282e1eadabf57e22ec2203e827a5a1e108c308b337a33cbf99af432decc684
TSLA,2025-11-10T14:45:39+00:00,"Stock Market Today: Dow Rises On Shutdown Deal Hopes; Nvidia, Palantir, Tesla Rally (Live Coverage)",Yahoo,https://finnhub.io/api/news?id=7882c169c35a30cca368d2858a7872b76a609678cd83ad55a41272bc3b416b0a
TSLA,2025-11-10T14:24:00+00:00,Ford Stock Trading Near 52-Week High: What Should Investors Do Now?,Yahoo,https://finnhub.io/api/news?id=c6e4759e5981ad7544f23d823e79dae19d4f5d869fff8133452f9ecedce7801a
TSLA,2025-11-10T14:19:00+00:00,"Company News for Nov 10, 2025",Yahoo,https://finnhub.io/api/news?id=f50afc2a0205b8830d95e2ebb0a3fec6f2f3232433336f1d059b459f29d15f04
TSLA,2025-11-10T14:00:03+00:00,"Tesla, Inc. (TSLA) Is a Trending Stock: Facts to Know Before Betting on It",Yahoo,https://finnhub.io/api/news?id=620f2500a209eb8eba35154d70dca1f2c2c7a574f7445ec00c535dded1e822e8
TSLA,2025-11-10T14:00:00+00:00,The Cheapest AI Leader in the World? Meet Baidu,Yahoo,https://finnhub.io/api/news?id=4349d25121db9662166ad2b8ff0fe2526a29b60bb19b3a7f2ec0000d3c733951
TSLA,2025-11-10T13:40:00+00:00,"Lofty Valuations, Overheated Technicals - Managing Market Risk With Victor Dergunov",SeekingAlpha,https://finnhub.io/api/news?id=32a1ada58b96bde5d8a8f9221dabf65f4479410b5cc8c6b4619c74c9357a4463
TSLA,2025-11-10T13:29:33+00:00,Tesla: More Unrealistic Promises,SeekingAlpha,https://finnhub.io/api/news?id=615bf0d797caa2c6239dfa97d5fba0330b03a7790b3427214e1f2effc65fa224
TSLA,2025-11-10T13:22:16+00:00,Possible Cancellation Of Ford's F-150 Battery Electric Pickup Illustrates Electrification's Delay,SeekingAlpha,https://finnhub.io/api/news?id=ea3f4b07a75c2e88f22395cfc284842979e7ef51306eadbeb7c385ff822478ca
TSLA,2025-11-10T13:17:33+00:00,Tesla Cybertruck executive leaving the Musk-led automaker,Yahoo,https://finnhub.io/api/news?id=94844435644dd44b9b0546670ee57652c9afa4e6b39e29c9fbda34ffd0747e4d
TSLA,2025-11-10T13:01:00+00:00,CaoCao Inc. and Abu Dhabi Investment Office Sign MoU to Advance Autonomous Driving and Launch Robotaxi in the Middle East,Yahoo,https://finnhub.io/api/news?id=6d8096be8034fdaeda130bb38296e3545811eed93eb4407a4f9ba89c3a697359
TSLA,2025-11-10T12:59:46+00:00,The Trillion-Dollar Man,Yahoo,https://finnhub.io/api/news?id=ccd9e6e77c69fa7af4c17cb512af9d63a85335c1164bda31e878e4764c5abce9
TSLA,2025-11-10T12:50:57+00:00,"Stocks making the biggest moves midday: Penn Entertainment, Metsera, Six Flags & more",CNBC,https://finnhub.io/api/news?id=cae8b6b10c7fb0e5dff140dab8c9cbfc24086d093dce49cbe277630ff8af415d
TSLA,2025-11-10T12:33:00+00:00,"These Stocks Are Moving the Most Today: Metsera, Pfizer, Nvidia, Tesla, Rumble, Monday.com, CoreWeave, and More",Yahoo,https://finnhub.io/api/news?id=1fa5a62eb2192768138aeea013f947d87b98c0d59e34606ebaac470e1c31af54
TSLA,2025-11-10T12:31:09+00:00,"Bitcoin Has 'High Probability' Of Crashing Below $60,000 If It Stays Below This Level, Says Analyst, But The Fall Could Be Even Steeper",Yahoo,https://finnhub.io/api/news?id=32f3e6e2fedf59c33a9f79fed9393b0e268a942f2b3523284f5e9a5b2f6a26e7
TSLA,2025-11-10T11:39:51+00:00,Tesla’s China sales hit three-year low amid fierce competition,Yahoo,https://finnhub.io/api/news?id=8622f02d614852e86dde1a9e981f2983c1fd8d69d945892ce9fd7173b5cb4cbf
TSLA,2025-11-10T09:57:10+00:00,EV Company News For The Month Of October 2025,SeekingAlpha,https://finnhub.io/api/news?id=39ce8edbee5b064daedda61b9ade00faf60796a6ec295b98623b46454f8f0b27
TSLA,2025-11-10T09:00:00+00:00,Elon Musk's Trillion-Dollar Tesla Package Is Pure Fantasy,SeekingAlpha,https://finnhub.io/api/news?id=0bb5376a9a6eb2f5f043a2d066aa1bdf3d90210225956ef0e3db2a8c6f504794
TSLA,2025-11-10T08:30:00+00:00,Rivian Stock Just Surged 25% in 1 Day. Here's Why Shares Are Still a Buy.,Yahoo,https://finnhub.io/api/news?id=0635524555289ded4ab6ac7468fce130a0d6d6d67d3ef5741f5d64f29e124a25
TSLA,2025-11-10T06:55:00+00:00,"Zacks Investment Ideas feature highlights Tesla, Intercontinental Exchange, American, United, Delta and QQQ",Yahoo,https://finnhub.io/api/news?id=088d1215df0d7ef2385ccfda8d5f35ae707ac0c453b8ac631b3ae727d98618a7
TSLA,2025-11-10T06:53:00+00:00,"The Zacks Analyst Blog Tesla, General Motors and Ford",Yahoo,https://finnhub.io/api/news?id=84effb57926a478c7537130ad8eb5c0a979ac0329bca0162b5e3257af9983f09
TSLA,2025-11-10T04:49:03+00:00,3 Volatile Stocks We Steer Clear Of,Yahoo,https://finnhub.io/api/news?id=2fa62cc627bb4db12286cf443054939f0959ed5fa6220675b36196dae9c9b650
TSLA,2025-11-10T03:01:22+00:00,"If You Invested $10K In One Liberty Properties Stock 10 Years Ago, How Much Would You Have Now?",Yahoo,https://finnhub.io/api/news?id=ee9fed1f1d3f197cddcc26dcd56a926f68f6de8d8ae91fa87bbf181840f1df6b
TSLA,2025-11-10T02:00:00+00:00,Feeling Great About the Economy? You Must Own Stocks,Yahoo,https://finnhub.io/api/news?id=e622cdc8fba92727f4c75e72a3159ac4334055dbb7f5386cc9d13f488c4b1c25
