ticker,published_utc,title,publisher,url
VERA,2025-10-22T12:00:00+00:00,"Vera Therapeutics to Host an Investor Call and Webcast to Provide an ORIGIN 3 Update on November 6, 2025 at 4:30 pm ET",Yahoo,https://finnhub.io/api/news?id=bfed02863630b0d5baf1d6ad4b9c594bf734c82682aa8626828c2e5257aab0f1
VERA,2025-08-26T20:05:00+00:00,Vera Therapeutics to Participate at Upcoming Investor Conferences,Yahoo,https://finnhub.io/api/news?id=1e916f416be52e5db47f94ec98ff46d118eed66fae1dc73409f2bd8dc99e093a
VERA,2025-08-04T13:35:03+00:00,"Coinbase downgraded, Spotify upgraded: Wall Street's top analyst calls",Yahoo,https://finnhub.io/api/news?id=f1502e4bd4a92bf74351df87b03ca2649d68e6cf7d5d8a156e04bd00adda901f
VERA,2025-06-04T07:30:00+00:00,"Vera Therapeutics Atacicept: Promising Step In IgAN, But Crowded Road Ahead (Rating Downgrade)",SeekingAlpha,https://finnhub.io/api/news?id=06f69697830e103e194f93ee5bb04d3a56274b43a9f34f27b9d677243b00ddbe
VERA,2025-01-13T12:00:00+00:00,"Vera Therapeutics Acquires Global Rights to Novel, Next Generation Dual BAFF/APRIL Inhibitor",Yahoo,https://finnhub.io/api/news?id=12c0afc53a2027e5429b99bc43b99c21af5125628e9e62eb39c5d8513b65fb94
