ticker,published_utc,title,publisher,url
ZS,2025-11-12T13:31:00+00:00,GC AI Raises $60 Million Series B to Give Every Company a Legal Advantage,Yahoo,https://finnhub.io/api/news?id=cbf7672474d0b5b652d534109ad64f75cdf9ae68907cd6be9357656eceb1ece2
ZS,2025-11-12T13:25:00+00:00,CrowdStrike Stock Rises 29% in 3 Months: Time to Hold or Book Profits?,Yahoo,https://finnhub.io/api/news?id=50390ea86b9a4d2f36e2c1d5948e83df208789352cbae0c69b4dbdcb64c913b0
ZS,2025-11-12T13:08:21+00:00,"Dow Jones Futures Rise; Palantir, Eli Lilly Lead Six Stocks In Buy Zones",Yahoo,https://finnhub.io/api/news?id=72a0c05feab4e1d3a6e253f1e094147e77b54fd50a82fb09ffbf117d1dcfb9aa
ZS,2025-11-12T13:00:00+00:00,Zscaler Public Sector CTO for AI Strategy and Former DHS Deputy CTO & Deputy CAIO Chad Tetreault Joins Knox Systems Federal Advisory Board,Yahoo,https://finnhub.io/api/news?id=0b4adc3be931700cc9afa34eda7a9e0cf02659f1f5ad082f3c7db0d0948aa16f
ZS,2025-11-12T11:02:17+00:00,AI boom fuels fresh wave of legal tech investments,Yahoo,https://finnhub.io/api/news?id=b84b7affb0aac7f2903eac194781acbe85a76d2b6c433250b9d073bdc7471009
ZS,2025-11-12T04:35:08+00:00,1 Growth Stock Set to Flourishand 2 Facing Headwinds,Yahoo,https://finnhub.io/api/news?id=665c317d34dcfdfff8d3a0135013145965fa29467ac979d6c1bdc6a10ddd046d
ZS,2025-11-12T02:52:52+00:00,Zscaler: The Cybersecurity Titan Poised For Continued Growth,SeekingAlpha,https://finnhub.io/api/news?id=04a250e0ac42928f6ebc8ec58ca1f79a901d86e1255e9f44bb49d8e821173718
ZS,2025-11-11T18:22:09+00:00,Zscaler (ZS): Evaluating Valuation Following New Digital Experience Platform Enhancements,Yahoo,https://finnhub.io/api/news?id=3eb3fcdb632f9b50f1e3adc61687a59c76429ea45e633e76124ae021a7c9e727
ZS,2025-11-11T15:08:00+00:00,Palo Alto Networks Rises 23% in 3 Months: How to Play the Stock,Yahoo,https://finnhub.io/api/news?id=46c6f51f1a40d0ecadb500374d3e4fd235f4bc6cde21d5ae5e706060075e9993
ZS,2025-11-10T22:45:03+00:00,Zscaler (ZS) Exceeds Market Returns: Some Facts to Consider,Yahoo,https://finnhub.io/api/news?id=5b451450f596ae6585af083a14553cc27091c8cd7d6de058e8eb58d67f7bb533
ZS,2025-11-10T17:46:30+00:00,Why Viasat Shares Spiked After Q2 2026 Earnings (Rating Upgrade),SeekingAlpha,https://finnhub.io/api/news?id=1791e2d2ca72569e01ad6053b6c2b7960ad0ec3407db7b000aeeb122f7db622b
ZS,2025-11-10T14:30:02+00:00,Brokers Suggest Investing in Zscaler (ZS): Read This Before Placing a Bet,Yahoo,https://finnhub.io/api/news?id=5e7da63ea0180c13e5b2e1a640100dfd4bc041778766c08831a82b6bda4d14d7
ZS,2025-11-06T19:02:00+00:00,IGEL Catalyses a New Era of EUC Transformation and Trusted Endpoint Security,Yahoo,https://finnhub.io/api/news?id=ddcb70367ead79a0540aa7cba84ef93b33e748b1001eb5e88eafbd2401c94487
ZS,2025-11-06T13:00:00+00:00,Zscaler to Host First Quarter Fiscal Year 2026 Earnings Conference Call,Yahoo,https://finnhub.io/api/news?id=e64e69ab30afa8a5e6251c209489b2de956b327435d0668030365dbf1668ce95
ZS,2025-11-06T11:38:13+00:00,Exploring 3 High Growth Tech Stocks In The US Market,Yahoo,https://finnhub.io/api/news?id=2fac5293301e4600ae162d6fd6641a2cc2497b4de1861505a7d1a00ecaac84ad
ZS,2025-11-06T05:05:04+00:00,3 Nasdaq 100 Stocks to Consider Right Now,Yahoo,https://finnhub.io/api/news?id=66516858878fba24be6ceef13a5c92ca409549b56819ab547ffd8cc7e9bce06b
ZS,2025-11-05T08:01:00+00:00,Zscaler ThreatLabz Reveals 67% Jump in Android Malware and 40% of IoT Attacks Target Critical Industries and Hybrid Work,Yahoo,https://finnhub.io/api/news?id=abe07bd21b2b3653ec3e2a3fe4a48ce139466042a659209c28223cb689bbf3ba
ZS,2025-11-04T22:40:04+00:00,Qualys (QLYS) Tops Q3 Earnings and Revenue Estimates,Yahoo,https://finnhub.io/api/news?id=d978624b1a951af493dd45325df0a7cd5a2b05c9c98907579ff7f3dd220cf4a9
ZS,2025-11-04T14:17:47+00:00,Should Zscaler's (ZS) Enhanced ZDX Platform Prompt Fresh Attention from Cloud Security-Focused Investors?,Yahoo,https://finnhub.io/api/news?id=351bc351936d1a05fcc27822c52755db66cec2ef6a123f39d0109ffa1648b77f
ZS,2025-11-04T13:04:54+00:00,CrowdStrike's ARR Slowing Fast - That's About To Change,SeekingAlpha,https://finnhub.io/api/news?id=2e8602f9d1b384de7d792ffabd8f5a13355b6f8db2a46f609ab24968cfd82ff6
ZS,2025-11-03T22:45:05+00:00,Zscaler (ZS) Outpaces Stock Market Gains: What You Should Know,Yahoo,https://finnhub.io/api/news?id=4e7215a23a473527c5a1604263a7199368668f24d8d77c32f93e08dcdc00ca84
ZS,2025-11-03T16:59:00+00:00,"Should You Buy, Sell or Hold Fortinet Stock Before Q3 Earnings?",Yahoo,https://finnhub.io/api/news?id=63820fcd689130a4e2903709aaf82a5168beb303b45fd443cd60bb8517332a75
ZS,2025-11-03T13:05:00+00:00,Zscaler Secures The Enterprise AI Lifecycle With Acquisition of Innovative AI Security Pioneer SPLX,Yahoo,https://finnhub.io/api/news?id=d5b29ab77b1d4662aad5912b5b394e8e63940ce9de87629223bf3f7fd37f7eed
ZS,2025-11-03T04:38:01+00:00,3 Software Stocks to Research Further,Yahoo,https://finnhub.io/api/news?id=1d71eda395c45622539760a4f2e25b59708b05c45ed8b6f3bc9f305fa1176a6c
ZS,2025-11-01T13:00:26+00:00,Zscaler's (NASDAQ:ZS) investors will be pleased with their solid 174% return over the last three years,Yahoo,https://finnhub.io/api/news?id=bf74a6c4f61e7f750a2bc49f3676af6e0cf22a1b4b8640a3fd4314f4074f83ee
ZS,2025-10-31T18:02:00+00:00,FTNT Stock Down 14.6% in 3 Months: Buy the Dip or Wait for Recovery?,Yahoo,https://finnhub.io/api/news?id=c7f4c38b84294ad6191ee59f5b6c949478cf839af89cca3e020d737c7a715b86
ZS,2025-10-31T13:41:02+00:00,"Here Are Friday’s Top Wall Street Analyst Upgrades and Downgrades: Apple, Comcast, Roblox, Zscaler and More",Yahoo,https://finnhub.io/api/news?id=3d5836c9ce5ff58e3b08f255b6d408abb427c761bfc7381973b9e83a51a44489
ZS,2025-10-31T11:38:17+00:00,High Growth Tech Stocks In The US Market With Promising Potential,Yahoo,https://finnhub.io/api/news?id=cd4c38255b821abdd7f0b9c0643fc345b2a3e5b3f43a0b0bb10789cacf7b7918
ZS,2025-10-30T11:38:13+00:00,High Growth Tech Stocks To Watch In US This October 2025,Yahoo,https://finnhub.io/api/news?id=9f7ab29d95bae18f7c7b706c8c1e3a6a7a603fa265a459351fb2b20fccde0c2a
ZS,2025-10-29T12:00:00+00:00,"Zscaler Announces New Innovations for Advanced End-to-End Monitoring, Diagnostics, and Remediation",Yahoo,https://finnhub.io/api/news?id=02d8532f42c4e10c06812238848b7d35908f2d158b47f5912d2dead24335a93a
ZS,2025-10-28T13:00:00+00:00,ConductorOne Raises $79 Million Series B To Scale the World’s First AI-Native Identity Security Platform,Yahoo,https://finnhub.io/api/news?id=9d128c49e5df175f9ec7be0d29948e7b428e00731d90b36c6b46966555fa2110
ZS,2025-10-28T12:00:00+00:00,Fal.Con Europe 2025 Showcases the Power of Ecosystem in Cybersecurity’s Agentic Era,Yahoo,https://finnhub.io/api/news?id=84af49bf260814bffcffc015d9fb7cd8a3b4ddef1d90193e06b8a013d93ade48
ZS,2025-10-28T11:35:52+00:00,Top 3 Growth Stocks With Significant Insider Ownership,Yahoo,https://finnhub.io/api/news?id=ba0be1fc5ff379e105a176c3fc4198de39afa0ef454deabc0e14aad8344e52ad
ZS,2025-10-28T04:37:39+00:00,3 Unpopular Stocks That Deserve a Second Chance,Yahoo,https://finnhub.io/api/news?id=d1a714d5a88eb05bb98ac0b819413e381f07c3322b34f702ee2af694b7081127
ZS,2025-10-27T21:45:05+00:00,Zscaler (ZS) Advances But Underperforms Market: Key Facts,Yahoo,https://finnhub.io/api/news?id=3cda99a6ba890a85cc7338b9e09e7756ebab9d6a7f10778acf0fbf9eb5959533
ZS,2025-10-27T17:38:13+00:00,High Growth Tech Stocks In US Market,Yahoo,https://finnhub.io/api/news?id=f38066c46afa88d19e4ff29ed71ab0293081d35e3b53ec81de69e2d12feb7232
ZS,2025-10-27T11:48:26+00:00,Fortinet: Decade Low Forward P/E Reveals Buying Opportunity,SeekingAlpha,https://finnhub.io/api/news?id=9466486919833dc0f4aeebf02172f1d340ed68b16befa452fae584a65c5a219d
ZS,2025-10-27T11:33:56+00:00,"Cybersecurity Stocks: With Earnings On The Way, Focus Shifts To 2026 Outlooks",Yahoo,https://finnhub.io/api/news?id=1e33f5e6c0c0f4b7ad6a66e9bd5145e4551f449cf339411cc83b95b0b927cf3f
ZS,2025-10-24T20:11:00+00:00,Zscaler (ZS): Evaluating Valuation After Analyst Upgrades and Major AI Security Partnership with HCLTech,Yahoo,https://finnhub.io/api/news?id=eda7e5c3d784a970a897ce01de82d2258b8f23decd1202b4103a7ab91f12fafb
ZS,2025-10-24T19:20:44+00:00,"Two Data Center Plays Race To New Highs, Near Buy Points",Yahoo,https://finnhub.io/api/news?id=a9ba549abf6781752f20f068f780a6833389d263cab5b0d478f82ba40582b871
ZS,2025-10-24T18:31:38+00:00,BTAL: Unconvincing Long-Short ETF,SeekingAlpha,https://finnhub.io/api/news?id=e9c8229720fc2528f411f8ef642b75e06ea92222f9541b86139f83b1f40c39e4
ZS,2025-10-24T13:30:01+00:00,Wall Street Bulls Look Optimistic About Zscaler (ZS): Should You Buy?,Yahoo,https://finnhub.io/api/news?id=2a5d1ad59cbeabe38bee28eab8aacd2d0dd348f79e420d0e1755ca8ce0b60048
ZS,2025-10-24T12:12:53+00:00,"Dow Jones Futures: Intel, AI Play Jump After Bullish Tesla Move; Trade Talks, CPI In Focus",Yahoo,https://finnhub.io/api/news?id=bb5919be2e5d53fa8c016d91ce66695093b97e66b992b2ae38dabfca85e8c37c
ZS,2025-10-24T11:38:20+00:00,Exploring 3 High Growth Tech Stocks in US Market,Yahoo,https://finnhub.io/api/news?id=77fd8c79f0126e86fa6731956d2615d4ad77bb6080ac8576496bd74df39529d8
ZS,2025-10-24T04:37:38+00:00,1 Momentum  Stock for Long-Term Investors and 2 We Brush Off,Yahoo,https://finnhub.io/api/news?id=7324ef9a73494f6ebfcc99d7ee76d32a4d79936998926c85eaaf462663a6d5f2
ZS,2025-10-23T19:20:56+00:00,Cloudflare: Growth Will Disappoint Long Term,SeekingAlpha,https://finnhub.io/api/news?id=183c1c0b24d42095389c91e33f54d4d329f1183fc037f17a54c8f26b7add6f67
ZS,2025-10-23T07:01:00+00:00,Global Survey Finds Cyber Incidents Cost Organizations $3.7M on Average in the Past Year,Yahoo,https://finnhub.io/api/news?id=2dbaa9c0fe9de1b1a5cfb741fd19e8281df3472f1461ffb547da9dfb58ae42b8
ZS,2025-10-23T04:43:46+00:00,2 Large-Cap Stocks Worth Investigating and 1 Facing Challenges,Yahoo,https://finnhub.io/api/news?id=0fdcfa56b06ceefd6ad29e5ffe7cede27c7c9542ae20d43c8d302f466b8116f8
ZS,2025-10-22T21:20:39+00:00,"Zscaler, Inc. (ZS): A Bull Case Theory",Yahoo,https://finnhub.io/api/news?id=cb652a0dce09c169882fd831d2a28fd28f94caf18f843706c8f90cd0a0bd51d7
ZS,2025-10-22T15:50:00+00:00,LINEN Cloud Secures CIO-Led Strategic Investment to Accelerate Intelligent Planning in the Cloud,Yahoo,https://finnhub.io/api/news?id=97ceaf6cb3f2f4a9e78a9dd30597fc436ba403aa5ac4ec65ba4f1a94de2b6504
ZS,2025-10-22T13:00:02+00:00,"Investors Heavily Search Zscaler, Inc. (ZS): Here is What You Need to Know",Yahoo,https://finnhub.io/api/news?id=1274e8652bfb3bbe8e4ea5cbe43c90e86fef3eef7b3b4c8169ba6c5c9ff92e0b
ZS,2025-10-21T13:26:00+00:00,Can Prisma Access Browser Keep PANW Ahead in SASE Growth?,Yahoo,https://finnhub.io/api/news?id=f5ea64a1938ea06a64e1cbc8f870b77fa011f6f91c29db23c375672e591d8efd
ZS,2025-10-21T11:38:07+00:00,Exploring High Growth Tech Stocks In The US Market,Yahoo,https://finnhub.io/api/news?id=51c6d4789880c29cdec0d6885f748ac7f2e4cd5069f827928d8f85395e42bb4a
ZS,2025-10-20T19:39:58+00:00,"Networking, Cybersecurity Stocks' Strong Momentum Seen Continuing in Intermediate Term, BofA Says",Yahoo,https://finnhub.io/api/news?id=06bc665026c2cec685e9ec2d96ee31e71f889a788afd45b0b76432ec99a23ad0
ZS,2025-10-20T15:21:08+00:00,"BofA lifts PANW, ZS targets, sees strong cybersecurity and network momentum",Yahoo,https://finnhub.io/api/news?id=e159350e7cecb5edc7f47c9002c0464714933ada5d9e196ec61e17a6960599d0
ZS,2025-10-20T11:38:07+00:00,Exploring High Growth Tech Stocks in the US This October 2025,Yahoo,https://finnhub.io/api/news?id=72c87f907699d9c61f08731374459edd380644c50c4dad2ef39d38c1cba87cef
ZS,2025-10-17T16:23:24+00:00,UBS sees agricultural cycle near bottom as it upgrades Deere,Yahoo,https://finnhub.io/api/news?id=fef4f7cd818f48ce4c940317a1f675fbb1e12d525826d571ae9f8725b0ac0bc2
ZS,2025-10-17T03:31:47+00:00,Q2 Rundown: Zscaler (NASDAQ:ZS) Vs Other Cybersecurity Stocks,Yahoo,https://finnhub.io/api/news?id=72a3ead8a815049188c050c40745ef87e01b4dd4b6b220cb533787f808dbd052
ZS,2025-10-16T18:13:00+00:00,HCLTech and Zscaler Expand Partnership for AI-Powered Security and Network Transformation,Yahoo,https://finnhub.io/api/news?id=d9818d76e8f4eee0eb34dbc160b9461428db81684fc826ddba0917ee38f1bbfe
ZS,2025-10-16T17:38:19+00:00,US High Growth Tech Stocks To Watch For Potential Expansion,Yahoo,https://finnhub.io/api/news?id=a249e3110eeb00f45439db75500feba477f7410d44888b8ec9f6d49447dfe152
ZS,2025-10-16T11:46:00+00:00,"$4.1 Bn Zero Trust Network Access (ZTNA) Markets, 2025-2030: Convergence of Ztna with AI/ML for Adaptive Trust Evaluation and Aging VPN Infrastructure Fuel Opportunities",Yahoo,https://finnhub.io/api/news?id=334d2b3ba42a93a1b842f500458aab8e9d12a4659fb3fb3fbdb636e61ba7c155
ZS,2025-10-15T16:57:00+00:00,Can Fortinet's FortiCloud Expansion Unlock the Next Wave of Growth?,Yahoo,https://finnhub.io/api/news?id=7a7de73a88cd69c591e0e703fa4824e8fa3b5b18e07bb9abb9501ae64be38680
ZS,2025-10-15T15:09:36+00:00,How I'm Investing $30K In AI Winners,SeekingAlpha,https://finnhub.io/api/news?id=c56ef18540be1c5b50a3851a460099be4097bfb1162dc782c515ac92199ec60a
ZS,2025-10-15T12:08:07+00:00,Netskope: A Cybersecurity IPO Worth Knowing,SeekingAlpha,https://finnhub.io/api/news?id=f00ca4f0c5c43552f1a1a282b90bd9df3affc2b3d4cadefaa28b35f3c272b066
ZS,2025-10-15T05:06:51+00:00,Does Zscaler’s 66% Rally in 2025 Still Leave Room for Growth?,Yahoo,https://finnhub.io/api/news?id=e193ba73aae3d048a667e60fe6486ad434c7f877dc4ffd90d31b765794b920b6
ZS,2025-10-14T18:57:08+00:00,Dow Jones Tech Titan Apple Eyes Latest Buy Point Amid Stock Market Volatility,Yahoo,https://finnhub.io/api/news?id=14404eedb4241495a7c0d80f893eda08985b95860fe952be35f72222e1743f6b
ZS,2025-10-14T17:30:48+00:00,Cybersecurity Name Zscaler Stock Near A Buy Point Taunts Investors,Yahoo,https://finnhub.io/api/news?id=50b5f374e420853c8f0ce21968fa5007133d55da450d94a4d6ac254ede9c43e5
ZS,2025-10-14T11:38:09+00:00,High Growth US Tech Stocks To Watch In October 2025,Yahoo,https://finnhub.io/api/news?id=24d28d629cb1d0357808e78e00aa64a0e5f9b9a2c9700844b78e2014f30b7684
ZS,2025-10-14T04:41:38+00:00,2 Unprofitable Stocks on Our Buy List and 1 Facing Headwinds,Yahoo,https://finnhub.io/api/news?id=b00b0fa8c5db55e9e14435ae39e3c6203ea91f6acfe1b7bdac26e9a0886976a1
ZS,2025-10-13T18:10:00+00:00,Can PANW's Platform Deals Drive Sustainable Double-Digit Growth?,Yahoo,https://finnhub.io/api/news?id=612e0ef768b303fc2a0666fd25d1e512cb4937b4c00e84a527b3f5d25473cd3d
ZS,2025-10-13T10:37:04+00:00,Rubrik: Why I'm Raising My Price Target (Rating Upgrade),SeekingAlpha,https://finnhub.io/api/news?id=3f62b8a00e9a0ebbd1625d0d471cbe9d614d2ee16cd681a1956719d90c01f47a
ZS,2025-10-12T10:30:00+00:00,3 Cybersecurity Stocks You Can Buy and Hold for the Next Decade,Yahoo,https://finnhub.io/api/news?id=7d844bb2d9260618ccf9a2183f702f4d129e7c7d0a204f8f3ce1d558edbc7aa2
ZS,2025-10-11T12:00:35+00:00,Oracle Leads Five AI Stocks Near Buy Points After Market Sell-Off,Yahoo,https://finnhub.io/api/news?id=beee8ce98e0ddfa6f74a1f9bdbd02184ee39e3bf7f3a1c0895ed316676197311
ZS,2025-10-10T22:04:55+00:00,"Stock Market Week Ahead: Gridlock, Q3 Earnings And AI Conferences",Yahoo,https://finnhub.io/api/news?id=b6a4027b89c7bfa69a7e2d7befbe93a10bc3cadd8c0f37eec1d761694c63b705
ZS,2025-10-10T20:07:46+00:00,What Zscaler (ZS)'s Role in Developing a Healthcare Cybersecurity Framework Means for Shareholders,Yahoo,https://finnhub.io/api/news?id=3a6caa7c21fc15db3c6879c07e0f86a8feaa12d76cd573461a1ccb405896d388
ZS,2025-10-10T16:21:35+00:00,2 Volatile Stocks with Exciting Potential and 1 That Underwhelm,Yahoo,https://finnhub.io/api/news?id=7839d9577964a17dc15ae58cbdff121ad100677a96f874f50b05f00a48be7cdd
ZS,2025-10-10T09:12:34+00:00,Zscaler (ZS) Valuation in Focus as Analyst Optimism Rises and Healthcare Security Initiatives Advance,Yahoo,https://finnhub.io/api/news?id=30c54d4026ea69c543867879b71f95d9c0d9b2bc8d87eabfe53dc69f2c791dfd
ZS,2025-10-09T20:18:32+00:00,"Stock Market Today: Russell 2000 Leads Pullback, Gold Stocks Fall Hard; Lesson From Ferrari's Plunge (Live Coverage)",Yahoo,https://finnhub.io/api/news?id=feb70129f37fd2c276450f29c05de90e747a8c99469724ebd25cd3759275dbfa
ZS,2025-10-09T18:01:05+00:00,"AI Party Is Not Over, Goldman Sachs Issues Top Picks",Yahoo,https://finnhub.io/api/news?id=6c253e870627ce50e740d0b925f91d90f2485cb2a70aba4d13be8a5662ef24ec
ZS,2025-10-09T17:40:23+00:00,"ZScaler, IBD Stock Of The Day, Eyes Breakout After Cybersecurity Firm's 74% Rally",Yahoo,https://finnhub.io/api/news?id=f3f8f94772142bb9c0f1f29d6a745c35ab6d57d010859ff6602981450aa65fb3
ZS,2025-10-09T17:29:00+00:00,Stock Market Today: Dow Falls But These Blue Chips Buck Drop; These Techs Eye New Entries (Live Coverage),Yahoo,https://finnhub.io/api/news?id=1698f938d98339bb5ac51386ca01d40fbac79dc20b4fdf5332334048abf16393
ZS,2025-10-09T14:47:00+00:00,Palo Alto Networks Rises 19.5% YTD: Time to Hold or Book Profits?,Yahoo,https://finnhub.io/api/news?id=962898c9eca306cc14665d5069f7c6c3194dbe4e65be6fc915a2e6ed5e41c289
ZS,2025-10-09T13:00:00+00:00,Halo Fund Announces Strategic Secondary Investment in 1Password,Yahoo,https://finnhub.io/api/news?id=7a4b591139a191ee38f865154fdf5a50547700a65c32b55eee34cbc3988e60a4
ZS,2025-10-09T11:38:09+00:00,High Growth Tech Stocks in US Market for October 2025,Yahoo,https://finnhub.io/api/news?id=55d512edd1c233fdb8a2c58fce5032fa94a245476740c6051167e4ce01d73404
ZS,2025-10-07T21:45:01+00:00,Here's Why Zscaler (ZS) Fell More Than Broader Market,Yahoo,https://finnhub.io/api/news?id=964a509bbaf5e20ba1ce78a4bd16d45030eea22e6d5954098865dc320b3ba5bc
ZS,2025-10-07T17:15:47+00:00,"Workday, BILL, Workiva, Zscaler, and Snowflake Stocks Trade Down, What You Need To Know",Yahoo,https://finnhub.io/api/news?id=9cd189d53189dcb73d656a9f6a672bb424db18c8031c0eb100fccd6e5f61e40a
ZS,2025-10-07T13:00:03+00:00,"Zscaler, Inc. (ZS) is Attracting Investor Attention: Here is What You Should Know",Yahoo,https://finnhub.io/api/news?id=d525134d2d0ace6f1c1d332c15c28dfc0c619f26f57dfc4eba14565d195809b1
ZS,2025-10-07T11:38:08+00:00,US High Growth Tech Stocks to Watch in October 2025,Yahoo,https://finnhub.io/api/news?id=5f644a43ba2d6f7ce7855af1721c84b8fa37190b4297a057d1e3abce22cb794c
ZS,2025-10-06T11:38:14+00:00,High Growth Tech Stocks in US to Watch for Potential Portfolio Boost,Yahoo,https://finnhub.io/api/news?id=65ed2ac6b47dbf840f11e14d84e0507638ace93be268cf53d1d26da2e73bb833
ZS,2025-10-05T12:08:53+00:00,"Zscaler: Agent-To-Agent Security Is Coming, But Is It Priced In?",SeekingAlpha,https://finnhub.io/api/news?id=45bc69906a71b9a26eafbd7aa558990fedca2cc76888c4c04c9461353da6bea2
ZS,2025-10-05T03:38:54+00:00,Zscaler: Why I'm Doubling Down Now,SeekingAlpha,https://finnhub.io/api/news?id=995dc14d62b74bca4d2737191009f863ad735e9df53db787d386170bd905337c
ZS,2025-10-05T01:40:57+00:00,Zscaler: Unstoppable Momentum As ARR Builds,SeekingAlpha,https://finnhub.io/api/news?id=346d0f300428e28b62abb0c8c131442c54035a7e6532f4446a95cdf68a459631
ZS,2025-10-02T20:00:44+00:00,Sector Update: Tech Stocks Gain Late Afternoon,Yahoo,https://finnhub.io/api/news?id=eaf778dbc838dad963604fec837013997fe794a632b145289e2a18d9e2a6c868
ZS,2025-10-02T15:30:02+00:00,Why Is Zscaler (ZS) Up 12.6% Since Last Earnings Report?,Yahoo,https://finnhub.io/api/news?id=d0280c7af94e81f931738b83e62c15b5f48dd5eeab983ac2869a93180a9006b1
ZS,2025-10-01T16:23:12+00:00,Breakout Stocks Watch: What Looms For October?,Yahoo,https://finnhub.io/api/news?id=8f17085289e021b5dfe6598a49e9955779334a5de2b53eee6e677b4a4dc97209
ZS,2025-09-30T18:22:07+00:00,"Zscaler, Inc. - Special Call",SeekingAlpha,https://finnhub.io/api/news?id=63f20f79f08e2a054cccf28c5e592b02a6ba804bcc3eb897ee25e760c631e2bb
ZS,2025-09-30T17:38:29+00:00,High Growth Tech Stocks In The US For September 2025,Yahoo,https://finnhub.io/api/news?id=ed0720f47fe3369504ec3b1d056d62ea808813497129ae8e702e29b8e7379539
ZS,2025-09-30T13:07:00+00:00,The Alliance for Smart Healthcare Excellence Teaming with Zscaler to Launch Development of Zero Trust Maturation Model (ZTMM) to Safeguard Smart Care,Yahoo,https://finnhub.io/api/news?id=f557df0396f06d0d4a75094b6d1e00716a1564e85f7e3a9304b04db1b60c3eef
ZS,2025-09-30T10:39:20+00:00,CrowdStrike: Positioning For Agentic AI Security Growth,SeekingAlpha,https://finnhub.io/api/news?id=c3bd549e7b2d8b826437bad43e49e4058d0ece76f1896802f4f7528acb059477
ZS,2025-09-29T12:26:00+00:00,PANW Bets on Prisma AIRS: Is it the Key to Future Platform Growth?,Yahoo,https://finnhub.io/api/news?id=674f9c857a0db15efc5c6f8c1905c0f63ab1c5ef32f984b5b57bfce0a6cc1b85
ZS,2025-09-29T11:35:46+00:00,Insider Confidence In Leading Growth Stocks September 2025,Yahoo,https://finnhub.io/api/news?id=6c1217ff5152e27d835d060153d1209e79355987a9f04ec7a96da6832e5b50c4
ZS,2025-09-29T03:03:15+00:00,"Dow Jones Futures Rise With Tesla Deliveries, Jobs Report Due; 5 Stocks Eye Buy Points",Yahoo,https://finnhub.io/api/news?id=de0eb11aa74a65a64f916b0962bdb3136bb9fbdbb8e4d0fa7b65023aacb1cb1f
ZS,2025-09-26T20:57:32+00:00,"Dow Jones Futures: Market Rallies Off Key Support, 5 Stocks Eye Buy Points; Tesla Deliveries Due",Yahoo,https://finnhub.io/api/news?id=d09161d54ba1ab2cfbfcb47cf11b05abbfae1bd5809ce9ca8bc2110a9bf531ed
ZS,2025-09-26T19:35:39+00:00,"Confluent, Flywire, Alarm.com, and Zscaler Shares Are Soaring, What You Need To Know",Yahoo,https://finnhub.io/api/news?id=3540c2d1e528a8d7e5edb3e03678e0146e3d38a876e99493ad6178068ef16ebd
ZS,2025-09-26T13:18:55+00:00,Here’s How Zscaler (ZS) Affected Fidelity Growth Strategies Fund’s Performance,Yahoo,https://finnhub.io/api/news?id=917d6c8786053fe12dc50c05d6c2b317f3a4dce3d257a62d7cfaf52cabb1ab9a
ZS,2025-09-26T11:38:09+00:00,High Growth Tech Stocks To Watch In The US September 2025,Yahoo,https://finnhub.io/api/news?id=0c885f97016d473bba1cb4679312587a22c08d70e222cec4a5f50aa46c8c89ce
ZS,2025-09-23T14:15:00+00:00,Fortinet's Geographic Mix Improves: Can EMEA Drive More Upside?,Yahoo,https://finnhub.io/api/news?id=6daf1d6f39085d323426f3bf700b1189b912e1e9c16bc1b7f972349ed775b93e
ZS,2025-09-23T13:00:02+00:00,"Zscaler, Inc. (ZS) Is a Trending Stock: Facts to Know Before Betting on It",Yahoo,https://finnhub.io/api/news?id=cf4e7abddf5bc4a1247e3cacef269fcc94a38ee77d3d37749c1819c8062473c7
ZS,2025-09-23T13:00:00+00:00,AHEAD Achieves Zscaler Data Security Delivery Specialization,Yahoo,https://finnhub.io/api/news?id=61c1dd3539521ef114996e34e7c6a4e10a99d4eba90d0cfc40a75813702ee346
ZS,2025-09-23T04:03:26+00:00,3 Reasons ZS Has Explosive Upside Potential,Yahoo,https://finnhub.io/api/news?id=a788ec238ddc152e6144f93c9219a38ca7aab5d20e2dd374a1f520f1b7d93dd3
ZS,2025-09-22T07:30:02+00:00,Netskope: High Growth Potential In The Right Market At The Right Time,SeekingAlpha,https://finnhub.io/api/news?id=f02dd0375d525e066bd4fd5893e7540568154db672be51417832de904678b9df
ZS,2025-09-19T18:38:14+00:00,Exploring High Growth Tech Stocks In The US Market September 2025,Yahoo,https://finnhub.io/api/news?id=24dc69a04abce03255842c322673854bb77a9073ddcb68fdec1f62b09a004e96
ZS,2025-09-19T12:38:09+00:00,High Growth Tech Stocks In The US Market September 2025,Yahoo,https://finnhub.io/api/news?id=5000311195eabbbaecbde15085bfdfbe5d4f9c96894a0d1836c8d52ae88c997e
ZS,2025-09-18T22:45:48+00:00,"Health Catalyst, Twilio, Palantir Technologies, Zscaler, and Appian Shares Skyrocket, What You Need To Know",Yahoo,https://finnhub.io/api/news?id=b7c1799cbe9691eba7b35a314a3efcf38442e8d74d3e4217dc2c4e5903e9a5d2
ZS,2025-09-18T17:49:22+00:00,Cybersecurity Stocks: Netskope IPO Jumps In First Day Of Trading,Yahoo,https://finnhub.io/api/news?id=afe4831b10eaf1497e40d53b7eb2e99349f0ea633e937e17455e856fb4eae7d4
ZS,2025-09-18T14:59:00+00:00,Gorilla Swings 13% Higher on $1.4B Freyr Deal in Southeast Asia,Yahoo,https://finnhub.io/api/news?id=09bdd1783ab68dcf2638fd624f615d8fd470177ac3750d25a6064425ecee77fd
ZS,2025-09-17T18:07:00+00:00,Can FTNT Stock Recover From YTD Drop on AI Security Push? How to Play,Yahoo,https://finnhub.io/api/news?id=a10c19dafdbe7a259d10ca59d60737dae77cc9d30cf6d4c4bc0bdefe9e34d797
ZS,2025-09-17T13:02:12+00:00,Should Zscaler's (ZS) Z-Flex Adoption and Stock Plan Filing Prompt Investor Attention?,Yahoo,https://finnhub.io/api/news?id=a68291a0b3c4736f1da462600c435c3d6f1ce7ccc4b526c1e3629f9b00d4d074
ZS,2025-09-16T20:00:17+00:00,"AI agents could multiply cyber risk, warns Zscaler CEO",Yahoo,https://finnhub.io/api/news?id=06ee7aa51ca1b7779322d19b6f74ab1698dd9e19bcd8f8f660078ce135fb8d20
ZS,2025-09-16T18:42:49+00:00,"Cybersecurity Stocks: Netskope Hikes IPO Price, Aims To Raise $900 Million",Yahoo,https://finnhub.io/api/news?id=14681d58d163758b6367f6544050ce1c35cdb7a71bc6897bd7ca08cb784ce03a
ZS,2025-09-16T17:59:00+00:00,Will FTNT's Heavy Infrastructure Build-Out Drive Next Phase of Growth?,Yahoo,https://finnhub.io/api/news?id=00a8fc2ab2fef23577f56fe79424b2d95bc4c13ca4a3532f4f217a139dc5e584
ZS,2025-09-16T14:55:00+00:00,PANW's Platform Strategy Builds Momentum: Can it Hit $15B ARR Target?,Yahoo,https://finnhub.io/api/news?id=4c56006f8a5454eeafcb33037d7c6bce5d1bf6cc923e3bd815e4e96ab7bf1eb7
ZS,2025-09-16T13:27:45+00:00,"Cybersecurity firm Netskope lifts IPO price range, eyes $7.3 billion valuation",Yahoo,https://finnhub.io/api/news?id=24c3003cbd2bfc820bc9a65e1f57c733b9c7cb37b38eb7356ae570859dadc422
ZS,2025-09-15T23:30:00+00:00,Exploring Agentic AI: Innovation Meets Security,Yahoo,https://finnhub.io/api/news?id=2fbcd640b48ba6a1ce94d4843f4137416f9233edb31c8da81584a2a4ad8d4b9f
ZS,2025-09-15T14:24:29+00:00,Zscaler CEO says companies need AI to fight AI threats,Yahoo,https://finnhub.io/api/news?id=71d9b0f6fb29e6ca206bd95d27f11ed8f6c96789bd21cf688b0cbc05ed71ee7f
ZS,2025-09-15T13:00:26+00:00,Zscaler CEO warns that AI could spark new cyberattacks,Yahoo,https://finnhub.io/api/news?id=a2f0f29fb55de21a47e3c61d759375fa79f230d399d93eb3053f5af1bc0dbba5
ZS,2025-09-13T14:53:35+00:00,"Truist Securities Buoyed by Zscaler (ZS)’s Emerging Business Growth, Affirms Buy Stance",Yahoo,https://finnhub.io/api/news?id=0a6c20391aa8300ecb2feb18ee8132e66af1ea78c3e699a354a308cedd606848
ZS,2025-09-13T11:10:08+00:00,‘Fastest-Growing Market in Software’: Morgan Stanley Suggests 2 Cybersecurity Stocks to Buy,Yahoo,https://finnhub.io/api/news?id=9a5da1e7e3deaa2c3be993f9403672088e2c18bcf948006c24bc8fdd49f1d05d
